,Unnamed: 0,text,predator,text_len,preprocessed_bow
41374,41374,"i dunno why the heck they put splash on thing like that ... can only slow down the actual loading kde is arround 96 and gnome 97 not sure or both one year sooner look on wikipedia :/ kommerck, 23 day so you didnt get latest kernel security patches ... ho your so doomed kommerck, hehe ;) was just joking anyway ... mmmm school work ...",0.0,66,"['dunno', 'why', 'put', 'splash', 'thing', 'can', 'only', 'slow', 'actual', 'loading', 'gnome', 'sure', 'year', 'sooner', 'look', 'day', 'so', 'late', 'kernel', 'security', 'patch', 'ho', 'so', 'doom', 'just', 'joke', 'anyway', 'ummm', 'school', 'work']"
41377,41377,"anyone have sound notification in gaim working properly ? vitamin, i cant get it to work :( vitamin, alsa vitamin, ill try that vitamin, how'd you know todo that and it all works ;) i got SOUNDS :)",0.0,38,"['sound', 'notification', 'gain', 'work', 'properly', 'can', 'work', 'vitamin', 'also', 'vitamin', 'ill', 'try', 'vitamin', 'how', 'know', 'work', 'get', 'sound']"
41378,41378,stupid tiny 150 watt power supply my system locks every 2 to 3 days so I reboot about that often :),0.0,21,"['tiny', 'power', 'supply', 'system', 'lock', 'day', 'so', 'reboot', 'often']"
41381,41381,"Shaezsche, in my experience, yes.  If anything cuts into the 99% of CPU time that pig seems to require, it gets a bit sulky. makes it almost tolerable, then? ah, well.  I'll have my new box built within the next couple of weeks, finally. heh",0.0,45,"['experience', 'cut', 'cpu', 'time', 'pig', 'seem', 'require', 'get', 'bit', 'sulky', 'make', 'almost', 'tolerable', 'then', 'new', 'box', 'build', 'next', 'couple', 'week', 'finally', 'heh']"
41385,41385,"yes, he definitely used an old version of the spec :-( Is that the same guy that contacted you recently, Marcos?",0.0,21,"['definitely', 'use', 'old', 'version', 'spec', 'same', 'guy', 'contact', 'recently', 'marco']"
41387,41387,"hm, what was the address of the logs for this channel again? nm, found them, http://krijnhoetmer.nl/irc-logs/ changes topic to 'WAF moinmoin Wiki will be retired | http://www.w3.org/2006/appformats/group/ | if you have content there that you want preserved, you have one week to copy it off before the Wiki is deleted || Logs: http://krijnhoetmer.nl/irc-logs/'",0.0,53,"['address', 'log', 'channel', 'again', 'find', 'help', 'arc', 'change', 'topic', 'will', 'retire', 'help', 'org', 'group', 'content', 'there', 'want', 'preserve', 'week', 'copy', 'wiki', 'delete', 'log', 'help', 'arc', 'log']"
41392,41392,"HELLO. Give me an idea for a game. Give me something that will blow my professor&apos;s mind off. EVERYTHING is in the contract Not in class right now, but I have to conjure something by the end of next week So yes, an idea for a game That is indeed interesting. Biology class. Goodbye.",0.0,54,"['give', 'idea', 'game', 'give', 'will', 'blow', 'professor', 'mind', 'contract', 'class', 'right', 'now', 'conjure', 'end', 'next', 'week', 'so', 'idea', 'game', 'indeed', 'interesting', 'biology', 'class', 'goodbye']"
41393,41393,hello cup what is thy bidding oh so am i getting paid by the hour am i your muse now? this wasnt in the contract ok an idea for a game when is this due are you in class? damn you kids these days uh ok i got it i got it i think storm trooper outfit rugby what class is this for? my god man,0.0,66,"['bidding', 'so', 'get', 'pay', 'hour', 'muse', 'now', 'contract', 'idea', 'game', 'when', 'due', 'class', 'damn', 'kid', 'day', 'get', 'get', 'think', 'storm', 'trooper', 'outfit', 'rugby', 'class', 'man']"
41394,41394,changes: hixie: typo (whatwg r6623) &lt;http://lists.w3.org/Archives/Public/public-html-diffs/2011Oct/0014.html&gt; bugmail: [Bug 13805] Drafts other than the most recent should be unindexable &lt;http://lists.w3.org/Archives/Public/public-html-bugzilla/2011Oct/0147.html&gt; ** [Bug 13803] Typo: the description of the option elements' form IDL attribute references colgroup - it should be optgroup &lt;http://lists.w3.org/Archives/Public/public-html-bugzilla/2011Oct/0146.html&gt; ** [Bug 13803] Typo: the description of the option elements' form IDL attribute references c,0.0,55,"['r6623', 'help', 'list', 'org', 'archive', 'public', 'public', 'himl', 'gmail', 'bug', 'draft', 'other', 'most', 'recent', 'should', 'unindexable', 'help', 'list', 'org', 'archive', 'public', 'public', 'bug', 'typo', 'description', 'option', 'element', 'form', 'ill', 'reference', 'colgroup', 'should', 'optgroup', 'help', 'list', 'org', 'archive', 'public', 'public', 'bug', 'typo', 'description', 'option', 'element', 'form', 'ill', 'attribute', 'reference']"
41402,41402,how can you get the size of a container/element using js? the visible size in pixels hmm ok thanks now I only need to find out the height of &quot;1em&quot; in pixels ah got it text draws outside my DIV for some reason... why doesn't it wrap a long line of characters? maybe.. i haven't solved it yet i mean i don't have to solve it right now :),0.0,69,"['how', 'can', 'size', 'container', 'element', 'use', 'visible', 'size', 'pixel', 'thank', 'now', 'only', 'need', 'find', 'height', 'quit', 'quit', 'pixel', 'get', 'text', 'draw', 'div', 'reason', 'why', 'doesn', 'wrap', 'long', 'line', 'character', 'maybe', 'haven', 'solve', 'yet', 'mean', 'don', 'solve', 'right', 'now']"
41403,41403,"oskie: getComputedStyle(element, null).getPropertyValue('width'); getComputedStyle(element, null).getPropertyValue('height'); just element.style.width if you set the property in css yourself. you're welcome. :) apparently, IE doesn't have getComputedStyle() oskie: absolute positioning problem perhaps?",0.0,28,"['element', 'getcomputedstyle', 'element', 'null', 'height', 'just', 'element', 'style', 'width', 'set', 'property', 'ass', 're', 'welcome', 'apparently', 'absolute', 'positioning', 'problem', 'perhaps']"
41404,41404,:) ur back kewl tell u about my life? i go 2 school come home do hw go 2 bed get up go 2 school u get teh idea theres my mom and theres my mom thats it shes pretty kewl though yes /:) thats up 2 u :| wut u mean ur being wierd y u asking me this stuff k :) yes :D :Dkewl shur but we gotta figure it out make a plan k when idk wut u wanna do idk no not really u im shur i culd idk gotta figure that out hmm yeah i guess she works at nite so wuldnt b 2 hard ;) idk but i can think of sumthin i know rite now im gona go take a shower we can talk more abou tthis k k u 2 :-* >:D< :x love u nnite,0.0,144,"['back', 'kewl', 'tell', 'life', 'go', 'school', 'come', 'home', 'go', 'bed', 'go', 'school', 'get', 'idea', 's', 'mom', 's', 'mom', 's', 's', 'pretty', 'kewl', 'though', 's', 'up', 'mean', 'wierd', 'ask', 'stuff', 'kewl', 'get', 'figure', 'make', 'plan', 'when', 'ink', 'want', 'ink', 'really', 'culd', 'ink', 'get', 'figure', 'guess', 'work', 'so', 'would', 'hard', 'ink', 'can', 'think', 'sustain', 'know', 'rite', 'now', 'go', 'take', 'shower', 'can', 'talk', 'more', 'abou', 'love', 'unite']"
41409,41409,"<a href=""http://bugs.debian.org/cgi-bin/bugreport.cgi?bug=382296"">http://bugs.debian.org/cgi-bin/bugreport.cgi?bug=382296</a> not debian unstable ? fair enough - the latest in debiunstable crashes on startup : <a href=""http://bugs.debian.org/cgi-bin/bugreport.cgi?bug=382296"">http://bugs.debian.org/cgi-bin/bugreport.cgi?bug=382296</a> especially for things which only cropped up today ;) it looks pretty trivial, it'll be right in a day or two",0.0,40,"['help', 'bug', 'bug', 'help', 'bug', 'bug', 'debian', 'unstable', 'enough', 'late', 'debiunstable', 'crash', 'startup', 'help', 'bug', 'bug', 'help', 'bug', 'bug', 'especially', 'thing', 'only', 'crop', 'today', 'look', 'pretty', 'trivial', 'be', 'right', 'day']"
41410,41410,"What is the appropriate way to manage guest accounts with ldapsam backend under samba 3.0.23b? I am building out samba 3.0.23b with openldap backend as PDC.  When I start samba it immediately crashes.  Bug 3905 appears to be related to security = server so I do not think it applies to me in that I'm using security = user. I accidently fixed it.  I executed smbd -d 10 -i, captured the output, found I could not yet see the ou=Groups in my tree.  So, I created it using phpldapadmin.  Now it runs.  I'm glad, but still unsure of why.  Yay! No, CentOS 4.3 base, OpenLDAP 2.3.24, Samba 3.0.23b. OpenLDAP and Samba were grabbed as SRPM and recompiled. Yeah, the release notes are extensive. But if you're not actvely following samba development, well, they don't make a lot of sense.  And this issue is relatively new, so Google isn't my friend as much as he usually is. The issue appeared in Samba around 3.0.22 -&gt; 3.0.23, as far as I can tell from reading.  But yeah, 3.0.23b is two days old so it probably made it into deb in the last 24 hours.  Good luck.",0.0,194,"['appropriate', 'way', 'manage', 'guest', 'account', 'backend', 'job', 'build', 'job', 'openldap', 'backend', 'pic', 'when', 'start', 'immediately', 'crash', 'bug', 'appear', 'relate', 'security', 'server', 'think', 'apply', 'use', 'security', 'user', 'accidently', 'fix', 'execute', 'say', 'capture', 'output', 'find', 'could', 'yet', 'see', 'group', 'tree', 'so', 'create', 'use', 'phpldapadmin', 'now', 'run', 'glad', 'still', 'unsure', 'why', 'cent', 'base', 'openldap', 'samba', 'job', 'openldap', 'grab', 'recompile', 'release', 'note', 'extensive', 're', 'actively', 'follow', 'samba', 'development', 'well', 'don', 'make', 'lot', 'sense', 'issue', 'relatively', 'new', 'so', 'friend', 'as', 'much', 'usually', 'issue', 'appear', 'as', 'far', 'can', 'tell', 'reading', 'job', 'day', 'old', 'probably', 'make', 'last', 'hour', 'good', 'luck']"
41411,41411,"Hi there. Thank you! I try my best, but being reassured is nice. What&apos;s on your mind stranger? I suffered from it uhhh freshman year. Maybe earlier. So no, it&apos;s not normal. You should have experienced it earlier. Are you going to college?",0.0,43,"['thank', 'try', 'good', 'reassure', 'nice', 'mind', 'stranger', 'suffer', 'freshman', 'year', 'maybe', 'earlier', 'so', 'normal', 'should', 'experience', 'earlier', 'go', 'college']"
41412,41412,"Hello. You&apos;re lovely. You do know that right? You&apos;re welcome School. I really just want to get it over with Is it normal to suffer from senioritis this early? Yeah, I guess. But my grades are going downhill so fast right now. I just don&apos;t care anymore. Lol. This year. Maybe. Why?",0.0,52,"['lovely', 'know', 'right', 'welcome', 'school', 'really', 'just', 'want', 'normal', 'suffer', 'seniority', 'early', 'guess', 'grade', 'go', 'downhill', 'so', 'fast', 'right', 'now', 'just', 'care', 'anymore', 'lol', 'year', 'maybe', 'why']"
41415,41415,html-spec: ianh@340c8d12-0b0e-0410-8428-c7bf67bfef74 * c9f32c2eb363 r6182 / (index complete.html source): html-spec: [e] (0) A first attempt at an example for a WebVTT file. html-spec: Fixing http://www.w3.org/Bugs/Public/show_bug.cgi?id=12192,0.0,25,"['index', 'complete', 'source', 'first', 'attempt', 'example', 'file', 'fix', 'help', 'org', 'bug', 'public', 'show', 'bug', 'cgi', 'would']"
41416,41416,"12192: contributor, P3, RESOLVED FIXED, &lt;video&gt; Would be great to see a sample .vtt file! bugmail: [Bug 12868] New: Allow placeholder for color, date+, and number types &lt;http://lists.w3.org/Archives/Public/public-html-bugzilla/2011Jun/0088.html&gt; ** &quot;[Bug 12192] &lt;video&gt; Would be great to see a sample .vtt file!&quot; (2 messages in thread) &lt;http://lists.w3.org/Archives/Public/public-html-bugzilla/2011Jun/0087.html&gt; ** [Bug 12867] New: Hidden with autofocus &lt;http://lists.w3.org/Archives/Public/public-html-bugzilla/2011Jun/0085.html&gt;",0.0,54,"['contributor', 'resolve', 'fix', 'video', 'would', 'great', 'see', 'sample', 'vet', 'file', 'gmail', 'bug', 'new', 'allow', 'placeholder', 'color', 'date', 'number', 'type', 'help', 'list', 'org', 'archive', 'public', 'public', 'himl', 'quit', 'bug', 'video', 'would', 'great', 'see', 'sample', 'vet', 'file', 'quit', 'message', 'thread', 'help', 'list', 'org', 'archive', 'public', 'public', 'bug', 'new', 'hide', 'autofocus', 'help', 'list', 'org', 'archive', 'public', 'public']"
41423,41423,"pike was last seen 10 hours, 46 minutes and 19 seconds ago, saying 'bed time, g'night' in #mobile.",0.0,18,"['pike', 'last', 'see', 'hour', 'minute', 'second', 'ago', 'say', 'bed', 'time', 'night', 'mobile']"
41424,41424,"0b77740fd791e193683643619e70cac9: I think some (all?) browsers did the newline-skipping in the renderer, rather than in the parser so they should give the same appearance as what HTML5 specified, though with a different DOM doesn't remember the details, though (nor the reason for HTML5 doing what it does) innerText is a whole extra layer of complexity, I think Better to stick with textContent for testing :-)",0.0,65,"['think', 'browser', 'decline', 'skip', 'render', 'rather', 'parker', 'should', 'give', 'same', 'appearance', 'specify', 'though', 'different', 'dom', 'doesn', 'remember', 'detail', 'reason', 'do', 'innertext', 'whole', 'extra', 'layer', 'complexity', 'think', 'better', 'stick', 'textcontent', 'testing']"
41425,41425,if there is a markup &lt;pre&gt;\ntext\n&lt;/pre&gt; where \n is newline character. innerText should be &quot;text\n&quot;. same. all major browser except IE don't strip first newline. if It's stripped in HTML syntax level. I expect i don't see it from DOM. i tested it against textContent.,0.0,45,"['markup', 'pre', 'next', 'pre', 'where', 'decline', 'character', 'innertext', 'should', 'quit', 'text', 'quit', 'same', 'major', 'browser', 'strip', 'first', 'decline', 'strip', 'level', 'expect', 'see', 'test', 'textcontent']"
41426,41426,"innerText is just a mindfuck innerText has only a limited amount to do with the DOM, however",0.0,17,"['just', 'mindfuck', 'innertext', 'only', 'limited', 'amount', 'dom', 'however']"
41429,41429,hello you can&apos;t see me though i don&apos;t think so no sorry to disappoint you i just don&apos;t believe i&apos;m &quot;cute&quot; haha some people said i&apos;m pretty but i don&apos;t believe them yes did you think i was a boy ? what are you then ? boy or girl ? you&apos;re a girl,0.0,53,"['can', 'see', 'don', 'think', 'so', 'sorry', 'disappoint', 'just', 'believe', 'quit', 'quit', 'people', 'say', 'apos', 'pretty', 'don', 'believe', 'think', 'boy', 'then', 'boy', 'girl', 'girl']"
41430,41430,hey you&apos;re cute :) so are you? aw whys that? no worries you&apos;re a gal i suppose not really same here,0.0,21,"['cute', 'so', 'why', 's', 'worry', 'life', 'suppose', 'really', 'same', 'here']"
41434,41434,getting information on ACTION-118 ACTION-118 -- Dan Connolly to reformat the document on URLs in HTML 5 as an Internet Draft -- due 2009-04-22 -- OPEN http://www.w3.org/html/wg/tracker/actions/118,0.0,27,"['get', 'information', 'action', 'action', 'connolly', 'reformat', 'document', 'internet', 'draft', 'due', 'open', 'help', 'org', 'tracker', 'action']"
41435,41435,"Title: ACTION-118 - HTML Weekly Tracker (at www.w3.org) Title: xml2rfc (at xml.resource.org) planet: about:mozilla - Meetups, demos, Fennec, JavaScript 3.1, Bespin, accessibility, BrowserCouch, Thunderbird, and more‚Ä¶ &lt;http://developer.mozilla.org/devnews/index.php/2009/04/21/aboutmozilla-meetups-demos-fennec-javascript-31-bespin-accessibility-browsercouch-thunderbird-and-more/&gt;",0.0,27,"['title', 'action', 'tracker', 'org', 'planet', 'meet', 'besoin', 'accessibility', 'browsercouch', 'thunderbird', 'more', 'help', 'developer', 'momzilla', 'review', 'index', 'pop', 'aboutmozilla', 'meet', 'besoin', 'accessibility', 'browsercouch', 'thunderbird', 'more']"
41439,41439,Which are you: A. Horny Male B. Non-Horny Male C. Horny Female D. Non-Horny Female Ok may I see them?,0.0,20,"['horny', 'male', 'non', 'male', 'horny', 'female', 'non', 'horny', 'female', 'may', 'see']"
41441,41441,"suv4x4: it's 6:13 over here.. My sarcasm died about 15 hours ago. My sarcasm usually is cold cysnism.. when I'm awake, sober and sane. Which I'm not right now. I haven't done CSS pixel-jerking-off for 1 year now.. this is quite straining... also did I have my last coffee 3 or 4 hours ago... this ain't no good. CommandPrompt: you smoke a lot crack, don't you? CommandPrompt: how could someone NOT smoking crack and drinking gasoline possibly spell that sentence wrong?",0.0,81,"['over', 'here', 'sarcasm', 'die', 'about', 'hour', 'ago', 'sarcasm', 'usually', 'cold', 'cysnism', 'when', 'awake', 'sober', 'sane', 'right', 'now', 'haven', 'do', 'jerk', 'year', 'now', 'quite', 'strain', 'also', 'last', 'coffee', 'hour', 'ago', 'ain', 'good', 'commandprompt', 'smoke', 'lot', 'crack', 'commandprompt', 'how', 'could', 'smoke', 'crack', 'drink', 'gasoline', 'possibly', 'spell', 'sentence', 'wrong']"
41442,41442,"jMCg, AM? it's 7:13 here my sarcasm never dies b0at, do you get weird chest pain as if you're gonna get a heart attack any moment now b0at, also excessive feeling you're funny and people need more of you b0at, that's how I feel, and it's wrong yea he does CommandPrompt, and stop drinking gasoline",0.0,55,"['here', 'sarcasm', 'never', 'die', 'beat', 'weird', 'chest', 'pain', 're', 'go', 'heart', 'attack', 'moment', 'now', 'beat', 'also', 'excessive', 'feeling', 're', 'funny', 'people', 'need', 'more', 'beat', 'how', 'feel', 'wrong', 'commandprompt', 'stop', 'drink', 'gasoline']"
41443,41443,"I've observed my sarcasm growing after at least 17 hours. It has been known to spoil into sardonic bitterness, though. A light bleach solution cures that No, I never feel funny, unless I have a funny feeling.",0.0,37,"['observe', 'sarcasm', 'grow', 'at', 'least', 'hour', 'know', 'spoil', 'sardonic', 'bitterness', 'light', 'bleach', 'solution', 'cure', 'never', 'feel', 'funny', 'funny', 'feeling']"
41444,41444,"jMCg: omg!! your last line shows how big time your sarcams is on, you roooolez dude, I mean, is like, I'm stunned, lemme lie down for a bit, it blew me away, // mine is alive and kicking btw =P moi? pour quoi? je ne smoke pas crack, pardon moi",0.0,50,"['omg', 'last', 'line', 'show', 'how', 'big', 'time', 'sarcasm', 'roooolez', 'dude', 'mean', 'stun', 'let', 'lie', 'bit', 'blow', 'away', 'alive', 'kick', 'pour', 'smoke']"
41445,41445,"Hey u How r u? :) Why? ))): Ow, yes :/ how old are u? Sure kkkkkkkkkkkkk 15, i guess Awn, cute! ahahahaha Girl :) and u? From...? where is doodland? ): Brazil ): *:) Really? Nice :DD i&apos;m sad ): My mommy she are angry with me  :T Soo im sad, cuz i dont know what&apos;s wrong Hey, i need sleep. Tomorrow school :) 15 and u? Nice :) bbye! xx",0.0,72,"['how', 'why', 'how', 'old', 'u', 'sure', 'guess', 'u', 'where', 'really', 'nice', 'apos', 'sad', 'mommy', 'angry', 'soo', 'sad', 'know', 'apo', 'wrong', 'need', 'sleep', 'tomorrow', 'school', 'nice', 'bye', 'ex']"
41446,41446,HIII i&apos;m....bored cuuuz everyone is booooorin borinG* um depends i can be 87 or 15/16 which is more legit? naaaah i&apos;m 87! boy/girl? giiirl doodland of course (i mean bulgaria) ?? xD* u? doodland is on the planet of awesome yup why? soo soo? how old are you? 16,0.0,49,"['bore', 'depend', 'can', 'more', 'legit', 'yaaah', 'apos', 'girl', 'course', 'mean', 'planet', 'awesome', 'why', 'soo', 'soo', 'how', 'old']"
41448,41448,is 'Ask any question about HTML5 &amp; Friends || HTML5 Spec for Developers: http://developers.whatwg.org || Also: http://html5rocks.com http://diveintohtml5.info http://mzl.la/9giLwR || Channel logs: http://j.mp/cG7UDa',0.0,23,"['ask', 'question', 'friend', 'developer', 'help', 'also', 'help', 'com', 'help', 'diveintohtml5', 'info', 'help', 'log', 'help', 'gouda']"
41451,41451,=:-|  -- real punk rockers don't smile wonders if all of his text made it through to 66ac8412c3aa86545c46679cf3528c98 what with the netsplit and all hides a chuckle in his coffeemug I'm thinking of reporting it to them as a bug,0.0,40,"['real', 'punk', 'rocker', 'smile', 'wonder', 'text', 'make', '66ac8412c3aa86545c46679cf3528c98', 'netsplit', 'hide', 'chuckle', 'coffeemug', 'think', 'report', 'bug']"
41452,41452,"It did, and I can't say I have an explanation for that besides that IE is dumb",0.0,17,"['can', 'say', 'explanation', 'ie', 'dumb']"
41458,41458,bugmail: [Bug 14229] New: ?ê¬ú?ê¬??ê¬ª?ê¬¥?ê¬µ?ë¬Ä ?ê¬? ?ê¬°?ê¬??ê¬??ê¬ª?ê¬ª?ê¬? ?ê¬??ê¬µ?ê¬??ë¬è?ë¬Ç?ë¬Å?ë¬è &lt;http://lists.w3.org/Archives/Public/public-html-bugzilla/2011Sep/0682.html&gt; ** [Bug 14229] ?ê¬ú?ê¬??ê¬ª?ê¬¥?ê¬µ?ë¬Ä ?ê¬? ?ê¬°?ê¬??ê¬??ê¬ª?ê¬ª?ê¬? ?ê¬??ê¬µ?ê¬??ë¬è?ë¬Ç?ë¬Å?ë¬è &lt;http://lists.w3.org/Archives/Public/public-html-bugzilla/2011Sep/0683.html&gt; ** [Bug 14228] New: ?ê¬ú?ê¬??ê¬ª?ê¬¥?ê¬µ?ë¬Ä ?ê¬? ?ê¬°?ê¬??ê¬??ê¬ª?ê¬ª?ê¬? ?ê¬??ê¬µ?É,0.0,25,"['bug', 'new', 'help', 'list', 'org', 'archive', 'public', 'public', 'bug', 'help', 'list', 'org', 'archive', 'public', 'public', 'himl', 'bug', 'new']"
41466,41466,planet: Mike Marchak: Fridaygram &lt;http://feedproxy.google.com/~r/blogspot/Dcni/~3/B0_l8-1Vd7U/fridaygram_29.html&gt; ** Mike Marchak: Chime in on #io2011 and check out After Hours &lt;http://feedproxy.google.com/~r/blogspot/Dcni/~3/452QKqBoJGY/chime-in-on-io2011-and-check-out-after.html&gt; bugmail: [Bug 11239] Canvas support accessible caret tracking independent of Focus Ring tracking &lt;http://lists.w3.org/Archives/Public/public-html-bugzilla/2011May/0034.html&gt;,0.0,32,"['help', 'com', 'blogspot', 'check', 'hour', 'help', 'com', 'blogspot', 'chime', 'in', 'check', 'gmail', 'bug', 'canvas', 'support', 'accessible', 'caret', 'tracking', 'independent', 'focus', 'ring', 'track', 'help', 'list', 'org', 'archive', 'public', 'public', 'himl']"
41471,41471,You have been called into my office for a reason I am very disappointed in you for what you have done. It is an embarrassment to the society that I have established here,0.0,33,"['call', 'office', 'reason', 'very', 'disappointed', 'do', 'embarrassment', 'society', 'establish', 'here']"
