,Unnamed: 0,text,predator,text_len,preprocessed_bow
71112,71112,"estupendocero: this is ok tarzeau: great, could you post it on your webpage along with a description of how you got the output? cool :) tarzeau: and if you could throw in a full log of ./uncurse's output too that'd be even better. CAiRO: maybe dpkg -L slapd will help you? CAiRO: maybe there's a way to get a list of registered config-files for a package, I dunno how.",0.0,69,"['estupendocero', 'great', 'post', 'webpage', 'description', 'get', 'output', 'cool', 'tarzan', 'throw', 'full', 'log', 'nurse', 'output', 'too', 'be', 'even', 'well', 'maybe', 'dog', 'slap', 'help', 'cairo', 'maybe', 'there', 'way', 'get', 'list', 'registered', 'config', 'file', 'package', 'dunno']"
71113,71113,"hi. anyone in here use gtk2-engines-clearlooks? if so, does your progressbar animation work? if i try to enable mine (by editing the gtkrc) it goes to the default theme instead of working...i'm trying to decide if i should file a bug or not. please help me if you know anything about this.",0.0,52,"['here', 'use', 'engine', 'clearlook', 'so', 'progressbar', 'animation', 'work', 'try', 'enable', 'edit', 'gtory', 'go', 'default', 'theme', 'instead', 'work', 'try', 'decide', 'file', 'bug', 'help', 'know']"
71114,71114,"where does slapd store it's database? i've looked at /var/lib/slapd but it isn't there unfo: not really as the database is not part of the package, but i found it finally in /var/lib/ldap very strange, i didn't expect anthoer directory in /var/lib",0.0,42,"['slap', 'store', 'database', 've', 'look', 'slap', 'isn', 'there', 'really', 'database', 'part', 'package', 'find', 'finally', 'lap', 'very', 'strange', 'didn', 'expect', 'anther', 'directory']"
71116,71116,"using rsync for a backup'ing system, what happens if i &quot;cut&quot; the transfer ? the file are uploaded again because not is complete or just skipped ? aha, perfect :) thx",0.0,31,"['use', 'sync', 'backup', 'ing', 'system', 'happen', 'quit', 'cut', 'quit', 'transfer', 'file', 'upload', 'again', 'complete', 'just', 'skip', 'perfect', 'thank']"
71117,71117,"Thanatermesis: uploaded again. they aren't moved into place until they are transferred completely nse: are you in the audio group? nse: if you are using alsa make sure snd-pcm-oss is loaded.  you need to be in the audio group regardless (does &quot;groups&quot; list audio?) liran_: &quot;help source&quot; liran_: . is just a shorthand for source Shadowcat: no.  i only update sid on saturdays however &lt;insert snide comment about reiserfs here&gt; swiceje: what does &quot;uname -r&quot; say? swiceje: that is what? a redhat kernel? swiceje: what does &quot;dpkg -l libc6 | tail -1&quot; say? zamaliphe: no !alsa one-liner swiceje: ^^ that should get you going in debian swiceje: there is no real config to be worried about, especially if you know what drivers you are using now (from lsmod) swiceje: when you install, type &quot;linux26&quot; at the boot prompt and it will install with a 2.6 kernel swiceje: it should hopefully neither help nor hurt pkern: --reinstall?",0.0,156,"['thanatermesis', 'upload', 'again', 'aren', 'move', 'place', 'transfer', 'completely', 'use', 'audio', 'group', 'use', 'use', 'also', 'make', 'sure', 'oss', 'load', 'need', 'audio', 'group', 'regardless', 'quit', 'group', 'quit', 'list', 'audio', 'quit', 'help', 'source', 'quit', 'lira', 'just', 'shorthand', 'source', 'shadowcat', 'only', 'update', 'saturday', 'however', 'insert', 'snide', 'comment', 'riser', 'here', 'swiceje', 'quit', 'name', 'quit', 'say', 'swiceje', 'redhat', 'kernel', 'swiceje', 'quit', 'dog', 'lick', 'tail', 'quit', 'say', 'zamaliphe', 'also', 'liner', 'swiceje', 'get', 'go', 'debian', 'real', 'config', 'worried', 'especially', 'know', 'driver', 'use', 'now', 'lemon', 'swiceje', 'install', 'type', 'quit', 'linux', 'quit', 'boot', 'prompt', 'install', 'kernel', 'swiceje', 'hopefully', 'help', 'hurt', 'kern', 'reinstall']"
71118,71118,if i wish to add skin and defult config to the mplayer  bakeg how to do that ? i use DEB_BUILD_OPTIONS=&quot;--prefix=/usr --confdir=/etc/mplayer --enable-runtime-cpudetection --enable-gui&quot; fakeroot debian/rules binary i use DEB_BUILD_OPTIONS=&quot;--prefix=/usr --confdir=/etc/mplayer --enable-runtime-cpudetection --enable-gui&quot; fakeroot debian/rules binary to bild mplayer bakeg how to add skin and config file to it stew:  do you know how to add skin to mplyer bakeg,0.0,60,"['wish', 'add', 'skin', 'default', 'config', 'player', 'bake', 'use', 'build', 'option', 'quit', 'prefix', 'usr', 'confirm', 'player', 'enable', 'quit', 'fakeroot', 'debian', 'rule', 'binary', 'use', 'build', 'option', 'quit', 'prefix', 'usr', 'confirm', 'player', 'enable', 'quit', 'fakeroot', 'debian', 'rule', 'binary', 'build', 'player', 'bake', 'add', 'skin', 'config', 'file', 'stew', 'know', 'add', 'skin', 'player', 'bake']"
71122,71122,"hello verybody. i receive this error message: &quot;sox: Can't open output file '/dev/dsp': Permission denied&quot; when trying to play audio files with play, that uses sox. what's wrong? stew: yes, perhaps yes i am",0.0,34,"['verybody', 'receive', 'error', 'message', 'quit', 'sox', 'open', 'output', 'file', 'dev', 'dip', 'permission', 'deny', 'quit', 'try', 'play', 'audio', 'file', 'play', 'use', 'sox', 'wrong', 'stew', 'perhaps']"
71124,71124,stew: any recent reports of data corrpution with the last batch of sid upgrades? corruption even I'm getting a journal replays in reiserfs for no reason at all and it's not the hd as it already passed the smart tests !beat stew this isn't the fs' fault as it's been running like this for over a year !beat beardy if you enable netfilter there should be :P btw you might know my reiserfs root fs started giving me journal replays out of the blue today wondering if anything in sid's corrupting stuff Dwonis: and no the smart tests passed bztunk: Windows NT 3.51!,0.0,103,"['stew', 'recent', 'report', 'datum', 'corruption', 'last', 'batch', 'corruption', 'even', 'get', 'journal', 'replay', 'riser', 'reason', 'at', 'all', 'already', 'pass', 'smart', 'test', 'beat', 'stew', 'fault', 'be', 'run', 'year', 'beat', 'beardy', 'enable', 'netfilter', 'way', 'know', 'riser', 'root', 'start', 'give', 'replay', 'blue', 'today', 'wonder', 'corrupt', 'stuff', 'doni', 'smart', 'test', 'pass', 'bunk', 'window']"
71125,71125,"I have the troublesome neomagic 256 chip for sound on my laptop, it works automatically in centos but locks up the computer in debian.  What files in centos should i copy to refer to help get it working in debian? 2.6.9-34.EL stew: yes, I'm in centos and I really don't like it one bit, but I'm hoping to retrieve my config files from it to make sound work in debian stew: so far, I've copied the output of lsmod and copied my modprobe.conf stew: I think I had those packages installed before on this in debian but after running alsaconf my computer would lock up when the module was loaded.  However, I was using the 2.4 kernel when i last loaded debian on this. stew: will udev help? stew: thanks a bunch",0.0,132,"['troublesome', 'nomadic', 'chip', 'sound', 'laptop', 'work', 'automatically', 'cent', 'lock', 'computer', 'file', 'cent', 'copy', 'refer', 'help', 'get', 'work', 'stew', 'cent', 'really', 'don', 'bit', 'hope', 'retrieve', 'config', 'file', 'make', 'sound', 'work', 'debian', 'stew', 'so', 'far', 've', 'copy', 'output', 'lemon', 'copy', 'modprobe', 'stew', 'think', 'package', 'instal', 'before', 'debian', 'run', 'computer', 'lock', 'module', 'load', 'however', 'use', 'kernel', 'last', 'loaded', 'debian', 'stew', 'dev', 'help', 'stew', 'thank', 'bunch']"
71126,71126,"If it's not the hardware, or the filesystem, it must be the one that choosed the filesystem.",0.0,17,"['i', 'hardware', 'filesystem', 'one', 'choose', 'filesystem']"
71127,71127,"Silly question -- can't seem to find the right google keywords here. Isn't there a /proc file that maintains statistics about bytes sent/received overall via tcp? Shadowcat: ah, thanks Dwonis: great -- that should be adequate enough for my tests, thanks much Dwonis: thanks for the pointer. I need to massage the data in a few ways, so I'll probably just capture output over time and do some perl.",0.0,69,"['silly', 'question', 'seem', 'find', 'right', 'keyword', 'here', 'isn', 'there', 'pro', 'file', 'maintain', 'statistic', 'byte', 'send', 'receive', 'overall', 'top', 'shadowcat', 'thank', 'doni', 'great', 'adequate', 'enough', 'test', 'thank', 'much', 'doni', 'thank', 'pointer', 'need', 'massage', 'datum', 'few', 'way', 'so', 'probably', 'just', 'capture', 'output', 'time']"
71128,71128,"sbk: well, there's /proc/net/dev, but that's raw data per-interface sbk: also, I have a tool... sbk: ftp://ftp.dlitz.net/pub/dlitz/scripts/loadmon/0.1/loadmon sbk: if you want to display transmission rates in a nice format hddcdfd0: Your question could mean several things, but probably /etc/resolv.conf !tell Shadowcat about smartmontools Shadowcat: but... reiserfs never loses data! ;)",0.0,50,"['suk', 'well', 'there', 'pro', 'net', 'dev', 'raw', 'datum', 'interface', 'suk', 'also', 'tool', 'suk', 'pub', 'script', 'suk', 'want', 'display', 'transmission', 'rate', 'nice', 'format', 'hddcdfd0', 'question', 'mean', 'several', 'thing', 'probably', 'tell', 'shadowcat', 'smartmontool', 'shadowcat', 'riser', 'never', 'lose', 'datum']"
71129,71129,"extra, extra, read all about it, alsa one-liner is apt-get install alsa-base alsa-utils &amp;&amp; alsaconf, or if you are running a 2.4 kernel ask me about &lt;2.4 alsa one-liner&gt;, or after its installed, run alsamixer and unmute the volume levels methinks popcon is the Debian Popularity contest. See results at <a href=""http://popcon.debian.org/"">http://popcon.debian.org/</a> or install popularity-contest to participate. do the dpkg-reconfigure -plow popularity-contest right after you answered all debconf stuff",0.0,69,"['extra', 'extra', 'read', 'all', 'also', 'liner', 'apt', 'get', 'install', 'also', 'base', 'also', 'util', 'run', 'kernel', 'ask', 'also', 'liner', 'instal', 'run', 'alsamixer', 'unite', 'volume', 'level', 'methink', 'popcorn', 'debian', 'popularity', 'contest', 'see', 'result', 'ref', 'help', 'popcorn', 'debian', 'help', 'popcorn', 'debian', 'install', 'popularity', 'contest', 'participate', 'dog', 'reconfigure', 'plow', 'popularity', 'contest', 'right', 'answer', 'deacon', 'stuff']"
71133,71133,Is there a way to reset file permissions back to the defaults specified in the Debian packages? Oh wrong channel. ): stew: Sounds nice.,0.0,24,"['way', 'reset', 'file', 'permission', 'back', 'default', 'specify', 'debian', 'package', 'wrong', 'channel', 'stew', 'sound', 'nice']"
71134,71134,would you guys recommend Debian or Ubuntu for laptops i know where I am at.  I am using debian.,0.0,19,"['guy', 'recommend', 'debian', 'bunt', 'laptop', 'know', 'use', 'debian']"
71144,71144,changes: Add some exposition around &lt;div&gt; and &lt;section&gt;. (bug 6771) (whatwg r3330) &lt;http://lists.w3.org/Archives/Public/public-html-diffs/2009Jun/0211.html&gt; bugmail: [Bug 6742] pre-encoded form values should be restorable as submitted &lt;http://lists.w3.org/Archives/Public/public-html-bugzilla/2009Jun/0142.html&gt; ** [Bug 6771] Sectioning Content Use versus DIV &lt;http://lists.w3.org/Archives/Public/public-html-bugzilla/2009Jun/0141.html&gt;,0.0,34,"['change', 'add', 'exposition', 'div', 'section', 'bug', 'whatwe', 'help', 'list', 'org', 'archive', 'public', 'public', 'himl', 'diff', 'himl', 'gmail', 'bug', 'pre', 'encode', 'form', 'value', 'restorable', 'submit', 'help', 'list', 'org', 'archive', 'public', 'public', 'himl', 'himl', 'bug', 'section', 'content', 'use', 'help', 'list', 'org', 'archive', 'public', 'public', 'himl', 'himl']"
71147,71147,"hi m or f good how are you feel&apos;m realy horny right now you horny come on, you know you are you wana suck my dick ya right  im the best guy there is ya i do but for right now, why dont you get down and suck my dick come on, just a quickie",0.0,55,"['good', 'feel', 'realy', 'horny', 'right', 'now', 'horny', 'come', 'know', 'wana', 'suck', 'dick', 'right', 'good', 'guy', 'right', 'now', 'get', 'suck', 'dick', 'come', 'just', 'quickie']"
71148,71148,Hey How are you? f tired u? :/ .... ehhhh mmaybe ;) hhaha what do you wanna talk about? nah.. I bet I&apos;ve seen better and I guess if I see one more before I turn 18 I guess I&apos;ll turn to the other side .. if u know what I mean cuz I never tried and guess I don&apos;t wanna nope,0.0,62,"['tire', 'mmaybe', 'want', 'talk', 'bet', 'apos', 've', 'see', 'well', 'guess', 'see', 'more', 'turn', 'guess', 'apos', 'turn', 'other', 'side', 'know', 'mean', 'never', 'try', 'guess', 'don', 'want', 'nope']"
71151,71151,hii whats up? In my room :P I m 21 m Indiaa India* same here dude so hows ur life going oh / on* ? why...what happened ? what do u do? sryy man I have gmail and yahoo..I has been long time to use msn so I have forgot my id and pass.. :P my life is just going cool.....not very iteresting intresting yup don&apos;t u have gmail or yahoo ? ok...no prob ? so may i know what do u do hmmm thats good so what do u study...? I have just  completed my studies and now doing job haha thanks so when r u completing ur study ? okk good so where do u stay in china ..I mean which city urwelcome,0.0,125,"['hii', 's', 'room', 'indian', 'same', 'here', 'dude', 'so', 's', 'life', 'go', 'happen', 'sry', 'man', 'gmail', 'yahoo', 'long', 'time', 'use', 'man', 'forget', 'i', 'd', 'pass', 'life', 'just', 'go', 'cool', 'very', 'interesting', 'intreste', 'gmail', 'yahoo', 'prob', 'so', 'know', 'ummm', 's', 'good', 'so', 'study', 'just', 'complete', 'study', 'now', 'do', 'job', 'thank', 'so', 'complete', 'study', 'ok', 'good', 'so', 'stay', 'mean', 'city', 'unwelcome']"
71152,71152,hi where are u? haha i&apos;m 20 m china nice to meet u not very good do u have MSN student how about u oh maybe the same no sorry student how about u? about port congratulations 2year later thanks,0.0,40,"['apos', 'nice', 'meet', 'very', 'good', 'man', 'student', 'maybe', 'same', 'sorry', 'student', 'u', 'port', 'congratulation', 'year', 'later', 'thank']"
71162,71162,"What are you?(to make it easier)
a. Guy who wants to talk
b. Guy who wants to talk to a girl
c. Horny guy who wants to talk to a girl
d. Horny guy who wants to talk to a guy
e. Girl who wants to talk
f. Girl who wants to talk to a guy
g. Horny girl who wants to talk to a guy
h. Horny girl who wants to talk to a girl",0.0,76,"['make', 'easy', 'guy', 'want', 'talk', 'guy', 'want', 'talk', 'girl', 'horny', 'guy', 'want', 'talk', 'girl', 'horny', 'guy', 'want', 'talk', 'guy', 'e', 'girl', 'want', 'talk', 'girl', 'want', 'talk', 'guy', 'girl', 'want', 'talk', 'guy', 'girl', 'want', 'talk', 'girl']"
71167,71167,"is 'WHATWG: http://www.whatwg.org/ -- logs: http://krijnhoetmer.nl/irc-logs/ -- stats: http://gavinsharp.com/irc/whatwg.html -- Please leave your sense of logic at the door, thanks!'",0.0,20,"['whatwe', 'help', 'whatwe', 'org', 'log', 'help', 'arc', 'log', 'stat', 'help', 'gavinsharp', 'com', 'arc', 'whatwe', 'himl', 'leave', 'sense', 'logic', 'door', 'thank']"
71169,71169,"so ISSUE-56 is about process too, in a way? i.e. when we change references to IRIbis? so weird XDR is not cool",0.0,22,"['so', 'issue', 'process', 'too', 'way', 'e', 'change', 'reference', 'crisis', 'so', 'weird', 'xur', 'cool']"
71170,71170,"http://msdn.microsoft.com/en-us/library/ms537512(VS.85).aspx - &quot;&lt;!--[if WindowsVersion 1]&gt;&lt;p&gt;You are using Windows Ultimate Edition.&lt;/p&gt;&lt;![endif]--&gt;&quot; I wonder if any analytics scripts use that yet (though that page can't decide whether it's WindowsVersion or WindowsEdition) http://www.giorgiosardo.com/ie8/standards/demo1/7_Selectors.htm - &quot;HTML 5&quot;? (from http://blogs.msdn.com/giorgio/archive/2009/11/29/ie8-and-html-5.aspx) XDR and JSON and Selectors API are now all HTML5 too, it seems http://tools.ietf.org/html/rfc4506 - XDR is already an IETF standard There ought to be a TLA registry to avoid naming conflicts That's easy - just make a registry X such that if someone asks it whether X is registered in it, their request gets bogged down in bureaucratic processes for years and they never get a definitive answer back That way the registry will never have to give an incorrect answer I hope you haven't been tricked into believing G??del's mere &quot;theorem&quot;",0.0,128,"['help', 'com', 'library', 'asp', 'quit', 'windowsversion', 'use', 'ultimate', 'edition', 'endof', 'quit', 'wonder', 'analytic', 'script', 'use', 'yet', 'page', 'decide', 'windowsversion', 'windowsedition', 'help', 'giorgiosardo', 'com', 'demon', 'selector', 'quit', 'himl', 'quit', 'help', 'blogs', 'man', 'com', 'archive', 'himl', 'asp', 'xur', 'son', 'selector', 'now', 'himl', 'too', 'seem', 'help', 'tool', 'ieft', 'org', 'xur', 'already', 'ieft', 'standard', 'tea', 'registry', 'avoid', 'name', 'conflict', 'easy', 'just', 'make', 'registry', 'such', 'ask', 'register', 'request', 'get', 'bogge', 'bureaucratic', 'process', 'year', 'never', 'get', 'definitive', 'answer', 'back', 'way', 'registry', 'never', 'give', 'incorrect', 'answer', 'hope', 'haven', 'be', 'trick', 'believe', 'mere', 'quit', 'theorem', 'quit']"
71171,71171,notes &quot;Detecting Firefox&quot; in community content What's XDR? ah. Cross-Domain Request there's also XRD whose coolness is questionable,0.0,18,"['note', 'quit', 'detect', 'firebox', 'quit', 'community', 'content', 'xur', 'cross', 'domain', 'request', 'there', 'also', 'ord', 'coolness', 'questionable']"
71174,71174,wants a registry of all registries that don't include themselves as a member But then how will I destroy the belief that all standards can be derived from the axiomatic proof?,0.0,31,"['want', 'registry', 'registry', 'don', 'include', 'member', 'then', 'destroy', 'belief', 'standard', 'derive', 'axiomatic', 'proof']"
71181,71181,"he called me fantastic, I called her a fat b*tch
Still kill the pussy, put the cat in a casket",0.0,20,"['call', 'fantastic', 'call', 'fat', 'tech', 'still', 'kill', 'pussy', 'put', 'cat', 'casket']"
71183,71183,"is 'WHATWG: http://www.whatwg.org/ -- logs: http://krijnhoetmer.nl/irc-logs/ -- stats: http://gavinsharp.com/irc/whatwg.html -- Please leave your sense of logic at the door, thanks!'",0.0,20,"['whatwe', 'help', 'whatwe', 'org', 'log', 'help', 'arc', 'log', 'stat', 'help', 'gavinsharp', 'com', 'arc', 'whatwe', 'himl', 'leave', 'sense', 'logic', 'door', 'thank']"
71185,71185,hmm. http://www.xanthir.com/demos/collidingcircles/ doesn't work for me in the Firefox build I happen to have clicking the canvas does nothing is reading 10 days of public-html email the accessibility rhetoric does not seem to help with finding solutions,0.0,37,"['help', 'panther', 'com', 'demos', 'collidingcircle', 'doesn', 'work', 'firebox', 'build', 'happen', 'click', 'canvas', 'read', 'day', 'public', 'himl', 'email', 'accessibility', 'rhetoric', 'seem', 'help', 'find', 'solution']"
71186,71186,my mos doesnt no if shes gonna be able to get off work friday so she said she mite not go then shes still waiting to hear no im keeping it real here lol :x:-*,0.0,35,"['mos', 's', 'go', 'able', 'get', 'work', 'so', 'say', 'mite', 'go', 'then', 's', 'still', 'wait', 'hear', 'keep', 'real', 'here', 'laugh', 'loud']"
71189,71189,Hi there My radio buttons are taking far too much vertical space how can I restrain it? theyre insede a hbox should I restrain the box's size? *inside,0.0,28,"['there', 'radio', 'button', 'take', 'far', 'too', 'much', 'vertical', 'space', 'restrain', 're', 'box', 'restrain', 'box', 'size', 'inside']"
71191,71191,"metzen: there is a macro GTK_WIDGET_VISIBLE() Evaluates to TRUE if the widget is visible. rigid: you should use gtk_widget_set_sensitive () I think that this is what set_senstive does I just tested it, and it works on gtk_spin_button",0.0,37,"['metre', 'macro', 'gak', 'widget', 'visible', 'evaluate', 'true', 'widget', 'visible', 'rigid', 'use', 'widget', 'set', 'sensitive', 'think', 'set', 'sensitive', 'just', 'test', 'work', 'spin']"
71192,71192,"how can one make a widget temporarily not receive/process any signals/callbacks? i found g_signal_block() but where should i get the signal_id from? i only know signal &quot;clicked&quot; ... Emiml, i'll try that Emiml, it doesn't seem to work with gtk_spin_button_set_value() ... the changed-callback still get's called... Emiml, can't i just block all &quot;changed&quot; signals for a while? hmm...",0.0,58,"['make', 'widget', 'temporarily', 'receive', 'process', 'signal', 'callback', 'find', 'signal', 'block', 'get', 'signal', 'd', 'only', 'know', 'quit', 'click', 'quit', 'emil', 'try', 'emil', 'doesn', 'seem', 'work', 'spin', 'set', 'value', 'change', 'callback', 'still', 'get', 'call', 'emil', 'just', 'block', 'quit', 'change', 'quit', 'signal', 'while']"
71194,71194,"hello hi hello So this dude Lehi he has four main sons, from oldest to youngest, are lamen, lemueal, sam, and nephi, i know 3 weird names and a normal one, so this lehi feller the heavens open up&quot; and he gets a vision Jerusalem is going to be destroyed unless the people repent so he tells them to do so  they throw rocks at him gods like gtfo of there so he leaves with his family into the wilderness so, gods like wtf go back and get these brass plates that have the history of your people and the religious shit too so lehi&apos;s like shit.....4 MAIN SONS.....go do it so they go back and these brass plates, when i say plates i mean like.....basically a book written on flat tablets in this case made of brass, so these belong to a guy named laben pretty fucking bad and they first ask, then bribe him, then hes just like fuck you i&apos;m taking all your gold and you&apos;re gonna die mother fuckers and sends his tiny army for hire at them so the two older brother, btw they&apos;re not too cool either, start beating up on nephi....well cause hes the youngest, had the ideas of asking then bribing, and hes the goody two shoes lets be righteous and follow god person and while they&apos;re doing this an angel appears and hes all fuck you this guy is chosen by god and he will rule over you cause you cannot govern yourselves they&apos;re like...well shit ok you&apos;re the man nephi, btw this happens alot in the book of mormon with these characters....so, they&apos;re on the outskirts of town waiting for someone to think of something then nephi’s like well im going to try again so he goes out and its night and he finds laben passed out drunk and an angel comes and is like KILL HIM and nephi’s like I could never do that and then the angels like it’s better for one man to be kill than a nation dwindle in unbelief so nephi’s like psh fine and he takes the sword and kills laben. So he takes laben’s clothes and goes to the place where the plates are kept and laben’s serpent is like what’s up and nephi, talking like laben and dressed like him, says give me the plates and the servant’s like ok and nephis tells him to fallow him and they walk to where his brothers were waiting and they see nephi think its laben and start to run off so nephi’s like wait it’s me and the servant’s like fuuuucccckkkkk and starts to try to creep off and nephi’s like dude come with me and you’ll be a free man so he’s like ok and they go. Then lehi’s like….go back and get HIS family cause you boys need wifes and hes got a lot of daughters so they do that.",0.0,488,"['so', 'dude', 'main', 'son', 'old', 'young', 'lame', 'nephew', 'know', 'weird', 'name', 'normal', 'one', 'lei', 'feller', 'heaven', 'open', 'quit', 'get', 'vision', 'go', 'destroy', 'people', 'repent', 'tell', 'so', 'throw', 'rock', 'god', 'gto', 'there', 'so', 'leave', 'family', 'wilderness', 'so', 'god', 'f', 'go', 'back', 'get', 'brass', 'plate', 'history', 'people', 'religious', 'shit', 'too', 'lei', 'like', 'shit', 'main', 'son', 'go', 'so', 'go', 'back', 'brass', 'plate', 'say', 'plate', 'mean', 'basically', 'book', 'write', 'flat', 'tablet', 'case', 'make', 'brass', 'belong', 'guy', 'name', 'label', 'pretty', 'fucking', 'bad', 'first', 'ask', 'then', 'bribe', 'then', 's', 'just', 'fuck', 'apos', 'take', 'gold', 'apos', 'go', 'die', 'mother', 'fucker', 'send', 'tiny', 'army', 'hire', 'old', 'brother', 'way', 'apos', 'too', 'cool', 'start', 'beat', 'nephew', 'well', 'cause', 's', 'young', 'idea', 'ask', 'then', 'bribe', 's', 'goody', 'shoe', 'let', 'righteous', 'follow', 'person', 'apos', 'do', 'angel', 'appear', 's', 'fuck', 'guy', 'choose', 'rule', 'govern', 'yourself', 'apos', 'apos', 'man', 'nephew', 'way', 'happen', 'alot', 'book', 'character', 'apos', 'outskirt', 'town', 'wait', 'think', 'then', 'nephew', 'like', 'go', 'try', 'again', 'so', 'go', 'night', 'find', 'label', 'pass', 'drunk', 'angel', 'come', 'kill', 'nephew', 'like', 'never', 'then', 'angel', 'well', 'man', 'kill', 'nation', 'dwindle', 'unbelief', 'so', 'nephew', 'like', 'push', 'fine', 'take', 'sword', 'kill', 'label', 'take', 'label', 'clothe', 'go', 'place', 'plate', 'keep', 'label', 'serpent', 'nephew', 'talk', 'label', 'dress', 'say', 'give', 'plate', 'servant', 'like', 'nephew', 'tell', 'fallow', 'walk', 'brother', 'wait', 'see', 'nephew', 'think', 'label', 'start', 'run', 'so', 'nephew', 'wait', 'servant', 'like', 'fuuuucccckkkkk', 'start', 'try', 'creep', 'nephew', 'like', 'dude', 'come', 'be', 'free', 'man', 'like', 'go', 'then', 'like', 'go', 'back', 'get', 'family', 'cause', 'boy', 'need', 'wife', 's', 'get', 'lot', 'daughter', 'so']"
