,Unnamed: 0,text,predator,text_len,preprocessed_bow
38910,38910,hi yeah so are u lol yeah who knows lol so ........... i dont like video games how old are u ? m or f ? chick 22 i dont think we know each other lol ok nice talking with u have a good night what is a fun conversatio what would u like to talk about lol i like comdey harold and kumar go to the white castle lol yeah they are funny lol do u smoke ? non smoker do u have tatto ? of course noooo lol yes do u ? i want one on my hips hmm haha my bf&apos;s name and say no entry lol lol do u have a gf ? why not ? haha ok it is ur private thing lol are u hot ? u should be active lol dont spend too much time on video game lol lol lol good whatcha doing ? i am a volunteer hmm served in orphanage yep hbu? what kind of fest cool lol well ? u wanna cyber ? yep i have a bf,0.0,179,"['so', 'laugh', 'loud', 'know', 'laugh', 'loud', 'like', 'video', 'game', 'how', 'old', 'chick', 'think', 'know', 'other', 'laugh', 'nice', 'talk', 'good', 'night', 'fun', 'conversation', 'would', 'like', 'talk', 'laugh', 'like', 'comedy', 'go', 'white', 'castle', 'laugh', 'funny', 'laugh', 'smoke', 'non', 'smoker', 'tatto', 'course', 'laugh', 'loud', 'want', 'one', 'hip', 'haha', 'name', 'say', 'entry', 'laugh', 'loud', 'laugh', 'why', 'private', 'thing', 'laugh', 'hot', 'should', 'active', 'spend', 'too', 'much', 'time', 'video', 'game', 'laugh', 'loud', 'laugh', 'loud', 'laugh', 'loud', 'good', 'whatcha', 'do', 'volunteer', 'serve', 'orphanage', 'hub', 'kind', 'f', 'cool', 'laugh', 'loud', 'want', 'cyber']"
38918,38918,"hiii how are you? im fine, thanks.. hbu? f/m? singapore..,you? f name? i&apos;m reni 17 ys me too. paris hilton. hihi",0.0,21,"['how', 'fine', 'thank', 'hub', 'singapore', 'name', 'rent', 'ys', 'too']"
38919,38919,hi how are you? im great! just chillin out asl? m 18 m us usa and you speak english? cool John nice to meet you reni :) what do you look like? fuck off,0.0,34,"['how', 'great', 'just', 'chillin', 'speak', 'meet', 'rent', 'look', 'fuck']"
38925,38925,hey m/f? hey age? from? hey 19 f japan i am horny...please do sex chat with me now fast what u have wear? ok me and my moth ae here *mther *mother u? alone? hey sheis not here now fast flirt me hey yup u?,0.0,45,"['hey', 'age', 'hey', 'horny', 'sex', 'chat', 'now', 'fast', 'wear', 'moth', 'here', 'other', 'mother', 'alone', 'here', 'now', 'fast', 'flirt']"
38926,38926,hi m/f? f germany u? 15 i study u age? nice ya but ill not give u ;) so what would u like talking about? do u have a girlfriend? that&apos;s bad why? i think bad luck soo are u virgin? nice so ya i have a boy why not sure well u can add me on msn my name is,0.0,61,"['germany', 'study', 'age', 'nice', 'ill', 'give', 'would', 'like', 'talk', 'girlfriend', 'apos', 'bad', 'why', 'think', 'bad', 'luck', 'soo', 'virgin', 'nice', 'so', 'boy', 'why', 'sure', 'can', 'add', 'man', 'name']"
38927,38927,hi m u? from? india age? what do u do 18 u have fb account ? ok m just asking not to saying to give me as u like no just b&apos;coz of my bad luck or good luck u r right do u have a boyfriend? no ok will u be my friend ? really ? ok how can i talk with u permanently ?,0.0,66,"['age', 'fu', 'account', 'ok', 'just', 'ask', 'say', 'give', 'like', 'just', 'apos', 'coz', 'bad', 'luck', 'good', 'luck', 'right', 'boyfriend', 'ok', 'will', 'friend', 'really', 'how', 'can', 'talk', 'permanently']"
38929,38929,"bugmail: [Bug 12787] 2D canvas createPattern(null, ...) should raise TypeError, not TYPE_MISMATCH_ERR &lt;http://lists.w3.org/Archives/Public/public-html-bugzilla/2011Aug/1213.html&gt; ** [Bug 12881] &quot;is expected to hide it&quot; is a bit vague. Clarify that it means display:none. &lt;http://lists.w3.org/Archives/Public/public-html-bugzilla/2011Aug/1212.html&gt; ** [Bug 12413] Handling of &lt;table border=0&gt; is incompatible with the Web &lt;http://lists.w3.org/Ar",0.0,44,"['gmail', 'bug', 'ad', 'canvas', 'createpattern', 'null', 'should', 'raise', 'typeerror', 'type', 'mismatch', 'err', 'help', 'list', 'org', 'archive', 'public', 'public', 'bug', 'expect', 'hide', 'quit', 'bit', 'vague', 'clarify', 'mean', 'display', 'none', 'help', 'list', 'org', 'archive', 'public', 'public', 'bug', 'handling', 'table', 'border', 'incompatible', 'web', 'help', 'list', 'org']"
38932,38932,"is there a way to use tabs for all windows? i want to use tab pages instead of multiple windows -- i.e., one window per tab btw, i think emacs has tabs, too",0.0,33,"['way', 'use', 'tab', 'window', 'want', 'use', 'tab', 'page', 'instead', 'multiple', 'window', 'e', 'window', 'bow', 'think', 'mac', 'tab', 'too']"
38933,38933,what do you mean exactly to set something &quot;globally&quot; put it in ~/.vimrc i didn't even know vim could do that i thought that was one of the main anti-vi(m) arguments,0.0,31,"['mean', 'exactly', 'set', 'quit', 'globally', 'quit', 'put', 'didn', 'even', 'know', 'could', 'think', 'main', 'anti', 'argument']"
38934,38934,"Hi How can i delete until last line -1 ? thpo: thanks. How can I know the font used in gvim, and save it (provided I've changed it before...) (maybe, some &quot;save current config&quot; could be appreciated, don't you think so?) jamessan: thanks",0.0,43,"['how', 'can', 'delete', 'last', 'line', 'theo', 'thank', 'how', 'can', 'know', 'font', 'use', 'grim', 'save', 'provide', 'change', 'maybe', 'quit', 'save', 'current', 'config', 'quit', 'could', 'appreciate', 'think', 'so', 'thank']"
38936,38936,"rixxon: vim7 introduced tabs boyd: vim -p file1 file2 file3 boyd: when you're in Vim, &quot;:tabe some_file&quot; instead of &quot;:e some_file&quot; er s/boyd/boggy/ yeah, I don't think that's a good use of Vim's tabs, but if that's what he wants to do... &quot;:set guifont?&quot; and then add that setting to your vimrc",0.0,52,"['introduce', 'file', 'file', 'file', 'boyd', 'when', 're', 'take', 'file', 'quit', 'instead', 'quit', 'e', 'file', 'quit', 'don', 'think', 'good', 'use', 'tab', 'want', 'quit', 'set', 'quit', 'then', 'add', 'set', 'vic']"
38937,38937,but that'll just make you type more to do the same as with simple :bn and so,0.0,17,"['just', 'make', 'type', 'more', 'same', 'simple', 'so']"
38940,38940,"edb259c0e0038f38bb200bc20c8cbf7e: I think the heading information for your table is almost right now The finalk thing is that the &lt;th&gt;Day 2&lt;/th&gt; has &quot;Day 1&quot; as one of its headings (and so on down the page) This is because these headers aren't assigned any heading information from the scope algorithm and HTML 4 says &quot;In the absence of header information from either the scope or headers attribute, user agents may construct header information according to the following algorithm&quot; From the implicit algorithm. I think it's an incorrect reading of the HTML 4 spec, but I don't know what the right reading is. Because, at the moment, my implementation assumes that &quot;&quot;In the absence of header information from either the scope or headers attribute&quot; applies to the cell we are trying to assign a heading to in the case of the &lt;th&gt; cell containing &quot;Day 2&quot; there is no information from any scope or headers attribute that assigns heading information to that cell edb259c0e0038f38bb200bc20c8cbf7e: But does HTML 4 actually say that? My reading is that if a cell has no heading information supplied from headers or scope you then do the row/column search ignoring scope or headers attributes edb259c0e0038f38bb200bc20c8cbf7e: agreed My imp. of the HTML 5 algorithm seems to get that right My conclusion from playing with a few tables on the net is that nothing always makes sense cc097e0d7183ae8436e7df709553c8c0: I'm interested insofar as it it necessary to show people that vauge = bad + probably illogical (illogical in non-trivial cases, that is)",0.0,251,"['edb259c0e0038f38bb200bc20c8cbf7e', 'think', 'head', 'information', 'table', 'almost', 'right', 'now', 'final', 'thing', 'day', 'quit', 'day', 'quit', 'heading', 'so', 'on', 'page', 'header', 'assign', 'head', 'information', 'scope', 'say', 'quit', 'absence', 'header', 'information', 'scope', 'header', 'attribute', 'user', 'agent', 'may', 'construct', 'header', 'information', 'accord', 'follow', 'quit', 'implicit', 'algorithm', 'think', 'i', 'incorrect', 'reading', 'himl', 'don', 'know', 'right', 'reading', 'moment', 'implementation', 'assume', 'quit', 'quit', 'absence', 'header', 'information', 'scope', 'header', 'attribute', 'quit', 'apply', 'cell', 'try', 'assign', 'heading', 'case', 'cell', 'contain', 'day', 'quit', 'information', 'scope', 'header', 'attribute', 'assign', 'head', 'information', 'cell', 'actually', 'say', 'reading', 'cell', 'head', 'information', 'supply', 'header', 'scope', 'then', 'row', 'column', 'search', 'ignore', 'scope', 'header', 'attribute', 'agree', 'imp', 'seem', 'right', 'conclusion', 'play', 'few', 'table', 'net', 'always', 'make', 'sense', 'interest', 'insofar', 'necessary', 'show', 'people', 'vague', 'bad', 'probably', 'illogical', 'illogical', 'non', 'trivial', 'case']"
38941,38941,"how would Day 2 get Day 1? Day 1 has an explicit scope... I do get how Day x gets Location, estimated time, etc. although that's not desired I'm not sure why you think there's absense of scope or headers attribute I suppose I need something like &lt;th scope=rowgroup colspan=4 headers&gt;Day x&lt;/th&gt; to override the Location, Height, ... headings assuming &lt;th headers&gt; works like that b9acb5df457f56156060d93d0827b8ac, yeah, so you look up and find a &lt;th&gt;, but that &lt;th&gt; can't be the header of the header because it has a different scope... not sure it also seems that the headers given in &lt;thead&gt; are not applied to the four columns... this is the case in the HTML5 algorithm though HTML5 actually has exactly how I want it including the scope=rowgroup headers not getting the &lt;thead&gt; headers wonders if that always makes sense I'm not sure if that's correct usage though of HTML tables because it doesn't make much sense to me to put summaries in headers that's not actually clear from HTML4 the prose doesn't really support that comment I'm not sure why it doesn't make sense. Comments, notes, examples, etc. are all non-normative. (Although in this specific case nothing much is normative and the whole thing is rather vague.) is not going to add scope=&quot;row&quot; to all his &lt;tr&gt;s euh, &lt;td&gt;s it's also good to know what use cases HTML4 catered for ? oh I'm not sure why it's unrealistic to study actual tables out there shrugs and goes to bed Given the way how HTML5 defines that browsers should present an image (inside an HTML document) you can  theoretically style that page using the Link: HTTP header... adds it to a list of silly things to test &quot;, and to the #mrt crew, the #mrt.no crew, and the cabal for their ideas and support.&quot; lol, I'm pretty sure that read #whatwg before...",0.0,313,"['how', 'would', 'day', 'day', 'day', 'explicit', 'scope', 'how', 'day', 'get', 'location', 'estimate', 'time', 'desire', 'sure', 'why', 'think', 'there', 'absense', 'scope', 'header', 'attribute', 'suppose', 'need', 'header', 'day', 'it', 'override', 'location', 'height', 'heading', 'assume', 'header', 'work', 'b9acb5df457f56156060d93d0827b8ac', 'so', 'look', 'find', 'can', 'header', 'header', 'different', 'scope', 'sure', 'also', 'seem', 'header', 'give', 'head', 'apply', 'column', 'case', 'actually', 'exactly', 'how', 'want', 'include', 'scope', 'regroup', 'header', 'get', 'head', 'header', 'wonder', 'always', 'make', 'sense', 'sure', 'correct', 'usage', 'table', 'doesn', 'make', 'much', 'sense', 'put', 'summary', 'header', 'actually', 'clear', 'doesn', 'really', 'support', 'comment', 'sure', 'why', 'doesn', 'make', 'sense', 'comment', 'note', 'example', 'non', 'normative', 'specific', 'case', 'much', 'normative', 'whole', 'thing', 'rather', 'vague', 'go', 'add', 'scope', 'quit', 'row', 'quit', 'euh', 'also', 'good', 'know', 'use', 'case', 'cater', 'sure', 'why', 'unrealistic', 'study', 'actual', 'table', 'there', 'shrug', 'go', 'bed', 'give', 'way', 'how', 'define', 'browser', 'should', 'present', 'image', 'document', 'can', 'theoretically', 'style', 'page', 'use', 'link', 'help', 'add', 'list', 'silly', 'thing', 'test', 'quit', 'meet', 'crew', 'meet', 'crew', 'cabal', 'idea', 'support', 'quit', 'lol', 'pretty', 'sure', 'read', 'whatwe']"
38942,38942,"Probably not. You could have a header cell for a rowgroup in a row that contained summary information/totals for the rowgroup I think I've seen tables like that in print. correct usage of what? Why aren't you? edb259c0e0038f38bb200bc20c8cbf7e: I don't see why not. A good example would be demographics. say you have area then pop in the thead then you have each rowgroup as a continent with total pop then you have countries in each rowgroup row with their respective pop Don't forget that a td can be a header simultaneously with being a data cell. edb259c0e0038f38bb200bc20c8cbf7e: yes it is. it's stated in the DTD is there anything that contradicts that? edb259c0e0038f38bb200bc20c8cbf7e: I think trying to read the comments against the prose doesn't make much sense. Specifications aren't meant to be read to be self-contradicting. :) (They might be self-contradicting by accident, but you don't seem to be arguing that's the case here.) edb259c0e0038f38bb200bc20c8cbf7e: Actually the prose does say: &quot;Note that it's not always possible to make a clean division of cells into headers or data. You should use the TD element for such cells together with the id or scope attributes as appropriate.&quot; Which seems a relatively clear restatement of the principle. edb259c0e0038f38bb200bc20c8cbf7e: Yes. But they are all intended to help explain the spec, not contradict it. therefore trying to read them as a source of contradictions, like two alternative sources for the same thing, is strange (that quote is from 11.4.1) edb259c0e0038f38bb200bc20c8cbf7e: also note the example intended to illustrate the scope attribute which features td with the scope=&quot;row&quot; followed by the text in the prose: &quot;Although the first cell in each row contains data, not header information, the scope attribute makes the data cell behave like a row header cell.&quot; edb259c0e0038f38bb200bc20c8cbf7e: Actually looking through the prose throughout supports that comment. I hadn't realised just how supported it was. I can't see how one could construct anything contradicting the comment. cc097e0d7183ae8436e7df709553c8c0: Depends on whether &quot;figuring out an algorithm ... that works with existing tables&quot; without consulting the spec that data table creators used is a realistic task. I suspect it isn't. (Although I'd certainly say it would be also worth looking at representations of the spec in major unlearning resources like w3schools.) edb259c0e0038f38bb200bc20c8cbf7e: I didn't say it was. I think that's a very important part of the process too. edb259c0e0038f38bb200bc20c8cbf7e: What I am saying is it's unrealistic to /only/ do that. (because the spec is a guide to well-authored tables that aren't sampled and unlearning resources are a guide to badly authored ones)",0.0,424,"['probably', 'could', 'header', 'cell', 'regroup', 'row', 'contain', 'summary', 'information', 'total', 'regroup', 'think', 've', 'see', 'table', 'print', 'correct', 'usage', 'why', 'edb259c0e0038f38bb200bc20c8cbf7e', 'don', 'see', 'why', 'good', 'example', 'would', 'demographic', 'say', 'area', 'then', 'pop', 'head', 'then', 'regroup', 'continent', 'total', 'pop', 'then', 'country', 'regroup', 'row', 'respective', 'pop', 'forget', 'can', 'header', 'simultaneously', 'data', 'cell', 'state', 'contradict', 'edb259c0e0038f38bb200bc20c8cbf7e', 'think', 'try', 'read', 'comment', 'prose', 'doesn', 'make', 'much', 'sense', 'specification', 'aren', 'mean', 'read', 'self', 'contradict', 'may', 'self', 'contradicting', 'accident', 'seem', 'argue', 'case', 'here', 'edb259c0e0038f38bb200bc20c8cbf7e', 'actually', 'prose', 'say', 'quit', 'note', 'always', 'possible', 'make', 'clean', 'division', 'cell', 'header', 'datum', 'should', 'use', 'element', 'such', 'cell', 'together', 'would', 'scope', 'attribute', 'appropriate', 'quit', 'seem', 'relatively', 'clear', 'restatement', 'principle', 'all', 'intend', 'help', 'explain', 'spec', 'contradict', 'therefore', 'try', 'read', 'source', 'contradiction', 'alternative', 'source', 'same', 'thing', 'strange', 'quote', 'edb259c0e0038f38bb200bc20c8cbf7e', 'also', 'note', 'example', 'intend', 'illustrate', 'scope', 'attribute', 'feature', 'scope', 'quit', 'row', 'quit', 'follow', 'text', 'prose', 'quit', 'first', 'cell', 'row', 'contain', 'datum', 'header', 'information', 'scope', 'attribute', 'make', 'data', 'cell', 'behave', 'row', 'header', 'cell', 'quit', 'actually', 'look', 'prose', 'support', 'comment', 'hadn', 'realise', 'just', 'how', 'support', 'can', 'see', 'how', 'could', 'construct', 'contradict', 'comment', 'depend', 'quit', 'figure', 'algorithm', 'work', 'existing', 'table', 'quit', 'consult', 'spec', 'datum', 'table', 'creator', 'use', 'realistic', 'task', 'suspect', 'certainly', 'say', 'would', 'also', 'worth', 'look', 'representation', 'spec', 'major', 'unlearning', 'resource', 'school', 'didn', 'say', 'think', 'very', 'important', 'part', 'process', 'too', 'edb259c0e0038f38bb200bc20c8cbf7e', 'say', 'unrealistic', 'only', 'spec', 'guide', 'well', 'author', 'table', 'sample', 'unlearning', 'resource', 'guide', 'badly', 'author', 'one']"
38943,38943,is unsure what the benefit is of trying to figure out what the intent of html4 is isn't it better to focus on figuring out an algorithm for html5 that works with existing tables on the web? b9acb5df457f56156060d93d0827b8ac: ok,0.0,39,"['unsure', 'benefit', 'try', 'figure', 'intent', 'better', 'focus', 'figure', 'algorithm', 'work', 'exist', 'table', 'web', 'b9acb5df457f56156060d93d0827b8ac']"
38945,38945,I'm hoping that doesn't count as a legitimate use case for &lt;input usemap&gt; (It's good to see the author has stopped using &lt;font&gt; - now they just need to go a little further and stop using &lt;/font&gt; too...),0.0,38,"['hope', 'doesn', 'count', 'legitimate', 'use', 'case', 'input', 'good', 'see', 'author', 'stop', 'use', 'font', 'now', 'just', 'need', 'go', 'little', 'further', 'stop', 'use', 'font', 'too']"
38947,38947,hi what&apos;s up? f you? where from? 18 you? ahha~ where from? ahha.. south korea you know south korea?,0.0,19,"['where', 'where', 'know']"
38951,38951,bugmail: [Bug 7157] New: I would like to see theora/vorbis as HTML5 standard. I'm tired of codec patents. &lt;http://lists.w3.org/Archives/Public/public-html-bugzilla/2009Jul/0061.html&gt; ** [Bug 7156] New: I would like to see theora/vorbis as HTML5 standard. I'm tired of codec patents. &lt;http://lists.w3.org/Archives/Public/public-html-bugzilla/2009Jul/0060.html&gt;,0.0,38,"['bug', 'would', 'like', 'see', 'theory', 'vobis', 'tire', 'patent', 'help', 'list', 'org', 'archive', 'public', 'public', 'bug', 'would', 'like', 'see', 'theory', 'vobis', 'tire', 'patent', 'help', 'list', 'org', 'archive', 'public', 'public']"
38967,38967,"anyone knows which version of chrome has css profiler? 7e92afba2b833719d96dfb3a3e624739, it hasnt come to stable yet? 7e92afba2b833719d96dfb3a3e624739, right now I am having chrome 17 ok",0.0,25,"['know', 'version', 'chrome', 'ass', 'profiler', 'come', 'stable', 'right', 'now', 'have', 'chrome', 'ok']"
38972,38972,"-there should be many things in yafray, that aren't there yet ;) -maybe not use greek letters for the carving :) -and exchange the floor texture :) -hehe -you mean LOD hopefully? :) -hehe Cheapy -which game is that? -umm :) -lol -MukiEX: LOD told you before -oh, 2 scenes in one blend? -hehe -me neither",0.0,56,"['should', 'many', 'thing', 'array', 'there', 'yet', 'maybe', 'use', 'greek', 'letter', 'carving', 'exchange', 'floor', 'texture', 'mean', 'old', 'hopefully', 'hehe', 'cheapy', 'game', 'old', 'tell', 'scene', 'blend', 'hehe']"
38973,38973,"+<a href=""http://img397.imageshack.us/my.php?image=sormus23hw.jpg"">http://img397.imageshack.us/my.php?image=sormus23hw.jpg</a> +carving inside of that is not on place, but beside that, how do you like it? +i don't know what those are... +i didn't have any words are days to put in it so i took random letters with font that dosn't say anything to me :) +true. floor is not the best one. +Cheapy: are you now sure that boobs are on rigtr position? +absolutely positive? +100% sure? +can i use light probe images to illuminate objects in blender? +Auralis: make it reflect more light and make it hard +if you make realistic space ships to a game or a movie and everything else like that, you would have to take sounds and explosions off too. would it look interesting? +why?",0.0,124,"['help', 'img397', 'imageshack', 'pop', 'image', 'jog', 'help', 'imageshack', 'pop', 'image', 'jog', 'carving', 'inside', 'place', 'how', 'like', 'don', 'know', 'didn', 'word', 'day', 'put', 'so', 'take', 'random', 'letter', 'font', 'down', 'say', 'true', 'floor', 'good', 'cheapy', 'now', 'sure', 'boob', 'rigor', 'position', 'absolutely', 'positive', 'sure', 'can', 'use', 'light', 'probe', 'image', 'illuminate', 'object', 'blender', 'mural', 'make', 'reflect', 'more', 'light', 'make', 'hard', 'make', 'realistic', 'space', 'ship', 'game', 'movie', 'else', 'would', 'take', 'sound', 'explosion', 'off', 'too', 'would', 'look', 'interesting', 'why']"
38974,38974,"-Does anyone know any good furniture tutorials for blender? Im trying to make a chair, covered by some sort of blanket... -How do you move the ObData (little dot) in a model? -ah right, thanks MickMcMack",0.0,36,"['know', 'good', 'furniture', 'tutorial', 'blender', 'try', 'make', 'chair', 'cover', 'sort', 'blanket', 'how', 'move', 'data', 'little', 'dot', 'model', 'right', 'thank', 'mickmcmack']"
38975,38975,"-Thanks, bert =3 -I made a new scene, and modeled something in it. How do I move it to the current scene? -Appending didn't work. -It wouldn't let me access the same scene. -err, .blend file I mean. -Yeah ^_^ -I got it tho. -Just made a new .blend; messy, but worked. -You have a point there. -No real reason, actually. -I've only been using Blender for a few days, still getting used to everything.",0.0,75,"['thank', 'make', 'new', 'scene', 'model', 'how', 'move', 'current', 'scene', 'append', 'work', 'let', 'access', 'same', 'scene', 'err', 'blend', 'file', 'mean', 'get', 'just', 'make', 'new', 'blend', 'messy', 'work', 'point', 'there', 'real', 'reason', 'actually', 've', 'only', 'use', 'blender', 'few', 'day', 'still', 'get', 'use']"
38976,38976,"-<a href=""http://www.planetgargoyle.com/models/nexlei8.jpg"">http://www.planetgargoyle.com/models/nexlei8.jpg</a> hehe -yes -yes -yes -nexuiz -<a href=""http://www.planetgargoyle.com/models/hsicleavage.png"">http://www.planetgargoyle.com/models/hsicleavage.png</a> also you can peek down her cleavage -the model itself is around 3000 triangles -no -there's a detailed bow on her back too -as well as a pair of large claw arms",0.0,41,"['help', 'planetgargoyle', 'com', 'model', 'help', 'planetgargoyle', 'com', 'model', 'hehe', 'nexus', 'help', 'planetgargoyle', 'com', 'model', 'hsicleavage', 'pig', 'help', 'planetgargoyle', 'com', 'model', 'hsicleavage', 'also', 'can', 'peek', 'cleavage', 'model', 'triangle', 'no', 'there', 'detailed', 'bow', 'back', 'too', 'as', 'well', 'pair', 'large', 'claw', 'arm']"
38977,38977,"+ACTION fluffles spiderworm +spiderworm, nice work on the wiki. x) +That model _really_ scares me, Cheapy. x| +You can move the cursor to where you want it to be, then do Center Cursor in the edit buttons.",0.0,37,"['action', 'spiderworm', 'spiderworm', 'nice', 'work', 'wiki', 'model', 'really', 'scare', 'cheapy', 'can', 'move', 'cursor', 'where', 'want', 'then', 'center', 'cursor', 'edit', 'button']"
38979,38979,"+Cheapy: and most of them are in her boobs? +ShortWave: when are you going to release it? +Auralis: material looks like plastic +or maybe it's just that it's grey +looks great as usual tho +why the red/green halos? I mean this is a military wessel in firing mode and in space +personally I've always thought it silly that space craft have a) windows b) ship lights c) strange surface features +but they're fantasy, so I guess it should just look good +a smooth sphere with docking cradle, sensor suit and propulsion doesn't look good +actually assuming radar is used, a smooth sphere would be rather bad +Auralis: yeah, but that has ridiculous amount of details on it, I ment smooth +where's the death star beam weapon? +texturing something like that would be mad +sorsis: you'd need pretty impressive texture resolution, and the amount of details.. +it has a lot of duplication I guess +but if they're in the mesh and not dupliverts, it'd be pain",0.0,165,"['cheapy', 'most', 'boob', 'shortwave', 'when', 'go', 'release', 'mural', 'material', 'look', 'plastic', 'maybe', 'just', 'grey', 'look', 'great', 'usual', 'tho', 'why', 'red', 'halo', 'mean', 'military', 'vessel', 'fire', 'mode', 'space', 'personally', 've', 'always', 'think', 'silly', 'space', 'craft', 'window', 'ship', 'light', 'strange', 'surface', 'feature', 're', 'fantasy', 'so', 'guess', 'should', 'just', 'look', 'good', 'smooth', 'sphere', 'docking', 'cradle', 'sensor', 'suit', 'propulsion', 'doesn', 'look', 'good', 'actually', 'assume', 'radar', 'use', 'smooth', 'sphere', 'would', 'rather', 'bad', 'mural', 'ridiculous', 'amount', 'detail', 'ment', 'smooth', 'where', 'death', 'star', 'weapon', 'texture', 'would', 'mad', 'horse', 'need', 'pretty', 'impressive', 'texture', 'resolution', 'amount', 'detail', 'lot', 'duplication', 'guess', 're', 'mesh', 'duplivert', 'be', 'pain']"
