,Unnamed: 0,text,predator,text_len,preprocessed_bow
21734,21734,"you, me, bed, now. YAY. NORMAL PERSON? pleasepleaseplease be normal. hahaha. Sweet, (: just not lookin forr cyber sex shit. lol. hahaha. I thought so (: it&apos;s not even pleasurable, is it? Haha. I&apos;m sure it would be. Like, Idk. It&apos;s....different. Lol. I have a good imagination.... but, no. still no. hahaha. Oh, I know. Some people are weird! Lol. And GOOD! I hope I&apos;m not awkward. haha ME. TOO. I don&apos;t gettt itttt. You can&apos;t just, turn lesbian, then turn straight again. hahaha. I thank the lord for the wittle disconnect button. (: I use it far too much,. hahahaa. yessss. There was a guy that came on like, &quot;25 m into incest.&quot; and i&apos;m just like, oh, uh, no. I know, right? hahah. Oh gosh. This one guy was telling me about how a 13 year old girl offered him nudes. i was like, holy shit. what is wrong with kidsss. the generations just get worse. that&apos;s what im screamin. ahaha. omg. ive never said that before. like saying. but screaming it. cause it&apos;s important. idk. a kid at my school says it, i&apos;ve always wanted a reason to say it hahaha. im satisfied. NNNOOOO. I&apos;m from a really boring place called ohio. Lol. Lies. haha. how&apos;d you know?! Do you really live in ohio?? What part of ohio? not to be like, creepy and whatnot.  just wondering. hahaha. west side is the best side. :P I&apos;m in cincinnati. :D This is too weird. lol. I&apos;ve never met anyone on here that lived decently close to me!!! It&apos;s cool! Hahaha. I&apos;m in highschoooolll :/ Only 16. sadly. Haha. PSSHH. I can&apos;t wait till that ageeee. Then i won&apos;t have to worry about my parents grounding me for every little thingg! Haha. I get in trouble for the gayest things! Like telling my brother to shut up AFTER he told me to burn in hell. guess who get&apos;s in trouble. THIS GIRL :D YAYY. Lol. Oh welll though. I knew you were! :DI don&apos;t know how, I just did :P I feel like you type differently than a guy would! haha. I think that&apos;s how you would do it. hahaha. I hate thatttt. When I have to keep up the conversation with a guy! I do know this guy though, that I&apos;m actually friends with. He talks alot on text, uses proper grammer, no abbreviations, adds all the &apos; things in don&apos;t, can&apos;t it&apos;s, and all that. And I find that very weird for a guy, but I like it! i cant believe i forgot what &apos; is called... Yeah! It&apos;s niceeee. This guy isn&apos;t even like, &quot;nerdy&quot;, or anything though! He&apos;s actually realllllllyyyyy cute! it&apos;s so weird. Lol. ..................No (: He&apos;s just a friend. A cute friend :D well, I did like him at the beginning of the school year..... haha. i don&apos;t knowww if i do anymore! He&apos;s too good of a friend! :P It is! but i&apos;m a sophomore. So can&apos;t go unless I have a Junior or Senior date :/ and that, I do not. D: My ex is a senior. And not to sound like a bitchhh but he would take me in a heartbeat. Lol. NO. i went to homecoming with him my Freshman year. he didn&apos;t even dance with me during THE ONLY slow song...... I ended up leaving him to dance with my friends. I was so mad..... Haha. They can be pretttyyy dumb. not all! but most :P hahha. Awww. That&apos;s always fun. lol. Telling them no is the worst part... they don&apos;t understand sometimes :( I know!! Like, you try and be soooooo nice. But after so long, you just have to tell them straight up. YEAH! and then it&apos;s downhill from there. hahahaha. oh my gosh. I had a kid that liked me all eighth grade year. He was weird. and i dont even know how many times i told him i wasnt interested. he still, to this day, tries to talk to me :/ That&apos;s significantly awkward. that&apos;s a little weird! hahahaha. I think I&apos;m getting off here soon. I didn&apos;t realize it was midnight :/ hahha Nice meeting you!!!!!! (: We may never talk againnnn.... so, farewell my friend... Lol that is very possible.",0.0,708,"['bed', 'now', 'normal', 'person', 'pleasepleaseplease', 'normal', 'sweet', 'just', 'shit', 'think', 'so', 'even', 'pleasurable', 'apos', 'sure', 'would', 'ink', 'different', 'good', 'imagination', 'still', 'no', 'know', 'people', 'weird', 'lol', 'good', 'hope', 'awkward', 'haha', 'too', 'don', 'getto', 'titty', 'can', 'just', 'turn', 'lesbian', 'then', 'turn', 'straight', 'again', 'thank', 'disconnect', 'button', 'use', 'far', 'too', 'much', 'hahaha', 'guy', 'come', 'quit', 'am', 'incest', 'apos', 'just', 'know', 'guy', 'tell', 'how', 'year', 'old', 'girl', 'offer', 'nude', 'holy', 'shit', 'wrong', 'kid', 'generation', 'just', 'bad', 'apos', 'have', 'never', 'say', 'before', 'say', 'scream', 'important', 'ink', 'kid', 'school', 'say', 've', 'always', 'want', 'reason', 'say', 'satisfied', 'apo', 'really', 'boring', 'place', 'call', 'lie', 'haha', 'how', 'know', 'really', 'live', 'part', 'whatnot', 'just', 'wonder', 'side', 'good', 'side', 'apos', 'too', 'weird', 've', 'never', 'meet', 'here', 'live', 'decently', 'close', 'cool', 'apo', 'only', 'sadly', 'haha', 'push', 'can', 'wait', 'agree', 'then', 'win', 'worry', 'parent', 'ground', 'little', 'thingg', 'get', 'trouble', 'gay', 'thing', 'tell', 'brother', 'shut', 'tell', 'burn', 'hell', 'guess', 'get', 'trouble', 'girl', 'know', 'know', 'how', 'just', 'feel', 'type', 'differently', 'guy', 'would', 'haha', 'think', 'how', 'would', 'hahaha', 'hate', 'when', 'keep', 'conversation', 'guy', 'know', 'guy', 'apos', 'actually', 'friend', 'talk', 'alot', 'text', 'use', 'proper', 'grammer', 'abbreviation', 'add', 'thing', 'can', 'apo', 'find', 'very', 'weird', 'guy', 'like', 'can', 'believe', 'forget', 'call', 'nictere', 'guy', 'even', 'quit', 'nerdy', 'quit', 'apo', 'actually', 'realllllllyyyyy', 'cute', 'so', 'just', 'friend', 'cute', 'friend', 'like', 'beginning', 'school', 'year', 'don', 'knoww', 'anymore', 'apo', 'too', 'good', 'friend', 'apo', 'sophomore', 'so', 'can', 'go', 'junior', 'senior', 'date', 'ex', 'senior', 'sound', 'bitch', 'would', 'take', 'heartbeat', 'lol', 'go', 'homecoming', 'freshman', 'year', 'didn', 'even', 'dance', 'only', 'slow', 'song', 'end', 'leave', 'dance', 'friend', 'so', 'mad', 'can', 'pretttyyy', 'dumb', 'most', 'haha', 'always', 'fun', 'lol', 'tell', 'bad', 'part', 'don', 'understand', 'sometimes', 'know', 'try', 'soooooo', 'nice', 'after', 'so', 'long', 'just', 'tell', 'straight', 'then', 'downhill', 'there', 'hahahaha', 'kid', 'like', 'eighth', 'grade', 'year', 'weird', 'even', 'know', 'how', 'many', 'time', 'tell', 'interested', 'still', 'day', 'try', 'talk', 'significantly', 'awkward', 'little', 'weird', 'hahahaha', 'think', 'apo', 'get', 'here', 'soon', 'didn', 'realize', 'midnight', 'nice', 'meeting', 'may', 'never', 'talk', 'so', 'farewell', 'friend', 'laugh', 'loud', 'very', 'possible']"
21736,21736,"hey How u doing? Im not too bad myself, except for possibly having diabetes yeah which type? hahaa so whats ur name? Im Alexander aundrea? are u black kinda of a black name made up of course lol yes, ander, andra is the girl oh ok how old are u aundrea I got that oh I meant alexandra would be a girl Im 21 not from my angle just kiddin nothing special, more responsibilities thats about it which part huh? oh u said lovely because u 17, made a joke its nottoo lovely on my side who does but we stuck i guess u too aundrea",0.0,106,"['how', 'do', 'too', 'bad', 'possibly', 'have', 'diabetes', 'type', 'so', 's', 'name', 'black', 'kinda', 'black', 'name', 'make', 'course', 'laugh', 'loud', 'and', 'anda', 'girl', 'how', 'old', 'get', 'mean', 'alexandra', 'would', 'girl', 'angle', 'just', 'kiddin', 'special', 'more', 'responsibility', 's', 'part', 'say', 'lovely', 'make', 'joke', 'nottoo', 'lovely', 'side', 'stick', 'guess', 'too']"
21737,21737,"hey. how are you? great. you? :) oh my. i&apos;m reaaally sorry to hear that. :/ one of my bestfriends has diabetes. i&apos;m not really sure. it&apos;s not the worse kind. it&apos;s one of the healthier ones. lol. aundrea. what&apos;s yours? nice name. male? no! lol. i get that a lot. i&apos;m white. i am a girl. 17. what about you, alex? lovely. :) what&apos;s it like being the big 21? huh? lol. you said something about an angle? ohhh. i don&apos;t really wanna grow up. well... some people... i guess... i have to go, unfortunately. it was nice meeting you. :) you guess? i enjoyed our convo...",0.0,108,"['how', 'great', 'apos', 'really', 'sorry', 'hear', 'bestfriend', 'diabetes', 'really', 'sure', 'bad', 'kind', 'apo', 'healthy', 'one', 'lol', 'yours', 'nice', 'name', 'male', 'get', 'lot', 'apos', 'white', 'girl', 'lovely', 'like', 'big', 'say', 'angle', 'ohhs', 'really', 'want', 'grow', 'well', 'people', 'guess', 'go', 'unfortunately', 'nice', 'meeting', 'guess', 'enjoy', 'convo']"
21740,21740,21 male hi from turkey yess we can be friend ;) have a msn? want to tell me? ok <email/> are u online now,0.0,24,"['male', 'less', 'can', 'friend', 'man', 'want', 'tell', 'ok', 'email', 'online', 'now']"
21741,21741,hi there 17 female :) korea cool haha maybe :) haha yes <email/> there you go yep,0.0,17,"['female', 'maybe', 'email', 'there', 'go']"
21746,21746,"So, why can't I find the spec for innerHTML anymore? Oh you made a whole new spec for it. You know that will confuse the hell out of people, right?",0.0,30,"['so', 'why', 'can', 'find', 'spec', 'anymore', 'make', 'whole', 'new', 'spec', 'know', 'will', 'confuse', 'hell', 'people', 'right']"
21753,21753,"Dulath, hm. I'd rather not. Norky, give him english Dulath, hal = hardware abstraction layer Dulath, dbus = lets 2 programs inteeract with each other Dulath, dbus doesn't stand for aanything, but it can be visualized as multiple cars sending messages to other houses can sp,rone help: er can someone help:.. i want to enable keyboard accessibility. how can i enable keyboard accessibility? Dulath, thanks. i didnt see that submenu. Dulath, alt+numlock mouse is slow for me, so.... :-) UM. so why don't I see my other HD in &quot;Computer&quot;? Dulath, I don't want to go to the  CLI just for one command. Is there a way for me to get Fedora Core 5 to mount it automatically? Healot, How? as root? Healot, do I have to install it? Healot, not there. Healot, hey dont nvm me Dulath, echo $PATH Dulath, does &quot;whereis tomboy&quot; work? [thewiz@x1-6-00-50-ba-55-75-16 ~]$ whereis pmount pmount: Healot, not there. wtf :P anyway",0.0,156,"['rather', 'dorky', 'give', 'hardware', 'abstraction', 'layer', 'bus', 'let', 'program', 'interact', 'other', 'bus', 'stand', 'can', 'visualize', 'multiple', 'car', 'send', 'message', 'other', 'house', 'can', 'so', 'rone', 'help', 'can', 'help', 'want', 'enable', 'keyboard', 'accessibility', 'how', 'can', 'enable', 'keyboard', 'thank', 'see', 'slow', 'so', 'so', 'why', 'see', 'other', 'computer', 'quit', 'don', 'want', 'go', 'cli', 'just', 'command', 'way', 'core', 'mount', 'automatically', 'zealot', 'how', 'root', 'zealot', 'install', 'zealot', 'there', 'zealot', 'nom', 'quit', 'whereis', 'tomboy', 'quit', 'work', 'ba', 'whereis', 'amount', 'amount', 'zealot', 'there', 'f', 'anyway']"
21755,21755,"yum yum just type &quot;mount&quot; in terminal use pmount? pmount &lt;device&gt; pmount is the userspace mount, doesn't require root permission kbrooks, it shouldbe installed, especially when you installed GNOME kbrooks, type &quot;pmount&quot; in terminal, see if it is there nvm then you can mount manually using mount whereis, maybe path? pmount is either in /sbin or /usr/sbin you can yum yum pmount :-",0.0,63,"['just', 'type', 'quit', 'terminal', 'use', 'amount', 'amount', 'device', 'amount', 'outerspace', 'require', 'root', 'permission', 'brook', 'shouldbe', 'instal', 'especially', 'when', 'instal', 'type', 'quit', 'amount', 'quit', 'terminal', 'then', 'can', 'mount', 'manually', 'use', 'maybe', 'path', 'amount', 'skin', 'usr', 'skin', 'can', 'yum', 'amount']"
21756,21756,"Dulath: check that google link it apaprently is due to a hal/d-bus interaction Dulath: did you copy /usr/share/doc/bcm43xx-fwcutter-004/modprobe.bcm43xx into /etc/modprobe.d/ ? yeah, I don't think it will fix anything wrt NM but try ity cp /usr/share/doc/bcm43xx-fwcutter-004/modprobe.bcm43xx /etc/modprobe.d/ Dulath: did you use the fwcutter tool to extrat the firmware from teh Windows .sys driver file? ok, cool, so you shoudl see one or more files in /lib/firmware if you hadn't done that bit, then you would have been unable to get a connection even using s-c-n, but I'm jsut double checking to be sure Dulath: apparently it is working for other people: https://bugzilla.redhat.com/bugzilla/show_bug.cgi?id=186329#c29 Dulath: if you've removed the rc.local entry, try a reboot",0.0,112,"['check', 'link', 'apparently', 'due', 'hal', 'bus', 'copy', 'usr', 'share', 'cutter', 'modprobe', 'modprobe', 'don', 'think', 'will', 'fix', 'art', 'try', 'ity', 'share', 'modprobe', 'use', 'cutter', 'tool', 'extra', 'firmware', 'driver', 'file', 'cool', 'shoudl', 'see', 'more', 'file', 'lib', 'firmware', 'hadn', 'do', 'bit', 'then', 'would', 'unable', 'connection', 'even', 'use', 'jsut', 'double', 'checking', 'sure', 'apparently', 'work', 'other', 'people', 'hate', 'bugzilla', 'redhat', 'com', 'bugzilla', 'bug', 'cgi', 'would', 'can', 'duluth', 'remove', 're', 'local', 'entry', 'try', 'reboot']"
21758,21758,"Heh, I don't know what that means k Norky: I read through that list and it sounds like it's an unresolved bug =/ They don't talk about hacks or fixes either No.. I don't recall doing that Norky: Shall I? done Yes the bcmwl5.sys Yeah, 12 bcm related files kbrooks: System -&gt; Preferences -&gt; Accessibility -&gt; Keyboard no? Not mounted? Was weiss Baerlach, obwohl er es nicht wissen sollte? Whoops kbrooks, do a &quot;locate pmount&quot; I noticed that in my Fedora install at least that none of the commands are mapped, and I have to include the path to them to execute them Sure Norky: I'm not finding anything else of interesting in this search",0.0,115,"['don', 'know', 'mean', 'dorky', 'read', 'list', 'sound', 'i', 'unresolved', 'bug', 'don', 'talk', 'hack', 'fix', 'don', 'recall', 'do', 'shall', 'do', 'bcmwl5', 'bum', 'related', 'file', 'system', 'preference', 'accessibility', 'keyboard', 'mount', 'weiss', 'quit', 'locate', 'amount', 'quit', 'notice', 'fedora', 'install', 'least', 'none', 'command', 'map', 'include', 'path', 'execute', 'sure', 'find', 'else', 'interesting', 'search']"
21759,21759,is it possible to turn standard partitions to logical volumes with the logical volume management tool with out wiping the partitions?,0.0,21,"['possible', 'turn', 'standard', 'partition', 'logical', 'volume', 'logical', 'volume', 'management', 'tool', 'out', 'wipe', 'partition']"
21760,21760,damn where is all the legacy peeps at chemaja im in that channel itas dead my cdrom wont mount as there is already too many devices mounted will that work for me aswell anyone use fedoracore 2 that wants to help me in the fedora legacy room pls,0.0,48,"['where', 'legacy', 'peep', 'schemata', 'dead', 'carom', 'will', 'mount', 'already', 'too', 'many', 'device', 'mount', 'will', 'work', 'aswell', 'use', 'fedoracore', 'want', 'help', 'room']"
21762,21762,hi guys anyone already installed on their linux box the lotus notes jowa is your reply intended for me k hello anyone who experience or successfully installed lotus note on their box,0.0,32,"['guy', 'already', 'instal', 'reply', 'intend', 'hello', 'experience', 'successfully', 'instal', 'note', 'box']"
21763,21763,"ok, I need working kernel source/headers .. is there an easy yum command to make this happen ? like yum install kernel-headers ? jowa: sweet, thanks",0.0,26,"['need', 'work', 'kernel', 'source', 'header', 'easy', 'command', 'make', 'happen', 'install', 'header', 'thank']"
21764,21764,"yum install kernel-devel No, it was intended for ipfw (who recieved it just fine. Sorry abt the confusion)",0.0,18,"['install', 'kernel', 'level', 'intend', 'receive', 'just', 'fine', 'abt', 'confusion']"
21766,21766,hi i am using fc3 i have some problem with yum when ever i use yum update it says Error: Missing Dependency:[pkg name] &gt;= 0.7.0 is needed by package [packagename] how do i solve that,0.0,35,"['use', 'problem', 'when', 'ever', 'use', 'update', 'say', 'error', 'miss', 'dependency', 'pig', 'name', 'need', 'package', 'packagename', 'how', 'solve']"
21767,21767,before the errata expire to update RH9 i save the updates in cdrom... please tell me how update my system to read the cdrom not to check the internet for updates in redhat 9. im using up2date tool hello anyone can help me on my updates problem,0.0,47,"['errand', 'expire', 'update', 'save', 'update', 'tell', 'how', 'update', 'system', 'read', 'carom', 'check', 'internet', 'update', 'redhat', 'use', 'update', 'tool', 'can', 'help', 'problem']"
21771,21771,hi! male or female? 25 male horny sweden msn? u got messenger? yes my dick is hard do u have a pic? good do u like to suck cock? a lot thnx how old is the oldest? guy u fucked,0.0,40,"['male', 'female', 'male', 'horny', 'sweden', 'man', 'get', 'messenger', 'dick', 'hard', 'pic', 'good', 'like', 'suck', 'cock', 'lot', 'thne', 'how', 'old', 'old', 'guy', 'fuck']"
21772,21772,16 horny f usa :) i dont have an msn:( r u horny? good! my pussy is wet do u like sex? hold on i am getting u a pic yes i do like sucking dick i dont have gag refelixs,0.0,41,"['horny', 'man', 'horny', 'good', 'pussy', 'wet', 'like', 'sex', 'hold', 'get', 'pic', 'suck', 'gag', 'refelixs']"
21775,21775,heya wat? finally got my cell workin again cheap crappy thing so like are you in OC or wat? I didnt understand yur last IM u there? k but u have to be back in riverside tonight rite? :-( 2am is to late dood how bout tomorow? how bout skip your frnds bday and come see me? oh ok when ? so thats like when? i didnt understand yur IM so like mebbe 8? kewl :-) 1 sec i gotta find it written down long beach its real near the want me to call to say hi? k no a house kinda an ugly brownish color park on the street an come to the side door by the garage its pretty easy to find i think u cant call it coz my mom put this stupid privacy thing on if yur numbers not on an allowed list u get a vm stupid bithc bitch but i culd call u round 730 huh? lol coz yur cute it did? im sry i say that to lotsa ppl did i relly creep u? huh? i just bein frndly dont u call girls baby an stuff like that? oh sry i guess i just kinda that way uh....... i thot we was in tune but mebbe not wha? wat happened? yur bein wierd prison? wat r u talkin bout? a bit ago u wanted to crawl in bed with me now yur like im some sorta bitch or sumthin im confused i guess k bye,0.0,252,"['finally', 'get', 'cell', 'workin', 'again', 'cheap', 'crappy', 'thing', 'so', 'understand', 'last', 'there', 'back', 'riverside', 'tonight', 'rite', 'late', 'dood', 'how', 'tomorow', 'how', 'about', 'skip', 'find', 'day', 'come', 'see', 'when', 'so', 's', 'when', 'understand', 'yur', 'so', 'mebbe', 'kewl', 'get', 'find', 'write', 'long', 'beach', 'real', 'want', 'call', 'say', 'house', 'kinda', 'ugly', 'brownish', 'color', 'park', 'street', 'come', 'side', 'door', 'garage', 'pretty', 'easy', 'find', 'think', 'can', 'call', 'coz', 'mom', 'put', 'stupid', 'privacy', 'thing', 'number', 'allow', 'list', 'get', 'stupid', 'bitch', 'bitch', 'culd', 'call', 'round', 'huh', 'laugh', 'loud', 'coz', 'yur', 'cute', 'sry', 'say', 'relly', 'creep', 'just', 'fondly', 'call', 'girl', 'baby', 'stuff', 'guess', 'just', 'kinda', 'way', 'thot', 'tune', 'mebbe', 'wha', 'happen', 'prison', 'talkin', 'bout', 'bit', 'ago', 'want', 'crawl', 'bed', 'now', 'sorta', 'bitch', 'sustain', 'confused', 'guess', 'bye']"
21776,21776,"changes: hixie: Make &lt;canvas&gt; fallback in the rendering correctly. (whatwg r4206) &lt;http://lists.w3.org/Archives/Public/public-html-diffs/2009Oct/0124.html&gt; ** hixie: Drop init*EventNS(), since DOM Events is dropping namespaced events. (whatwg r4204) &lt;http://lists.w3.org/Archives/Public/public-html-diffs/2009Oct/0123.html&gt; ** hixie: Make &lt;script for&gt; block script execution. (whatwg r4203) &lt;http://lists.w3.org/Archives/Public/public-html-diff bugmail: [Bug 7848] MathML version used in HTML5 &lt;http://lists.w3.org/Archives/Public/public-html-bugzilla/2009Oct/0365.html&gt; ** &quot;[Bug 7856] When JavaScript or &lt;canvas&gt; is disabled &lt;canvas&gt; should be treated as an ordinary element and not a replaced element.&quot; (2 messages in thread) &lt;http://lists.w3.org/Archives/Public/public-html-bugzilla/2009Oct/0364.html&gt; ** [Bug 7806] atom ID element generation for feed entries &lt;http://lists.w3.org/Archi",0.0,84,"['change', 'make', 'canvas', 'fallback', 'rendering', 'correctly', 'whatwe', 'help', 'list', 'org', 'archive', 'public', 'public', 'drop', 'event', 'dom', 'event', 'drop', 'namespace', 'event', 'help', 'list', 'org', 'archive', 'public', 'public', 'pixie', 'make', 'script', 'help', 'list', 'org', 'archive', 'public', 'public', 'bug', 'math', 'version', 'use', 'help', 'list', 'org', 'archive', 'public', 'public', 'quit', 'bug', 'when', 'canva', 'disable', 'canvas', 'should', 'treat', 'ordinary', 'element', 'replace', 'element', 'quit', 'message', 'thread', 'help', 'list', 'org', 'archive', 'public', 'public', 'bug', 'atom', 'would', 'element', 'generation', 'feed', 'entry', 'help', 'list', 'org', 'arch']"
21777,21777,hello whats up good you? hows life? hating on people thats about it a/s means i hate people all people its a gift lol good dodge on the a/s thought lol why not spain? mexico? oh ok so age and male or female? 25/m,0.0,44,"['s', 'good', 'how', 's', 'life', 'hate', 'people', 's', 'mean', 'hate', 'people', 'people', 'gift', 'laugh', 'loud', 'good', 'dodge', 'a', 'think', 'laugh', 'loud', 'why', 'so', 'age', 'male', 'female']"
21778,21778,"hi how r u? fine pretty good wats ur hobbies/ hating on people?
i dont understand why? well in my country its a saying
love and live na india 20 m u?",0.0,32,"['how', 'fine', 'pretty', 'good', 'wat', 'hobby', 'hate', 'people', 'understand', 'why', 'country', 'say', 'love', 'live', 'am']"
21782,21782,CONSEQUENCES :o tumblr? or /b/tard wut cancer in the breatestes breastesesssss* poop on you YOUR RESISTENCE IS INLY MAKING MY PENIS HARDERR &lt;3 WELL FUCK ME RUNNING. YOU&apos;RE AWFUL. ya would :(,0.0,32,"['consequence', 'tard', 'cancer', 'breastese', 'breastesesssss', 'resistence', 'inly', 'make', 'penis', 'harder', 'fuck', 'run', 're', 'awful', 'would']"
21783,21783,implying they&apos;ll never be the same implying i&apos;d go to /b/ 2.0 with snazzy interface assuming you must be summerfag or cancer implying it makes a difference implying talking about breasts are funny implying I&apos;d care that i&apos;m not letting you have fun implying i&apos;d be amused at your attempts to repeat old memes implying your &lt;3 would make me mad implying i&apos;d fuck you running not really not at all.. implying your emoticon would make me feel sorry for you,0.0,81,"['imply', 'apo', 'all', 'never', 'be', 'same', 'imply', 'apos', 'go', 'snazzy', 'interface', 'assume', 'must', 'summer', 'cancer', 'imply', 'make', 'difference', 'imply', 'talk', 'breast', 'funny', 'imply', 'care', 'apos', 'let', 'fun', 'imply', 'be', 'amuse', 'attempt', 'repeat', 'old', 'meme', 'imply', 'would', 'make', 'mad', 'imply', 'fuck', 'run', 'really', 'at', 'all', 'imply', 'emoticon', 'would', 'make', 'feel', 'sorry']"
21784,21784,"hi stopped do do do do. do do . do do. Cant&apos; touch this. not bad, you? awesome just watching the animatrix you? skins? what&apos;s it about? lol ah cool.  good characters usually make or break a story.",0.0,38,"['stop', 'can', 'apos', 'touch', 'bad', 'awesome', 'just', 'watch', 'unimatrix', 'skin', 'laugh', 'loud', 'cool', 'good', 'character', 'usually', 'make', 'break', 'story']"
21785,21785,"STOP hammertime Haha, yeah so, how are you? not bad either, felt like I was four again, had lots of sugar and stuff, but whatever what are you up to? had been watching skins the whole day, now i&apos;m just sipping on some coffee and chatting yeah, it&apos;s this series from the uk and my friends kept telling me to watch it so I decided to give it a go and I&apos;m truly in love with it reckless teenagers, lol just a lot of teen drama, it&apos;s a bit idiot sometimes, but it&apos;s hard not to fall for the characters",0.0,100,"['stop', 'summertime', 'so', 'how', 'bad', 'feel', 'again', 'lot', 'sugar', 'stuff', 'watch', 'skin', 'whole', 'day', 'now', 'apos', 'just', 'sip', 'coffee', 'chatting', 'apo', 'series', 'friend', 'keep', 'tell', 'watch', 'so', 'decide', 'give', 'go', 'apos', 'truly', 'love', 'reckless', 'teenager', 'laugh', 'just', 'lot', 'teen', 'drama', 'bit', 'idiot', 'sometimes', 'apo', 'hard', 'fall', 'character']"
21788,21788,"is anyone not in North America that can test a site please? is anyone not in North America that can test a site please? oops www.justmakegames.com nah 33efc1e92757da55a29793522ce54302 some1 in Germany just said it didnt load, thanks for checkign i was gonna clean my room, but i played battlefield 3",0.0,50,"['can', 'test', 'site', 'can', 'test', 'site', 'oop', 'just', 'say', 'load', 'thank', 'check', 'go', 'clean', 'room', 'play']"
21789,21789,which site? seems to work fine to me is there anything in particular you are wanting to test there? no probs,0.0,21,"['site', 'seem', 'work', 'fine', 'particular', 'want', 'test', 'there', 'probs']"
