,Unnamed: 0,text,predator,text_len,preprocessed_bow
24373,24373,"Virgin Atlantic Airways says it will ban passengers from using Apple and Dell laptops running on battery power for all international flights. Passengers on the U.K.-based airline carrying the laptops can bring them aboard only after removing the battery and storing it in carry-on luggage, according to the company Redwood City (CA) - The most powerful computing device in your PC may not be that dual-core processor, but your average graphics card. Interest in tapping the hidden processing power in graphics processor has been growing over the past two years, but Peakstream is the first company to actually offer a solution to create a supercomputer based on graphics cards. Peakstream claims that it has developed a new software platform that can create supercomputers by combining the processing capability of common CPUs with the resources of modern graphics cards. Simply by adding the horsepower of graphics cards to an existing computer, the company claims that the original system can be accelerated by a factor of 20x. lol <a href=""http://www.tomshardware.co.uk/2006/09/18/jvc_pulsating_sphere_speakers/"">http://www.tomshardware.co.uk/2006/09/18/jvc_pulsating_sphere_speakers/</a> yarr what's the difference between xvid and divx? ok cool",0.0,178,"['say', 'will', 'ban', 'passenger', 'use', 'apple', 'laptop', 'run', 'battery', 'power', 'international', 'flight', 'passenger', 'base', 'airline', 'carry', 'laptop', 'can', 'bring', 'only', 'remove', 'battery', 'store', 'carry', 'luggage', 'accord', 'company', 'redwood', 'city', 'ca', 'most', 'powerful', 'computing', 'device', 'pa', 'may', 'dual', 'core', 'processor', 'average', 'graphic', 'card', 'interest', 'tap', 'hide', 'processing', 'power', 'graphic', 'processor', 'grow', 'past', 'year', 'peakstream', 'first', 'company', 'actually', 'offer', 'solution', 'create', 'supercomputer', 'base', 'graphic', 'card', 'peakstream', 'claim', 'develop', 'new', 'software', 'platform', 'can', 'create', 'supercomputer', 'combine', 'processing', 'capability', 'common', 'cup', 'resource', 'modern', 'graphic', 'card', 'simply', 'add', 'horsepower', 'graphic', 'card', 'exist', 'computer', 'company', 'claim', 'original', 'system', 'can', 'accelerate', 'factor', 'laugh', 'ref', 'help', 'uvc', 'pulsating', 'sphere', 'speaker', 'help', 'uvc', 'pulsating', 'sphere', 'speaker', 'yard', 'difference', 'dive', 'cool']"
24375,24375,"i have a friend who is a phd student in cs who was working on running code on graphics cards.  they problem was that the instruction sets onthe graphics cards were missing some key instructions, for instance, any kind of ability to fork",0.0,43,"['friend', 'pod', 'student', 'work', 'run', 'code', 'graphic', 'card', 'problem', 'instruction', 'set', 'onthe', 'graphic', 'card', 'miss', 'key', 'instruction', 'instance', 'kind', 'ability', 'fork']"
24386,24386,"bugmail: [Bug 13179] &quot;alternative&quot; A possible alternative to the main track, e.g. a different take of a song (audio), or a different angle (video). Audio and video. Ogg: &quot;audio/alterate&quot; or &quot;video/alternate&quot;. in this piece of content the audio/alterate I believe is a typo. &lt;http://lists.w3.org/Archives/Public/public-html-bugzilla/2011Aug/1217.html&gt; ** [Bug 13449] Don't allow blank alt text on area elements &lt;http://lists.w3.org/Archives/Public/publi 13179: contributor, P3, RESOLVED FIXED, &quot;alternative&quot; A possible alternative to the main track, e.g. a different take of a song (audio), or a different angle (video). Audio and video. Ogg: &quot;audio/alterate&quot; or &quot;video/alternate&quot;. in this piece of content the audio/alterate I believe is a typo. changes: hixie: typo (whatwg r6408) &lt;http://lists.w3.org/Archives/Public/public-html-diffs/2011Aug/0070.html&gt; bugmail: [Bug 13401] Make command.checked behavior consistent with input.checked &lt;http://lists.w3.org/Archives/Public/public-html-bugzilla/2011Aug/1219.html&gt; ** [Bug 13401] Make command.checked behavior consistent with input.checked &lt;http://lists.w3.org/Archives/Public/public-html-bugzilla/2011Aug/1218.html&gt;",0.0,127,"['gmail', 'bug', 'quit', 'alternative', 'quit', 'possible', 'alternative', 'main', 'track', 'different', 'take', 'song', 'audio', 'different', 'angle', 'video', 'audio', 'video', 'ogg', 'quit', 'audio', 'alternate', 'quit', 'quit', 'video', 'alternate', 'quit', 'piece', 'content', 'audio', 'alternate', 'believe', 'typo', 'help', 'list', 'org', 'archive', 'public', 'public', 'bug', 'allow', 'blank', 'text', 'area', 'element', 'help', 'list', 'org', 'archive', 'public', 'public', 'contributor', 'resolve', 'fix', 'quit', 'alternative', 'quit', 'possible', 'alternative', 'main', 'track', 'different', 'take', 'song', 'audio', 'different', 'angle', 'video', 'audio', 'video', 'ogg', 'quit', 'audio', 'alternate', 'quit', 'quit', 'video', 'alternate', 'quit', 'piece', 'content', 'audio', 'alternate', 'believe', 'typo', 'change', 'typo', 'whatwe', 'help', 'list', 'org', 'archive', 'public', 'public', 'gmail', 'bug', 'make', 'command', 'check', 'behavior', 'consistent', 'input', 'check', 'help', 'list', 'org', 'archive', 'public', 'public', 'bug', 'make', 'command', 'check', 'behavior', 'consistent', 'input', 'check', 'help', 'list', 'org', 'archive', 'public', 'public']"
24387,24387,html-spec: ianh@340c8d12-0b0e-0410-8428-c7bf67bfef74 * c43afe8d2eca r6407 / (index complete.html source): html-spec: [e] (0) typo html-spec: Fixing http://www.w3.org/Bugs/Public/show_bug.cgi?id=13179,0.0,16,"['index', 'complete', 'source', 'typo', 'fix', 'help', 'org', 'bug', 'public', 'show', 'bug', 'cgi', 'would']"
24388,24388,I have an overly chatty windows box here that keeps sending out UDP packets to port 137. Will &quot;iptables -t filter -I FORWARD 9 -p UDP -rport 137 -s 192.168.1.50 -j DROP&quot; entered in on my Linux box doing NAT block this data?,0.0,43,"['overly', 'chatty', 'window', 'box', 'here', 'keep', 'send', 'packet', 'port', 'will', 'quit', 'table', 'filter', 'forward', 'up', 'report', 'drop', 'enter', 'do', 'block', 'data']"
24393,24393,"bugmail: [Bug 12858] This doesn't actually define &quot;align descendants&quot;. It says which descendants are to be aligned, but not what's supposed to happen to them. Is it like floating, or something else? &lt;http://lists.w3.org/Archives/Public/public-html-bugzilla/2011Aug/1884.html&gt; ** [Bug 13793] New: &quot;The the caption element&quot; &lt;http://lists.w3.org/Archives/Public/public-html-bugzilla/2011Aug/1883.html&gt; ** [Bug 13568] use of &quot;accessible&quot; to refer to p",0.0,52,"['gmail', 'bug', 'doesn', 'actually', 'define', 'quit', 'align', 'descendant', 'quit', 'say', 'descendant', 'align', 'suppose', 'happen', 'float', 'else', 'help', 'list', 'org', 'archive', 'public', 'public', 'bug', 'quit', 'caption', 'element', 'quit', 'help', 'list', 'org', 'archive', 'public', 'public', 'bug', 'use', 'quit', 'accessible', 'quit', 'refer']"
24394,24394,"b8810fee2f4a71f849f3f7409546d1d9, bugzilla sucks? it does? maybe someone should file a bug on URL stuff then ah, missed that i was thinking about filing a bug on &lt;keygen&gt; the other day so that I don't forget it breakz teh Webz Result: Valid HTML5 Note: implied tags found (learn more, show me) might be a mess with styling &lt;p&gt; ... &lt;section&gt; ... &lt;h1&gt; ends up with &lt;h1&gt; as sibling of &lt;p&gt; the real solution is probably adding support for these elements quickly because you do want the implied &lt;p&gt; euh, implied &lt;/p&gt; having it for &lt;div&gt; and not for &lt;section&gt; would be weird I'm not sure if the not filing bugs in Bugzilla practice works btw. Seems that Hixie files bugs himself to keep himself from doing URL work! Madness",0.0,128,"['bugzilla', 'suck', 'maybe', 'should', 'file', 'bug', 'stuff', 'then', 'miss', 'think', 'file', 'bug', 'oxygen', 'other', 'day', 'don', 'forget', 'break', 'web', 'result', 'valid', 'himl', 'note', 'implied', 'tag', 'find', 'learn', 'more', 'show', 'may', 'mess', 'style', 'section', 'end', 'sible', 'it', 'real', 'solution', 'probably', 'add', 'support', 'element', 'quickly', 'want', 'imply', 'euh', 'imply', 'have', 'div', 'section', 'would', 'weird', 'sure', 'file', 'bug', 'bugzilla', 'practice', 'work', 'bow', 'seem', 'pixie', 'file', 'bug', 'keep', 'do', 'url', 'work', 'madness']"
24396,24396,"edb259c0e0038f38bb200bc20c8cbf7e: bugzilla password renewal email sucks oops. my mail filters suck is a bit nervous that that the new block elements are defined to have interaction with implicit &lt;/p&gt; without a parse error so authors can now shoot themselves in the foot with omitted &lt;/p&gt; during the transition to HTML5 cc097e0d7183ae8436e7df709553c8c0: Yeah. cc097e0d7183ae8436e7df709553c8c0: in fact, I have a request on file to provide warnigns on implied tags f139aba52f9fa1394b4034a7954b2220: different DOMs are scary f139aba52f9fa1394b4034a7954b2220: well that's my point. if you want to ensure it, a validator doesn't tell you oh, I agree that not having it would be weird in the long run fun! the algorithms for li, dd and dt have changed aargh. AAA step #8 has changed. is it merely editorial? ab7faae5d7b250ea8606486575f8f79c: since March 13th since May 13th, too ab7faae5d7b250ea8606486575f8f79c: it seems to me that the first para of step 8 has changed since the W3C diff oops. I'm looking at the diff the wrong way round heh https://bugzilla.mozilla.org/show_bug.cgi?id=439646",0.0,160,"['password', 'renewal', 'email', 'suck', 'oop', 'mail', 'filter', 'suck', 'bit', 'nervous', 'new', 'block', 'element', 'define', 'interaction', 'implicit', 'parse', 'error', 'author', 'can', 'now', 'shoot', 'foot', 'omit', 'transition', 'fact', 'request', 'file', 'provide', 'warning', 'implied', 'tag', 'f139aba52f9fa1394b4034a7954b2220', 'different', 'scary', 'f139aba52f9fa1394b4034a7954b2220', 'well', 'point', 'want', 'ensure', 'validate', 'doesn', 'tell', 'agree', 'have', 'would', 'weird', 'long', 'run', 'fun', 'algorithm', 'change', 'aka', 'step', 'change', 'merely', 'editorial', 'may', 'too', 'seem', 'first', 'para', 'change', 'diff', 'look', 'diff', 'wrong', 'way', 'round', 'hate', 'org', 'show', 'bug', 'cgi', 'would']"
24397,24397,"b8810fee2f4a71f849f3f7409546d1d9, why is it a problem? I fail to see how generating an implied end tag for p when encounting a new element like section will cause back compat problems. although it will create slightly different DOMs in new browsers compared with current browsers so JS libraries could be used to fix up the DOMs. Just find all section, aside, article, etc., check if any have a P element has a parent and move it. or just ensure you always use &lt;/p&gt; before such an element. oh well. hey, does anyone have any suggestions for example use cases of data-* attributes, that could be used in an article? The use cases in this article are already covered by the WF2 attributes with the same name http://www.alistapart.com/articles/scripttriggers/ - so that didn't help me much.",0.0,133,"['why', 'problem', 'fail', 'see', 'how', 'generate', 'implied', 'end', 'tag', 'when', 'count', 'new', 'element', 'section', 'will', 'cause', 'combat', 'problem', 'will', 'create', 'slightly', 'different', 'doe', 'new', 'browser', 'compare', 'current', 'browser', 'so', 'library', 'could', 'use', 'fix', 'just', 'find', 'section', 'article', 'check', 'element', 'parent', 'move', 'just', 'ensure', 'always', 'use', 'element', 'suggestion', 'example', 'use', 'case', 'datum', 'attribute', 'could', 'use', 'article', 'use', 'case', 'article', 'already', 'cover', 'attribute', 'same', 'name', 'help', 'alistapart', 'com', 'article', 'scripttrigger', 'help', 'much']"
24398,24398,Changed since when? I believe there was one non-editorial change since I last looked at it http://www.w3.org/TR/2008/WD-html5-20080610/diff/tree-construction.html#adoptionAgency jgraham__: http://blog.whatwg.org/atmedia-2008 misspells my name,0.0,22,"['change', 'when', 'believe', 'non', 'editorial', 'change', 'last', 'look', 'help', 'org', 'himl', 'tree', 'construction', 'medium', 'misspell', 'name']"
24406,24406,"well ? wassuuup ? jus chillin listenin to Pink Floyd amazing i feel high and i&apos;m completely sober Awesome !! i LOVE dire Straits too  ! my next song Six blade knife :) i think we&apos;re best friends already lol India you &gt; morrocco ? amazing place i&apos;ve heard you speak french right ? primarily ? niice oui means Yes.. lol s all i know so, wassup with you ? I Love that song too u like High Hopes ? mark knopfler is awesome yeah http://www.facebook.com/Araknus lol...i took that picture today thank you red sweat shirt ? cool nice background man is all of morocco so neat ? ha ha you should see india NOO lmao you google india, you&apos;ll see trash on the roads",0.0,125,"['listening', 'pink', 'feel', 'high', 'apo', 'completely', 'sober', 'awesome', 'love', 'dire', 'strait', 'too', 'next', 'blade', 'knife', 'think', 're', 'good', 'friend', 'already', 'laugh', 'loud', 'india', 'morocco', 'amazing', 'place', 'hear', 'speak', 'right', 'primarily', 'nice', 'oui', 'mean', 'laugh', 'know', 'so', 'love', 'song', 'too', 'like', 'high', 'hope', 'awesome', 'help', 'com', 'uranus', 'lol', 'take', 'picture', 'today', 'thank', 'sweat', 'shirt', 'cool', 'nice', 'background', 'man', 'so', 'neat', 'should', 'see', 'a', 'see', 'trash', 'road']"
24407,24407,hi nothing u? waw cool i listen to pink &amp; mark knopfler i listen now to telegraph road :D cooool waw it&apos;s nice really where u from ? lol i&apos;m from morrocco yeah hahaha yeah oui oui je la parles bien ;) yeah hey you i love this song from pink http://www.youtube.com/watch?v=dd3btVhwr48&amp;feature=related yeah yeah listen to this http://www.youtube.com/watch?v=dd3btVhwr48&amp;feature=related it&apos;s from mark are u in facebook? nice pic man http://www.facebook.com/Araknus#!/azzdiine.laanani it&apos;s me yeah thank you not all there are places not neat ! hhhhh neat? xD,0.0,85,"['waw', 'listen', 'pink', 'listen', 'now', 'telegraph', 'cool', 'nice', 'really', 'where', 'laugh', 'apos', 'oui', 'oui', 'parle', 'love', 'song', 'pink', 'help', 'youtube', 'com', 'watch', 'feature', 'relate', 'listen', 'help', 'youtube', 'com', 'watch', 'feature', 'relate', 'man', 'help', 'com', 'lanai', 'thank', 'place', 'neat', 'neat']"
24410,24410,google xorg.conf DisplaySize you should be able to come up with the math algorythm to figure yours out.,0.0,18,"['displaysize', 'should', 'able', 'come', 'math', 'algorithm', 'figure']"
24411,24411,"avtobiff: How would you mount it? avtobiff: You can read data from a partition without a filesystem.  The 'mount' command requires a filesystem specification (or an 'auto' option to guess). avtobiff: You aren't mounting the partition, actually, you're mounting the filesystem on it. avtobiff: It's almost certainly vfat. avtobiff: Alternatively, you can read the raw datastream using dd. avtobiff: I may be unpartitioned.  This doesn't mean it has no filesystem. avtobiff: You can create a filesystem on a raw disk.  You can also partition a file. avtobiff: ... and fdisk isn't going to tell you what filesystem you've got.  Try:  mkdir /mnt/misc; mount -t auto &lt;USB mass storage&gt; /mnt/misc avtobiff: Dollars to donuts it mounts as dos or vfat. avtobiff: ... the actual order depends on the sequence of filesystems in /proc/filesystems, or /etc/filesystems, if you've created it. avtobiff: ... order == order of detection.  dos often preceeds vfat in /proc/filesystems. dragonfly: Not so far as swap is concerned. dragonfly: Naturally, if it's logical and you delete the underlying physical partition, yes, it makes a difference. dragonfly: Um.  You don't &quot;mount&quot; swap, you activate it. dragonfly: How were you verifying active swap partitions, how were you activating it, and any output either to shell, console, logfiles, or dmesg? dragonfly: It's possible you've got underlying disk issues, which would indicate that this is a very good time to make sure your backups are current. dragonfly: Might be a good time to run some stress-testing on the disk. dragonfly: 'bonnie' is among the tools you can use... tilrman: True, but if the disk is still working, I'd get what I could now. dragonfly: Hrm.  Did you have swap properly initialized?  You can switch to a shell (&lt;alt&gt;&lt;F2&gt;) and run 'dmesg'.  Look for anything like a &quot;read-seek complete error&quot;. dragonfly: It'll brutalized your disk for a while.  See if it wimps out. tilrman: hrm... tilrman: Thanks.  I like this:  You can tell dd_rescue to start from the end of a file and move bcakwards. dragonfly: Disks, more than a lot of hardware, exhibit signs of infant death. dragonfly: ... that is, the ones that are going to fail often do early on.  So stress-testing them can be a good idea. dragonfly: And I'm once bitten - toss it out WRT disk errors.  RMA it if it's warranteed. tilrman: I also like:  Just one note: It does work. I unfortunately did not just create this program for fun ... tilrman: Yeah.  I love those little phrases that code for hours of anger, loss, denial, frustration, blood, sweat, and tears. avtobiff: NP. dragonfly: You can also install and run smartmontools for most recent hard drives. dragonfly: There are two tests, short and long.  Short only takes a minute or so, long runs about 30. dragonfly: Both can be run while your system's active, though the long test will impact performance markedly.  The short test rarely claims a failure when there isn't one (low false positive), but sometimes misses stuff (moderate false negative).  Long test is more accurate overall but takes longer. dragonfly: If you install the package it runs the tests for you automatically, periodically. dragonfly: Check that your disk isn't now being seen as /dev/hda rather than /dev/sda dragonfly: ... if you've got SATA there are two modes of accessing it, one interprets as SCSI (sda) the other as ATA (hda). WTF? dragonfly: I did? dragonfly: Probably my lag.  If I typed a few lines together, they'll hit the channel at the same time and debhelper kicks me. dragonfly: cat /proc/partitions dragonfly: ... should list your visible partitions. dragonfly: ... and they may be either sda or hda, depending.  If you don't see anything, other strangeness is going on.  Most likely you don't have the right drivers for your SATA drisk. dragonfly: Yeah.  Most likely you're in an initrd shell right now which is going to be pretty limited. dragonfly: ... the change is different kernels, you're not running the installer's kernel but the one you installed after.  Prolly want to update to a 2.6.x kernel right smart. dragonfly: ?? dragonfly: You'll probably have to edit /etc/fstab as well if you have other partitions.",0.0,690,"['how', 'would', 'mount', 'avtobiff', 'can', 'read', 'datum', 'partition', 'filesystem', 'require', 'filesystem', 'specification', 'auto', 'option', 'guess', 'mount', 'partition', 'actually', 're', 'mount', 'filesystem', 'avtobiff', 'almost', 'certainly', 'fat', 'avtobiff', 'alternatively', 'can', 'read', 'raw', 'datastream', 'use', 'may', 'partition', 'doesn', 'mean', 'filesystem', 'avtobiff', 'can', 'create', 'filesystem', 'raw', 'disk', 'can', 'also', 'partition', 'file', 'avtobiff', 'disk', 'go', 'tell', 'filesystem', 'get', 'try', 'medium', 'meet', 'auto', 'usb', 'mass', 'storage', 'meet', 'dollar', 'donut', 'mount', 'do', 'fat', 'avtobiff', 'actual', 'order', 'depend', 'sequence', 'filesystem', 'pro', 'filesystem', 'filesystem', 'create', 'avtobiff', 'order', 'order', 'detection', 'do', 'often', 'preceed', 'fat', 'pro', 'filesystem', 'dragonfly', 'so', 'far', 'swap', 'concern', 'dragonfly', 'naturally', 'logical', 'delete', 'underlying', 'physical', 'partition', 'make', 'difference', 'dragonfly', 'quit', 'swap', 'activate', 'how', 'verify', 'active', 'swap', 'partition', 'how', 'activate', 'output', 'shell', 'console', 'logfile', 'dragonfly', 'possible', 'get', 'underlying', 'disk', 'issue', 'would', 'indicate', 'very', 'good', 'time', 'make', 'sure', 'backup', 'current', 'dragonfly', 'may', 'good', 'time', 'run', 'stress', 'test', 'disk', 'tool', 'can', 'use', 'tillman', 'true', 'disk', 'still', 'work', 'get', 'could', 'now', 'dragonfly', 'swap', 'properly', 'initialize', 'can', 'switch', 'shell', 'alt', 'fu', 'run', 'look', 'quit', 'read', 'seek', 'complete', 'error', 'quit', 'dragonfly', 'brutalize', 'disk', 'while', 'wimp', 'tillman', 'thank', 'like', 'can', 'tell', 'rescue', 'start', 'end', 'file', 'move', 'disk', 'more', 'lot', 'hardware', 'exhibit', 'sign', 'infant', 'death', 'dragonfly', 'one', 'go', 'fail', 'often', 'early', 'on', 'so', 'stress', 'test', 'can', 'good', 'idea', 'once', 'bite', 'toss', 'art', 'disk', 'error', 'ma', 'warrant', 'also', 'like', 'just', 'note', 'work', 'unfortunately', 'just', 'create', 'program', 'love', 'little', 'phrase', 'code', 'hour', 'anger', 'loss', 'denial', 'frustration', 'blood', 'sweat', 'tear', 'dragonfly', 'can', 'also', 'install', 'run', 'smartmontool', 'most', 'recent', 'hard', 'drive', 'dragonfly', 'test', 'short', 'long', 'short', 'only', 'take', 'minute', 'so', 'long', 'run', 'dragonfly', 'can', 'run', 'system', 'active', 'long', 'test', 'will', 'impact', 'performance', 'markedly', 'short', 'test', 'rarely', 'claim', 'failure', 'when', 'there', 'low', 'false', 'positive', 'sometimes', 'miss', 'stuff', 'moderate', 'false', 'negative', 'long', 'test', 'more', 'accurate', 'overall', 'take', 'long', 'dragonfly', 'install', 'package', 'run', 'test', 'automatically', 'periodically', 'check', 'disk', 'now', 'see', 'rather', 'dev', 'dragonfly', 'get', 'sit', 'mode', 'access', 'interpret', 'other', 'probably', 'lag', 'type', 'few', 'line', 'together', 'hit', 'channel', 'same', 'time', 'debhelper', 'kick', 'cat', 'partition', 'dragonfly', 'should', 'list', 'visible', 'partition', 'dragonfly', 'may', 'sea', 'depend', 'don', 'see', 'other', 'strangeness', 'go', 'most', 'likely', 'right', 'driver', 'sat', 'drink', 'dragonfly', 'most', 'likely', 're', 'invited', 'shell', 'right', 'now', 'go', 'pretty', 'limited', 'dragonfly', 'change', 'different', 'kernel', 're', 'run', 'installer', 'kernel', 'one', 'instal', 'prolly', 'want', 'update', 'kernel', 'right', 'probably', 'edit', 'stab', 'as', 'well', 'other', 'partition']"
24412,24412,"hmm... but i have a usb-mass-storage-device (mp3-player) without fs karsten, yes i... hmmm... no it is reported to be unpartitioned space. but it perhaps is vfat yes in fdisk it is reported as unpartitioned space. not vfat now breakfast ok karsten. thanks :-D",0.0,43,"['usb', 'mass', 'storage', 'device', 'player', 'karsten', 'ummm', 'report', 'partition', 'space', 'perhaps', 'fat', 'disk', 'report', 'partition', 'space', 'fat', 'now', 'breakfast', 'karsten']"
