,Unnamed: 0,text,predator,text_len,preprocessed_bow
19696,19696,"umm sigh, yes I wonder what its complaint is now... where's that sombrero again? you mean DOMPrototype isn't the right answer?!?! I suspect that'll change at some point in es6 (the proxies not being able to override bit) makes sense",0.0,40,"['wonder', 'complaint', 'now', 'where', 'sombrero', 'again', 'mean', 'right', 'answer', 'suspect', 'change', 'point', 'proxy', 'able', 'override', 'bit', 'make', 'sense']"
19697,19697,"khuey: ping khuey: hi, any idea how long it might take to debug the problem with 2010 &amp; pgo ? I'm wondering if I should go ahead and block win2k, xp rtm+sp1 for Nightly updates now, rather than have to coordinate it all would kinda suck to deprecate people early, but I guess they're gonna have to deal with it sooner or later a couple of months out of date but https://bugzilla.mozilla.org/show_bug.cgi?id=668436#c57 I should just deploy after QA gets back to me with a real live check rather than my synthetic ones yeah, ok I'd forgotten it was so small I don't trust me either ;-)",0.0,106,"['idea', 'how', 'long', 'may', 'take', 'debug', 'problem', 'amp', 'go', 'wonder', 'should', 'go', 'ahead', 'block', 'wink', 'rum', 'spy', 'nightly', 'update', 'now', 'rather', 'coordinate', 'would', 'kinda', 'suck', 'deprecate', 'people', 'early', 'guess', 're', 'go', 'deal', 'sooner', 'later', 'couple', 'month', 'date', 'hate', 'org', 'show', 'bug', 'cgi', 'would', 'can', 'should', 'just', 'deploy', 'get', 'back', 'real', 'live', 'check', 'rather', 'synthetic', 'one', 'forget', 'so', 'small', 'don', 'trust', 'either']"
19698,19698,0dccab0200831aeaeef4153ca37fd91a: pong hopefully this week do we know how many people it would affect? yeah and we're planning on doing it this cycle anyways if we're only going to block a couple hundred people I say just flip the switch real checking would be nice ;-),0.0,46,"['pong', 'hopefully', 'week', 'know', 'how', 'many', 'people', 'would', 'affect', 're', 'plan', 'do', 'cycle', 'anyways', 're', 'only', 'go', 'block', 'couple', 'people', 'say', 'just', 'flip', 'switch', 'real', 'checking', 'would', 'nice']"
19699,19699,"Does anyone know if Android C1 timing out is a known issue? a406713e05b1b23bdd6f397d9294b81b: Thanks! a406713e05b1b23bdd6f397d9294b81b: Just to be 100% sure, aurora migration already happened, right? 51c1edab440268cdb0754ff0c4584a9f: Oh, thanks :) I thought the migration was on tuesday, I kind of figured it'd happened :) Ah, okay :) 51c1edab440268cdb0754ff0c4584a9f: Thanks! I'll delay my landing my super-risky refactoring then :) 51c1edab440268cdb0754ff0c4584a9f: I guess I'm not sure what is meant by aurora hasn't migrated, then :) 51c1edab440268cdb0754ff0c4584a9f: Ahah, but it has branched -off- of m-c then? 51c1edab440268cdb0754ff0c4584a9f: Thanks, I learn something new every day :)",0.0,91,"['know', 'ca', 'timing', 'known', 'issue', 'a406713e05b1b23bdd6f397d9294b81b', 'thank', 'just', 'sure', 'migration', 'already', 'happen', 'right', 'think', 'migration', 'kind', 'of', 'figure', 'happen', 'thank', 'delay', 'landing', 'super', 'risky', 'factoring', 'then', 'guess', 'sure', 'mean', 'migrate', 'then', 'branch', 'then', 'thank', 'learn', 'new', 'day']"
19700,19700,"e92c45d0ed5c3da366c5b45ae81bb2c8: I don't think aurora migrated yet is verifying now (hg just being slow) yea it is &quot;on tuesday&quot; and it normally happens much much earlier than &quot;now&quot; e92c45d0ed5c3da366c5b45ae81bb2c8: confirmed, not yet migrated: http://hg.mozilla.org/releases/mozilla-aurora/file/default/browser/config/version.txt akeybl: should know more on the specific timing here, I don't e92c45d0ed5c3da366c5b45ae81bb2c8: If by super-risky-refactor is meant for trunk, you can land e92c45d0ed5c3da366c5b45ae81bb2c8: trunk should be &quot;clear&quot; for any Gecko 13's now (e.g. they attempted to switch to MSVC2010 already) e92c45d0ed5c3da366c5b45ae81bb2c8: my statement about aurora hasn't migrated, is that &quot;what was once Gecko 12 is not pushed to aurora yet&quot; e92c45d0ed5c3da366c5b45ae81bb2c8: but &quot;Mozilla-Central *is* open for Gecko 13 landings&quot; yes",0.0,104,"['don', 'think', 'migrate', 'yet', 'verify', 'now', 'just', 'slow', 'yea', 'quit', 'quit', 'normally', 'happen', 'much', 'much', 'earlier', 'quit', 'now', 'quit', 'confirm', 'yet', 'migrate', 'help', 'release', 'aurora', 'file', 'default', 'config', 'text', 'akeybl', 'should', 'know', 'more', 'specific', 'timing', 'here', 'don', 'super', 'risky', 'reactor', 'mean', 'trunk', 'can', 'land', 'e92c45d0ed5c3da366c5b45ae81bb2c8', 'trunk', 'should', 'quit', 'clear', 'quit', 'gecko', 'now', 'attempt', 'switch', 'already', 'statement', 'migrate', 'quit', 'once', 'push', 'yet', 'quit', 'quit', 'central', 'open', 'gecko', 'landing', 'quit']"
19701,19701,If there any reason an upgrade to fx 10 would unassociated firefox with its pinned icon in Win7?,0.0,18,"['reason', 'upgrade', 'fix', 'would', 'associate', 'firebox', 'pin', 'icon', 'win']"
19702,19702,"so a webidl question what, if anything, should the [[Class]] of interface objects be? a3f19f90edf0a0893c7847d08016abe3: ok a3f19f90edf0a0893c7847d08016abe3: thanks I guess I have to hook these up to Function.prototype too, eh? a3f19f90edf0a0893c7847d08016abe3: that's sorta irrelevant to me for impl purposes a3f19f90edf0a0893c7847d08016abe3: for the moment a3f19f90edf0a0893c7847d08016abe3: since I can in fact have custom [[Class]] in my code a3f19f90edf0a0893c7847d08016abe3: but thanks khuey: ping or anyone else who knows build stuff",0.0,67,"['so', ""we'il"", 'question', 'should', 'class', 'interface', 'object', 'a3f19f90edf0a0893c7847d08016abe3', 'thank', 'guess', 'hook', 'function', 'prototype', 'too', 'a3f19f90edf0a0893c7847d08016abe3', 'sorta', 'irrelevant', 'imply', 'purpose', 'a3f19f90edf0a0893c7847d08016abe3', 'moment', 'a3f19f90edf0a0893c7847d08016abe3', 'can', 'fact', 'custom', 'class', 'code', 'a3f19f90edf0a0893c7847d08016abe3', 'thank', 'huey', 'ping', 'else', 'know', 'build', 'stuff']"
19703,19703,"bz, the spec should say, let's see bz, doesn't say anything special, so &quot;Function&quot; bz, yeah bz, relatedly I made a recent change that doesn't set [[Class]] at all, so that JS implementations will work. instead I define that Object.prototype.toString is overwritten with a new function that can return &quot;[object Node]&quot; etc. bz, since even proxies can't have custom [[Class]] bz, sure, as long as Object.prototype.toString returns the right thing 0b9a93bcbf56042557d5a41dd3db0243, oh, when that happens I'll drop the custom toString thing then",0.0,82,"['spec', 'should', 'say', 'let', 'see', 'say', 'special', 'so', 'quit', 'function', 'quit', 'belatedly', 'make', 'recent', 'change', 'doesn', 'set', 'class', 'at', 'all', 'so', 'implementation', 'will', 'work', 'instead', 'define', 'object', 'prototype', 'testing', 'overwritten', 'new', 'function', 'can', 'return', 'quit', 'object', 'node', 'quit', 'even', 'proxy', 'can', 'custom', 'class', 'sure', 'as', 'long', 'object', 'prototype', 'testing', 'return', 'right', 'thing', 'when', 'happen', 'drop', 'custom', 'testing', 'thing', 'then']"
19706,19706,hey asl im m 20 canada horny :) im 6 foot 2 blue eyes 6 pack wbu nice i would start with making out then take off all ur clothes lick all the wayy down then lick ur pussy then shove my huge cock in it and u would ride me ;D what would u do to me if i was laying tied to ur bed :) r u masterbating ;) describe what ur doing to urself i wish i was licking ur pussy right now what would u do to me tell me in detail ;) :) keep going can u send a pic of urself i will after u,0.0,111,"['foot', 'blue', 'eye', 'pack', 'nice', 'would', 'start', 'make', 'then', 'take', 'clothe', 'lick', 'way', 'down', 'then', 'lick', 'pussy', 'then', 'shove', 'huge', 'cock', 'would', 'ride', 'would', 'lay', 'tie', 'bed', 'masturbate', 'describe', 'do', 'wish', 'lick', 'pussy', 'right', 'now', 'would', 'tell', 'detail', 'keep', 'go', 'can', 'send', 'pic', 'will']"
19707,19707,"18 f us horny u what do you look like babee 5&apos;7 persian-tan long wavy brown hair green eyes hmm tell me what you would do to me if we were together and ill make you go crazy ;) i just got outta the shower, soaking wet on my bed naked id kiss every inch of you all the way to your cock and suck it and shove it in my pussy for as long as you want mhm ugh i want you in me so bad im fingering myself with two fingers while rubbing my tits i wanna suck your dick so bad right on the tipppp",0.0,108,"['horny', 'look', 'brown', 'hair', 'green', 'eye', 'tell', 'would', 'together', 'ill', 'make', 'go', 'crazy', 'just', 'get', 'outta', 'shower', 'soak', 'bed', 'naked', 'would', 'keep', 'inch', 'way', 'cock', 'suck', 'shove', 'pussy', 'as', 'long', 'want', 'mom', 'ugh', 'want', 'so', 'bad', 'finger', 'finger', 'rub', 'tit', 'want', 'suck', 'dick', 'so', 'bad', 'right', 'tip']"
19709,19709,"I really really appreciate your help DrBacchus, fajita, Blissex that was insane Not because of the difficulty- but because all our websites went down everytime i got it wrong",0.0,29,"['really', 'really', 'appreciate', 'help', 'blisse', 'insane', 'difficulty', 'website', 'go', 'down', 'everytime', 'get', 'wrong']"
19711,19711,"fajita++ A new command line option -M has been added that lists all modules that are loaded based on the current configuration. Unlike the -l option, this list includes DSOs loaded via mod_so. 2.2.x p.s. I found that as first result of googl esearch. :) yes, if you are using version 2.2.x you can  run httpd -M to see the list I really should upgrade, but I am too lazy errr: still running 1.3.34 you *can* set cookies for domains other than the one serving the request, but most browsers will block or give a warning about that",0.0,98,"['new', 'command', 'line', 'option', 'add', 'list', 'module', 'load', 'base', 'current', 'configuration', 'option', 'list', 'include', 'do', 'load', 'so', 'find', 'first', 'result', 'search', 'use', 'version', 'can', 'run', 'hate', 'see', 'list', 'really', 'should', 'upgrade', 'too', 'lazy', 'errr', 'still', 'run', 'can', 'set', 'cookie', 'domain', 'other', 'one', 'serve', 'request', 'most', 'browser', 'will', 'block', 'give', 'warning']"
19712,19712,"Is there a way to verify that a module is loaded after starting apache? dkr, a command line option for apachectl? ah yeah it worked cool",0.0,26,"['way', 'verify', 'module', 'load', 'start', 'command', 'line', 'option', 'apachectl', 'work', 'cool']"
19714,19714,"httpd -h shows a nice list of cli options you can pass to it for info like that what do you use? oh dear, that is lazy :P",0.0,28,"['hate', 'show', 'nice', 'list', 'cli', 'option', 'can', 'pass', 'info', 'use', 'dear', 'lazy']"
19715,19715,"Hello. I have a question about cookies, and what amounts to cross site cooking. I have a server with a number of virtual domains. The same server has only one SSL domain name. When I create a cookie for the virtual domain, can I create an identical cookie for the secure domain as well? Could I do this with a 3rd party cookie? Or possible an embedded frame that accesses the ssl domain and creates another cookie?",0.0,77,"['question', 'cookie', 'amount', 'cross', 'site', 'cook', 'server', 'number', 'virtual', 'domain', 'same', 'server', 'only', 'domain', 'name', 'when', 'create', 'cookie', 'virtual', 'domain', 'can', 'create', 'identical', 'cookie', 'secure', 'domain', 'well', 'could', 'party', 'cookie', 'possible', 'embed', 'frame', 'access', 'domain', 'create', 'cookie']"
19716,19716,"KevinBooks: if all sites share the same certificate (which is a difficult situation) you can create multiple SSL virtual domains too. KevinBooks: anyhow the obvious simple solution is to send each cookie twice, once with a domain and the other with the other domain. Fifoxez: it means that you are telling the server you only accept stuff that the server is not configured to serve. Seems pretty obvious to me. Fifoxez: so change the server or change the range of things your app is prepared to accept. aao_pwner: and thats exactly is not clear in ´You're speaking plain HTTP to an SSL-enabled server portª?",0.0,104,"['kevinbook', 'site', 'share', 'same', 'certificate', 'difficult', 'situation', 'can', 'create', 'multiple', 'virtual', 'domain', 'too', 'kevinbook', 'anyhow', 'obvious', 'simple', 'solution', 'send', 'cookie', 'twice', 'once', 'domain', 'other', 'other', 'domain', 'fifoxez', 'mean', 'tell', 'server', 'only', 'accept', 'stuff', 'server', 'configure', 'serve', 'seem', 'pretty', 'obvious', 'so', 'change', 'server', 'change', 'range', 'thing', 'app', 'prepared', 'accept', 'ago', 'owner', 's', 'exactly', 'clear', 're', 'speak', 'plain', 'help', 'enable', 'server', 'port']"
19717,19717,"ok. does anyone have any idea how to solve this problem? I have an apache running with suexec module. this module has been compiled with uidmin 100. however, I have a cgi script here which I *definitely* need to run as wwwrun (which is uid 8). is there any way to do this apart from disabling suexec completely (suexec is needed for other sites)? this paranoia that's going on today is probably costing people 90% of their time fixing stuff... wonderful how such security measures make php and cgi incompatible to each other. is it possible to change the minimum uid for suexec WITHOUT recompiling all of apache? mooney2: but, it's a loadable module... not sure if I can recompile just a single module? hmmmmm.... LoadModule suexec_module                  /usr/lib64/apache2-prefork/mod_suexec.so are you sure? mooney2: i would recompile apache, but this is a production system with lots of sites and I can't afford to take half of them down potentially ;) (if thinkgs break) mooney2: yes, I also only knew of the seperate suexec binary but this indeed seems to be a module mooney2: 'test seperately' a dozen highly complex sites? heh it took me two days to get all sites running again and testing, i don't want to repeat again :) if I knew where in the .so the minimum uid is stored, i'd just use a damn hex editor. mooney2: hmmmmmm... really? and that works? :) then let me fetch the apache sources and try. mooney2: well, normally you tell it to configure when compiling apache itself... --with-suexec-minuid or something mooney2: well, if it's checked in the support program, it would be much easier, because then I could just recompile that. well, does anyone here know then if apache2 uses an external suexec binary? (if something like &quot;LoadModule suexec_module                  /usr/lib64/apache2-prefork/mod_suexec.so&quot; is present)? oh, wait... argh [Fri Sep 22 22:51:14 2006] [notice] suEXEC mechanism enabled (wrapper: /usr/sbin/suexec2) that really looks as if it IS external. hehe well, but the uid restriction could still be in the module, not the binary. because it's also passed as a ./configure option to apache... that's odd on the other hand, there is no minuid or even min to be found in neither the .c nor the .h file.",0.0,372,"['idea', 'how', 'solve', 'problem', 'run', 'suede', 'module', 'compile', 'however', 'cgi', 'script', 'here', 'definitely', 'need', 'run', 'wwwrun', 'way', 'apart', 'disable', 'suede', 'completely', 'suede', 'need', 'other', 'site', 'paranoia', 'go', 'today', 'probably', 'cost', 'people', 'time', 'fix', 'stuff', 'wonderful', 'how', 'such', 'security', 'measure', 'make', 'pop', 'cgi', 'incompatible', 'other', 'possible', 'change', 'minimum', 'uid', 'suede', 'compile', 'i', 'lovable', 'module', 'sure', 'can', 'recompile', 'just', 'single', 'module', 'apache', 'preform', 'suede', 'so', 'sure', 'mooney', 'would', 'recompile', 'production', 'system', 'lot', 'site', 'can', 'afford', 'take', 'half', 'potentially', 'thing', 'break', 'mooney', 'also', 'only', 'know', 'seperate', 'suede', 'binary', 'indeed', 'seem', 'mooney', 'test', 'seperately', 'dozen', 'highly', 'complex', 'site', 'heh', 'take', 'day', 'site', 'run', 'again', 'test', 'don', 'want', 'repeat', 'again', 'know', 'where', 'so', 'minimum', 'uid', 'store', 'just', 'use', 'damn', 'editor', 'really', 'work', 'then', 'let', 'fetch', 'source', 'try', 'normally', 'tell', 'configure', 'when', 'compile', 'suede', 'minuit', 'mooney', 'check', 'support', 'program', 'would', 'much', 'easy', 'then', 'could', 'just', 'recompile', 'well', 'here', 'know', 'then', 'apache', 'use', 'external', 'suede', 'binary', 'apache', 'preform', 'suede', 'so', 'quit', 'present', 'wait', 'notice', 'suede', 'enable', 'wrapper', 'skin', 'suexec2', 'really', 'look', 'external', 'hehe', 'uid', 'restriction', 'could', 'still', 'module', 'binary', 'also', 'pass', 'configure', 'option', 'odd', 'other', 'hand', 'minuit', 'even', 'find', 'file']"
19718,19718,"i'm writing an application that sends data to a web server and i'm getting back a 406 Not acceptable error. I looked it up and it says that I need to change the accept headers in my application. what might be causing this? i have standard accept types. what is odd is that i am running almost identical code on a windows machine and it doesn't give me that error. i only get it in linux i can show paste the http request somewhere if that'd help here is the request: <a href=""http://rafb.net/paste/results/Qp8TSZ70.html"">http://rafb.net/paste/results/Qp8TSZ70.html</a> i modified my php script and added: header(&quot;Content-type&quot;) *** header(&quot;Content-type: text/plain&quot;) could it be a funky return or something in the request? as i said before, the same code runs fine on windows, but not on linux",0.0,130,"['write', 'application', 'send', 'datum', 'web', 'server', 'get', 'back', 'acceptable', 'error', 'look', 'say', 'need', 'change', 'accept', 'header', 'application', 'may', 'cause', 'standard', 'accept', 'type', 'odd', 'run', 'almost', 'identical', 'code', 'machine', 'doesn', 'give', 'error', 'only', 'get', 'can', 'show', 'paste', 'help', 'request', 'somewhere', 'help', 'here', 'request', 'help', 'raft', 'net', 'paste', 'result', 'himl', 'help', 'raft', 'net', 'paste', 'result', 'himl', 'modify', 'pop', 'script', 'add', 'quit', 'content', 'type', 'quit', 'quit', 'content', 'type', 'text', 'plain', 'quit', 'could', 'funky', 'return', 'request', 'say', 'same', 'code', 'run', 'fine', 'window']"
19719,19719,"I got a quick question, i'm using Mod_SSL and every time i try to connect to a directory in my server via IP it gives me an error page.. Bad Request Your browser sent a request that this server could not understand. Reason: You're speaking plain HTTP to an SSL-enabled server port. Instead use the HTTPS scheme to access this URL, please. Hint: https://secure.aaopwner.com/ so.. what should i do? change the port from 443 to what? Blissex2, what do you suggest i do... because I have no idea what to do Blissex2, lol nevermind.. i get an error with my certs... Error Code: -8182 Could not extablish an encrypted connection because certificate presented by 192.168.1.111 is invalid or corrupted. Error Code: -8182",0.0,122,"['get', 'quick', 'question', 'use', 'time', 'try', 'connect', 'directory', 'server', 'give', 'error', 'page', 'bad', 'request', 'browser', 'send', 'request', 'server', 'could', 'understand', 'reason', 're', 'speak', 'plain', 'help', 'enable', 'server', 'port', 'instead', 'use', 'hate', 'scheme', 'access', 'url', 'hint', 'secure', 'aaopwner', 'com', 'so', 'should', 'change', 'port', 'blisse', 'suggest', 'idea', 'blisse', 'get', 'error', 'cert', 'error', 'code', 'could', 'establish', 'encrypt', 'connection', 'certificate', 'present', 'invalid', 'corrupt', 'error', 'code']"
19720,19720,"intrr: no intrr: well yes - just recomile suexec intrr: suexec is not a loadable module, its a seperate binary in your apache bin directory hm intrr: sry - never seen that before you but looks like youa re right. i am thinking of the seperate support program - see <a href=""http://httpd.apache.org/docs/2.2/mod/mod_suexec.html"">http://httpd.apache.org/docs/2.2/mod/mod_suexec.html</a> intrr: no need to take things down - recompile apache, test it seperately, stop old server start new server you can recompile loadable modules using apxs e.g. cd apache*/src/modules/standard; apxs -c mod_proxy.c proxy_*.c you end up with a new mod_proxy.so certainly for other modules - not done it with suexec_module tho intrr: how do you tell it the new uid though? yeah - dont know how you would do it if you just recompile mod_suexec i think the minuid is checked in the suexec support program but i only really know suexec frmo apache 1.3 intrr: i just did: apxs -i -c mod_suexec.c : that compiles a new mod_suexec.so and puts it into your libexec module directory yes as i said :) idd",0.0,175,"['just', 'lovable', 'module', 'seperate', 'binary', 'sry', 'never', 'see', 'look', 'right', 'think', 'seperate', 'support', 'program', 'see', 'help', 'hate', 'hate', 'need', 'take', 'thing', 'recompile', 'test', 'seperately', 'stop', 'old', 'server', 'start', 'new', 'server', 'can', 'recompile', 'lovable', 'module', 'use', 'ape', 'ad', 'module', 'ape', 'mod', 'proxy', 'proxy', 'end', 'new', 'proxy', 'so', 'certainly', 'other', 'module', 'do', 'how', 'tell', 'new', 'uid', 'though', 'know', 'how', 'would', 'just', 'recompile', 'think', 'minuit', 'check', 'suede', 'support', 'program', 'only', 'really', 'know', 'suede', 'just', 'ape', 'mod', 'compile', 'new', 'suede', 'so', 'put', 'libel', 'module', 'directory', 'say']"
19721,19721,"hmm, so i often will do redirect rules like this: RewriteEngine On \ RewriteRule /olddir(.*) <a href=""http://new.example.com/newdir"">http://new.example.com/newdir</a>$1 but is there a nicer way to do this? [using apache2]",0.0,28,"['so', 'often', 'will', 'redirect', 'rule', 'rewriteengine', 'rewriterule', 'old', 'help', 'new', 'example', 'com', 'new', 'help', 'new', 'example', 'com', 'new', 'nice', 'way', 'use', 'apache']"
19722,19722,bugmail: [Bug 13128] Allow wrapping list items in DIV elements &lt;http://lists.w3.org/Archives/Public/public-html-bugzilla/2011Aug/2299.html&gt; ** [Bug 13128] Allow wrapping list items in DIV elements &lt;http://lists.w3.org/Archives/Public/public-html-bugzilla/2011Aug/2298.html&gt; ** [Bug 13062] HTML spec should not dictate first/last child nesting level and exact order of child siblings &lt;http://lists.w3.org/Archives/Public/public-html-bugzilla/201,0.0,41,"['gmail', 'bug', 'allow', 'wrapping', 'list', 'item', 'element', 'help', 'list', 'org', 'archive', 'public', 'public', 'bug', 'allow', 'wrapping', 'list', 'item', 'element', 'help', 'list', 'org', 'archive', 'public', 'public', 'bug', 'should', 'dictate', 'first', 'last', 'child', 'nesting', 'level', 'exact', 'order', 'child', 'sibling', 'help', 'list', 'org', 'archive', 'public', 'public']"
19728,19728,not much what's up with u? yay! u going to have a day off when my aunt's gone? she's leaving the 17 and coming home i think late 19 cool :) what time u get off work? i'll give it to you when i'm sure she's going k? i'm in grand rapids tho how long will it take u to get to gr? that's cool right? yay :) well i got to play disc golf this morning! emma's dad sent me some discs so i can play here sometimes! did u ever play it? it's fun lol yeah on ur profile how would i do that lol? sure! yeah wow! yeah that's big it still looks big! my xbf wasn't that big lol i think so too ok u seen the ones on my myspace? that's all i got :( sorry :( i don't have any pics like that no :( i barely got this computer when i got here awwwww :( can u switch? :( its ok yeah but u can't help it :(,0.0,175,"['much', 'go', 'day', 'when', 'aunt', 'go', 'leave', 'come', 'home', 'think', 'late', 'cool', 'time', 'get', 'work', 'give', 'when', 'sure', 'go', 'grand', 'tho', 'how', 'long', 'will', 'take', 'go', 'cool', 'get', 'play', 'disc', 'golf', 'morning', 'emma', 'dad', 'send', 'disc', 'can', 'play', 'here', 'sometimes', 'ever', 'play', 'fun', 'laugh', 'loud', 'profile', 'how', 'would', 'big', 'still', 'look', 'big', 'wasn', 'that', 'big', 'think', 'so', 'too', 'see', 'one', 'myspace', 'get', 'sorry', 'don', 'pic', 'barely', 'get', 'computer', 'when', 'get', 'here', 'awwwww', 'can', 'switch', 'can', 'help']"
19733,19733,"SQUIRREL CROSSDRESSER x) and kool LOL ummm awkward.... xD age? yeaaa well, nice talkin 2 u buddy x) laterrrzzz",0.0,19,"['crossdresser', 'laugh', 'ummm', 'awkward', 'ad', 'age', 'yeaah', 'nice', 'talkin', 'buddy', 'laterrrzzz']"
19734,19734,hey  i m a boy who loves wearing women clothes ? teah i like feeling myslf as woman u? a bit yeah... no one knows 22 but it is persinal w bt u?,0.0,33,"['boy', 'love', 'wear', 'woman', 'clothe', 'team', 'like', 'feel', 'woman', 'bit', 'one', 'know', 'personal', 'u']"
19740,19740,"i'm having some issues with gvim 7 on a mac, the delete key stops working once i save the file",0.0,20,"['have', 'issue', 'grim', 'delete', 'key', 'stop', 'work', 'save', 'file']"
19751,19751,hey m/f? 18 f usa no im sorry yes please friends have fun stuff like that hbu? so when did u turn 20? hahaha yeah a senior so yeah oh nice i just turned 18 last sat yeah so whats ur name? ?,0.0,43,"['usa', 'sorry', 'friend', 'fun', 'stuff', 'hub', 'so', 'when', 'turn', 'hahaha', 'senior', 'so', 'nice', 'just', 'turn', 'last', 'sit', 'so', 's', 'name']"
19752,19752,hi 20 m u? m u? frm? ok so horny? or simple clean chat....? ok no prblm...? i was jst asking so wat u do there? same here full enjoyment every time r u a student ? this feb 12th ok thats nice student name kaushik ur?,0.0,47,"['am', 'am', 'so', 'horny', 'simple', 'clean', 'chat', 'problem', 'just', 'ask', 'so', 'there', 'same', 'here', 'full', 'enjoyment', 'time', 'student', 'feb', 's', 'nice', 'student', 'name']"
