,Unnamed: 0,text,predator,text_len,preprocessed_bow
20899,20899,"Media Player 11 is Microsofts latest &quot;stealth bomb&quot; invasion of provacy into your PC privacy Nobody seems to realize that Media Player opens communications with a Microsoft server even when all connectivity options are deselected The clearest manifestation of this unethical behaviour is the reappearance of so-called &quot;services&quot; on the media menu, even after all relevant registry keys for these &quot;services&quot; have been hunted down and deleted Appearing as unwanted addware for MTV and other less-than-useful adware on my pc. These unsolicited downloads to my PC do not occurr when I take the ethernet cable out :P Dewi: y I no eh? A DHCP server that is not configurable?? hardly RFC-compliant Belchbag: have you tried the &quot;Microsoft Keyboard Layout Editor&quot; (www.microsoft.com/globaldev/tools/msklc.mspx) ? chrismon: that's pretty vague chrismon: NT-based Windoze forbids direct HW addressing by DOSISH apps chrismon: some XP video cards do support a working VESA layer, but it requires a very specific buffering configuration call from the app chrismon: the long and short is yes - use dosbox or a separate DOS parttion boot (you could also try to run it from the UDOS live DOS CD on sourceforge :) ..but that would also require stupid reboot Ardonik: udos is a developer for udos :)\ y CCFreak2K: uhm... I guess that kind of thinking is what separates Microsoft (and America) from the rest of the world... CCFreak2K: uhm... true to Amer* form, I would say that 99.9% of what M$ does is a pure manifestation of &quot;their financial practices&quot; so we agree that the point is moot quote CCFreak2K: &quot;We aren't talking about their financial practices.  We're talking about their implementation(s) of DHCP.&quot; You made that argument. Not me",0.0,280,"['medium', 'player', 'late', 'quit', 'bomb', 'quit', 'invasion', 'privacy', 'privacy', 'seem', 'realize', 'medium', 'player', 'open', 'communication', 'server', 'even', 'when', 'connectivity', 'option', 'select', 'clear', 'manifestation', 'unethical', 'behaviour', 'reappearance', 'so', 'call', 'service', 'quit', 'medium', 'menu', 'even', 'all', 'relevant', 'registry', 'key', 'quit', 'service', 'quit', 'hunt', 'delete', 'appear', 'unwanted', 'aware', 'mav', 'other', 'less', 'useful', 'aware', 'pa', 'unsolicited', 'download', 'occur', 'when', 'take', 'ethernet', 'cable', 'dew', 'drop', 'server', 'configurable', 'hardly', 'rec', 'compliant', 'belch', 'try', 'editor', 'quit', 'com', 'tool', 'pretty', 'vague', 'crimson', 'base', 'window', 'forbid', 'direct', 'address', 'dosis', 'app', 'crimson', 'video', 'card', 'support', 'working', 'vest', 'layer', 'require', 'very', 'specific', 'buffering', 'configuration', 'call', 'app', 'crimson', 'long', 'short', 'use', 'separate', 'do', 'partition', 'boot', 'could', 'also', 'try', 'run', 'do', 'live', 'do', 'ad', 'sourceforge', 'would', 'also', 'require', 'stupid', 'reboot', 'sardonic', 'do', 'developer', 'guess', 'kind', 'thinking', 'separate', 'rest', 'world', 'ccfreak2k', 'true', 'form', 'would', 'say', 'pure', 'manifestation', 'quit', 'financial', 'practice', 'quit', 'so', 'agree', 'point', 'moot', 'quit', 'talk', 'financial', 'practice', 're', 'talk', 'implementation', 'drop', 'quit', 'make', 'argument']"
20903,20903,"anyone there? yo anyone there? do you know anything about reprogramming the keyboards of different languages in windows? dewi: i'm using the spanish variation, and i like it best, but i wish i could just switch the functions of 2 keys on it i've looked up several programs and a lot of them don't do what i want the ones that do don't work with spanish symbols is anyone there to answer my question? i'll try it thanx",0.0,78,"['there', 'there', 'know', 'reprogramme', 'keyboard', 'different', 'language', 'use', 'spanish', 'variation', 'like', 'best', 'wish', 'could', 'just', 'switch', 'function', 'key', 'look', 'several', 'program', 'lot', 'want', 'one', 'work', 'spanish', 'symbol', 'there', 'answer', 'question', 'try', 'thanx']"
20905,20905,"does anyone know of a free, simple, winxp  DHCP server?  i need a really simple one to hand out IPs at a LAN party ( we dont want to have to manually assign IPs, and our switch doesnt have DHCP server ) Ardonik, the switch we are using right now doesnt have DHCP, and i dont think the new one we are getting does either, so Id like to find a server just in case is that configurable? is that configurable? er, um, idk, i just dont like turning something on and not having control over what it does either way i found a program that does it, so im good, thanks anyway",0.0,113,"['know', 'free', 'simple', 'win', 'drop', 'server', 'need', 'really', 'simple', 'one', 'hand', 'ips', 'want', 'manually', 'assign', 'ip', 'switch', 'drop', 'server', 'sardonic', 'switch', 'use', 'right', 'now', 'drop', 'think', 'new', 'one', 'get', 'so', 'would', 'like', 'find', 'server', 'just', 'case', 'configurable', 'configurable', 'ink', 'just', 'like', 'turn', 'have', 'control', 'way', 'find', 'program', 'so', 'good', 'thank', 'anyway']"
20906,20906,"imMute: I would use a router for that. My router (and most I know about) assigns IP addresses to the things connected to it automatically. chrismon: try running it through DosBox. DosBox emulates real-mode DOS games much better than ntvdm nowadays. Which is why you need an emulator. (or an actual working installation of FreeDOS, whichever you prefer.) udos: I take it you have a hand in this project How well does it work for you? (I'm curious; I've recommended it before but never actually used it.) GUIPEnguin: through the scheduled tasks, perhaps? GUIPEnguin: I don't have an XP box handy at the moment, but you can check. It was founded in the United States, its headquarters is to the north of me, and its board meets in Redmond. Read the DosBox documentation.  It allows you to increase the framerate with a hotkey. There's a &quot;how much CPU should I take&quot; hotkey, and a &quot;how many frames should I drop&quot; hotkey.  Between the two of them, you should be able to get something usable. ...then it's working as intended.",0.0,179,"['immune', 'would', 'use', 'router', 'router', 'most', 'know', 'assign', 'ip', 'address', 'thing', 'connect', 'automatically', 'try', 'run', 'emulate', 'real', 'mode', 'do', 'game', 'much', 'well', 'nted', 'nowadays', 'why', 'need', 'emulator', 'actual', 'work', 'installation', 'freedom', 'prefer', 'do', 'take', 'hand', 'project', 'how', 'well', 'work', 'curious', 'recommend', 'before', 'never', 'actually', 'use', 'guipenguin', 'schedule', 'task', 'perhaps', 'guipenguin', 'don', 'up', 'box', 'handy', 'moment', 'can', 'check', 'found', 'headquarters', 'north', 'board', 'meet', 'allow', 'increase', 'framerate', 'hockey', 'there', 'quit', 'how', 'much', 'cpu', 'should', 'take', 'quit', 'hockey', 'quit', 'how', 'many', 'frame', 'should', 'drop', 'quit', 'hockey', 'should', 'able', 'usable', 'then', 'work', 'intend']"
20907,20907,"ive never heard of a switch that does dhcp (other than router/switch combinations) anyway windows xp has a dhcp server, just enable ics imMute: what do you need to configure? imMute: then get a linux box or windows 2003, you shouldnt need to change anything anyway chrismon: from memory thats a dos game and i dont think you'll get it working i would normally be the first to call for standards compliance (and occasionally to bash america) but i dont think the average user needs a full dhcp server (and i dont see any of this being related to country of origin) chrismon: from memory it doesnt, if it detects another dhcp server it shuts down and wont restart without a reboot or user intervention",0.0,125,"['have', 'never', 'hear', 'switch', 'drop', 'other', 'router', 'switch', 'combination', 'anyway', 'window', 'up', 'drop', 'server', 'just', 'enable', 'immune', 'need', 'configure', 'immune', 'then', 'get', 'box', 'window', 'should', 'need', 'change', 'anyway', 'crimson', 'memory', 's', 'game', 'think', 'get', 'work', 'would', 'normally', 'first', 'call', 'standard', 'compliance', 'occasionally', 'bash', 'think', 'average', 'user', 'need', 'full', 'drop', 'server', 'see', 'relate', 'country', 'memory', 'detect', 'drop', 'server', 'shut', 'will', 'restart', 'reboot', 'user', 'intervention']"
20908,20908,"IIRC Windows XP's DHCP server service is not configurable. It assigns the Ethernet adapter as 192.168.0.1, and assigns addresses in the 192.168.0.0/24 range. udos, it doesn't have to be RFC compliant. It works &quot;well enough.&quot; Microsoft offers a much better DHCP server service in their Server line of Windows products. udos, don't drag America into this.  Remember that Microsoft is a multinational corporation. We aren't talking about their financial practices.  We're talking about their implementation(s) of DHCP. Don't like it?  Use another DHCPd then. udos, what company ISN'T out to make a profit? I don't have to agree, since you dragged it out to this point. I'm not going to continue this.  It's just going to fall into a flame war. Erm? To play C&amp;C on my laptop, I had to set the cycles to somewhere in the range of 20,000. You basically dick around with the cycles until the program is running at full speed.",0.0,156,"['window', 'drop', 'server', 'service', 'configurable', 'assign', 'ethernet', 'adapter', 'assign', 'address', 'range', 'do', 'doesn', 'rec', 'compliant', 'work', 'quit', 'enough', 'quit', 'offer', 'much', 'well', 'drop', 'server', 'service', 'server', 'line', 'product', 'drag', 'remember', 'multinational', 'corporation', 'aren', 'talk', 'financial', 'practice', 're', 'talk', 'implementation', 'drop', 'like', 'use', 'diced', 'then', 'do', 'company', 'make', 'profit', 'don', 'agree', 'drag', 'point', 'go', 'continue', 'just', 'go', 'fall', 'flame', 'war', 'erm', 'play', 'amp', 'laptop', 'set', 'cycle', 'somewhere', 'range', 'basically', 'dick', 'cycle', 'program', 'run', 'full', 'speed']"
20909,20909,"ccfreak2k, thanks for your help yesterday, I got that wifi card working under the restricted acct (and to xbit too, but he's not here) i have an old win98 game that I can't get running i've tried the win98/me compat mode for the binary but its just unhapy true, heh i run it, and up pops the cmd window, which goes full screen, then goes back to window mode, black with the title saysing &quot;Inactive &lt;progname&gt;&quot; the &quot;progname&quot; is redneck rampage :) hrm, last i bought/installed/played-successfully was win98 days hmm hmmm thanks oh nice, its a sourceforge project dosbox that is yeah if i can run this from xp, i'll try it... RR isn't worth THAT much to me :) currently, i'm highly enfatuated with fs-driver.org so much better than mounting fat32 or ntfs under un*x oses so far *very* well ardonik, heh ah that's where I recognize  you from, #svn and its financial practices are the textbook example of american capitalism ;) hwh sorta the same, really, if their implementation causes other, RFC-compliant implementaitons to fail CCFreak2K, amen brother udos, amen to that too it is possible to make a profit for yourself and not try to remove all profit from everyone else oh i'm a happy camper now and I quote... &quot;Yeeeehaaah!&quot; thanks for the DOSBox suggestion ccfreak2, good idea :) hrm hmmm super slow :-/ yeah i did ctrl-f12 hit it about a billion times give or take ;) made it a little faster...  i have a brand spankin new t2400 duo hrm set cycles to 6000 hmmm hmm so if taskmgr says that my cpu is pinned at 50% when running dosbox and i've got a duo, is this taskmgrs way of saying that a single cpu is simply maxed out? cc, i've got it at like 100,000 :) i've tried a lot of stuff between 3k and 100k thanks again all time for bed",0.0,319,"['thank', 'help', 'yesterday', 'get', 'wifi', 'card', 'work', 'restricted', 'act', 'bit', 'too', 'here', 'old', 'win', 'game', 'can', 'run', 'try', 'win', 'combat', 'mode', 'binary', 'just', 'unhappy', 'true', 'heh', 'run', 'up', 'pop', 'cod', 'window', 'go', 'full', 'screen', 'then', 'go', 'back', 'window', 'mode', 'black', 'title', 'say', 'quit', 'inactive', 'programe', 'quit', 'quit', 'programe', 'quit', 'redneck', 'rampage', 'last', 'buy', 'instal', 'play', 'successfully', 'win', 'day', 'ummm', 'thank', 'nice', 'sourceforge', 'project', 'dobson', 'can', 'run', 'up', 'try', 'worth', 'much', 'currently', 'highly', 'infatuate', 'driver', 'so', 'much', 'well', 'mount', 'fat', 'os', 'so', 'far', 'very', 'well', 'sardonic', 'heh', 'where', 'recognize', 'son', 'financial', 'practice', 'textbook', 'example', 'american', 'same', 'really', 'implementation', 'cause', 'other', 'compliant', 'implementation', 'fail', 'brother', 'do', 'too', 'possible', 'make', 'profit', 'try', 'remove', 'profit', 'else', 'happy', 'camper', 'now', 'quit', 'quit', 'thank', 'suggestion', 'good', 'idea', 'ummm', 'super', 'slow', 'curl', 'hit', 'time', 'give', 'take', 'make', 'little', 'faster', 'brand', 'spank', 'new', 'set', 'cycle', 'ummm', 'say', 'cpu', 'pin', 'when', 'run', 've', 'get', 'duo', 'taskmgrs', 'way', 'say', 'single', 'cpu', 'simply', 'maxe', 'ca', 'get', 'try', 'lot', 'stuff', 'ok', 'thank', 'again', 'time', 'bed']"
20910,20910,"I know it is possible in win2k, but it is possible to run a job in Windows XP to execute a batch file every 10 min? I mean win2k3 Ardonik: there are scheduled tasks in xp? thanks, I think I overlooked that argh, you can't set a scheduled task in xp for every 5 min only large increments",0.0,58,"['know', 'possible', 'wink', 'possible', 'run', 'job', 'window', 'execute', 'batch', 'file', 'min', 'mean', 'wink', 'sardonic', 'schedule', 'task', 'thank', 'think', 'overlook', 'can', 'set', 'schedule', 'task', 'up', 'min', 'only', 'large', 'increment']"
20911,20911,my router needs a restart i think that or a reset or... i need to remove the QOS settings,0.0,19,"['router', 'need', 'restart', 'think', 'reset', 'need', 'remove', 'cos', 'setting']"
20924,20924,[http://twitter.com/CssMenuBar] Submenu example html [M2-Html] Microformats Button 1.0.0 - Plugins - Resources Maxthon Forum Microformats Butt... http://t.co/aquRI9J,0.0,17,"['help', 'twitter', 'com', 'example', 'microformat', 'plain', 'help', 'co']"
20928,20928,say asl and i&apos;m gone haha well i did and now we all have to suffer the consequences,0.0,18,"['say', 'apos', 'go', 'now', 'suffer', 'consequence']"
20933,20933,sudo smbumount /home/osiris/mnt/OTHERBOX/otherbox_d /home/osiris/mnt/OTHERBOX/otherbox_d probably not smb-filesystem uh...it was five minutes ago ? any klews as to why samba shares would freeze up like this ?,0.0,26,"['meet', 'home', 'meet', 'probably', 'sub', 'filesystem', 'minute', 'ago', 'plew', 'why', 'share', 'would', 'freeze']"
20934,20934,hii goood you asl 20 m massachusetts yep where nicee bridgewater stae state mass exercise science youu nice nice im sorry im drunk and um horny sorry wow nicee hott aha k?,0.0,32,"['goood', 'where', 'nice', 'bridgewater', 'stay', 'state', 'mass', 'exercise', 'science', 'youu', 'nice', 'nice', 'sorry', 'drunk', 'horny', 'nice']"
20935,20935,"hey how are you? 20 f USA, and i&apos;m alright what about you? cool stuff, are you a student ? cool, me too loyola university chicago what about you? cool, what do you study? cool i study psychology psychology, haha and neuroscience ha, have fun with that...",0.0,47,"['how', 'apos', 'alright', 'cool', 'stuff', 'student', 'cool', 'too', 'loyal', 'university', 'cool', 'study', 'cool', 'study', 'psychology', 'psychology', 'haha', 'neuroscience', 'fun']"
20937,20937,"MY NAME IS DIRTY D, AND IM BLACK well 99% ur not female ur a fat male whos biggest dream is to be a sexy bi female u fail at life to fucking hard go and kill yourself haha fucking old joke &apos;KILL yourself",0.0,44,"['name', 'dirty', 'black', 'female', 'fat', 'male', 's', 'big', 'dream', 'sexy', 'bi', 'female', 'fail', 'life', 'fucking', 'hard', 'go', 'kill', 'haha', 'fucking', 'old', 'joke', 'kill']"
20938,20938,Bi Female seeking f roleplayer for mud wrestling Shouldn&apos;t you be stealing a bike? I repeat. Isn&apos;t there a bike you should be stealing? Blackie. Negro. Nigger. Slave. Bitch. Whore. Cunt. White. Oh wait. That&apos;s me.,0.0,36,"['seek', 'roleplay', 'mud', 'wrestling', 'be', 'steal', 'bike', 'repeat', 'there', 'bike', 'should', 'steal', 'bitch', 'whore', 'cunt', 'white', 'wait', 'apos']"
20940,20940,"Doesn't seem to bark up quite the right tree to me... Talking about modularization and xhtml-* already requires namespaces, one namespace per thing you want",0.0,25,"['seem', 'bark', 'right', 'tree', 'talk', 'popularization', 'already', 'require', 'namespace', 'namesake', 'thing', 'want']"
20943,20943,Hey girl or boy? Sweet I&apos;m a girl how old r u I&apos;m 16 and my name is tinsley Where r u from Oh that&apos;s fun hahah I&apos;m from Cali and how sweet Yea my friend callie says hi Hahah well ...,0.0,42,"['girl', 'boy', 'sweet', 'girl', 'how', 'old', 'apos', 'name', 'tinsley', 'where', 'apos', 'how', 'sweet', 'yea', 'friend', 'say']"
20944,20944,"boy 19 how old are you? Very nice. Just so you know, I am masturbating right now. Toronto I figured I might as well be honest.  :) Very cool. Hi callie Do you two masturbate? well?  Not necessarily together.",0.0,39,"['boy', 'how', 'old', 'very', 'nice', 'just', 'so', 'know', 'masturbate', 'right', 'now', 'figure', 'may', 'as', 'well', 'honest', 'very', 'cool', 'callie', 'masturbate', 'necessarily', 'together']"
20945,20945,[[Special:Log/block]]  http://microformats.org/wiki?title=Special:Log/block&amp;diff=0&amp;oldid=0 * Tantek * (+0) blocked &quot;User:RolalC4tel&quot; with an expiry time of infinite: spam [[Special:Log/delete]]  http://microformats.org/wiki?title=Special:Log/delete&amp;diff=0&amp;oldid=0 * Tantek * (+0) deleted &quot;Talk:currency-proposal&quot;: spam,0.0,24,"['special', 'log', 'block', 'help', 'microformat', 'title', 'amp', 'tante', 'block', 'quit', 'user', 'quit', 'expiry', 'time', 'help', 'microformat', 'title', 'diff', 'amp', 'tante', 'delete', 'quit', 'talk', 'currency', 'proposal', 'spam']"
20946,20946,Heyy Guess wat? How old btw HAPPY BIRTHDAY!!!! :D 15 Guess wat happened yesterday Btw rose I was at my house and ppl in a truck showed up to do my driveway and sidewalk then after there was trapped smoke in the side of the house The fire department sent a firetruck ambulance police over And I can Say it was the random guys fault cause he had a blowtorch to do the cracks This happened yesterday And massachussets My names really Abbie And btw these ppl travel so watch out for them and it&apos;s cuz I want to b safe and not hurt Srrrry Our neighbors gonna help pay for repair Were really close Since kindergarten my mom noes them really well And he&apos;ll no They sent over an investigator yesterday Ya thnx,0.0,134,"['guess', 'how', 'old', 'happy', 'birthday', 'guess', 'happen', 'yesterday', 'rise', 'house', 'pal', 'truck', 'show', 'driveway', 'sidewalk', 'then', 'trap', 'smoke', 'side', 'house', 'fire', 'department', 'send', 'firetruck', 'ambulance', 'police', 'can', 'say', 'random', 'guy', 'fault', 'blowtorch', 'crack', 'happen', 'yesterday', 'name', 'really', 'pal', 'travel', 'so', 'watch', 'apo', 'want', 'safe', 'hurt', 'sorry', 'neighbor', 'go', 'help', 'pay', 'repair', 'really', 'close', 'kindergarten', 'mom', 'noe', 'really', 'well', 'apo', 'send', 'investigator', 'yesterday', 'thne']"
20947,20947,"IT&apos;S MY 20TH BIRTHDAY :D How old are you? Thanks, stranger! How nice of you! What&apos;s your name? I have no clue. Tell me more What a beautiful name I apologize, but is there a reason you are telling me this? I am kind of confused lol Where are you from, Rose? O_O ME TOO :O That is crazy lol, okay. Why did you call yourself Rose? Abbie&apos;s a great name Alright..... I am not sure if I can help you with this, lol. Sorry! xD Just out of curiosity, are you making this up? Sorry *hell Honestly, I would prefer if we could talk about something else",0.0,108,"['birthday', 'how', 'old', 'thank', 'stranger', 'how', 'nice', 'apo', 'name', 'clue', 'tell', 'more', 'beautiful', 'name', 'apologize', 'reason', 'tell', 'kind', 'of', 'confused', 'laugh', 'loud', 'where', 'rise', 'too', 'crazy', 'lol', 'why', 'call', 'rise', 'great', 'name', 'alright', 'sure', 'can', 'help', 'lol', 'sorry', 'ad', 'just', 'curiosity', 'make', 'hell', 'honestly', 'would', 'prefer', 'could', 'talk', 'else']"
20957,20957,Hi.. asl? nice to meet you.. Where are you from? 20 m korea do you have msn? do hyung lee your name? gia.. <email/>,0.0,24,"['nice', 'meet', 'where', 'man', 'name', 'email']"
20958,20958,20 f me too indonesia ur asl? wow korea what&apos;s your name? yes i have it i&apos;m gia what can i call you?,0.0,23,"['too', 'name', 'apos', 'gia', 'can', 'call']"
20959,20959,bugmail: [Bug 12834] LEGEND should be allowed to NOT be exactly first child of FIELDSET (&quot;The legend element&quot; spec section) &lt;http://lists.w3.org/Archives/Public/public-html-bugzilla/2011Dec/0227.html&gt;,0.0,21,"['gmail', 'bug', 'legend', 'should', 'allow', 'exactly', 'first', 'child', 'field', 'quit', 'legend', 'element', 'quit', 'section', 'help', 'list', 'org', 'archive', 'public', 'public']"
20960,20960,bugmail: [Bug 7978] New: Form foster parenting introduces extra space to layout &lt;http://lists.w3.org/Archives/Public/public-html-bugzilla/2009Oct/0379.html&gt; ** [Bug 7977] New: Define whether application/octet-stream with parameters is a type that the user agent knows it cannot render &lt;http://lists.w3.org/Archives/Public/public-html-bugzilla/2009Oct/0378.html&gt;,0.0,34,"['bug', 'new', 'form', 'foster', 'parenting', 'introduce', 'extra', 'space', 'layout', 'help', 'list', 'org', 'archive', 'public', 'public', 'bug', 'new', 'define', 'application', 'often', 'stream', 'parameter', 'type', 'user', 'agent', 'know', 'can', 'render', 'help', 'list', 'org', 'archive', 'public', 'public']"
20961,20961,Õ?ÍÓÈ ÁÌ‡Â ÎË Í‡Í ÒÂ ÔÓÎÁ‚‡ IRDA Ò?Ï GSM ÔÓ‰ ÎËÌÛÍÒ? Â‰ÌÓ ÏÓÏË *˜Â ÏÂ ÚÓ?ÏÓÁË Ò‡ÏÓ...,0.0,17,[]
20962,20962,hi Will there be a volume attribute for &lt;video&gt; an &lt;audio&gt; tags in case some internet boards don't allow javascript?,0.0,20,"['will', 'volume', 'attribute', 'video', 'audio', 'tag', 'case', 'internet', 'board', 'allow']"
20964,20964,[[rel-tag]] M http://microformats.org/wiki/index.php?title=rel-tag&amp;diff=45307&amp;oldid=45305&amp;rcid=58615 * Tantek * (-207) Reverted edits by [[Special:Contributions/Spicerider1|Spicerider1]] ([[User talk:Spicerider1|Talk]]) to last version by [[User:Bgp1|Bgp1]] [[Special:Log/block]] block  * Tantek *  blocked [[User:Spicerider1]] with an expiry time of infinite (account creation disabled): Spamming links to external sites [[hatom]] M http://microformats.org/wiki/index.php?title=hatom&amp;diff=45308&amp;oldid=45306&amp;rcid=58617 * Tantek * (-207) Reverted edits by [[Special:Contributions/Spicerider1|Spicerider1]] ([[User talk:Spicerider1|Talk]]) to last version by [[User:Bgp1|Bgp1]],0.0,57,"['help', 'microformat', 'index', 'pop', 'title', 'rid', 'tante', 'revert', 'edit', 'special', 'contribution', 'spicerider1', 'spicerider1', 'user', 'talk', 'spicerider1', 'talk', 'last', 'version', 'user', 'special', 'block', 'block', 'block', 'user', 'spicerider1', 'expiry', 'time', 'infinite', 'account', 'creation', 'disable', 'spamme', 'link', 'external', 'site', 'atom', 'help', 'microformat', 'index', 'pop', 'title', 'atom', 'rid', 'revert', 'edit', 'special', 'contribution', 'spicerider1', 'spicerider1', 'user', 'talk', 'spicerider1', 'talk', 'last', 'version', 'user']"
20966,20966,"hi guys can i make you a question regarding Wireless access point and p2p client software? when i turn on Ktorrent client on my laptop connected to the net through an US-robotics access point, the web navigation became very bad... furthermore i tried to ping the wifi router and the amount of packet loss is HUGE.. like 90% is this normal? do you have to turn off p2p clients too for  a correct navigation? i never had this problem with a wired connection....",0.0,83,"['guy', 'can', 'make', 'question', 'regard', 'wireless', 'access', 'point', 'pop', 'client', 'software', 'when', 'turn', 'torrent', 'client', 'laptop', 'connect', 'net', 'robotic', 'access', 'point', 'web', 'navigation', 'become', 'very', 'bad', 'furthermore', 'try', 'pe', 'wifi', 'router', 'amount', 'packet', 'loss', 'huge', 'normal', 'turn', 'pop', 'client', 'too', 'correct', 'navigation', 'never', 'problem', 'wired', 'connection']"
20967,20967,"hi there!! i'm doing a paper about DBs... one item is the cost of various databases.. i wanna know one thing, who should purchase MySQL and who doesn't need to purchase it?!? hum.. if i'm going to crate a datacenter, and sell storage for people.. i just need to purchase MySQL if i want support?! hum.. arjenAU: going there right now ;-) thanks arjenAU: thanks for your help.. that url you gave me answered my question ;-) and.. nothing.. :p i need to find the cost of other DBs.. but I always liked MySQL the way things works in Open Source is just wondefull",0.0,104,"['there', 'do', 'paper', 'de', 'item', 'cost', 'various', 'database', 'want', 'know', 'thing', 'should', 'purchase', 'mysel', 'doesn', 'need', 'purchase', 'go', 'crate', 'datacenter', 'sell', 'storage', 'people', 'just', 'need', 'purchase', 'mysel', 'want', 'support', 'hum', 'arena', 'go', 'there', 'right', 'now', 'thank', 'arena', 'thank', 'help', 'url', 'give', 'answer', 'question', 'need', 'find', 'cost', 'other', 'always', 'like', 'mysel', 'way', 'thing', 'work', 'open', 'source', 'just', 'wonderfull']"
