,Unnamed: 0,text,predator,text_len,preprocessed_bow
40846,40846,Hey. A s l ? Because I asked. Because I wanted to know. Alright. Fine. It is my life. Pleaseeeeeeeeeee. fjksa;fjvak;fjas dfajkl;fjiowuperwiqhjfasd faskfj;ak;fjt rewqt43wq fvdsgfsdgtrt yurtsg fdasg fdsagterwt yrea gdfa gfsde rtwy try ertg rqr wqr wqtyreyu iu tyfg vdfxz bvxf dsg reaw tgswgf sd g erwtrrwet rwe gtres g sdfg fds bvxc b ds gf sdg ret erw twe gd sgf dsg fsd gf dsg stgr et ew trwe Wow. Most people leave after that. It&apos;s pretty easy. Just pound away. ;),0.0,83,"['ask', 'want', 'know', 'fine', 'life', 'faskfj', 'fvdsgfsdgtrt', 'yurt', 'fast', 'area', 'idea', 'rty', 'try', 'type', 'dog', 'real', 'tgswgf', 'so', 'erwtrrwet', 'tre', 'safe', 'fed', 'go', 'star', 'true', 'most', 'people', 'leave', 'pretty', 'easy', 'just', 'pound', 'away']"
40847,40847,"Hello How are you? oh please why? whhyyyyyy yeah, but why did you ask? There&apos;s no possible way to continue it from there only &quot; so youre not fromUSA&quot; but why? Why it is so vital to you? you sure know how to beat a keyboard ;) can you teach me? master? cool",0.0,53,"['how', 'why', 'why', 'ask', 'there', 'possible', 'way', 'continue', 'there', 'only', 'quit', 'be', 'formula', 'quit', 'why', 'why', 'so', 'vital', 'sure', 'know', 'how', 'beat', 'keyboard', 'can', 'teach', 'master', 'cool']"
40848,40848,hello hi 24 f im penny which city in the us rob? yours too so how r u rob? nope i&apos;m from asia how i&apos;ve heard of it.. just don&apos;t know the location. so what&apos;s ur motive rob? talking to a strangers just making friends? making friends :) strangers can keep secrett what do you do? sure plenty later.. u first what do you usually talk about i havfe you haven&apos;t tell me.. what&apos;s ur plan for the weekend i&apos;m thinking.. what kind of secret are you interested? hah i am good person that&apos;s worst right just a plain old girl let&apos;s talk about something else how bout music? what do you like to listen? which band?,0.0,117,"['penny', 'city', 'too', 'so', 'how', 'apo', 'how', 'apos', 'hear', 'just', 'know', 'location', 'so', 'motive', 'rob', 'talk', 'stranger', 'just', 'make', 'friend', 'make', 'friend', 'stranger', 'can', 'keep', 'secret', 'sure', 'plenty', 'later', 'first', 'usually', 'talk', 'haven', 'tell', 'apo', 'plan', 'weekend', 'apos', 'think', 'kind', 'secret', 'interested', 'good', 'person', 'worst', 'just', 'plain', 'old', 'girl', 'let', 'talk', 'else', 'how', 'music', 'like', 'listen', 'band']"
40849,40849,"hi, 22 m us im rob cool na,e name san antonio, do you know where that is? i&apos;m ok, i&apos;ll show you will this work? http://maps.google.com/maps/ms?ie=UTF8&amp;oe=UTF8&amp;msa=0&amp;msid=106287946817352730249.00044402c2e4ad4d3226c none just showing you i&apos;m not sure what&apos;s yours cool you have secrets? tell me one then I&apos;ll tell you then why bring it up? we don&apos;t have all day anything ? that&apos;s no fun secrets you first you brought it up just tell me i won&apos;t bite you the worst one you have mine are bad, so I want a bad secret",0.0,89,"['cool', 'name', 'know', 'where', 'ok', 'apos', 'show', 'will', 'work', 'help', 'map', 'com', 'map', 'none', 'just', 'show', 'apos', 'sure', 'yours', 'cool', 'secret', 'tell', 'one', 'then', 'apos', 'tell', 'then', 'why', 'bring', 'don', 'day', 'apos', 'fun', 'secret', 'first', 'bring', 'just', 'tell', 'win', 'bite', 'bad', 'one', 'bad', 'want', 'bad', 'secret']"
40853,40853,HEY g&apos;bye why&apos;d you say goodbye? I DON&apos;T KNOW WHY YOU SAY GOODBYE I SAY HELLO,0.0,16,"['apos', 'why', 'say', 'goodbye', 'don', 'know', 'why', 'say', 'goodbye', 'say']"
40859,40859,hi I Just finished reading the GSoc for the game engine. I must say that I am a litle bit disapointed. The documentation. It's not that it's bad. To be honest it's very good for beginers. I just wanted some more. About the Python GameLogic API. In the main site it's still for 2.34. Is it the same with the current version?,0.0,62,"['just', 'finish', 'read', 'soc', 'game', 'engine', 'must', 'say', 'litle', 'bit', 'disappoint', 'documentation', 'bad', 'honest', 'very', 'good', 'beginner', 'just', 'want', 'more', 'main', 'site', 'still', 'same', 'current', 'version']"
40861,40861,in what? the GE or de documentation? too bad i don't like it when that happens _o/,0.0,17,"['documentation', 'too', 'bad', 'don', 'like', 'when', 'happen']"
40862,40862,"Greetings everybody! quick question... how to I import a 2D-shape (e.g. SVG) in blender for extrusion? Helixgruven, well that's the most obvious format I can think of atm it's not like I've AI here (on Linux) that's what I was thinking of hm... I've copied the svg2obj_050.py in my ~/.blender/scripts and restarted blender... but not sure where I can trigger it now for importing a plain svg ah... found it hm... I cannot get the extrusion to go into the depth... blender extrudes the imported .svg in the plane of the svg itself I wonder how I can set a normal to instruct blender in which direction I want the .svg to extrude. Helixgruven, extrude is only available in edit-mode and there I cannot set any &quot;extrusion direction&quot; via x-,y- or z-keys",0.0,132,"['greeting', 'quick', 'question', 'how', 'import', 'ad', 'shape', 'e', 'sig', 'blender', 'extrusion', 'helixgruven', 'well', 'most', 'obvious', 'format', 'can', 'think', 've', 'ai', 'here', 'think', 've', 'copy', 'svg2obj', 'py', 'blender', 'script', 'restart', 'blender', 'sure', 'where', 'can', 'trigger', 'now', 'import', 'plain', 'sig', 'find', 'can', 'extrusion', 'go', 'depth', 'blender', 'extrude', 'import', 'sig', 'plane', 'wonder', 'how', 'can', 'set', 'normal', 'instruct', 'blender', 'direction', 'want', 'extrude', 'extrude', 'only', 'available', 'edit', 'mode', 'there', 'can', 'set', 'quit', 'extrusion', 'direction', 'quit', 'y', 'key']"
40863,40863,"Is that the only format you can save as, MacSlow? Looks like &gt;= 2.40 supoprts importing SVG. Here's a script for importing it as a path: <a href=""http://jmsoler.free.fr/didacticiel/blender/tutor/cpl_import_svg_en.htm"">http://jmsoler.free.fr/didacticiel/blender/tutor/cpl_import_svg_en.htm</a> Yeah, I run AI in VMware. But... there's InkScape too. That's pretty sweet, that script. Handy for 3d-ifying logos. I've lots of stuff in EPS with beziers. I'll have to test it out today =) File -&gt; Import? If you switch to the scripts window and click Scripts -&gt; Update Menus, I don't think you have to restart. Try hitting e, then x, y, or z. One of the latter three being the plane you wish to extrude in. How did the shape import, is it a bezier path? You'd have to have splits every time someone modified something, else they make a modification and it goes through a moderation process. Seems like too much tape for me. I was playing with those bezier import scripts for AI, SVG, and EPS, but they don't play nice with compund paths. Have any of you had any experience with using the DXF exporter in Illustrator to get shapes into blender? The idea is to be able to take a vector graphic and bring it into blender instead of tracing a bitmap.",0.0,207,"['only', 'format', 'can', 'save', 'marlow', 'look', 'support', 'import', 'sig', 'here', 'script', 'import', 'path', 'help', 'jmsoler', 'free', 'import', 'sig', 'help', 'jmsoler', 'free', 'import', 'sig', 'en', 'run', 'aware', 'there', 'mindscape', 'too', 'pretty', 'sweet', 'script', 'handy', 'ad', 'iying', 'logo', 've', 'lot', 'stuff', 'beer', 'test', 'today', 'file', 'import', 'switch', 'script', 'window', 'click', 'script', 'update', 'don', 'think', 'restart', 'try', 'hit', 'e', 'then', 'y', 'latter', 'plane', 'wish', 'extrude', 'how', 'shape', 'import', 'well', 'path', 'split', 'time', 'modify', 'else', 'make', 'modification', 'go', 'moderation', 'process', 'seem', 'too', 'much', 'tape', 'play', 'well', 'import', 'script', 'don', 'play', 'nice', 'compound', 'path', 'experience', 'use', 'exporter', 'illustrator', 'shape', 'blender', 'idea', 'able', 'take', 'vector', 'graphic', 'bring', 'blender', 'instead', 'trace', 'bitmap']"
40864,40864,"does anyone know how to add a bezier-curve as a ipo-curve in python? (object should follow the path) because i import the scene from xml hm, the problem is, the program should execute from the console and call blender in background-mode isn't it possible to just define the handlers of the bezier-curve? yes, that's what i'm trying to do hm... BezTriple.vec -&gt; a list of the 3 points [ handle, knot, handle ] that comprise a BezTriple, with each point composed of a list [x,y,z] of floats. The list looks like [ [H1x, H1y, H1z], [Px, Py, Pz], [H2x, H2y, H2z] ]. hmm how do i get the coords of the knot? i would better if one could define just the distance of the knot from the handle otherwise i have to calculate the points i don't know... it say [x][y][z] for every point... &lt;- this a point no vector right? but then it has to be 2 beztriples to form a bezcurve yippieh blenderartists.org gives me an answer ;) bt = BezTriple.New((1.0, 2.0, 3.0, 4.0, 5.0, 6.0, 7.0, 8.0, 9,0)) yeah i created a bezier-curve in python =) now i need to find out, how to make an move-ipo out of it maybe with xIpo.append(1,icu[1]) the same with y and zIpo",0.0,212,"['know', 'how', 'add', 'well', 'curve', 'ipo', 'curve', 'object', 'should', 'follow', 'path', 'import', 'scene', 'problem', 'program', 'should', 'execute', 'console', 'call', 'blender', 'background', 'mode', 'possible', 'just', 'define', 'handler', 'well', 'curve', 'try', 'beztriple', 'vet', 'list', 'point', 'handle', 'handle', 'comprise', 'beztriple', 'point', 'compose', 'list', 'y', 'float', 'list', 'look', 'haz', 'how', 'cord', 'knot', 'would', 'better', 'could', 'define', 'just', 'distance', 'knot', 'handle', 'otherwise', 'calculate', 'point', 'don', 'know', 'say', 'y', 'point', 'point', 'vector', 'then', 'beztriple', 'form', 'recurve', 'yippie', 'blenderartist', 'give', 'answer', 'beztriple', 'new', 'create', 'well', 'curve', 'now', 'need', 'find', 'how', 'make', 'move', 'ipo', 'maybe', 'same', 'y', 'zip']"
40865,40865,"Why would you use python for that? ah well that should be interesting What you probably want to do is just create the physical curve object in blender, and do the magic of parenting your object to it and making it follow that path rather than trying to create an IPO out of it That way you can then change it well you'd setup the knot vectors and such See the Curve module of the Blender Python API There you is all done :) The knot I think is a point, but the handles are *vectors* aren't they? Project collaboration I agree with I'm not terribly sure I want everyone and their brother meddling with my creative work. [Relic]: hear hear I like for my work to remain MINE",0.0,129,"['why', 'would', 'use', 'should', 'interesting', 'probably', 'want', 'just', 'create', 'physical', 'curve', 'object', 'blender', 'magic', 'parent', 'object', 'make', 'follow', 'path', 'rather', 'try', 'create', 'ipo', 'way', 'can', 'then', 'change', 'setup', 'knot', 'vector', 'such', 'see', 'curve', 'module', 'there', 'all', 'do', 'knot', 'think', 'point', 'handle', 'vector', 'project', 'collaboration', 'agree', 'terribly', 'sure', 'want', 'brother', 'meddle', 'creative', 'work', 'hear', 'hear', 'like', 'work', 'remain']"
40866,40866,Hello :) not to mention all the goofy people that would steal the work and sell it on turbo squid :),0.0,21,"['mention', 'goofy', 'people', 'would', 'steal', 'work', 'sell', 'turbo']"
40868,40868,how do you like the idea of having a place where people can release their openSource blender projects/scenes/models/... ? Or even use a verse server to collaborate on projects?,0.0,29,"['how', 'like', 'idea', 'have', 'place', 'where', 'people', 'can', 'release', 'opensource', 'blender', 'project', 'scene', 'model', 'even', 'use', 'verse', 'server', 'collaborate', 'project']"
40869,40869,"Hi In this Tutorial  <a href=""http://www.trcoding.de/informatik/blender/tasse/becherboden/becherboden.html"">http://www.trcoding.de/informatik/blender/tasse/becherboden/becherboden.html</a>  the button REgion dos net exist after pressing E (xtrude) .. what do i need to do ? the mode is the thing whichi can change by pressing Tab ? sounds logicall :D but nothing happens by pressing ctrl+tab edit mode= the mode in which i atm can select points+lines thats the mode i am in.. where can i see in which select mode i am ? ah  i got the GUI-buttons k well crtl+tab does not work, but nowi  can handle this Tank you :) arg *thank",0.0,94,"['tutorial', 'ref', 'help', 'trading', 'help', 'trading', 'himl', 'button', 'region', 'do', 'net', 'exist', 'press', 'e', 'extrude', 'need', 'mode', 'thing', 'whichi', 'can', 'change', 'press', 'tab', 'sound', 'logical', 'happen', 'press', 'mode', 'mode', 'can', 'select', 'point', 'line', 's', 'mode', 'where', 'can', 'see', 'select', 'mode', 'get', 'button', 'well', 'call', 'work', 'nowi', 'can', 'handle', 'tank', 'thank']"
40870,40870,"if you're in face select mode it'll extrude the region automatically if you're in vertex or edge select mode it'll ask you no in edit mode, press ctrl+tab in &quot;vertices&quot; you can select vertices, in edges edges, and in faces faces ;P make sure you're in edit mode yup and ctrl+tab does nothing? :/ if you're in vertex select mode, the vertices have (by default) purple dots on them if you're in face select mode, the middle of the faces have black dots when you're in face select, the extrude command won't ask what you want to extrude in edge select neither",0.0,102,"['re', 'face', 'select', 'mode', 'extrude', 'region', 'automatically', 're', 'in', 'edge', 'select', 'mode', 'ask', 'edit', 'mode', 'press', 'curl', 'quit', 'vertex', 'quit', 'can', 'select', 'vertex', 'edge', 'edge', 'face', 'face', 'make', 'sure', 're', 'edit', 'mode', 'yup', 'curl', 're', 'in', 'select', 'mode', 'vertex', 'default', 'purple', 'dot', 're', 'face', 'select', 'mode', 'middle', 'face', 'black', 'dot', 'when', 're', 'face', 'select', 'command', 'win', 'ask', 'want', 'extrude', 'edge', 'select']"
40871,40871,"hi all, I used the game engine for a walktrough at work (linux) and now I'm using the same official template on my mac, and the mouse wont move camera, while the arrows do move the actor. Any ideas? could it be I use python 2.3 on my mac and 2.4 at work? Khellendros|: tnx (still haven't figured it out)",0.0,60,"['use', 'game', 'engine', 'walkthrough', 'work', 'now', 'use', 'same', 'official', 'template', 'mac', 'mouse', 'will', 'move', 'camera', 'arrow', 'move', 'actor', 'idea', 'could', 'use', 'work', 'tax', 'still', 'haven', 'figure']"
40872,40872,"ok, trying this again :) anyone know if there's a way to use a sequence as a node input?",0.0,19,"['try', 'again', 'know', 'way', 'use', 'sequence', 'node', 'input']"
40874,40874,is there anyway to have a UV texture only cover up part of a mesh... and have the material be the rest?,0.0,22,"['anyway', 'texture', 'only', 'cover', 'part', 'mesh', 'material', 'rest']"
40875,40875,"hello there I have a problem.. though it's not about blender.. but I hope someone can help :D I've got these three equations: <a href=""http://www.math.aau.dk/~dethlef/Undervisning/L5LA/img3.gif"">http://www.math.aau.dk/~dethlef/Undervisning/L5LA/img3.gif</a> And I'm trying to solve it using matrices.. the solution is here, page 2: <a href=""http://www.math.aau.dk/~dethlef/Undervisning/L5LA/loes01.pdf"">http://www.math.aau.dk/~dethlef/Undervisning/L5LA/loes01.pdf</a> I just don't get it! What happens at step 2? thanx =)",0.0,53,"['there', 'problem', 'blender', 'hope', 'can', 'help', 've', 'get', 'equation', 'help', 'math', 'dethlef', 'undermine', 'lila', 'image', 'gif', 'help', 'math', 'dethlef', 'undermine', 'lila', 'image', 'gif', 'try', 'solve', 'use', 'matrix', 'solution', 'here', 'page', 'help', 'math', 'dethlef', 'undermine', 'lila', 'loess', 'edf', 'help', 'math', 'dethlef', 'undermine', 'lila', 'loess', 'just', 'get', 'happen', 'step', 'thanx']"
40877,40877,"DanC: The IRC bot is broken following the wiki upgrade. Ryan's word was that it would need to be ‚Äòrewritten‚Äô, so we're on the hunt for a new one. I've got a huge project on at Yahoo this week though, so I've no time to look for it. Hopefully after Thanksgiving we'll get it restored",0.0,55,"['dance', 'arc', 'bot', 'break', 'follow', 'word', 'would', 'need', 'rewrite', 're', 'hunt', 'new', 'one', 've', 'get', 'huge', 'project', 'week', 'though', 'so', 've', 'time', 'look', 'hopefully', 'thanksgive', 'get', 'restore']"
40884,40884,"hai do you like pie i like pie and not just any pie all kinds of pie it is all good to me he is big, and is very busy being awesome anyways... do you like pie? whats your facorite kind how does what make me feel? my dad, or my pie? my dad scares me the pie makes me feel warm and tingly what about you? how does that make you feel? that&apos;s what i though",0.0,77,"['pie', 'like', 'pie', 'just', 'pie', 'kind', 'pie', 'all', 'good', 'big', 'very', 'busy', 'awesome', 'anyway', 'pie', 's', 'favorite', 'kind', 'how', 'make', 'feel', 'dad', 'pie', 'dad', 'scare', 'pie', 'make', 'feel', 'warm', 'tingly', 'how', 'make', 'feel', 'though']"
40885,40885,"who&apos;s your daddy, and what does he do? c-c-c-c-c-combo breaker how does that make you feel? so you are overweight... i see...",0.0,22,"['daddy', 'combo', 'breaker', 'how', 'make', 'feel', 'overweight', 'see']"
40886,40886,hey people i was wondering how to set up a dual boot? what? there is no #linux channel i think it would i need windows for other stuf otherwise i would ok i'll try i hope i dont break anything....,0.0,40,"['people', 'wonder', 'how', 'set', 'dual', 'boot', 'channel', 'think', 'would', 'need', 'window', 'other', 'otherwise', 'would', 'ok', 'try', 'hope', 'break']"
40889,40889,"scabootssca, #linux ? yup, i'm still in #blender scabootssca, ever try a linux chat to set up dual booting? not a 3d modeling chat it would only make more sense neighborlee, is there a #linux channel still? ah, xchat automaticlly spinds me over to ##linux whenever i would go in there but i havent been there in so many months now scabootssca, just use ubuntu, it will take you through it all eugman, it would indeed eugman, you didnt like it either, i take it? scabootssca, same here, i just need windows for video editing and effects, but bleh, linux has nothing good enough for me ShortWave is made of money, so he can have multiple setups, but im stuck with a low income and this laptop ive had for a while now eugman, no, i feel its a bad movie as well no story, no plot, no character development as i told it to ShortWave, it's nothing more than an animated gallery of what blender can do i feel there's no finality also. probably because we waited so long, and there's absolutely no story at all i wouldnt blame any of the animators, just put all the blame on the producers and the &quot;writer&quot; it was a good try though for the time given for the project, it was a good job done Strongbad2, what a way to show maturity in the blender community they dont come in here touting &quot;haha, maya was used for monsters inc., finding nemo, haha! you guys have puney crappy elephants dream&quot; Strongbad2, use another piece of software stoik video converter Strongbad2, google is free, look it up in the time it took to ask that, you could have googled it, and found the website and realised it was indeed free there's a free version which supports more formats and there's a free version. i know, ive used it. you need to look harder <a href=""http://www.stoik.com/products/svc/"">http://www.stoik.com/products/svc/</a> oh my, what's that say in large bold text on the left? &quot;STOIK Video Converter 2.1.1 (free)&quot; Strongbad2, get it? it should be pretty straightforward input video, output video destination and format",0.0,354,"['still', 'blender', 'scabootssca', 'ever', 'try', 'linux', 'chat', 'set', 'dual', 'booting', 'ad', 'modeling', 'chat', 'would', 'only', 'make', 'more', 'sense', 'neighborly', 'linux', 'channel', 'still', 'chat', 'automatically', 'spend', 'whenever', 'would', 'go', 'in', 'there', 'there', 'so', 'many', 'month', 'now', 'scabootssca', 'just', 'use', 'bunt', 'will', 'take', 'eggman', 'would', 'indeed', 'eggman', 'like', 'take', 'same', 'here', 'just', 'need', 'window', 'video', 'editing', 'effect', 'good', 'enough', 'shortwave', 'make', 'money', 'can', 'multiple', 'setup', 'stick', 'low', 'income', 'laptop', 'have', 'have', 'while', 'now', 'eggman', 'feel', 'bad', 'movie', 'as', 'well', 'story', 'plot', 'character', 'development', 'tell', 'shortwave', 'more', 'animate', 'gallery', 'blender', 'can', 'feel', 'there', 'finality', 'also', 'probably', 'wait', 'so', 'long', 'there', 'absolutely', 'story', 'at', 'all', 'would', 'blame', 'animator', 'just', 'put', 'blame', 'producer', 'quit', 'writer', 'quit', 'good', 'try', 'though', 'time', 'give', 'project', 'good', 'job', 'do', 'strongbad2', 'way', 'show', 'maturity', 'blender', 'community', 'come', 'in', 'here', 'tout', 'quit', 'use', 'monster', 'guy', 'puny', 'crappy', 'elephant', 'dream', 'quit', 'strongbad2', 'use', 'piece', 'software', 'stock', 'video', 'converter', 'free', 'look', 'time', 'take', 'ask', 'could', 'google', 'find', 'website', 'realise', 'indeed', 'free', 'there', 'free', 'version', 'support', 'more', 'format', 'there', 'free', 'version', 'know', 'have', 'use', 'need', 'look', 'harder', 'ref', 'help', 'stock', 'com', 'product', 'help', 'stock', 'com', 'product', 'say', 'large', 'bold', 'text', 'left', 'stock', 'video', 'converter', 'free', 'quit', 'strongbad2', 'should', 'pretty', 'straightforward', 'input', 'video', 'output', 'video', 'destination', 'format']"
40890,40890,"##linux Hmmm, I'm guessing this wouldn't be the place to ask a question about Elephant's dream? It's not that entirely. It's that it seems like the only person who can tell me some of the background facts is me and that's a bit annoying. I suppose I'm just young but it feels like it's lacking finality because I'm left to interpet and assume verything. Truthfully, I thought it was an intro and they had the credits at the beginning. Then I realized that was it and they weren't going to explain anything. Of course the lisencing means someone could in theory redo it and make it a bit better but apparently it took 125 days on the renderfarm. I'm not blaming the animators I'm just saying it doesn't reem feasible to render a longer version at any great resolution. Well, you've got to reverse the polarity of the lumines equalizer and then re-adjust the perocity of the voluminator. I guess it's a bit obvious I don't model, eh? If that had been the intro and then there was another 50 minutes afterwards that made sense it'd be awesome. Seriously I'd just be satisfied if there was a background paragraph that said what was supposed to be going on. But it seems like that isn't the point.",0.0,216,"['guess', 'be', 'place', 'ask', 'question', 'elephant', 'dream', 'that', 'entirely', 'seem', 'only', 'person', 'can', 'tell', 'background', 'fact', 'bit', 'annoying', 'suppose', 'just', 'young', 'feel', 'lack', 'finality', 'leave', 'internet', 'assume', 'verything', 'truthfully', 'think', 'credit', 'beginning', 'then', 'realize', 'weren', 'go', 'explain', 'course', 'listening', 'mean', 'could', 'theory', 'redo', 'make', 'bit', 'better', 'apparently', 'take', 'day', 'renderfarm', 'blame', 'animator', 'just', 'say', 'seem', 'feasible', 'render', 'long', 'version', 'great', 'resolution', 'get', 'reverse', 'polarity', 'lumine', 'equalizer', 'then', 're', 'adjust', 'ferocity', 'deluminator', 'guess', 'i', 'bit', 'obvious', 'don', 'model', 'then', 'minute', 'afterwards', 'make', 'sense', 'be', 'awesome', 'seriously', 'just', 'satisfied', 'background', 'paragraph', 'say', 'suppose', 'go', 'seem', 'point']"
40891,40891,"Hello :) nope, I don't remember how many sides a nornagon has either :) can't win them all I guess  :) since you did escape this nut house, what dragged you back?    :) not very good at it  :) thought of a neat idea for my f1 detailing  :) :) if it calculated radisity then it should have rendered with it if it actually says it is calculationg the elements in the dos-box it should be you have the radi button checked in (F10) not sure exactly what you are doing so it is hard to tell, and the 3d view isn't too accurate  :)",0.0,105,"['don', 'remember', 'how', 'many', 'side', 'donnagon', 'can', 'win', 'guess', 'escape', 'drag', 'back', 'very', 'good', 'think', 'neat', 'idea', 'fu', 'detailing', 'calculate', 'rapidity', 'then', 'should', 'render', 'actually', 'say', 'calculation', 'element', 'should', 'radio', 'button', 'check', 'sure', 'exactly', 'do', 'so', 'hard', 'tell', 'ad', 'view', 'too', 'accurate']"
40892,40892,"hi :) ltns (I wonder if you remember me. :P) oh well. :P Just being fiddling with blender a bit recently, dropped in and have been idling since :P",0.0,29,"['wonder', 'remember', 'just', 'fiddle', 'blender', 'bit', 'recently', 'drop', 'in', 'idle']"
