,Unnamed: 0,text,predator,text_len,preprocessed_bow
23807,23807,"default HZ in solaris is 100, right? (sparc) Doc: thanks. another question, related to sparc - do i understand correctly, that most of the time stack - i mean, the stack in memory - contains 'empty' frames, that is, frames that are allocated, but function arguments from registers were not copied into them?",0.0,53,"['default', 'right', 'spare', 'doc', 'thank', 'question', 'relate', 'spare', 'understand', 'correctly', 'most', 'time', 'stack', 'mean', 'stack', 'memory', 'contain', 'empty', 'frame', 'frame', 'allocate', 'function', 'argument', 'register', 'copy']"
23809,23809,do u have a problem with dicks? if so disconnect right... now yay asl? 21 m new zealand very 9 in ;) how big are your boobs dammmn oooh do i get to see them is that a yes? alright babe okay hunni damn one min http://www.leesporn.com/images/gay/acm/adam.jpg ? send a naked pic of you now? ?? please okay abbe oh welll. send those please i could do some harm to you im getting a better one http://www.firstboys.com/pics/uk-afro-black-long-penis.html/black-long-penis.jpg,0.0,77,"['problem', 'dick', 'so', 'disconnect', 'right', 'now', 'very', 'how', 'big', 'boob', 'damn', 'oooh', 'see', 'help', 'leesporn', 'com', 'image', 'send', 'naked', 'pic', 'now', 'abbe', 'send', 'could', 'harm', 'get', 'well', 'one', 'help', 'firstborn', 'com', 'pic', 'long', 'penis', 'black', 'long', 'penis', 'jog']"
23810,23810,hey :) asl? no im a girl :) 19 f cali :) u? :) horny much? how big is your dick? :P no way :) 33dd :) I HAVE PICS TOO ;) hehe :P you only get naked ones if i can see your dick ;P funtil then you get clothed ones :) http://tinypic.com/view.php?pic=2v2bipv&amp;s=5 :) :P theres a pic ;D ? :) okay hun :) omg :D your big! the things i would do to you :) hold on hun :) there are better ones with me doing &quot;other things&quot; ;P http://tinypic.com/view.php?pic=34r8zsk&amp;s=5 ;P nuh uh more cock plz ;P shame i&apos;ve never had a black dick in me ;P theres the one above no more till i see more of you ;P ;P,0.0,123,"['girl', 'cali', 'horny', 'much', 'how', 'big', 'dick', 'way', 'add', 'pic', 'too', 'only', 'get', 'naked', 'one', 'can', 'see', 'dick', 'then', 'get', 'clothe', 'one', 'help', 'tinypic', 'com', 'view', 'pop', 'there', 's', 'pic', 'omg', 'big', 'thing', 'would', 'hold', 'well', 'one', 'do', 'quit', 'other', 'thing', 'quit', 'help', 'com', 'view', 'pop', 'amp', 'nuh', 'more', 'cock', 'ply', 'shame', 'apo', 'never', 'black', 'dick', 'there', 's', 'one', 'more', 'see', 'more']"
23815,23815,"im setting up DNS server on windows 2003 server &lt;mbk&gt; i ened to enter NETWORK ID..or ZONE name &lt;mbk&gt; what should I do? &lt;rhys&gt; use linux. &lt;mbk&gt; should i enter the first three XXX.XXX.XXX of the ip (xxx.xxx.xxx.xxx)of the server? in NETWORK ID? please dont consider it spam my ip is 71.288.94.190, WHAT IS MY REVERSE ZONE? &lt;mbk&gt; should i enter the first three XXX.XXX.XXX of the ip (xxx.xxx.xxx.xxx)of the server? in NETWORK ID? &lt;mbk&gt; im setting up DNS server on windows 2003 server &lt;mbk&gt; &lt;mbk&gt; i ened to enter NETWORK ID..or ZONE name &lt;mbk&gt; &lt;mbk&gt; what should I do? &lt;mbk&gt; &lt;rhys&gt; use linux. &lt;mbk&gt; &lt;mbk&gt; should i enter the first three XXX.XXX.XXX of the ip (xxx.xxx.xxx.xxx)of the server? in NETWORK ID? &lt;mbk&gt; please dont consider it spam &lt;mbk&gt; my ip is 71.288.94.190, WHAT IS MY REVERSE ZONE? tallu please help me ! &lt;mbk&gt; im setting up DNS server on windows 2003 server &lt;mbk&gt; &lt;mbk&gt; i ened to enter NETWORK ID..or ZONE name &lt;mbk&gt; &lt;mbk&gt; what should I do? &lt;mbk&gt; &lt;rhys&gt; use linux. &lt;mbk&gt; &lt;mbk&gt; should i enter the first three XXX.XXX.XXX of the ip (xxx.xxx.xxx.xxx)of the server? in NETWORK ID? &lt;mbk&gt; please dont consider it spam &lt;mbk&gt; my ip is 71.288.94.190, WHAT IS MY REVERSE ZONE?",0.0,207,"['set', 'dna', 'server', 'window', 'server', 'mak', 'need', 'enter', 'network', 'would', 'zone', 'name', 'mak', 'should', 'rhys', 'use', 'mak', 'should', 'enter', 'first', 'server', 'network', 'would', 'consider', 'spam', 'ip', 'reverse', 'zone', 'mak', 'should', 'enter', 'first', 'server', 'network', 'would', 'mak', 'set', 'dna', 'server', 'window', 'server', 'mak', 'mak', 'need', 'enter', 'network', 'would', 'zone', 'name', 'mak', 'mak', 'should', 'mak', 'rhy', 'use', 'mak', 'mak', 'should', 'enter', 'first', 'server', 'network', 'would', 'mak', 'consider', 'spam', 'mak', 'ip', 'reverse', 'zone', 'tall', 'help', 'mak', 'set', 'dna', 'server', 'window', 'server', 'mak', 'mak', 'need', 'enter', 'network', 'would', 'zone', 'name', 'mak', 'mak', 'should', 'mak', 'rhy', 'use', 'mak', 'mak', 'should', 'enter', 'first', 'server', 'network', 'would', 'mak', 'consider', 'spam', 'mak', 'ip', 'reverse', 'zone']"
23818,23818,"http://dvcs.w3.org/hg/from-origin/raw-file/tip/Overview.html#from-origin-response-header now has a processing model b8810fee2f4a71f849f3f7409546d1d9, first version of CORS is not meant for static resources b8810fee2f4a71f849f3f7409546d1d9, that Gecko used it for fonts without prior discussion with WebApps, well, ... # is some HTTPism makes sense to me to define headers the same way HTTP does you're right about same, I should make that an expansion and link origin to some definition in the origin concept draft terminate means &quot;these steps don't apply&quot; that should prolly be clarified somewhat and &quot;same&quot; is a convenience keyword if you can specify an empty header that should probably be allowed too right however, before step 7 it will be terminated if it's same origin so that's all good actually, WebDAV does that I believe XHR also has a distinction between no header and empty string value anyway, currently it's not allowed # means one or more iirc b8810fee2f4a71f849f3f7409546d1d9, yes and yes it would; guess I'll do it now 06cb330920ae58e1614c9145d983b3d6, no, then same would not be case-sensitive maybe case-insensitive is okay lets not confuse HTTP ABNF with EBNF http://dvcs.w3.org/hg/from-origin/raw-file/tip/Overview.html#from-origin-response-header refresh thanks 06cb330920ae58e1614c9145d983b3d6, done I guess I'll just say that the ABNF is the same as the Web Origin Concept so I can avoid dealing with HTTP references it now just references ORIGIN which in turn hopefully references some correct spec, but it's no longer my problem :) actually, this is not quite correct bah origin-list is space separated :/ fixed bnf again 06cb330920ae58e1614c9145d983b3d6, yeah, this all needs to be integrated one day at some point someone might take everything network and write it all down :) a9b326df4e6da61c5b6f5e1058be83a2, that is wrong a9b326df4e6da61c5b6f5e1058be83a2, now it says there's a method Notification on the Notification object a9b326df4e6da61c5b6f5e1058be83a2, respec2 doesn't handle it either? sounds painful a9b326df4e6da61c5b6f5e1058be83a2, I'm fine with publishing as-is though, maybe with a note or maybe berjon knows a cure 06cb330920ae58e1614c9145d983b3d6, added main step 06cb330920ae58e1614c9145d983b3d6, b8810fee2f4a71f849f3f7409546d1d9, thanks a lot",0.0,313,"['help', 'org', 'origin', 'raw', 'file', 'tip', 'overview', 'origin', 'response', 'now', 'processing', 'model', 'first', 'version', 'cop', 'mean', 'static', 'resource', 'gecko', 'use', 'font', 'prior', 'discussion', 'webapps', 'well', 'httpism', 'make', 'sense', 'define', 'header', 'same', 'way', 'help', 're', 'right', 'same', 'should', 'make', 'expansion', 'link', 'origin', 'definition', 'origin', 'concept', 'draft', 'terminate', 'mean', 'quit', 'step', 'apply', 'quit', 'should', 'prolly', 'clarify', 'somewhat', 'quit', 'same', 'quit', 'convenience', 'keyword', 'can', 'specify', 'empty', 'header', 'should', 'probably', 'allow', 'too', 'right', 'however', 'step', 'will', 'terminate', 'same', 'origin', 'good', 'actually', 'webcam', 'believe', 'also', 'distinction', 'header', 'empty', 'string', 'value', 'anyway', 'currently', 'allow', 'mean', 'more', 'circ', 'would', 'guess', 'now', 'then', 'same', 'would', 'case', 'sensitive', 'maybe', 'case', 'insensitive', 'okay', 'let', 'confuse', 'help', 'end', 'help', 'doc', 'org', 'origin', 'raw', 'file', 'tip', 'overview', 'origin', 'response', 'header', 'refresh', 'thank', 'do', 'guess', 'just', 'say', 'same', 'web', 'origin', 'concept', 'can', 'avoid', 'deal', 'help', 'reference', 'now', 'just', 'reference', 'origin', 'turn', 'hopefully', 'reference', 'correct', 'spec', 'no', 'longer', 'problem', 'actually', 'quite', 'correct', 'bah', 'origin', 'list', 'space', 'separate', 'fix', 'bef', 'again', 'need', 'integrate', 'day', 'point', 'may', 'take', 'network', 'write', 'wrong', 'a9b326df4e6da61c5b6f5e1058be83a2', 'now', 'say', 'there', 'method', 'notification', 'notification', 'object', 'respect', 'doesn', 'handle', 'sound', 'painful', 'fine', 'publishing', 'maybe', 'note', 'maybe', 'person', 'know', 'cure', 'add', 'main', 'step', 'thank', 'lot']"
23819,23819,"edb259c0e0038f38bb200bc20c8cbf7e: the spec is completely obscure unless one remembers what prefix # means in this flavor of BNF edb259c0e0038f38bb200bc20c8cbf7e: can the header take a list of multiple origins? edb259c0e0038f38bb200bc20c8cbf7e: it's very sad that CORS doesn't allow multiple origins to be specified 06cb330920ae58e1614c9145d983b3d6: that would help doesn't know what #[] means also, the words origin and same aren't quoted but if they are non-terminals, I don't see expansions, either &quot;if none of&quot; suggests that a list is allowed edb259c0e0038f38bb200bc20c8cbf7e: so is From-Origin: same, same conforming? edb259c0e0038f38bb200bc20c8cbf7e: it would be really nice to link the word &quot;BNF&quot; to whatever IETF flavor of BNF this is edb259c0e0038f38bb200bc20c8cbf7e: also, linking the non-terminals to their expansions would be really nice 1f58faf0d058f303f30239a369808167: XML BNF is readable. Unlike the IETF stuff.",0.0,124,"['edb259c0e0038f38bb200bc20c8cbf7e', 'spec', 'completely', 'obscure', 'one', 'remember', 'prefix', 'mean', 'flavor', 'bef', 'can', 'header', 'take', 'list', 'multiple', 'origin', 'edb259c0e0038f38bb200bc20c8cbf7e', 'very', 'sad', 'cop', 'doesn', 'allow', 'multiple', 'origin', 'specify', 'would', 'help', 'know', 'mean', 'also', 'word', 'origin', 'same', 'aren', 'quote', 'non', 'terminal', 'don', 'see', 'expansion', 'quit', 'none', 'suggest', 'list', 'allow', 'so', 'origin', 'same', 'same', 'conforming', 'edb259c0e0038f38bb200bc20c8cbf7e', 'would', 'really', 'nice', 'link', 'word', 'quit', 'bef', 'quit', 'ieft', 'flavor', 'bef', 'edb259c0e0038f38bb200bc20c8cbf7e', 'also', 'link', 'non', 'terminal', 'expansion', 'would', 'really', 'nice', 'readable', 'stuff']"
23820,23820,"where's the definition of this BNF syntax? should it be referenced explicitly? i assumed the #[] meant a comma-separated list or something like that &quot;same&quot; = empty list, don't terminate in step 1 and depend on step 5 to allow same-origin only? i know that i mean &quot;From-Origin: same&quot; means #1 won't terminate and step 7 will always terminate? er, abort i figured that was the idea having an empty header would be cleaner but yeah I don't remember if that's allowed, and it might be a bad idea anyway since nothing ever does that probably best for empty header to be equivalent to no header for example, there's no way to specify an empty header with curl specifying an empty header removes it should it be #[origin | &quot;same&quot;]? bnf-fu very rusty this relates not just to HTML but HTTP; should it reference HTTP for what &quot;response header&quot; means? not sure how explicit that's typically made that definition says &quot;strings&quot; are case-sensitive 15.7.1 Denial of Service Attacks on Proxies They exist. They are hard to defend against. Research continues. Beware. gotta love a spec that uses the single word &quot;beware&quot; as a sentence http://tools.ietf.org/html/rfc2616#page-14 (&quot;page-14&quot; as an anchor? really?) writing specs as if the expectation is that everyone's going to print them out ... that's pretty amusing even for 1999 can I be happy that we're in an age where we no longer feel the need to explicitly reference the ASCII spec from HTML edb259c0e0038f38bb200bc20c8cbf7e: perhaps explicitly say that these steps are to be performed as part of the &quot;main step&quot; of fetching assuming that's where it goes (implying that if F-O aborts the resource, cookies aren't updated, and so on) httpbis ref is http://tools.ietf.org/html/draft-ietf-httpbis-p1-messaging-12#page-7 but if it's the same may as well not use an in-progress reference &lt 06cb330920ae58e1614c9145d983b3d6&gt; http://tools.ietf.org/html/rfc2616#page-14 &lt;- that's the 2616 ref edb259c0e0038f38bb200bc20c8cbf7e: the fetch algorithm has a specifically named &quot;main step&quot;; i think it makes sense to refer to it by name to be precise about where in the algorithm it goes (of course, it won't be when multiple addon-specs are doing that, but heh)",0.0,351,"['where', 'definition', 'bef', 'syntax', 'should', 'reference', 'explicitly', 'assume', 'mean', 'comma', 'separated', 'list', 'quit', 'same', 'quit', 'empty', 'list', 'terminate', 'step', 'depend', 'step', 'allow', 'same', 'origin', 'only', 'know', 'mean', 'quit', 'origin', 'same', 'quit', 'mean', 'win', 'terminate', 'step', 'will', 'always', 'terminate', 'abort', 'figure', 'idea', 'have', 'empty', 'header', 'would', 'clean', 'don', 'remember', 'allow', 'may', 'bad', 'idea', 'anyway', 'ever', 'probably', 'good', 'empty', 'header', 'equivalent', 'header', 'example', 'there', 'way', 'specify', 'empty', 'header', 'curl', 'specify', 'empty', 'header', 'remove', 'should', 'origin', 'quit', 'same', 'bef', 'very', 'rusty', 'relate', 'just', 'help', 'should', 'reference', 'help', 'quit', 'response', 'header', 'quit', 'mean', 'sure', 'how', 'explicit', 'typically', 'make', 'definition', 'say', 'quit', 'string', 'quit', 'case', 'sensitive', 'denial', 'service', 'attack', 'proxy', 'exist', 'hard', 'defend', 'research', 'continue', 'get', 'love', 'spec', 'use', 'single', 'word', 'quit', 'quit', 'sentence', 'help', 'tool', 'ieft', 'quit', 'page', 'quit', 'anchor', 'really', 'write', 'spec', 'expectation', 'go', 'print', 'pretty', 'amusing', 'even', 'can', 'happy', 're', 'age', 'where', 'no', 'longer', 'feel', 'need', 'explicitly', 'reference', 'perhaps', 'explicitly', 'say', 'step', 'perform', 'part', 'quit', 'main', 'step', 'quit', 'fetch', 'assume', 'where', 'go', 'imply', 'o', 'abort', 'resource', 'cookie', 'update', 'so', 'on', 'help', 'tool', 'ieft', 'httpbi', 'message', 'page', 'i', 'same', 'may', 'as', 'well', 'use', 'progress', 'reference', '06cb330920ae58e1614c9145d983b3d6', 'help', 'tool', 'ieft', 'fetch', 'algorithm', 'specifically', 'name', 'quit', 'main', 'step', 'quit', 'think', 'make', 'sense', 'refer', 'name', 'precise', 'where', 'algorithm', 'go', 'of', 'course', 'win', 'when', 'multiple', 'addon', 'spec', 'do', 'heh']"
23821,23821,http://www.w3.org/TR/2000/REC-xml-20001006#sec-notation a link for EBNF there is also ABNF http://tools.ietf.org/html/rfc4234 http://tools.ietf.org/html/rfc5234 geez with erratas 06cb330920ae58e1614c9145d983b3d6: for http I recommend to look in the direction of httpbis http://tools.ietf.org/wg/httpbis/,0.0,27,"['help', 'org', 'notation', 'link', 'end', 'also', 'help', 'tool', 'ieft', 'help', 'tool', 'ieft', 'errand', 'help', 'recommend', 'look', 'direction', 'httpbis', 'help', 'tool', 'ieft', 'org', 'httpbi']"
23822,23822,"ietf is kinda fucked up They regard technologies that postdate the 60s with suspicion and even downright hostility I thought we did reference the ASCII spec They was a whole cycle of the Issue process around it, was there not?",0.0,40,"['kinda', 'fuck', 'regard', 'technology', 'postdate', 'suspicion', 'even', 'downright', 'hostility', 'think', 'reference', 'whole', 'cycle', 'issue', 'process', 'there']"
23823,23823,"&quot;They exist. They are hard to defend against. Research continues. Beware.&quot; seems like a good section for other stuff as well, like &quot;Security considerations&quot; edb259c0e0038f38bb200bc20c8cbf7e: RFC2119 ref is broken",0.0,29,"['quit', 'exist', 'hard', 'defend', 'research', 'continue', 'beware', 'seem', 'good', 'section', 'other', 'stuff', 'as', 'well', 'quit', 'security', 'consideration', 'quit', 'break']"
23824,23824,"edb259c0e0038f38bb200bc20c8cbf7e, zevt: reusing the HTTP ABNF makes sense here. the reference should go to http://greenbytes.de/tech/webdav/rfc2616.html#rfc.section.2.1 (not that URI, but RFC 2616, Section 2.1) you'll also need to steal the definition of OWS from HTTPbis http://greenbytes.de/tech/webdav/draft-ietf-httpbis-p1-messaging-12.html#rfc.section.1.2.2 it may make sense to steal the details from the new cookie spec actually no: it uses the 5234 syntax",0.0,55,"['edb259c0e0038f38bb200bc20c8cbf7e', 'zest', 'reuse', 'help', 'make', 'sense', 'here', 'reference', 'should', 'go', 'help', 'uri', 'section', 'also', 'need', 'steal', 'definition', 'help', 'draft', 'httpbi', 'may', 'make', 'sense', 'steal', 'detail', 'new', 'cookie', 'spec', 'actually', 'use', 'syntax']"
23825,23825,"edb259c0e0038f38bb200bc20c8cbf7e: please take a look at http://dev.w3.org/2006/webapi/WebNotifications/static.html and let me know if you see any problems please compare to http://dev.w3.org/2006/webapi/WebNotifications/publish/Notifications.html the main difference is where/how the Notification constructor is defined Berjon's current JS respec does not seem to provide any way to handle the constructor differently than normal methods hmm oK edb259c0e0038f38bb200bc20c8cbf7e; so now I have to hack fricking respec more yeah, I know I can't imagine this is the first spec using respec that has needed to document a constructtor nah, I can fix it today maybe",0.0,88,"['edb259c0e0038f38bb200bc20c8cbf7e', 'take', 'look', 'help', 'dev', 'org', 'himl', 'let', 'know', 'see', 'problem', 'compare', 'help', 'dev', 'org', 'weari', 'webnotification', 'publish', 'notification', 'main', 'difference', 'where', 'how', 'notification', 'constructor', 'define', 'person', 'current', 'respect', 'seem', 'provide', 'way', 'handle', 'constructor', 'differently', 'normal', 'method', 'edb259c0e0038f38bb200bc20c8cbf7e', 'so', 'now', 'hack', 'fricking', 'respect', 'more', 'know', 'can', 'imagine', 'first', 'spec', 'use', 'respect', 'need', 'document', 'constructor', 'can', 'fix', 'today', 'maybe']"
23829,23829,"hey can someone tell me why this script works in Firefox but not in IE. <a href=""http://pastebot.nd.edu/698"">http://pastebot.nd.edu/698</a>",0.0,17,"['can', 'tell', 'why', 'script', 'work', 'firebox', 'help', 'pastebot', 'edu', 'help', 'pastebot', 'edu']"
23835,23835,hiya whats ur story ok nope sorry missed that one but i still love u ah u have me caught out i dont really love u just a little horney thats my kinda girl/boy haha i like it ah never mind that if i ever use it in the future i&apos;ll credit it to you,0.0,55,"['hiya', 's', 'story', 'miss', 'one', 'still', 'love', 'catch', 'really', 'love', 'just', 'little', 'honey', 's', 'kinda', 'girl', 'boy', 'like', 'never', 'mind', 'ever', 'use', 'future', 'apos', 'credit']"
23836,23836,"hello I don&apos;t wanna go into that David Copperfield kinda crap... damn :P was hoping you&apos;d get the reference then I&apos;d fall madly in love another time... :&lt; prove it! write me a love poem even a love haiku will do =P what! &lt;/3 love/lust all the same to me which would you rather? because if you want to talk to a girl, I&apos;m your man! shamelessly stolen from some /b/tard :P ok that&apos;s all that matters fair well",0.0,79,"['don', 'want', 'go', 'hope', 'get', 'reference', 'then', 'apos', 'fall', 'madly', 'love', 'time', 'prove', 'write', 'love', 'poem', 'even', 'love', 'haiku', 'will', 'love', 'lust', 'same', 'would', 'rather', 'want', 'talk', 'girl', 'apos', 'man', 'shamelessly', 'steal', 'ok', 'apos', 'matter', 'fair', 'well']"
23837,23837,"anyone using visual studio for html5 stuffs? I am a bit confused I have only done asp.net tutorials but I am interested in doing 2D games with gpu acceleration in html5(canvas) ok whats this about jquery? ahh its $99 b2cd6591be1072d089bbff014c556826 :) well, I am just having trouble getting a good environment to work in i like VS becouse it sets up the web page framework what do you think of aptana? okay i need a boilerplate i guess is what Im saying wow there are lots of them",0.0,88,"['use', 'visual', 'studio', 'bit', 'confused', 'only', 'do', 'net', 'tutorial', 'interested', 'do', 'ad', 'game', 's', 'query', 'just', 'have', 'trouble', 'get', 'good', 'environment', 'work', 'like', 'becouse', 'set', 'web', 'page', 'framework', 'think', 'need', 'boilerplate', 'guess', 'say', 'lot']"
23838,23838,"uses a simple highlighting editor jquery is a utility library that won't really do you much good for game dev. 811780683054020570e65321ea5bd9f5: what you said was &quot;i built a skateboard.  now i want to make a tank.&quot; 811780683054020570e65321ea5bd9f5: take smaller intermediate steps. 811780683054020570e65321ea5bd9f5: you'll get to the other side faster because you spend less time fighting the learning curve. oh ffs. &quot;this tank kit is too expensive&quot; good luck. 0acb83f1a9cfc48f061ff5555e61c6bf: thanks, i actually don't structure how i speak around instructions from strangers 811780683054020570e65321ea5bd9f5: if your first client-side software is an attempt to make a complex game, and you are at the point where you can't even get an enviroment set up, you are aiming too high, and you will fail, regardless of skill.  start /smaller/ .  most backend experience does not transfer to frontend. or not. boilerplate is a sure route to never understanding what you're actually doing",0.0,147,"['use', 'simple', 'highlighting', 'editor', 'query', 'utility', 'library', 'win', 'really', 'much', 'good', 'game', 'say', 'quit', 'build', 'skateboard', 'now', 'want', 'make', 'tank', 'quit', 'take', 'small', 'intermediate', 'step', 'get', 'other', 'side', 'faster', 'spend', 'less', 'time', 'fight', 'learn', 'curve', 'quit', 'tank', 'kit', 'too', 'expensive', 'good', 'luck', '0acb83f1a9cfc48f061ff5555e61c6bf', 'thank', 'actually', 'don', 'structure', 'how', 'speak', 'instruction', 'stranger', 'first', 'client', 'side', 'software', 'attempt', 'make', 'complex', 'game', 'point', 'where', 'can', 'even', 'enviroment', 'set', 'aim', 'too', 'high', 'will', 'fail', 'regardless', 'skill', 'start', 'small', 'most', 'backend', 'experience', 'transfer', 'front', 'boilerplate', 'sure', 'route', 'never', 'understand', 're', 'actually', 'do']"
23840,23840,"811780683054020570e65321ea5bd9f5: probably the answer is &quot;no one is using&quot; 811780683054020570e65321ea5bd9f5: I suggest you start with a some Javascript 2D game library instead of starting from the scratch 811780683054020570e65321ea5bd9f5: jquery is for different purpose than &lt;canvas&gt; 811780683054020570e65321ea5bd9f5: http://impactjs.com/ 811780683054020570e65321ea5bd9f5: there are free ones, but that one is well-documented and suitable for newcomers with known good track record 811780683054020570e65321ea5bd9f5: here is free one http://cocos2d-javascript.org/demos b2cd6591be1072d089bbff014c556826: let's be polite and encouraging :) if someone want to give data for our little innerHTML vs. documentFragment benchmark please go here http://jsperf.com/fragment-vs-appendchild-vs-innerhtml/6 and hit run tests 811780683054020570e65321ea5bd9f5: I use Aptana Studio 3 myself it is the most heavy tool in my armory but I need all that power it is a complex and flexible software, but little bit too complex for novices I'd say 811780683054020570e65321ea5bd9f5: I suggest you'd start with a simple text editor like Sublime bb, see you later -&gt; aha first you need to pick an library you are going to use because you don't want to start from the scratch and the library will usually have a tutorial/boilerplate for you https://gist.github.com/768272 there's a list FYI sneak peak http://miohtama.github.com/Eric-Cartman/",0.0,185,"['probably', 'answer', 'quit', 'one', 'use', 'quit', 'suggest', 'start', 'ad', 'game', 'library', 'instead', 'start', 'scratch', 'query', 'different', 'purpose', 'canva', 'help', 'impact', 'com', 'free', 'one', 'one', 'well', 'document', 'suitable', 'newcomer', 'know', 'good', 'track', 'record', 'here', 'free', 'help', 'let', 'polite', 'encouraging', 'want', 'give', 'datum', 'little', 'innerhtml', 'documentfragment', 'benchmark', 'go', 'here', 'help', 'sperm', 'com', 'fragment', 'appendchild', 'hit', 'run', 'test', 'use', 'most', 'heavy', 'tool', 'armory', 'need', 'power', 'complex', 'flexible', 'software', 'little', 'bit', 'too', 'complex', 'novice', 'say', 'suggest', 'start', 'simple', 'text', 'editor', 'sublime', 'see', 'later', 'aha', 'first', 'need', 'pick', 'library', 'go', 'use', 'want', 'start', 'scratch', 'library', 'will', 'usually', 'tutorial', 'boilerplate', 'hate', 'com', 'there', 'list', 'sneak', 'peak', 'help']"
23846,23846,hey m/f? m age? where you from ??? nice whats your name ? (: Emre (: denmark.. but originally from turkey thanks describe ypurself :),0.0,25,"['age', 'where', 'nice', 's', 'name', 'mere', 'denmark', 'originally', 'thank', 'describe']"
23847,23847,"Hii Sup f you? Ohh. 14 America Yeah What&apos;s yours? ha Where you from That&apos;s sweet! Welcome (: Well, my name is Zoey I am short and blonde and I have blue eyes. you?",0.0,34,"['yours', 'where', 'apos', 'sweet', 'name', 'short', 'blonde', 'blue', 'eye']"
