,Unnamed: 0,text,predator,text_len,preprocessed_bow
39452,39452,"hi. i'm trying to install an instance in VirtualPC7 on a G4 Mac.  yeah, yeah, I know ... i've installed, boot to initlevel 3 OK, YAST update via network --- all OK. but, @ boot to KDE desktop, i'm met with a &quot;failed to load ... libpcidata.so&quot;: <a href=""http://tinyurl.com/hfm5s"">http://tinyurl.com/hfm5s</a> ideas? oops, s/instance/instance of OpenSuse 10.1/",0.0,55,"['try', 'install', 'instance', 'virtualpc7', 'go', 'know', 've', 'instal', 'boot', 'initlevel', 'last', 'update', 'network', 'boot', 'desktop', 'meet', 'quit', 'fail', 'load', 'libpcidata', 'so', 'quit', 'help', 'tinyurl', 'com', 'home', 'help', 'tinyurl', 'com', 'home', 'idea', 'instance', 'instance', 'opensuse']"
39454,39454,"does anyone know if the regualr AGP(4X/8X) will work in a n AGP Pro Slot? <a href=""http://www.newegg.com/Product/Product.asp?Item=N82E16813130493"">http://www.newegg.com/Product/Product.asp?Item=N82E16813130493</a>",0.0,17,"['know', 'regular', 'ago', 'ex', 'will', 'work', 'ago', 'pro', 'slot', 'ref', 'help', 'new', 'com', 'product', 'product', 'item', 'help', 'new', 'com', 'product', 'product', 'item']"
39455,39455,n AGP Pro ?!? wtf is that it is a normal apg port ... just that it seem to run through a pcie bus or something what they wont invent to make you buy new hardware i see make it work with xinerama/twinview then i might consider it less useless :| xinerama is for any card yah,0.0,57,"['ago', 'pro', 'normal', 'ape', 'port', 'just', 'seem', 'run', 'pie', 'bus', 'will', 'invent', 'make', 'buy', 'new', 'hardware', 'see', 'make', 'work', 'twinkie', 'then', 'may', 'consider', 'less', 'useless', 'card', 'yah']"
39459,39459,im installing suse 10.1 from networking... and it asked for ip do i have to put my ip? cool tks,0.0,20,"['instal', 'sure', 'networking', 'ask', 'put', 'ip', 'cool', 'tis']"
39461,39461,hi asl 17 m us will u jack me off 7 in wats ur name im andrew wat r u wearing wat does ur bra look like do u have any pics of it sad u dont have any pics,0.0,40,"['will', 'jack', 'wat', 'name', 'wear', 'bra', 'look', 'pic', 'sad', 'pic']"
39462,39462,hi 17 f usa yup. how bigs your dick honey ohh nice. perfect for me to blow you allie shorts and a bra you? it purple with black lace nope not of my boobs,0.0,34,"['how', 'big', 'honey', 'nice', 'perfect', 'blow', 'allie', 'short', 'bra', 'purple', 'black', 'lace', 'boob']"
39475,39475,"hm, i can't view the webevent on sun.com with firefox it says it requiers windows or macosx with msie or safari :lame: it's there i think i need to configure the replayerplugin somehow",0.0,33,"['can', 'view', 'webevent', 'sun', 'com', 'firebox', 'say', 'require', 'window', 'lame', 'there', 'think', 'need', 'configure', 'replayerplugin', 'somehow']"
39478,39478,"shafty, worked here as well you can proably feed the links into  mplayer and have it work as well tpenta, yes its cool, remember i asked for  crossbow support :-) hi nacho AbeFroman, it can be over ridden in /etc/system currently set rlim_fd_max = 4096 set rlim_fd_cur = 1024 sickness, only new stuff breaks on  flag days, the ghosts of sysadmins past protect the old code ;-p",0.0,67,"['shaft', 'work', 'here', 'as', 'well', 'can', 'probably', 'feed', 'link', 'player', 'work', 'as', 'well', 'spend', 'cool', 'remember', 'ask', 'can', 'over', 'ride', 'system', 'currently', 'set', 'slim', 'set', 'sickness', 'only', 'new', 'stuff', 'break', 'flag', 'day', 'ghost', 'protect', 'old', 'code']"
39480,39480,I can't see the webcast because we're running SunRays on Solaris 9/Gnome. And I can't win a thumper because the contest doesn't include the Netherlands. Double bummer :-( THey've outsourced the whole video streaming thing to some 3rd party apparently. Company called 'feedroom.com',0.0,43,"['can', 'see', 'webcast', 're', 'running', 'sunray', 'gnome', 'can', 'win', 'thumper', 'contest', 'doesn', 'include', 'double', 'bummer', 'outsource', 'whole', 'video', 'stream', 'thing', 'apparently', 'company', 'call', 'bedroom', 'com']"
39482,39482,that's kinda sad you would think sun wouldn't require you to be running a non-solaris os to view its stuff. must have did the &gt;256 fd limit fix get rolled back into solaris 10? how i'm running into it with imapd spawning out of inetd awesome thanks,0.0,47,"['kinda', 'sad', 'would', 'think', 'require', 'run', 'non', 'solaris', 'view', 'stuff', 'must', 'limit', 'fix', 'roll', 'back', 'how', 'run', 'mad', 'spawning', 'ineed', 'awesome', 'thank']"
39483,39483,"morning people love is the lack of ability to see the other person's flaws ;) same here well, no, mine is a bit smarter and clasifies food.. though once she ate my brother's teethbrush ohh, i thought you wanted crayola to have an excuse to leave early :) Error_404: hehe",0.0,50,"['morning', 'people', 'love', 'lack', 'ability', 'see', 'other', 'person', 'flaw', 'same', 'here', 'mine', 'bit', 'smart', 'classify', 'food', 'though', 'eat', 'brother', 'toothbrush', 'think', 'want', 'excuse', 'leave', 'early', 'error', 'hehe']"
39484,39484,"hi eboutilier heh I've been able to rebuild the /usr part and to make some more modifications anyway, I'll look forward to the next version if it will be possible to go fully 64bit eheh, yeah he was nice I didn't think that he would reply so promptly :) yeah eheheh yeah a little more &quot;environment&quot; is needed, well, like to being able to update the skeleton/packages when a new build comes out, and then rebuild the iso, in a seamless way... but I've seen that's not too difficul since I already tried with b46 and it worked out of the box, even if the scripts were for b44 I have a little fear over b47 because of the flag days I've read about... I don't know if it's like in obsd that all the binaries stop working and so on...",0.0,141,"['eboutilier', 've', 'able', 'rebuild', 'usr', 'part', 'make', 'more', 'modification', 'anyway', 'look', 'forward', 'next', 'version', 'will', 'possible', 'go', 'fully', 'bit', 'nice', 'didn', 'think', 'would', 'reply', 'so', 'promptly', 'little', 'more', 'quit', 'environment', 'quit', 'need', 'well', 'able', 'update', 'skeleton', 'package', 'when', 'new', 'build', 'come', 'then', 'rebuild', 'iso', 'seamless', 'way', 've', 'see', 'too', 'difficult', 'already', 'try', 'work', 'box', 'even', 'script', 'be', 'little', 'fear', 'flag', 'day', 've', 'read', 'don', 'know', 'like', 'binary', 'stop', 'work', 'so', 'on']"
39485,39485,"hi sickness, how's the live media project going? I saw your e-mails w/ Moinak on the list. Cool. Yeah, and now they're looking at a live CD for testing HW compatibility (HCTS) Which is a perfect use for live media and yours  too :) The possibilities are endless -- as they've already discovered in the Linux arena I think flag days  only affect you if you're BFU'ing. Binaries should not stop working, that's for sure. hi steve early riser, eh? Eek, and I thought I had it bad getting the kids off to school ~7am stevel: Your shoes really take a beating! :) Our dog pees/poops in the right places, but we can't seem to keep her from stealing/eating anything that seems like food off the coffee table. Including chapstick and gum Amazing it all just goe through her. Ate a whole box of crayons a few year ago! We had a laugh when she shit in technicolor MMmm! I could go for a few of those right now. Start the weekend early :-) liquor filled chocolates that is, not crayola poop :) :) elektronkind: I use them and have been pretty happy. They're kinda pricey though. That sucks FIOS? Geez, that is tempting. But no shell access, right? That's what keeps me with speakeasy stevel: thanks for the link Well, I have speakeasy VOIP too, one-stop-shopping, etc. But I'd sure love  to have 15mb for $45 bucks. I'll have to check if my contract obligation is up with speakeasy. Sounds like it's time to do some price-shopping again.",0.0,259,"['sickness', 'how', 'live', 'media', 'project', 'go', 'see', 'e', 'mail', 'monk', 'list', 'cool', 'now', 're', 'look', 'live', 'ad', 'testing', 'compatibility', 'hit', 'perfect', 'use', 'live', 'medium', 'too', 'possibility', 'endless', 've', 'already', 'discover', 'linux', 'arena', 'think', 'flag', 'day', 'only', 'affect', 're', 'binary', 'should', 'stop', 'work', 'sure', 'early', 'riser', 'think', 'bad', 'get', 'kid', 'school', 'steel', 'shoe', 'really', 'take', 'beating', 'dog', 'pee', 'poop', 'right', 'place', 'can', 'seem', 'keep', 'steal', 'eat', 'seem', 'food', 'coffee', 'table', 'include', 'chapstick', 'gum', 'amazing', 'just', 'goe', 'eat', 'whole', 'box', 'crayon', 'few', 'year', 'ago', 'laugh', 'when', 'shit', 'could', 'go', 'few', 'right', 'now', 'start', 'weekend', 'early', 'liquor', 'fill', 'chocolate', 'use', 'pretty', 'happy', 're', 'kinda', 'pricey', 'suck', 'fit', 'geez', 'tempting', 'shell', 'access', 'right', 'keep', 'speakeasy', 'steel', 'thank', 'link', 'speakeasy', 'void', 'too', 'stop', 'shop', 'etc', 'sure', 'love', 'bomb', 'buck', 'check', 'contract', 'obligation', 'up', 'speakeasy', 'sound', 'time', 'price', 'shopping', 'again']"
39486,39486,"morning eric i usually get into work around this time usually one of the first people in MPK17 :-P my fiancee has to be at work by 5:30, so i tend to wake up with her jteo: that and beating traffic coming down 880 love is managing not to strangle your dog after he's taken a crap in your favourite shoes i mean seriously. you have to aim to get your poop in a shoe fortunately they're very washable :) our dog ate a whole costco pack of liquor filled chocolates rofl :-D fiber optic eboutilier: <a href=""http://www.bricklin.com/fiosinstall.htm"">http://www.bricklin.com/fiosinstall.htm</a> eboutilier: get shell access somewhere else :) eboutilier: rootshell.be",0.0,107,"['usually', 'get', 'work', 'time', 'usually', 'first', 'people', 'fiancee', 'work', 'so', 'tend', 'wake', 'teo', 'beat', 'traffic', 'come', 'down', 'love', 'manage', 'strangle', 'dog', 'take', 'crap', 'favourite', 'shoe', 'mean', 'seriously', 'aim', 'poop', 'shoe', 'fortunately', 're', 'very', 'washable', 'dog', 'eat', 'whole', 'costco', 'pack', 'liquor', 'fill', 'chocolate', 'roll', 'fiber', 'optic', 'eboutilier', 'ref', 'help', 'trickle', 'com', 'fiosinstall', 'help', 'trickle', 'com', 'eboutili', 'get', 'shell', 'access', 'somewhere', 'else', 'eboutili', 'softshell']"
39489,39489,"speakeasy.net can bite me this dsl line of mine can never stay up on a rainy day, no matter how many techs get dispatched eboutilier: so have I... over 3 places I've lived in over 6 years, I've been their customer, but for the past 6 months at where I live now, my dsl line has been bouncing whenever it rains, and they can't seem to fix it. I even dropped my speed down from 6/768 to 3/384, but got no extra stability from it. new modem, the whole nine yards. yeah... it's making me think of taking verizon up on their FIOS offer. eboutilier: fiber to the house. 15mb down, 5mb up. ~$45 a month. eboutilier: of course... but I have my own server colocated elsewhere :) eboutilier: I imagine you could perhaps by shell service from speakeasy s/by/buy right now my dsl line has manged to stick up a connection, but not at full speed. b47 iso is dl'ing at 100Kb/s :/ this is not supposed to be teh intarnuts of 2006!",0.0,174,"['speakeasy', 'can', 'bite', 'line', 'mine', 'can', 'never', 'stay', 'rainy', 'day', 'no', 'matter', 'how', 'many', 'tech', 'get', 'dispatch', 'eboutilier', 'so', 'place', 've', 'live', 'year', 've', 'been', 'customer', 'past', 'month', 'where', 'live', 'now', 'del', 'line', 'bounce', 'whenever', 'rain', 'can', 'seem', 'fix', 'even', 'drop', 'speed', 'get', 'extra', 'stability', 'new', 'modem', 'whole', 'yard', 'make', 'think', 'take', 'verizon', 'fit', 'offer', 'eboutili', 'fiber', 'house', 'bomb', 'amb', 'up', 'month', 'eboutilier', 'course', 'own', 'server', 'locate', 'elsewhere', 'eboutilier', 'imagine', 'could', 'perhaps', 'service', 'buy', 'right', 'now', 'del', 'line', 'manage', 'stick', 'connection', 'full', 'speed', 'iso', 'ing', 'suppose', 'intercut']"
39491,39491,is there a list of sata kit that works ok with opensolaris/sxcr anywhere? the hcl is pretty much empty...,0.0,19,"['list', 'sat', 'kit', 'work', 'ok', 'anywhere', 'hel', 'pretty', 'much', 'empty']"
39505,39505,"Hello. What is a good, online proxy service that I can use to check my email securely? A free one? Yes, scratchme I am in a puplic place (airport)) and don't want people grabbing my mail with WireShark or Ethereal",0.0,40,"['good', 'online', 'proxy', 'service', 'can', 'use', 'check', 'email', 'securely', 'free', 'one', 'scratch', 'public', 'place', 'airport', 'want', 'people', 'grab', 'mail', 'wireshark', 'ethereal']"
39506,39506,"haha ok frb im downloading it now though, thanks at 2% right now nope scratchme maybe you should learn before spelling Treval in reply to your ssl scratchme",0.0,28,"['download', 'now', 'thank', 'right', 'now', 'scratch', 'maybe', 'should', 'learn', 'spell', 'real', 'reply', 'scratch']"
39507,39507,"lkj2: tor.eff.org lkj2, um, then a proxy won't help you need encryption proxies are good if you want to hide your identity, if you want to secure your data, you need encryption, like say... pgp tor.eff.org is a proxy if you care (it's encrypted) god, I hope I backuped all my data before formating... would suck to have duplicates I dislike flash personally especially because it doesn't work on linux Treval, err... he, her mom was a whore? is she hot then? Cymage, I find a ton that use the non-H.263 codec frb-work, yes it is their fault, they decided to use a non-free and non-open format gah, I hate Ubuntu, a new install needs 186+ updates!? frb-work, or... they might have used MPEG-4 or Theora, which are infinitely better 6.06.0 meh mm, 147 remain damn this dialup mm, I don't because I have VLC yep... 180MB left it doesn't matter though, as long as I can update faster than new versions are released",0.0,164,"['then', 'proxy', 'win', 'help', 'need', 'encryption', 'proxy', 'good', 'want', 'hide', 'identity', 'want', 'secure', 'datum', 'need', 'encryption', 'say', 'pop', 'tor', 'eff', 'org', 'proxy', 'care', 'encrypt', 'hope', 'backup', 'datum', 'format', 'would', 'suck', 'duplicate', 'dislike', 'flash', 'personally', 'especially', 'doesn', 'work', 'real', 'err', 'mom', 'whore', 'hot', 'then', 'damage', 'find', 'ton', 'use', 'work', 'fault', 'decide', 'use', 'non', 'free', 'non', 'open', 'format', 'gah', 'hate', 'bunt', 'new', 'install', 'need', 'update', 'work', 'may', 'use', 'mpeg', 'theory', 'infinitely', 'well', 'meh', 'remain', 'damn', 'dial', 'don', 'mb', 'leave', 'matter', 'though', 'as', 'long', 'can', 'update', 'faster', 'new', 'version', 'release']"
39508,39508,"lkj2, do you mean at an insecure terminal? Couldn't your keystrokes be monitored regardless? Oh. Just the connection. Yeah, then a proxy service is in order. Well, one that does SSL for all traffic. Anonymizer will do that, but I don't think for free. SSL traffic isn't cheap in CPU resources. Arrick, nope?",0.0,53,"['mean', 'insecure', 'terminal', 'couldn', 'keystroke', 'monitor', 'regardless', 'just', 'connection', 'then', 'proxy', 'service', 'order', 'one', 'traffic', 'anonymizer', 'will', 'don', 'think', 'free', 'traffic', 'cheap', 'resource']"
39509,39509,"Can I get banned please? I'd love that. It makes me come. Wtf did I spell wrong? Did you know my dad told me about a second sister I have, he had her from a whore while he was married to my mom. Isn't that wonderful? :) Cpudan80 perhaps there is some option in the registry that loads a particular path when loading cmd. For example, I always start at \ = root. I don't remember exactly but if you give me a few minutes I can look for it. Cpudan80: HKEY_LOCAL_MACHINE\Software\Microsoft\Command Processor Yw. Then yes it must be in those local machine keys. Cpudan80, it connects you to someone's desktop. So yeah you can get to the registry. Well then as I said, look into the local machine keys I just showed. Perhaps remote is current_user",0.0,137,"['can', 'ban', 'love', 'make', 'come', 'spell', 'wrong', 'know', 'dad', 'tell', 'second', 'sister', 'whore', 'married', 'mom', 'wonderful', 'cpudan80', 'perhaps', 'option', 'registry', 'load', 'particular', 'path', 'when', 'load', 'cod', 'example', 'always', 'start', 'root', 'don', 'remember', 'exactly', 'give', 'few', 'minute', 'can', 'look', 'cpudan80', 'key', 'local', 'machine', 'software', 'then', 'must', 'local', 'machine', 'key', 'cpudan80', 'connect', 'desktop', 'so', 'can', 'registry', 'well', 'then', 'say', 'look', 'local', 'machine', 'key', 'just', 'show', 'perhaps', 'remote', 'current', 'user']"
39510,39510,"Cymage, I prefer urban ninjas you dislike bad usage of flash I mean, if you hate flash, you need to hate javascript too since it's quite easy to write js that only works on IE that's not flash's fault the On2 codec isn't any better than 263 anyway at least not in my experience I'm not having this argument if they didn't use flash, they would have used WMV or Real which are even worse when using flash, the producer must be aware of his/her audience, and only use features that they have anon32, no one would use theora and mpeg4 is no better for support everyone on windows has flash, they all have windows media player when you require users to get a new plugin, especially a &quot;Codec&quot; they get pissed and run away I don't even download codecs anymore because of V-Codec anon32, have you ever realized you are a minority in the computing world?",0.0,157,"['damage', 'prefer', 'urban', 'ninja', 'dislike', 'bad', 'usage', 'flash', 'mean', 'hate', 'flash', 'need', 'hate', 'too', 'quite', 'easy', 'write', 'only', 'work', 'flash', 'fault', 'any', 'better', 'anyway', 'least', 'experience', 'have', 'argument', 'didn', 'use', 'flash', 'would', 'use', 'real', 'even', 'bad', 'when', 'use', 'flash', 'producer', 'must', 'aware', 'audience', 'only', 'use', 'feature', 'would', 'use', 'theory', 'mpeg', 'no', 'well', 'support', 'window', 'flash', 'window', 'medium', 'player', 'when', 'require', 'user', 'new', 'pugin', 'especially', 'quit', 'quit', 'get', 'piss', 'run', 'away', 'don', 'even', 'download', 'code', 'anymore', 'ever', 'realize', 'minority', 'computing', 'world']"
39511,39511,"son just showed me. first few videos are where people threw a kick and broke their leg anon32, i can see them in my fedora box oh, here we go again anon32, what version of ubuntu? 6.06 or 6.06.1? anon32, theres why the updates u on dial, u gonna be there a while think update from 6.06 is around 200 meg lol",0.0,62,"['son', 'just', 'show', 'first', 'few', 'video', 'where', 'people', 'throw', 'kick', 'break', 'leg', 'can', 'see', 'here', 'go', 'again', 'anon', 'version', 'anon', 's', 'why', 'update', 'dial', 'go', 'there', 'while', 'think', 'update', 'around', 'meg', 'laugh', 'loud']"
39512,39512,Hello everyone got a weird problem Every time I load command prompt - a game starts up Specifically - the Sim 2 Night Life Treval: Can I look at that somewhere? like what key HKEY\LOCAL_USER\...? Treval: Ok Treval: Thanks Treval: This only happens when you do it from the local machine IE. I am logged in remotely (VNC) - and I don't have the problem same user Treval: But I am on a VNC connection.... Its a screen emulator? Treval: No - what I am saying is If I am VNCd into the box - I can load CMD no problem However The local user can load it - and the damn sims game starts and there was nothin in the command processor thing,0.0,124,"['get', 'weird', 'problem', 'time', 'load', 'command', 'prompt', 'game', 'start', 'specifically', 'night', 'life', 'real', 'can', 'look', 'somewhere', 'key', 'key', 'local', 'user', 'real', 'ok', 'real', 'thank', 'real', 'only', 'happen', 'when', 'local', 'machine', 'ie', 'log', 'remotely', 'don', 'problem', 'same', 'user', 'real', 'connection', 'screen', 'emulator', 'real', 'say', 'box', 'can', 'load', 'cod', 'problem', 'however', 'local', 'user', 'can', 'load', 'sim', 'game', 'start', 'nothing', 'command', 'processor', 'thing']"
39517,39517,"wonders how reputation works on stackoverflow seems to be stuck on 41, just 1 point below a great number :)",0.0,20,"['wonder', 'how', 'reputation', 'work', 'stackoverflow', 'seem', 'stick', 'just', 'point', 'great', 'number']"
39519,39519,"buddy the elf, whats your favorite color? :D k how old are you male? do you have abbs? are they nicee? :) yumm, that didnt count btw. are you a perv? dont lie haha figures. virgin? how tall are you? damnnn. do you like lil wayne? nicee favorite sport? mmm. big dick? interestingg smoke weed? sweeet haha im done your turn 16 femalee B. sorry haha no, but i only did it twice so i dont have a preference haha 5&apos;2 haha i dontt do it idk haha i think its weird. when someone else can just do it for you. and sex feels better if you dont. its not as weird for guys though noo sir. volleyball. and yesss definetly what is? mhmm alrightt byeee",0.0,126,"['s', 'favorite', 'color', 'how', 'old', 'male', 'ab', 'nice', 'yummy', 'count', 'bow', 'perv', 'lie', 'haha', 'figure', 'virgin', 'how', 'tall', 'damn', 'sport', 'mom', 'big', 'interesting', 'smoke', 'sweet', 'do', 'turn', 'female', 'only', 'twice', 'so', 'preference', 'haha', 'apo', 'dontt', 'ink', 'think', 'weird', 'when', 'else', 'can', 'just', 'sex', 'feel', 'well', 'as', 'weird', 'guy', 'definetly', 'uhmm', 'alright']"
39520,39520,"Want to play a game? Ask me 10 questions and I&apos;ll answer them truthfully! Blue 18 correct i do, yes very much so :) of course. negative i am 6&apos;4&quot; playin with fire is the only song ill listen to football.  played 4 years in HS 9&quot; haha ive got a 420 tattoo so yes age? sex? off to a good start cup size? sorry for what? i dont mind a b cup ;) umm.. 2 part question counts as one virgin? if not, favorite position fair enough height? good i like small girls.  easier to pick up thoughts on masturbation? why not? ever try anal? play any sports? got an ass? haha ah thats too bad fuck yeah.  those volleyball shorts are sexy not having tried anal. haha.   i know a couple girls who love it got facebook? add me, <email/> we&apos;ll talk later aight cuz i gotta bounce. haha byee",0.0,152,"['want', 'play', 'game', 'ask', 'question', 'apos', 'answer', 'truthfully', 'blue', 'correct', 'very', 'much', 'so', 'course', 'negative', 'apo', 'quit', 'playin', 'fire', 'only', 'song', 'ill', 'listen', 'football', 'play', 'year', 'quit', 'have', 'get', 'tattoo', 'so', 'age', 'sex', 'off', 'good', 'cup', 'size', 'sorry', 'mind', 'cup', 'part', 'question', 'count', 'virgin', 'favorite', 'position', 'fair', 'enough', 'height', 'good', 'like', 'small', 'girl', 'easy', 'pick', 'thought', 'masturbation', 'why', 'ever', 'try', 'anal', 'play', 'sport', 'get', 'ass', 's', 'too', 'bad', 'fuck', 'volleyball', 'short', 'sexy', 'have', 'try', 'anal', 'know', 'couple', 'girl', 'love', 'get', 'add', 'email', 'apos', 'talk', 'later', 'aight', 'get', 'bounce']"
39531,39531,"I added the !doctype html (html 5 doctype) to my website, and it made a little white space at the bottom of the page, any ideas why? http://www.modernwebpro.com/dan/about/index.html 0fe8692be7a494c6561f745b9f3b0d17 so there is no way to fix it? well I understand on how to set it as a css background but in this case I have the bg image is being resized by a js script based upon the browser's width and height so I need it in the markup like this if I use the xhmlt doctype it's just fine it's just the html5 doctype that throws it off if you check the 'homgepage' you can see it I guess you can see it on ie only not ff or chrome :| i'm trying to be cross browser scripting fml well i'm very new to this whole web stuff, could you help explain it in better terms, as like how I can fix it? you say I need to make it block not inline? display: block? wow it looks like that did the trick lol 0fe8692be7a494c6561f745b9f3b0d17 I never test ie well if I do it's last c2eb257d1afa6da62c7dd11790e063f3 i'm just learning :p f -inline and 0fe8692be7a494c6561f745b9f3b0d17 I didn't update the website just local testing now it's updated ;p and yeah it looks great now thanks c2eb257d1afa6da62c7dd11790e063f3 what does the HTML5 Conformance Checker. warning mean? that is done with html5? can anyone tell me what the HTML5 Conformance checker does? or means? or why it's a warning?",0.0,245,"['add', 'doctore', 'doctore', 'website', 'make', 'little', 'white', 'space', 'bottom', 'page', 'idea', 'why', 'help', 'index', 'so', 'way', 'fix', 'understand', 'how', 'set', 'ass', 'background', 'case', 'be', 'image', 'resize', 'script', 'base', 'browser', 'width', 'height', 'so', 'need', 'markup', 'use', 'shalt', 'doctore', 'just', 'fine', 'just', 'doctore', 'throw', 'check', 'homepage', 'can', 'see', 'guess', 'can', 'see', 'only', 'chrome', 'try', 'cross', 'browser', 'script', 'very', 'new', 'whole', 'web', 'stuff', 'could', 'help', 'explain', 'well', 'term', 'how', 'can', 'fix', 'say', 'need', 'make', 'block', 'inline', 'display', 'block', 'look', 'trick', 'laugh', 'never', 'test', 'ie', 'well', 'last', 'just', 'learn', 'inline', 'didn', 'update', 'website', 'just', 'local', 'testing', 'now', 'update', 'look', 'great', 'now', 'thank', 'conformable', 'checker', 'warning', 'mean', 'do', 'can', 'tell', 'mean', 'why', 'i', 'warning']"
