,Unnamed: 0,text,predator,text_len,preprocessed_bow
68285,68285,Hi where are you from? CHINA f 17 1992.10.18 My first year at university My first year at university ok ok OK OK NO I have no BF,0.0,28,"['first', 'year', 'university', 'first', 'year', 'university', 'ok']"
68290,68290,"this is a copy and paste - if you want to talk to specifically girls or guys, go to zuchat.com bye now :)",0.0,23,"['copy', 'paste', 'want', 'talk', 'specifically', 'girl', 'guy', 'go', 'chat', 'com', 'now']"
68291,68291,-got the qt 4.1.3 snapshot -it's in the uic3 directory -so far so good -;D -bbiab dudes,0.0,17,"['get', 'snapshot', 'nice', 'directory', 'so', 'far', 'so', 'good', 'brian', 'dude']"
68292,68292,"+I don't remember how to solve the &quot;multiple types in a declaration&quot; problem, when promoting a widget to custom in designer. I had it once, but forgot what I done +ok I got it, I forgot a semicolon after class declaration /o\ +I have a strange problem, when I promote a widget in designer, it makes it disappear, in preview and even after compilation... Does anyone sees why ?",0.0,69,"['don', 'remember', 'solve', 'quit', 'multiple', 'type', 'declaration', 'quit', 'problem', 'promote', 'widget', 'custom', 'designer', 'once', 'forget', 'do', 'get', 'forget', 'semicolon', 'class', 'declaration', 'strange', 'problem', 'promote', 'widget', 'designer', 'make', 'disappear', 'preview', 'even', 'compilation', 'see']"
68297,68297,hey 15 f becky hbu? kool from? canada yeah i guess lol :P just bored you?,0.0,16,"['becky', 'guess', 'laugh', 'just', 'bore']"
68298,68298,"hi 1 9m cool =) name im tugay turkey u nice sweet, What are you doing here =)",0.0,18,"['cool', 'name', 'tuway', 'nice', 'sweet', 'do', 'here']"
68301,68301,"1f8387eb43f131d7c309a90a4e36b5cb: I updated http://dev.w3.org/csswg/css3-values/#value-stages 1f8387eb43f131d7c309a90a4e36b5cb: (Mainly just syncing against 2.1 and fixing formatting issues.) Nope I think that's all the sections, though 1f8387eb43f131d7c309a90a4e36b5cb: yeah 1f8387eb43f131d7c309a90a4e36b5cb: So I'm thinking we should publish and then start to process issues. already did",0.0,39,"['update', 'help', 'dev', 'case', 'value', 'value', 'stage', '1f8387eb43f131d7c309a90a4e36b5cb', 'mainly', 'just', 'sync', 'fix', 'format', 'issue', 'nope', 'think', 'section', '1f8387eb43f131d7c309a90a4e36b5cb', '1f8387eb43f131d7c309a90a4e36b5cb', 'so', 'think', 'publish', 'then', 'start', 'process', 'issue', 'already']"
68302,68302,"3f21e54c5c5ffd50fe3680acc025bb1d: Okay, looks fine.  Are you looking for specific feedback? 3f21e54c5c5ffd50fe3680acc025bb1d: Ah, so at this point everything's received at least a token treatment? 3f21e54c5c5ffd50fe3680acc025bb1d: What's this email about nimbu's writeup in response to? She sent it to you too, nimbu. Yeah, definitely. Put it on the docket for tomorrow?",0.0,49,"['3f21e54c5c5ffd50fe3680acc025bb1d', 'okay', 'look', 'fine', 'look', 'specific', 'feedback', '3f21e54c5c5ffd50fe3680acc025bb1d', 'so', 'point', 'receive', 'least', 'token', 'treatment', '3f21e54c5c5ffd50fe3680acc025bb1d', 'email', 'write', 'response', 'send', 'too', 'nimbus', 'definitely', 'put', 'docket', 'tomorrow']"
68303,68303,1f8387eb43f131d7c309a90a4e36b5cb: wat o yeah 1f8387eb43f131d7c309a90a4e36b5cb: i had cced you here 1f8387eb43f131d7c309a90a4e36b5cb: http://oksoclap.com/f6Htohonjr 3f21e54c5c5ffd50fe3680acc025bb1d fixed stuff for me ^_^ so ur fixes would be welcome too,0.0,25,"['wat', 'ice', 'here', '1f8387eb43f131d7c309a90a4e36b5cb', 'help', 'fix', 'stuff', 'so', 'fix', 'welcome', 'too']"
68308,68308,"hello asl get outta here kid huh? i&apos;m your mom so you should know not to you bitch indeed. i&apos;d love to you&apos;re never gonna get a fuck what the hell is sike. are you 5 or what? maaaaayn those kids today hahaha, good guess. but not true you could start do it yourself, kid you&apos;re a dumbass, yes i knew that ^^ If you&apos;re smarter than my mom, you wouldn&apos;t type like that, and have that low self-esteem.",0.0,79,"['age', 'get', 'outta', 'here', 'kid', 'apos', 'mom', 'know', 'bitch', 'indeed', 'apos', 'love', 'apos', 'never', 'go', 'get', 'fuck', 'hell', 'maaaaayn', 'kid', 'today', 'good', 'guess', 'true', 'start', 'kid', 'apos', 'dumbass', 'know', 'apos', 'smart', 'mom', 'type', 'low', 'self', 'esteem']"
68309,68309,"heeey 14;f;usa, siike how old are you? heeey mommy, wanna make me foood? my guess is your from 15-19. go fuck yourself siiike your 16 &amp; a girl! shut the fuck up hey guess what! naaaah bitchh, im smarter than your mom otherwise she wouldnt be on her knees right now ya little prick trust me, theres no low self esteem here",0.0,62,"['usa', 'old', 'heee', 'want', 'make', 'food', 'guess', 'go', 'fuck', 'strike', 'amp', 'girl', 'shut', 'fuck', 'guess', 'bitch', 'smart', 'mom', 'otherwise', 'knee', 'right', 'now', 'little', 'prick', 'trust', 's', 'low', 'self', 'esteem', 'here']"
68310,68310,bugmail: &quot;[Bug 11828] Drop hgroup completely until more research has been conducted&quot; (6 messages in thread) &lt;http://lists.w3.org/Archives/Public/public-html-bugzilla/2011May/0089.html&gt;,0.0,17,"['quit', 'bug', 'drop', 'group', 'completely', 'more', 'research', 'conduct', 'quit', 'message', 'thread', 'help', 'list', 'org', 'archive', 'public', 'public', 'bugzilla', 'himl']"
68311,68311,is there anyway to boot a 7500 via tftp from the bootloader? jroysdon: this thing has no flash heh it only has bootflash which is apparently 16mb so it has a 4mb bootloader on it now gonna put an 8mb ios on it then boot the real ios via tftp,0.0,50,"['anyway', 'boot', 'tatp', 'bootloader', 'royston', 'thing', 'flash', 'heh', 'only', 'bootflash', 'apparently', 'bomb', 'amb', 'bootloader', 'now', 'go', 'put', 'amb', 'io', 'then', 'boot', 'real', 'io', 'tatp']"
68312,68312,"ya can always try... have boot system tftp://1.1.1.1/file and then on the next line boot system flash:filename (it'll try the tftp first, then the flash)",0.0,25,"['always', 'try', 'boot', 'system', 'tatp', 'file', 'then', 'next', 'line', 'boot', 'system', 'flash', 'filename', 'try', 'tatp', 'first', 'then', 'flash']"
68313,68313,"sup? none of your business :P google says pitt to wichita is 4 hrs i did it in 2.5 Then again, I went pitt to KC in under 2 hrs 100 in a 70 zone... sounds right to me.",0.0,39,"['sup', 'none', 'business', 'say', 'pitt', 'then', 'again', 'go', 'pitt', 'zone', 'sound', 'right']"
68317,68317,hey 16 f us u? o were? maybe wow well a little soooo maybe mmmm i wanna suck it,0.0,19,"['u', 'maybe', 'little', 'soooo', 'maybe', 'ummm', 'want', 'suck']"
68318,68318,Hey asl 15 m usa Horny? Tn Yea baby my cock is so hard Yessss My cock Your pussy Is your pussy wet ? Mmmm I wana lick it up Mmm baby yesss harder,0.0,34,"['age', 'horny', 'yea', 'baby', 'cock', 'so', 'hard', 'yesss', 'cock', 'pussy', 'pussy', 'wet', 'ummm', 'wana', 'lick', 'mom', 'baby', 'yesss', 'hard']"
68323,68323,hey i took a shower just seeing if you had left yet oh lol i didnt know how long it would take how long will it take? you take and take and go to ya go to and its on theres ya take  tho cause i live here lol plus my mom works in ya lol do you? me too how long will it take you to get here? ok just wondering :) i feel like im all excited and all scared at the same time lol not really lol you there? :) ya watching tv he died im ok with it sorta now i get sad sometimes ya but not like i did at first ya so am i :( :) i dont either if my mom found out lol im sure i would hear about it alot i dunno im not gonna tell her lol ya do you wanna? k lol no by the parking lot my friend sammi girl shes got my goat back in nv minni :) nothing just finding out about minni oops minni ate one of her shirts :( you still here? oh are you still coming? ok :) ya it only takes me like 5 minutes to get there tho,0.0,207,"['take', 'shower', 'just', 'see', 'leave', 'yet', 'laugh', 'know', 'long', 'take', 'long', 'take', 'take', 'take', 'go', 'go', 's', 'take', 'live', 'here', 'laugh', 'mom', 'work', 'laugh', 'too', 'long', 'take', 'get', 'here', 'just', 'wonder', 'feel', 'all', 'excited', 'scared', 'same', 'time', 'laugh', 'loud', 'really', 'laugh', 'loud', 'there', 'watch', 'die', 'ok', 'sorta', 'now', 'get', 'sad', 'sometimes', 'first', 'so', 'mom', 'find', 'laugh', 'sure', 'hear', 'alot', 'dunno', 'go', 'tell', 'laugh', 'wanna', 'laugh', 'parking', 'lot', 'friend', 'sammi', 'girl', 's', 'get', 'goat', 'back', 'mini', 'just', 'find', 'mini', 'oop', 'mini', 'eat', 'shirt', 'still', 'here', 'still', 'come', 'ok', 'only', 'take', 'minute', 'get', 'there', 'tho']"
68331,68331,bugmail: &quot;[Bug 11203] Canvas security model does not allow for same-origin relaxation&quot; (5 messages in thread) &lt;http://lists.w3.org/Archives/Public/public-html-bugzilla/2010Nov/0069.html&gt;,0.0,17,"['quit', 'bug', 'canvas', 'security', 'model', 'allow', 'same', 'origin', 'relaxation', 'quit', 'message', 'thread', 'help', 'list', 'org', 'archive', 'public', 'public', 'himl']"
68334,68334,"1f8387eb43f131d7c309a90a4e36b5cb: If you weren't going to Japan on Google's dollar it might be worth your while to know that you can (or could 6 years ago) get some kind of foreigners-only tourist train ticket that makes travelling about more affordable, at least if you travel a lot http://www.japanrailpass.net/ Seems to be not valid on at least some Shinkansen I am a bit hazy on what we did because we went with a japanese friend so mostly we just followed her instructions No, I doubt it in that case. We travelled quite a bit more than that (although we did do that as part of the trip) wonders if anyone noticed the irony of using relatively-cpu-intensive video on a page about saving energy",0.0,122,"['1f8387eb43f131d7c309a90a4e36b5cb', 'weren', 'go', 'dollar', 'worth', 'while', 'know', 'year', 'ago', 'get', 'kind', 'foreigner', 'only', 'tourist', 'train', 'ticket', 'make', 'travel', 'more', 'affordable', 'least', 'travel', 'lot', 'help', 'seem', 'valid', 'least', 'shinkansen', 'bit', 'hazy', 'go', 'japanese', 'friend', 'so', 'mostly', 'just', 'follow', 'instruction', 'doubt', 'case', 'travel', 'bit', 'more', 'part', 'trip', 'wonder', 'notice', 'irony', 'use', 'relatively', 'cpu', 'intensive', 'video', 'page', 'save', 'energy']"
68335,68335,"Interesting. My wife and friend are coming with me and not being paid for by Google, so it might still be good to look into. Seems like it wouldn't actually save me anything if we're just doing a single roundtrip between tokyo and kyoto. Yeah, seems like a great deal if you'll be taking the train a few times.",0.0,59,"['interesting', 'wife', 'friend', 'come', 'pay', 'still', 'good', 'look', 'seem', 'wouldn', 'actually', 'save', 're', 'just', 'do', 'single', 'roundtrip', 'seem', 'great', 'deal', 'be', 'take', 'train', 'few', 'time']"
68341,68341,"hello, quick question, just looking at postmessage, is it just for iframes, or does it also work on popup windows?",0.0,20,"['quick', 'question', 'just', 'look', 'postmessage', 'just', 'frame', 'also', 'work', 'popup', 'window']"
68342,68342,paul_irish knock knock my geolocation script now ... uses navigator.geolocation http://code.google.com/p/better-geolocation-api/ http://www.manuel-bieh.de/publikationen/scripts/geolocation/demo.html maybe you may want to add it to the polyfills collection now ;),0.0,25,"['knock', 'geolocation', 'script', 'now', 'use', 'navigator', 'geolocation', 'help', 'com', 'well', 'geolocation', 'api', 'help', 'geolocation', 'demo', 'himl', 'maybe', 'want', 'add', 'polyfill', 'collection', 'now']"
68343,68343,male here from and age??? m 18 ny n u?? ??? so dear wht r u doing now??? ne bf?? ok...can i be ur freind??? ?? yup whts ur name??? ??? jhon jhon u i m dying here to see u,0.0,41,"['male', 'here', 'age', 'u', 'so', 'dear', 'do', 'now', 'freind', 's', 'name', 'die', 'here', 'see']"
68344,68344,female asl? i asked first f 17 london what?? chatting to you and noo i&apos;m single yes if you like ;) are you single? cool georgie whats yours? name? john or jhon? i like your name aww you sound lovely what are you doing at the moment,0.0,47,"['female', 'asl', 'ask', 'first', 'chat', 'noo', 'apos', 'single', 'like', 'single', 'cool', 'georgie', 's', 'name', 'like', 'name', 'aww', 'sound', 'lovely', 'do', 'moment']"
68351,68351,hi whats up that sux when are u comin here? k all good really i just wish I could see u i hope shit gtg grandma wants to go to the store,0.0,32,"['s', 'sux', 'comin', 'here', 'good', 'really', 'just', 'wish', 'see', 'hope', 'shit', 'gig', 'grandma', 'want', 'go', 'store']"
68359,68359,Don&apos;t you laugh at me sir I heard you snickering back there before you came in the room just because you are taller than I am well there are such things as stairs you know then you have very tall shoes not particularily are you a lawyer for the united nations? I hate giraffes they are terrifying they are demon animals with their horns and devil purple tongues,0.0,68,"['laugh', 'hear', 'snicker', 'back', 'there', 'come', 'room', 'just', 'tall', 'well', 'such', 'thing', 'stair', 'know', 'then', 'very', 'tall', 'shoe', 'particularly', 'lawyer', 'hate', 'giraffe', 'terrify', 'demon', 'animal', 'horn', 'devil', 'purple', 'tongue']"
68360,68360,"Why, I didn&apos;t. You accuse me wrongly. &gt;.&gt; ou have super ears. Actually. I&apos;m much shorter than you are. Not true. There are only dragons. Indeed I do. The cobbler stopped by last week. Do you like them? Oh well I&apos;m offended. I for one really dislike your coat. No sir. I am a specialist in giraffes. That&apos;s a shame you think that. They really are quite nice creatues. creatures* so are you. -SNICKER- See what I did there. I Laughed at you. in your face. Good day sir.",0.0,89,"['didn', 'accuse', 'wrongly', 'super', 'ear', 'actually', 'apos', 'much', 'short', 'true', 'only', 'dragon', 'indeed', 'cobbler', 'stop', 'last', 'week', 'like', 'apos', 'offend', 'really', 'dislike', 'coat', 'sir', 'specialist', 'giraffe', 'apos', 'shame', 'think', 'really', 'quite', 'nice', 'creature', 'creature', 'so', 'snicker', 'see', 'there', 'laugh', 'face', 'good', 'day', 'sir']"
68362,68362,hey wassup ? :) what&apos;s your name ? Iam nancy 19 f Your asl ? m 19 f NY,0.0,19,"['wassup', 'apos', 'name', 'age', 'ny']"
68364,68364,"this is a copy and paste - if you want to talk to specifically girls or guys, go to zuchat.com bye now :)",0.0,23,"['copy', 'paste', 'want', 'talk', 'specifically', 'girl', 'guy', 'go', 'chat', 'com', 'now']"
68366,68366,"m hi.. cool.. name,age,place n,a,p Deepak,19,m,india 19,m,india n my name is Deepak chole is a very nice name well...in indi... chole is a name of dish... pic??? i have a fb account..",0.0,32,"['cool', 'name', 'age', 'place', 'deepak', 'name', 'deepak', 'chole', 'very', 'nice', 'name', 'well', 'name', 'dish', 'pic', 'fu', 'account']"
68367,68367,"hi f hi chloe, 16 , UK u wat? nice :) kl :) thnx u want a pic? kool, wat is it? picture",0.0,23,"['chloe', 'wat', 'nice', 'thne', 'want', 'pic', 'kool', 'wat', 'picture']"
68368,68368,"Hi . &lt;.&lt;&apos; calm . o.o&apos; heheh , Spywares . Waht is the video ? &lt;.&lt;&apos; calma girl . 5:26 in the omegle ? &lt;.&lt;&apos; A movie ratarded kiddy or spyware &lt;.&lt;&apos; thats question . ... I&apos;m fine .. Okay i&apos;m with fear. Brasil . Because i&apos;m transleater in the veloceter . &lt;.&lt;&apos; Boy .",0.0,55,"['apos', 'calm', 'o', 'spyware', 'waht', 'video', 'apos', 'calma', 'girl', 'omelet', 'apos', 'movie', 'retard', 'kiddy', 'spyware', 'apos', 's', 'question', 'apos', 'fine', 'apos', 'fear', 'basil', 'apos', 'translate', 'veloceter', 'apos', 'boy']"
68369,68369,"hey i have something funny lol hold on i want someone&apos;s reaction to this realy bad go to 5:26 on this    http://www.youtube.com/watch?v=JxFNfof8mAI&amp;feature=related pleeease   :) no its not :( how old are you? im 17 and a girl :) u can look me up on myspace if u want its a retarded kids movie and the funny part is on 5:26 i just wana c what ppl have to say to it :( hehe!!! http://www.youtube.com/watch?v=JxFNfof8mAI&amp;feature=related :] ok dont trust me :( we can be friendsh :D fine, ill tell you how to find it on youtube and you get it urself, how bout that? its easy to find the first result :( hoosier are you from indiana? boy or girl? how old? ..",0.0,122,"['funny', 'laugh', 'hold', 'want', 'apos', 'reaction', 'realy', 'bad', 'go', 'help', 'youtube', 'com', 'watch', 'feature', 'relate', 'pleeease', 'old', 'girl', 'look', 'myspace', 'want', 'retarded', 'kid', 'movie', 'funny', 'part', 'just', 'wana', 'pal', 'say', 'help', 'youtube', 'com', 'watch', 'feature', 'relate', 'trust', 'friend', 'fine', 'ill', 'tell', 'find', 'youtube', 'get', 'easy', 'find', 'first', 'result', 'hoosier', 'boy', 'girl', 'old']"
68372,68372,"Hey :) let&apos;s cut the crap, which one are YOU? :D
A. Boy wants to talk with boy
B. Boy wants to talk with girl
C. Boy (horny) wants to talk with boy
D. Boy (horny) wants to talk with girl
E. Girl wants to talk with boy
F. Girl wants to talk with girl
G. Girl (horny) wants to talk with boy
H. Girl (horny) wants to talk with girl",0.0,71,"['let', 'cut', 'crap', 'one', 'boy', 'want', 'talk', 'boy', 'want', 'talk', 'girl', 'boy', 'want', 'talk', 'boy', 'want', 'talk', 'girl', 'girl', 'want', 'talk', 'boy', 'girl', 'want', 'talk', 'girl', 'girl', 'horny', 'want', 'talk', 'boy', 'girl', 'horny', 'want', 'talk', 'girl']"
68374,68374,"hello, my name is claudia :) i speak perfect english and am not interested in cybering or webcams.. if you are the same then i would love to talk with you! hi stranger :)",0.0,34,"['name', 'speak', 'perfect', 'english', 'interested', 'covering', 'webcam', 'same', 'then', 'love', 'talk', 'stranger']"
68376,68376,If your horny gay black or White and have a big dick you Can stau Stay*,0.0,16,"['horny', 'gay', 'black', 'white', 'big', 'dick', 'stay', 'stay']"
68381,68381,19685048ab49226517b9e214a6e971f6: yesum? thats wierd language for 'yes?' whats a  4c681049601b3c374f1d2c0077c99049' 976c3ffadc0468d18d4aca16e4353cac: you clearly did not think that through did you :P,0.0,21,"['s', 'wierd', 'language', 's', 'clearly', 'think']"
68382,68382,"4a722ba9665fe3ebecdfcf04168ae596, 4c681049601b3c374f1d2c0077c99049: what do you use for online presos? (or anybody else) 4c681049601b3c374f1d2c0077c99049: a presentation via a web browser 4c681049601b3c374f1d2c0077c99049: inb4 google docs 4c681049601b3c374f1d2c0077c99049: ok, I'll check it out 4c681049601b3c374f1d2c0077c99049: I was gonna use Swinger but the whitespace is really inflexible 4c681049601b3c374f1d2c0077c99049: (by quirky) it's cool, but, meh we'll see gotta do my preso 4a722ba9665fe3ebecdfcf04168ae596: ok, cool 4a722ba9665fe3ebecdfcf04168ae596: cool 4a722ba9665fe3ebecdfcf04168ae596: I'm not a macfag enough to do that 976c3ffadc0468d18d4aca16e4353cac: lulz http://swinger.quirkey.com/ 976c3ffadc0468d18d4aca16e4353cac 4a722ba9665fe3ebecdfcf04168ae596: ok",0.0,74,"['4c681049601b3c374f1d2c0077c99049', 'use', 'online', 'press', 'else', '4c681049601b3c374f1d2c0077c99049', 'presentation', 'web', 'browser', 'doc', 'check', 'go', 'use', 'swinger', 'whiteface', 'really', 'inflexible', 'quirky', 'cool', 'meh', 'see', 'get', 'preso', '4a722ba9665fe3ebecdfcf04168ae596', 'ok', 'cool', '4a722ba9665fe3ebecdfcf04168ae596', 'cool', 'i', 'macaw', 'enough', 'lull', 'help', 'swinger', 'quirky', 'com', '4a722ba9665fe3ebecdfcf04168ae596']"
68383,68383,whats an online preso ive been using the one from hakim.se recently fuuuuuuck google docs those presentations blo w o yeah i like swinger,0.0,24,"['s', 'online', 'preso', 've', 'use', 'one', 'recently', 'fuuuuuuck', 'doc', 'presentation', 'blo', 'like', 'swinger']"
68384,68384,"2360aabaa09d5610935ee7e2283f0780, i don't use online preso haha preso i use keynote :( nothing beats the presenter view of keynote",0.0,19,"['don', 'use', 'online', 'preso', 'preso', 'use', 'keynote', 'beat', 'presenter', 'view']"
68385,68385,what ever you do don't search for swinger html5 :| esepcially when your at work! 2360aabaa09d5610935ee7e2283f0780: cheers well i thought i was safe with html5,0.0,25,"['ever', 'don', 'search', 'swinger', 'himl', 'especially', 'work', 'cheer', 'think', 'safe', 'himl']"
68390,68390,changes: SSE; hixie: fix pub issues &lt;http://lists.w3.org/Archives/Public/public-html-diffs/2011Apr/0105.html&gt; ** webstorage; hixie: fix pub issues &lt;http://lists.w3.org/Archives/Public/public-html-diffs/2011Apr/0104.html&gt; ** postmsg; hixie: fix pub issues &lt;http://lists.w3.org/Archives/Public/public-html-diffs/2011Apr/0103.html&gt; ** microdata; hixie: fix pub issues &lt;http://lists.w3.org/Archives/Public/public-html-diffs/2011Apr/0102.htm bugmail: [Bug 12559] &lt;video&gt; Make paused true at playback end &lt;http://lists.w3.org/Archives/Public/public-html-bugzilla/2011Apr/0642.html&gt;,0.0,39,"['change', 'pixie', 'fix', 'pub', 'issue', 'help', 'list', 'org', 'archive', 'public', 'public', 'himl', 'diff', 'himl', 'webstorage', 'pixie', 'fix', 'pub', 'issue', 'help', 'list', 'org', 'archive', 'public', 'public', 'himl', 'diff', 'himl', 'post', 'pixie', 'fix', 'pub', 'issue', 'help', 'list', 'org', 'archive', 'public', 'public', 'himl', 'diff', 'himl', 'microdot', 'pixie', 'fix', 'pub', 'issue', 'help', 'list', 'org', 'archive', 'public', 'public', 'himl', 'diff', 'gmail', 'bug', 'video', 'make', 'pause', 'true', 'end', 'help', 'list', 'org', 'archive', 'public', 'public', 'himl', 'bugzilla', 'himl']"
68391,68391,:-* HEY BF >:D< ya we just got home while ago missed u ya was fun that train was scary gma took some a couple >:D< lots what u been doin? did it rain on u? luvs u 2 ya just sittin here what u doin? cool ya would b so cool lol i like u i like u more lol lol. thanks what else did u do after u went 2 the beach? what did u buy? ya ohhh lol like the ones u showed me? ya :-* me 2!!!! cant wait cool :-* whatever u wanna do lots of stuff like lagoon movies n all that stuff u was tellin me about ya ya u comin back 2 utah yet? that sucks u gotta drive here or go on a plane? how long does that take? thats long time! we drove like 9 or 10 hours 2 day i just read my books in the car i been readin all the harry potter books again yep ya :-* ya i got 2 ride on a train cause it was way up high n it was like on a cliff everybody on the train was runnin 2 the side that was over the cliff 2 look out n the train was leanin way over that was scary cause i thought it was gonna fall over ya went up a big mountain n at the top was where indians used 2 live lol brat that was a diff place than the train cool nope i think thats way cool like ur real cute :-* brb gma wants me 2 help unpack the car,0.0,273,"['just', 'get', 'home', 'ago', 'miss', 'fun', 'train', 'scary', 'take', 'couple', 'lot', 'been', 'doin', 'rain', 'just', 'sittin', 'here', 'doin', 'cool', 'so', 'cool', 'laugh', 'like', 'like', 'more', 'laugh', 'loud', 'lol', 'thank', 'else', 'go', 'beach', 'buy', 'ohhs', 'laugh', 'loud', 'one', 'show', 'wait', 'want', 'lot', 'stuff', 'lagoon', 'movie', 'stuff', 'tellin', 'comin', 'utah', 'yet', 'suck', 'got', 'drive', 'here', 'go', 'plane', 'long', 'take', 's', 'long', 'time', 'drive', 'hour', 'day', 'just', 'read', 'book', 'car', 'be', 'read', 'potter', 'book', 'again', 'get', 'ride', 'train', 'cause', 'way', 'up', 'high', 'cliff', 'train', 'runnin', 'side', 'cliff', 'look', 'train', 'lean', 'way', 'over', 'scary', 'think', 'go', 'fall', 'go', 'big', 'mountain', 'top', 'use', 'live', 'laugh', 'loud', 'brat', 'diff', 'place', 'train', 'cool', 'think', 's', 'way', 'cool', 'real', 'cute', 'right', 'back', 'want', 'help', 'unpack', 'car']"
