,Unnamed: 0,text,predator,text_len,preprocessed_bow
23117,23117,"b25b6b77a0087ff8385941e5545d32ea: not everyone on the TAG has a clear view of the harbor er, meant that comment for b8810fee2f4a71f849f3f7409546d1d9 but you guys know what I meant I don't think anyone suggested switching browser *behavior* for XHTML/HTML based on anything other than MIME type, but there was an argument that it's ok if some document that in some sense &quot;is&quot; XHTML as text/html, if processing as HTML is what you want I think, anyway minutes are muddled well, the spec introduces this distinction somewhat, when it says, &quot;XML documents that use elements or attributes from the HTML namespace and that are served over the wire (e.g. by HTTP) must be sent using an XML MIME type such as application/xml or application/xhtml+xml and must not be served as text/html.&quot; so that raises the question whether a document &quot;is&quot; an XML document - particularly tricky in light of polyglot document support the spec already says separately that anything sent as text/html will be treated as HTML I'm not sure I even know what that paragraph means I think the MIME type registrations included in the document might already say that (maybe not as to XML documents served as text/xml or application/xml instead of application/xhtml+xml) but yeah, anything that doesn't form to the HTML syntax must not be served as text/html anything that conforms to the XML syntax either is also valid HTML (in which case you can in fact send it as text/html), or it's not, in which case it's already invalid the sentence I cited superficially seems to forbid serving polyglot documents as text/html, which is inconsistent with the rest of the spec I don't think it even means to prohibit that it seems like it assumes there's some platonic sense in which something is either an HTML document or an XML document (based on author's intent? I dunno) and thus can't really be checked it sort of seems like it's saying &quot;don't serve XHTML as HTML unless you know it's not really going to get processed as XML&quot; that would be a fine thing to say",0.0,345,"['b25b6b77a0087ff8385941e5545d32ea', 'tag', 'clear', 'view', 'harbor', 'mean', 'comment', 'guy', 'know', 'mean', 'think', 'suggest', 'switch', 'browser', 'behavior', 'base', 'other', 'mime', 'type', 'argument', 'ok', 'document', 'sense', 'quit', 'quit', 'text', 'himl', 'processing', 'want', 'think', 'anyway', 'minute', 'muddle', 'well', 'spec', 'introduce', 'distinction', 'somewhat', 'when', 'say', 'quit', 'document', 'use', 'element', 'attribute', 'namesake', 'serve', 'wire', 'e', 'help', 'must', 'send', 'use', 'mime', 'type', 'such', 'application', 'application', 'must', 'serve', 'text', 'himl', 'quit', 'raise', 'question', 'document', 'quit', 'quit', 'document', 'particularly', 'tricky', 'light', 'polyglot', 'document', 'support', 'spec', 'already', 'say', 'separately', 'send', 'text', 'himl', 'will', 'treat', 'sure', 'even', 'know', 'paragraph', 'mean', 'think', 'mime', 'type', 'registration', 'include', 'document', 'may', 'already', 'say', 'maybe', 'document', 'serve', 'text', 'application', 'instead', 'application', 'himl', 'doesn', 'form', 'syntax', 'must', 'serve', 'text', 'himl', 'conform', 'also', 'valid', 'himl', 'case', 'can', 'fact', 'send', 'text', 'himl', 'case', 'already', 'invalid', 'sentence', 'cite', 'superficially', 'seem', 'forbid', 'serve', 'polyglot', 'document', 'text', 'himl', 'inconsistent', 'rest', 'don', 'think', 'even', 'mean', 'prohibit', 'seem', 'assume', 'there', 'platonic', 'sense', 'document', 'document', 'base', 'author', 'intent', 'dunno', 'thus', 'can', 'really', 'check', 'sort', 'of', 'seem', 'say', 'quit', 'serve', 'know', 'really', 'go', 'process', 'quit', 'would', 'fine', 'thing', 'say']"
23118,23118,"fwiw, I think the above paragraph is not necessary, or at least should be worded differently it should just say that documents in the HTML namespace served with an XML mime type must conform to the XML (XHTML) syntax and that documents served as text/html must conform to the HTML syntax and leave it at that yeah I don't think it's necessary for it to have that prohibition nor anything similar yeah, that's a good way to put it",0.0,79,"['few', 'think', 'above', 'paragraph', 'necessary', 'least', 'should', 'word', 'differently', 'should', 'just', 'say', 'document', 'serve', 'mime', 'type', 'must', 'conform', 'document', 'serve', 'text', 'himl', 'must', 'conform', 'syntax', 'leave', 'don', 'think', 'necessary', 'prohibition', 'similar', 'good', 'way', 'put']"
23119,23119,"&quot;Definition: A data object is an XML document if it is well-formed, as defined in this specification.&quot; - What is a data object? &quot;Don't serve XHTML as text/html unless it's also valid HTML&quot;",0.0,33,"['quit', 'definition', 'data', 'object', 'document', 'well', 'form', 'define', 'specification', 'quit', 'data', 'object', 'quit', 'serve', 'text', 'himl', 'also', 'valid']"
23120,23120,hey 18 us m u?/ hey r u there?? ep??? yup u?? sexy?? horny virgin?? kk gr8 with bf nope have pic send it to me wat happened?? try sending me have my id\ <email/> ohh fuck just try it some more time send it to my id but why no prob just send it to me didnt mind to me ohh pls sexy plsss,0.0,65,"['there', 'yup', 'sexy', 'horny', 'virgin', 'great', 'nope', 'send', 'happen', 'try', 'send', 'would', 'email', 'fuck', 'just', 'try', 'more', 'time', 'send', 'would', 'why', 'prob', 'just', 'send', 'mind', 'sexy', 'less']"
23121,23121,hy als 17 f ep hot weird i like it no 2 times you ill try this is a new computer from my boyfrend  im cheating on him wait they dont load ok mwhat im trying i cant i dont nkow im pretty not that smart i cant yes but they dont want to load,0.0,55,"['ep', 'like', 'time', 'ill', 'try', 'new', 'computer', 'boyfriend', 'cheat', 'wait', 'load', 'try', 'can', 'know', 'pretty', 'that', 'smart', 'can', 'want', 'load']"
23122,23122,"Hi. I'm having a problem installing XP. When I first ran the disk, it told me it couldn't find my harddrive and I needed to run diagnostic or get drivers. Well, I tried the former and it didn't work. So I got drivers, and their on a floppy. I hit F6 and all, then it tells me to put it into drive A:. I do, and it scans for a moment, then asks me to put it in again. What should I do? Anyone? Yeah it's a dell. I got it from their site and it had me run an executable. One second well, I got this: <a href=""http://support.dell.com/support/downloads/download.aspx?c=us&amp;l=en&amp;s=gen&amp;releaseid=R99738&amp;SystemID=DIM_P4_9100&amp;os=WW1&amp;osl=en&amp;deviceid=8615&amp;devlib=0&amp;typecnt=2&amp;vercnt=1&amp;formatcnt=1&amp;libid=41&amp;fileid=128967"">http://support.dell.com/support/downloads/download.aspx?c=us&amp;l=en&amp;s=gen&amp;releaseid=R99738&amp;SystemID=DIM_P4_9100&amp;os=WW1&amp;osl=en&amp;deviceid=8615&amp;devlib=0&amp;typecnt=2&amp;vercnt=1&amp;formatcnt=1&amp;libid=41&amp;fileid=128967</a> Which had me put it on a floppy. I'm not sure whats on it because I can't see whats on the disk ATM (The computerI'm on now doesn't have a floppy drive) Thank you. Yeah I did. Maybe. It almost acts like there's no disk in A: at all. It simply tells me to insert it and press enter when ready again. I wouldn't rule out my drive. Few years of dissuse. I have another one I can try, though, so I'll do that. But the disk should be fine, as it worked about an hour before I put it in (when I put the stuff on it.) Thanks!",0.0,218,"['have', 'problem', 'instal', 'when', 'first', 'run', 'disk', 'tell', 'couldn', 'find', 'hardrive', 'need', 'run', 'diagnostic', 'driver', 'well', 'try', 'former', 'didn', 'work', 'so', 'get', 'driver', 'hit', 'then', 'tell', 'put', 'drive', 'scan', 'moment', 'then', 'ask', 'put', 'again', 'should', 'i', 'dell', 'get', 'site', 'run', 'executable', 'one', 'second', 'get', 'help', 'support', 'com', 'support', 'download', 'amp', 'en', 'amp', 'release', 'systemic', 'oil', 'device', 'amp', 'typecast', 'amp', 'percent', 'amp', 'amp', 'fileid', 'help', 'support', 'dell', 'com', 'support', 'download', 'amp', 'en', 'amp', 'release', 'systemic', 'oil', 'device', 'amp', 'typecast', 'amp', 'percent', 'amp', 'amp', 'fileid', 'put', 'floppy', 'sure', 's', 'can', 'see', 's', 'disk', 'computer', 'now', 'floppy', 'drive', 'thank', 'maybe', 'almost', 'act', 'there', 'disk', 'at', 'all', 'simply', 'tell', 'insert', 'press', 'enter', 'when', 'ready', 'again', 'wouldn', 'rule', 'drive', 'few', 'year', 'disuse', 'one', 'can', 'try', 'though', 'so', 'disk', 'should', 'fine', 'work', 'hour', 'put', 'when', 'put', 'stuff', 'thank']"
23123,23123,anyone know how I can find my ADs LDAP Container? *the name of my *any of you :),0.0,18,"['know', 'how', 'can', 'find', 'ad', 'lap', 'container', 'name']"
23124,23124,"Tape, you need a special driver description file that can be understood by the Windows installer, not a standard Windows driver .inf file. I suspect it will be called &quot;boot driver&quot; or something like that on the manufacturer's website. So what files have you got on the disk now then? Well I'll download it and look because from the description I can't tell what the package contains anyway OK, I looked, it seems to contain what you need. You read section 5.3 of the readme and this: <a href=""http://www.intel.com/support/chipsets/imst/sb/CS-020825.htm"">http://www.intel.com/support/chipsets/imst/sb/CS-020825.htm</a> right? (you don't need to do all the unattended things, just the first section is really relevant to you here in the link) Also here is another article: <a href=""http://www.extremetech.com/article2/0"">http://www.extremetech.com/article2/0</a>,1697,1733453,00.asp Seems like one file is missing from the disk, if it's not showing up any drivers? Is the disk broken then perhaps? Or the drive? Well, sorry I couldn't really give you an answer, but hopefully it'll work okay the second time around You could set the permissions on those running processes, I suppose I don't know how the programs themselves would take it of course, they may go crazy if they receive a close request and then find that they aren't allowed to close after all A program that goes crazy, you mean? Don't allow users to stop services running in the localsystem, localservice or networkservice accounts is the usual way... But you can set permissions on any process in theory Service is just a process running in a service account. HentaiXP: well, let's take that as given, otherwise it's impossible.",0.0,261,"['tape', 'need', 'special', 'driver', 'description', 'file', 'can', 'understand', 'installer', 'standard', 'window', 'driver', 'file', 'suspect', 'will', 'call', 'boot', 'driver', 'quit', 'manufacturer', 'website', 'so', 'file', 'get', 'disk', 'now', 'then', 'download', 'look', 'description', 'can', 'tell', 'package', 'contain', 'anyway', 'look', 'seem', 'contain', 'need', 'read', 'section', 'reade', 'ref', 'help', 'com', 'mist', 'so', 'help', 'com', 'mist', 'so', 'right', 'need', 'unattended', 'thing', 'just', 'first', 'section', 'really', 'relevant', 'here', 'link', 'also', 'here', 'article', 'help', 'com', 'article', 'help', 'extremetech', 'com', 'article', 'asp', 'seem', 'file', 'miss', 'disk', 'show', 'driver', 'disk', 'break', 'then', 'perhaps', 'drive', 'couldn', 'really', 'give', 'answer', 'hopefully', 'work', 'second', 'time', 'could', 'set', 'permission', 'run', 'process', 'suppose', 'don', 'know', 'how', 'program', 'would', 'take', 'course', 'may', 'go', 'crazy', 'receive', 'close', 'request', 'then', 'find', 'aren', 'allow', 'close', 'after', 'all', 'program', 'go', 'crazy', 'mean', 'allow', 'user', 'stop', 'service', 'run', 'localsystem', 'localservice', 'networkservice', 'account', 'usual', 'way', 'can', 'set', 'permission', 'process', 'theory', 'service', 'just', 'process', 'run', 'service', 'account', 'let', 'take', 'as', 'give', 'otherwise', 'impossible']"
23125,23125,"Could support for application/xhtml+xml be added to IE 6 using ActiveX? Or a plugin like Flash? airzer0: this isn't really an advocacy channel airzer0: windows support/non-advocacy discussion really lol I hate Windows! They leak all the heat out of my house! ;) it's not so much that (i don't really hate them). They're old sash windows, don't close properly. Air leaks out the gaps. i could cover myself in apples anyhow or make a fire, a nice open source of heat ;)",0.0,82,"['could', 'support', 'application', 'add', 'use', 'active', 'pugin', 'flash', 'airzer0', 'really', 'advocacy', 'channel', 'airzer0', 'window', 'support', 'non', 'advocacy', 'discussion', 'really', 'laugh', 'hate', 'window', 'leak', 'heat', 'house', 'so', 'much', 'don', 'really', 'hate', 're', 'old', 'sash', 'window', 'close', 'properly', 'air', 'leak', 'gap', 'could', 'cover', 'apple', 'anyhow', 'make', 'fire', 'nice', 'open', 'source', 'heat']"
23126,23126,"Hiya Does anyone know a way to lock open programs from being quit or edited. I have a few security programs that I want to be turned off only by a password-holding administrator. Hmm, yeah There must be such a program. Somehow system administrators must be able to prevent closing down firewalls or running services. But then it'd need to be a service, instead of process. Right? I think taking advantage of widows is cruel. So I say no. Windows are great too. Imagine the darkness without them. Don't you have doubled windows? Oh, I get it. Well, but if you didn't have windows it'd be way colder. But you could cover yourself in apples. Hahaha Well, I better get back to developing on my Mac. Thanks for the help :-) Respect. Ciao.",0.0,133,"['know', 'way', 'lock', 'open', 'program', 'quit', 'edit', 'few', 'security', 'program', 'want', 'turn', 'only', 'password', 'hold', 'administrator', 'must', 'program', 'somehow', 'system', 'administrator', 'must', 'able', 'prevent', 'close', 'firewall', 'running', 'service', 'then', 'need', 'service', 'instead', 'process', 'think', 'take', 'advantage', 'widow', 'cruel', 'so', 'say', 'window', 'great', 'too', 'imagine', 'darkness', 'double', 'window', 'get', 'well', 'didn', 'window', 'be', 'way', 'cold', 'could', 'cover', 'apple', 'better', 'get', 'back', 'develop', 'thank', 'help', 'respect']"
23128,23128,hi is widows better?&gt; what is the topic here?&gt; i like windows it is great super how do i install xp over 98?&gt; i have an xp disc but how do i install it?&gt; otay hehehe sry my bad hi,0.0,40,"['widow', 'well', 'topic', 'here', 'like', 'window', 'great', 'super', 'how', 'install', 'up', 'disc', 'how', 'install', 'stay', 'bad']"
23129,23129,xp full install? whats the CD? xp full install oem? just install it without changing the file system,0.0,18,"['full', 'install', 's', 'ad', 'full', 'install', 'poem', 'just', 'install', 'change', 'file', 'system']"
23132,23132,heyy asl i am asl 16 m yes if you are you sound hot babe lets have sex chat sex chat?,0.0,21,"['sound', 'hot', 'babe', 'let', 'sex', 'chat', 'sex', 'chat']"
23133,23133,hi british only 16 f england 16 f eng horny?........... unless you are a f great babe facebook ? mine is ruby louisa cook whatb is your facebook// ?? okaii fitty WHAT IS YOUR FACEBOOK! yes how long is your penis?,0.0,41,"['only', 'eng', 'horny', 'great', 'mine', 'louisa', 'cook', 'facebook', 'oaii', 'fifty', 'facebook', 'how', 'long', 'penis']"
23138,23138,"I had this idea for the database module ... the CRUD statements are pretty consistent across implementations, it should be easy, relatively speaking, to spec them, or refer to ANSI SQL. it's the creation of the tables and indicies where the real compatibility problems come in. what if HTML5 defined DOM APIs to create tables and indicies? This would also allow the types to be defined as standard DOM types, instead of SQL types. It would be up to the implementation to do the conversion to whatever it's internal representation is. this would provide a real shot at abstracting the implementation (sqlite) from the spec.",0.0,105,"['idea', 'database', 'module', 'statement', 'pretty', 'consistent', 'implementation', 'should', 'easy', 'relatively', 'speak', 'spec', 'refer', 'i', 'creation', 'table', 'index', 'where', 'real', 'compatibility', 'problem', 'come', 'define', 'dom', 'ape', 'create', 'table', 'index', 'would', 'also', 'allow', 'type', 'define', 'standard', 'dom', 'type', 'instead', 'type', 'would', 'implementation', 'conversion', 'internal', 'representation', 'would', 'provide', 'real', 'shot', 'distract', 'implementation', 'quite', 'spec']"
23139,23139,"sounds reasonable to me i recommend sending mail to the list suggesting it, let's see what the other vendors think hey a03bfa2a78d00389c65221c74759cbb4: whatever you did with the blog seems to have helped, &quot;lhunt&quot; is never at the top of the process list anymore",0.0,43,"['sound', 'reasonable', 'recommend', 'send', 'mail', 'list', 'suggest', 'let', 'see', 'other', 'vendor', 'think', 'a03bfa2a78d00389c65221c74759cbb4', 'blog', 'seem', 'help', 'quit', 'hunt', 'never', 'top', 'process', 'list', 'anymore']"
23158,23158,"lol, first cookies, now cakes tries to find a URL http://www.ietf.org/mail-archive/web/http-state/current/msg00893.html (has a proposal for a cake header that handles session management) you're doing that now?",0.0,26,"['first', 'cookie', 'now', 'cake', 'try', 'find', 'url', 'help', 'ieft', 'mail', 'archive', 'web', 'help', 'state', 'current', 'msg00893', 'proposal', 'cake', 'header', 'handle', 'session', 'management', 're', 'do', 'now']"
23159,23159,"I thought we wanted to send less traffic with every request, not more And cakes are usually much bigger than cookies",0.0,21,"['think', 'want', 'send', 'less', 'traffic', 'request', 'more', 'cake', 'usually', 'much', 'big', 'cookie']"
23160,23160,cakes? I don't like writing test cases that need server-side scripting dealing with request timing edb259c0e0038f38bb200bc20c8cbf7e: I'm doing it in the sense of trying to figure out how to do it. I'm not doing it in the sense of writing the test just yet.,0.0,44,"['cake', 'don', 'like', 'write', 'test', 'case', 'need', 'server', 'side', 'scripting', 'deal', 'request', 'timing', 'edb259c0e0038f38bb200bc20c8cbf7e', 'do', 'sense', 'try', 'figure', 'how', 'do', 'sense', 'write', 'test', 'just', 'yet']"
23167,23167,bugmail: [Bug 8230] New: It might be good with a comment in script's Content attributes section mentioning onload/onerror being defined in Global attributes (I've had the question come up several times about script.onload missing from html5). &lt;http://lists.w3.org/Archives/Public/public-html-bugzilla/2009Nov/0077.html&gt; ** [Bug 8228] New: The formatting of the example is very screwed up. Needs to be reformatted to be readable. &lt;http://lists.w3.org/Ar,0.0,58,"['bug', 'new', 'may', 'good', 'comment', 'script', 'content', 'attribute', 'section', 'mention', 'onload', 'terror', 'define', 'global', 'attribute', 've', 'question', 'come', 'several', 'time', 'script', 'onload', 'miss', 'help', 'list', 'org', 'archive', 'public', 'public', 'bug', 'new', 'formatting', 'example', 'very', 'screw', 'need', 'reformatte', 'readable', 'help', 'list', 'org']"
23173,23173,hi als? yeah sure venezuela and you? 18 and you? max and yourse? like that name laying on my bed babe and you? what are you whearing? ;) heres hot to just boxers no t-shirt yes that will be shure what are you like fisicily? ?? me too yes and you? do you have also skype? for what babe ;) have you skpe/ ?? ? ? ? ? ?,0.0,69,"['max', 'yourse', 'name', 'lay', 'bed', 'babe', 'wear', 'here', 'hot', 'just', 'boxer', 'shirt', 'will', 'shure', 'sicily', 'too', 'also', 'skype', 'skype']"
23174,23174,"hi there wanna have sex? so where r u come from? great california so how old are ya? 17\ so what&apos;s your name? jenny so what are you doin now? thanks :) just the same as you are honestly, i&apos;m wearing only bra and underwear cause it&apos;s kinda hot here how bout ya? but it&apos;s hotter when you are near me haha i&apos;m kinda hot haha so do you have facebook? can i have your emal?",0.0,76,"['want', 'sex', 'so', 'where', 'come', 'so', 'how', 'old', 'so', 'apo', 'name', 'do', 'now', 'thank', 'just', 'same', 'honestly', 'apos', 'wear', 'only', 'bra', 'underwear', 'kinda', 'hot', 'here', 'how', 'hotter', 'when', 'apos', 'kinda', 'hot', 'haha', 'so', 'can', 'meal']"
23175,23175,what version of server 2003 would you guys suggest for a company with 4 servers and 18 clients..but is expecting to grow much in the next few years im also guessing that NAT would be the best choise for my project.. do i &quot;need&quot; to install &quot;remote access &amp; VPN server&quot; to get NAT working? i was ginda confused about that what directory is it? or just stop the program that is using the dll..usally the program in that dir:P ah had some problems deliting it too a time ago i just terminated all the processes that was related to cygwin and exploerer.exe,0.0,103,"['version', 'server', 'would', 'guy', 'suggest', 'company', 'server', 'client', 'expect', 'grow', 'much', 'next', 'few', 'year', 'also', 'guess', 'would', 'good', 'choise', 'project', 'quit', 'need', 'quit', 'install', 'quit', 'remote', 'access', 'server', 'quit', 'work', 'kinda', 'confused', 'directory', 'just', 'stop', 'program', 'use', 'usally', 'program', 'dir', 'problem', 'delete', 'too', 'time', 'ago', 'just', 'terminate', 'process', 'relate', 'tywin', 'explorer', 'eye']"
23177,23177,"hello, im trying to remote a directory but there is a dll file that it says is in use. How can I find out what process is using this dll? remove not remote openssh that I installed and removed but theres a dll that is still in use that I need to be gone yeah, a reboot will fix it but I can't really reboot it at the moment HentaiXP: ok thanks I'll check it out yallax: heh already done that its a cygwin dll yeah I think the only option is a reboot as they suggest sometimes the process just doesn't get freed up. Oh well stuff it I'll reboot it oh ok.. heh I am... but this is for a friend sooo",0.0,124,"['try', 'remote', 'directory', 'file', 'say', 'use', 'how', 'can', 'find', 'process', 'use', 'remove', 'remote', 'open', 'instal', 'remove', 's', 'still', 'use', 'need', 'go', 'reboot', 'will', 'fix', 'can', 'really', 'reboot', 'moment', 'thank', 'check', 'already', 'do', 'tywin', 'think', 'only', 'option', 'reboot', 'suggest', 'sometimes', 'process', 'just', 'doesn', 'get', 'free', 'stuff', 'reboot', 'friend', 'sooo']"
23178,23178,restart the computer and delete it. have you restarted google it feel lucky and how did you success *succeed use linux :),0.0,22,"['restart', 'computer', 'delete', 'restart', 'feel', 'lucky', 'how', 'success', 'succeed', 'use']"
23180,23180,"Does anyone know how to use the replace function of MS office to find and replace the wildcards? I can find the string but with what symbol do I refer to the selected wildcard string? i.e. replace all {*} with '*', that is {somestring} with 'somestring'",0.0,46,"['know', 'how', 'use', 'replace', 'function', 'office', 'find', 'replace', 'wildcard', 'can', 'find', 'string', 'symbol', 'refer', 'select', 'wildcard', 'stre', 'e', 'replace', 'all']"
23182,23182,hows it goin im alright just chattin till i gotta leave in 5 min what u up to for the day/night lol too bad im gonna b leaving in a bit i gotta work just got called in LOL it sucked balls to get that phone call so whats ur name and where u located an european? what part? I live in the states LOL north europe? no country name? I live in florida Alright well it is time for me to head out to work good brief chattin with ya LOL,0.0,92,"['how', 's', 'go', 'just', 'chat', 'get', 'leave', 'day', 'night', 'laugh', 'loud', 'too', 'bad', 'go', 'leave', 'bit', 'get', 'work', 'just', 'get', 'call', 'suck', 'ball', 'phone', 'call', 'so', 's', 'name', 'where', 'locate', 'part', 'live', 'state', 'laugh', 'north', 'country', 'name', 'live', 'time', 'head', 'work', 'good', 'brief', 'chat', 'laugh', 'loud']"
23183,23183,good thanks what about you? what are you doing in 5 mins? nothing really im bored and just wanted to find somebody to talk with why are you leaving? i&apos;m located in europe ;) nort europe which state? north Norway yeah have a nice day at work,0.0,47,"['good', 'thank', 'do', 'min', 'really', 'bored', 'just', 'want', 'find', 'talk', 'why', 'leave', 'locate', 'nice', 'day', 'work']"
23184,23184,bugmail: [Bug 10642] No alternative text description for video key frame (poster) &lt;http://lists.w3.org/Archives/Public/public-html-bugzilla/2010Nov/0512.html&gt; ** [Bug 10660] use &lt; and &gt; and not &amp;#8592; and &amp;#8594; to indicate previous and next &lt;http://lists.w3.org/Archives/Public/public-html-bugzilla/2010Nov/0511.html&gt; ** [Bug 11307] New: hjh hj hjh &lt;http://lists.w3.org/Archives/Public/public-html-bugzilla/2010Nov/0510.html&gt;,0.0,39,"['gmail', 'bug', 'alternative', 'text', 'description', 'video', 'key', 'frame', 'poster', 'help', 'list', 'org', 'archive', 'public', 'public', 'bug', 'use', 'amp', 'amp', 'indicate', 'previous', 'next', 'help', 'list', 'org', 'archive', 'public', 'public', 'bug', 'new', 'help', 'list', 'org', 'archive', 'public', 'public']"
23194,23194,kennyluck: I wonder if a cleartext version of that one is going to appear on The Bj??rn H??hrmann Project,0.0,19,"['wonder', 'clear', 'version', 'one', 'go', 'appear', 'be']"
23195,23195,you can use http://www.rot13.com/ or some such to decode I should prolly update http://thebjoernhoehrmannproject.org/ with a pointer,0.0,17,"['can', 'use', 'help', 'rot', 'com', 'such', 'decode', 'should', 'prolly', 'update', 'help', 'thebjoernhoehrmannproject', 'org', 'pointer']"
