,Unnamed: 0,text,predator,text_len,preprocessed_bow
69780,69780,"what kind of card? minipci?  cardbus/pcmcia, etc? pci? either MC or MMCX hrm that looks mmcx-ish to me I have very little prism2 experience in linux and all of it was with the senao 2511 pcmcia is your cardbus/pcmcia controller detected by linux? www.windizupdate.com is entirely slicker than expected. well, the download urls aren't secret and they don't change regularly its just a browser extension to see whats been updated, then enables the suggested patches accordingly, similar to windowsupdate. I'm hoping it updates whatever is broken in 'basic' sp2 for windowsupdate everything else here updates fine except freshly installed sp2 boxes plus it works in non-shitty browsers so IE can be eliminated from the entire scenario",0.0,116,"['kind', 'card', 'minipci', 'card', 'pi', 'much', 'look', 'much', 'ish', 'very', 'little', 'prism', 'experience', 'linux', 'card', 'controller', 'detect', 'windizupdate', 'com', 'entirely', 'slicker', 'expect', 'download', 'curl', 'aren', 'secret', 'don', 'change', 'regularly', 'just', 'browser', 'extension', 'see', 's', 'update', 'then', 'enable', 'suggest', 'patch', 'accordingly', 'similar', 'windowsupdate', 'hope', 'update', 'break', 'basic', 'spy', 'windowsupdate', 'else', 'here', 'update', 'fine', 'freshly', 'instal', 'spy', 'box', 'work', 'non', 'shitty', 'browser', 'eliminate', 'entire', 'scenario']"
69781,69781,blammmmm J4k3: so basically it's a local proxy of sorts for windowsupdate.com huh?  just makes different decisions about what to download from windowsupdate.com and what to report back?,0.0,28,"['blammmmm', 'joke', 'so', 'basically', 'i', 'local', 'proxy', 'sort', 'windowsupdate', 'com', 'just', 'make', 'different', 'decision', 'download', 'windowsupdate', 'com', 'report', 'back']"
69782,69782,hey asl 19 f us so u in to guys girls or both so ur in to girls. but do u like girls oh ok i like both u sound pretty sexy idk just the way u type do u have big breasts no im not it was just a ? no female im a lezbisaian well bi bisexual idk just tell me i wear a36 C hello??,0.0,68,"['age', 'in', 'guy', 'girl', 'girl', 'like', 'girl', 'like', 'sound', 'pretty', 'sexy', 'ink', 'just', 'way', 'type', 'big', 'breast', 'just', 'female', 'well', 'bisexual', 'ink', 'just', 'tell', 'wear']"
69783,69783,hello~ f 20 macau asl? good! i find the only girls in here as u! allthe guys are boy f 20 macau i have bf no~ i like... but dunt love HAHA ^^ ?how can know HAHA u r crazy...... u sure a boy why you want to know my breasts size?,0.0,52,"['macau', 'asl', 'good', 'find', 'only', 'girl', 'in', 'here', 'guy', 'boy', 'macau', 'like', 'dunt', 'love', 'know', 'crazy', 'sure', 'boy', 'want', 'know', 'breast', 'size']"
69786,69786,"hi where r u from? india, u? ?? 21 m which city? kolkata whats ur name? abhishek its a nice name",0.0,21,"['city', 'kolkata', 's', 'name', 'nice', 'name']"
69789,69789,"hi asl? asl? nice name i am shanu asl? m20 u? hey? r u f? what r u doing? s means SEX, A mens age i m chjating with u where r u? fuck u",0.0,35,"['nice', 'name', 'shank', 'asl', 'do', 'mean', 'sex', 'men', 'age', 'cheat', 'u', 'fuck']"
69790,69790,hi my name is leon Thank you What is asl? i dont know what you are talking about Watching tv and U? ?,0.0,23,"['name', 'thank', 'asl', 'know', 'talk', 'watch', 'u']"
69793,69793,"hey 4dd217ba7542bb00a127f682e2c3ad27, do you think we can publish http://dvcs.w3.org/hg/from-origin/raw-file/tip/Overview.html -- it's a complementary document to CORS basically sort of defines an opposite mechanism instead of enabling access, it denies it the WebFonts WG would like to have something published is the impression I get we can always move it around later it seems within scope but our charter is expired for half a year now? top hit in Google is the old charter :/ thanks 4dd217ba7542bb00a127f682e2c3ad27",0.0,76,"['think', 'publish', 'help', 'doc', 'org', 'origin', 'raw', 'file', 'tip', 'overview', 'himl', 'i', 'complementary', 'document', 'cop', 'basically', 'sort', 'of', 'define', 'opposite', 'mechanism', 'instead', 'enable', 'access', 'deny', 'webfont', 'like', 'publish', 'impression', 'get', 'always', 'move', 'around', 'later', 'seem', 'scope', 'charter', 'expire', 'year', 'now', 'top', 'hit', 'old', 'charter', 'thank']"
69794,69794,"Anne, given the text in Section 5, perhaps this should wait for the WebAppSec WG? Perhaps you could ask for comments on public-web-security and an update on the chartering of the WebAppSec WG WebApps charter runs thru June 2012 Anne, why don't you announce it on public-{webapps,web-security} and ask for feedback re WebApps publishing it and definitely include info/pointers re why WebFonts wants this published that is, note the dependency",0.0,70,"['give', 'text', 'section', 'perhaps', 'wait', 'webappsec', 'perhaps', 'ask', 'comment', 'public', 'web', 'security', 'update', 'chartering', 'webappsec', 'charter', 'run', 'anne', 'don', 'announce', 'public', 'webapps', 'web', 'security', 'ask', 'feedback', 'webapps', 'publish', 'definitely', 'include', 'info', 'pointer', 'webfont', 'want', 'publish', 'note', 'dependency']"
69795,69795,"f5af272b5b04154c260eec46f4deb905, with 1h5m, transposition errors can happen. so is the answer not something like 12:34, where only order matters? i see what you did there.",0.0,25,"['transposition', 'error', 'happen', 'so', 'answer', 'only', 'order', 'matter', 'see', 'there']"
69799,69799,bugmail: [Bug 13127] New: Improve &quot;constructing the form data set&quot; for external usage &lt;http://lists.w3.org/Archives/Public/public-html-bugzilla/2011Jul/0096.html&gt; ** [Bug 12949] click() shouldn't have special powers over dispatching click event manually &lt;http://lists.w3.org/Archives/Public/public-html-bugzilla/2011Jul/0094.html&gt; ** [Bug 13117] ok what are you doning &lt;http://lists.w3.org/Archives/Public/public-html-bugzilla/2011Jul/0095.html,0.0,37,"['gmail', 'bug', 'new', 'improve', 'quit', 'construct', 'form', 'datum', 'set', 'quit', 'external', 'usage', 'help', 'list', 'org', 'archive', 'public', 'public', 'himl', 'himl', 'bug', 'click', 'special', 'power', 'dispatch', 'click', 'event', 'manually', 'help', 'list', 'org', 'archive', 'public', 'public', 'himl', 'himl', 'bug', 'do', 'help', 'list', 'org', 'archive', 'public', 'public', 'himl', 'himl']"
69800,69800,"there seems to be a few mails missing from the URIs in HTML5 thread. The last 3 from Hixie at the top of this page are in reply to messages that aren't in the archive http://lists.w3.org/Archives/Public/public-html/2008Jun/ ah, ok",0.0,38,"['seem', 'few', 'mail', 'miss', 'himl', 'thread', 'last', 'pixie', 'top', 'page', 'reply', 'message', 'aren', 'archive', 'help', 'list', 'org', 'archive', 'public', 'public', 'himl']"
69816,69816,never really thought about this http://www.reddit.com/r/IAmA/comments/nqerr/i_am_a_totally_blind_redditer/c3b6z7a that's kind of a major fail don't think so http://hixie.ch/tests/adhoc/data/,0.0,16,"['never', 'really', 'think', 'help', 'reddit', 'com', 'mama', 'comment', 'totally', 'blind', 'redder', 'kind', 'major', 'fail', 'think', 'so', 'help', 'test']"
69817,69817,edb259c0e0038f38bb200bc20c8cbf7e: does anybody support the From-Origin header yet? k know if there are any test suites for data URL support? thanks,0.0,21,"['support', 'origin', 'header', 'yet', 'know', 'test', 'suite', 'datum', 'support', 'thank']"
69820,69820,"hi asl cool 14 f nc in my pro morehead city u? cool what do u mean o lol y do u ask? cool whats ur name lol i guess what would we do o ok do u have a pic hey ur cute how old r u? rly? u said 22 b4 your pro says 25 o yep lol how far r u from morehead city ur not far! thats so cool hmmm when u want to? cool r u serious? yep what time? i dont believ u u have digits? yep i can get out no ill call u my dads here right now cool k let me see if i can get the phone yep, my dads on the phone said he will be done in sec yep, is that ok? lol no dads still talking no u? one sec yep r u omg u better not be can i add ya as friend k cool no r u? lol cool car is it yours dad on phone cool what kind lol u cant show up i would have to meet ya at beach or down the street noooo lol im scard u will sho up lol i think dad is done let me see u gonna take me driving in your car? its so cool what kinda music u like yep i like some of that too who is your fav sorry dads on phone still cool do u like any nickelback me 2 i dont kno chevelle me 2 i have some cds we can listen to i will hes on the phone i want to make sure i can get out or try to get out tell him i'm goin for a walk lol brb gonna pee k sorry what u doin? sorry if i cant get out tonite can u meet me tomorrow ok i dont want u mad if i cant yep i hope so whats the latest u can meet me cool but k if he gets off phone i can call u do u work uh oh thats early what time u get done cool what do u do cool u wrok on ur car? work thats so cool i think dads off now let me get the phone k i got the phone but i cant go tonite u still want me to call u he said i nedd to stay in cuz i didnt feel good this moring i cant he would be mad yeah cuz he sets the alarm dang it mebbe tomorrow? lol u want me to call u? u guess? geting ur # off here u mad? im sorry i feel bad now stupid dad lol i cant its calling card so it dont show on phone bill sorry u want me 2 call again k answer this time u werent talking and i got another call i tried to click the call but hung up sorry u mad im sorry i didnt mean 2 be i guess a little nervous i dont what do i sound o thanks y? i didnt mean 2 be im sorry dont be mad at me then whats up u r mad ok, one sec ok i cant talk long time i dont want dad comin in i got ur voice mal mail u gonna anser k no i told u i couldnt hear u didnt u hear me? i was too but i didnt hear u did u hear me do what what do i sound like lol ur buddy is high u would come to my house and get me in trouble u just mad cuz i cant get out tonite me either u see my pro? i can call u again tomorow i dunno that its me duh what ur pic prove? u could rly be 10 so ur are 10 me 2 but how do i know ur not that could be your bros car and your pro in the pic im cool if ur cool i aint lying to u as much as u do i just called ya i dont drive dood no but i want one u gonna buy me one lol ok i dont drive so idont have lisense who was that singing u sure i dont know if ur saying all this stuff to me if mebbe ur not fer real me eithr how come u and not me and y/ so who cares i dont how will they know what if i met u on the beach how they gonna kno if we sitting there talking y would they care u still gonna talk to me? i think ur mad at me now like what if i get anothe pic? or somethin one sec lemme see where i got one u got email? i can mebbe email u a pic k k one sec do u see pic k im trying one sec i'll email 2 u if its ok lol sorry im slow lol i dont kno how to put pic in email do u k let me try sory i know how to put on im but not email im trying to figure out k i think i got it lol did u get it k i know its not a very good pic huh um let me look u want me to email or put it in im hello hey u there brb k one sec k i sent it u not mad at me u have any ohter pix yes u have pix cool can u put them in im? i dont see pic omg u r soooo cute u in the military? thats cool how come ur not now u got some cool tats noooo y? u want hm 2 be? lol good u got myspace cool can i see yep we can be freinds lol one sec ill get it k is myspace ok i cant get signed in can u k let me try again error on page k i can try i think my dad might be at meeting tomorrow i prolly can if hes gone will that be good i know hes going to florda on the weekend too where u mean in floirida? or my house just me he has to go to some meeting yep that would be cool lol yeah when u come see me u wanna go to the beach 2 cool! u wanna rent movies? we can order pizza one sec what ever u wanna do lol have fun with u yep do u? can u bring rubers rubbers no r u? good if we use them? no we have 2 use them ok pls bring them i dont want to have baby if i do ur in trubble! can u bring somethin 2 drink??? lol yep thats cool ok ok we dont have to its cool no i dont have lots of hair is that ok i dont lol i dunno i nvr done it that way y? ooooo no then i dont want 2 hurt no i think thats all u have more? i will when u come see me dang im scared ur gonna show up and ill get in trouble by my dad lol i dunno let me think about it k? k u dont trust me so.... i dont know u make me mad cuz u do im scared a little and u dont understand i hate guys sometimes yah there is im just mad thats all want to see u? yes mebbe tomorrow or when my dad goes i can call u tomorrow k i can call u tomorrow after 5ish? k i will call you after 5 then mebbe we can see each other noooo dad will anser yeah he will ill get in trouble its too late to call now thats silly y call then u will call he will anser then ur gonna ask 4 a guy? can i mebbe give u the # tomorrow if hes not home? who yes if its ok",0.0,1348,"['cool', 'forehead', 'city', 'mean', 'laugh', 'ask', 'cool', 's', 'name', 'laugh', 'guess', 'pic', 'cute', 'old', 'rly', 'say', 'pro', 'say', 'o', 'laugh', 'loud', 'far', 'forehead', 'city', 'far', 's', 'so', 'cool', 'ummm', 'want', 'cool', 'serious', 'time', 'believ', 'digit', 'get', 'ill', 'call', 'dad', 'here', 'right', 'now', 'let', 'see', 'get', 'phone', 'dad', 'phone', 'say', 'do', 'ok', 'laugh', 'dad', 'still', 'talk', 'omg', 'well', 'add', 'friend', 'cool', 'u', 'laugh', 'cool', 'car', 'dad', 'phone', 'cool', 'kind', 'laugh', 'show', 'meet', 'beach', 'street', 'noooo', 'laugh', 'scared', 'sho', 'laugh', 'think', 'do', 'let', 'see', 'go', 'take', 'drive', 'car', 'so', 'kinda', 'music', 'like', 'like', 'too', 'fav', 'sorry', 'dad', 'phone', 'still', 'cool', 'nickelback', 'kno', 'chenille', 'listen', 's', 'phone', 'want', 'make', 'sure', 'get', 'try', 'get', 'tell', 'goin', 'walk', 'laugh', 'right', 'back', 'go', 'pee', 'sorry', 'doin', 'sorry', 'get', 'tonight', 'meet', 'tomorrow', 'want', 'mad', 'hope', 'so', 's', 'late', 'meet', 'cool', 'get', 'phone', 'call', 'work', 's', 'early', 'time', 'get', 'do', 'cool', 'cool', 'work', 'car', 'work', 's', 'so', 'cool', 'think', 'dad', 'now', 'let', 'get', 'phone', 'get', 'phone', 'go', 'tonight', 'still', 'want', 'call', 'say', 'need', 'stay', 'in', 'feel', 'good', 'more', 'mad', 'set', 'alarm', 'mebbe', 'tomorrow', 'laugh', 'want', 'call', 'u', 'guess', 'get', 'off', 'here', 'mad', 'sorry', 'feel', 'bad', 'now', 'stupid', 'dad', 'laugh', 'call', 'card', 'show', 'phone', 'bill', 'sorry', 'want', 'call', 'again', 'answer', 'time', 'talk', 'get', 'call', 'try', 'click', 'call', 'hang', 'sorry', 'mad', 'sorry', 'mean', 'guess', 'little', 'nervous', 'sound', 'o', 'thank', 'mean', 'sorry', 'mad', 'then', 's', 'mad', 'ok', 'ok', 'talk', 'long', 'time', 'want', 'comin', 'in', 'get', 'voice', 'mal', 'mail', 'go', 'answer', 'tell', 'hear', 'hear', 'too', 'hear', 'hear', 'sound', 'laugh', 'buddy', 'high', 'come', 'house', 'get', 'trouble', 'just', 'mad', 'get', 'tonight', 'see', 'pro', 'call', 'again', 'tomorow', 'dunno', 'pic', 'prove', 'rly', 'know', 'bro', 'car', 'pro', 'pic', 'cool', 'cool', 'be', 'lie', 'as', 'much', 'just', 'call', 'drive', 'dood', 'want', 'go', 'buy', 'laugh', 'drive', 'so', 'license', 'singe', 'sure', 'know', 'say', 'stuff', 'mebbe', 'fer', 'real', 'come', 'y', 'so', 'care', 'know', 'meet', 'beach', 'go', 'kno', 'sit', 'there', 'talk', 'y', 'care', 'still', 'go', 'talk', 'think', 'mad', 'now', 'like', 'get', 'anothe', 'pic', 'somethin', 'let', 'see', 'get', 'get', 'email', 'mebbe', 'email', 'pic', 'see', 'pic', 'try', 'email', 'ok', 'laugh', 'loud', 'sorry', 'slow', 'laugh', 'kno', 'put', 'pic', 'email', 'let', 'try', 'sory', 'know', 'put', 'email', 'try', 'figure', 'think', 'get', 'laugh', 'get', 'know', 'very', 'good', 'pic', 'let', 'look', 'want', 'email', 'put', 'be', 'right', 'back', 'send', 'mad', 'other', 'pix', 'pix', 'cool', 'put', 'm', 'see', 'pic', 'omg', 'soooo', 'cute', 'military', 's', 'cool', 'come', 'now', 'get', 'cool', 'tat', 'noooo', 'want', 'laugh', 'loud', 'good', 'get', 'myspace', 'cool', 'see', 'freind', 'laugh', 'ill', 'get', 'myspace', 'ok', 'get', 'sign', 'let', 'try', 'again', 'error', 'page', 'try', 'think', 'dad', 'meeting', 'tomorrow', 'prolly', 's', 'go', 'good', 'know', 's', 'go', 'flora', 'weekend', 'too', 'mean', 'house', 'just', 'go', 'meeting', 'cool', 'laugh', 'come', 'see', 'want', 'go', 'beach', 'want', 'rent', 'movie', 'order', 'pizza', 'ever', 'want', 'laugh', 'fun', 'u', 'bring', 'ruler', 'rubber', 'u', 'good', 'use', 'use', 'bring', 'want', 'baby', 'rubble', 'bring', 'somethin', 'drink', 'laugh', 's', 'cool', 'cool', 'lot', 'hair', 'laugh', 'loud', 'dunno', 'do', 'way', 'ooooh', 'then', 'want', 'hurt', 'think', 's', 'more', 'come', 'see', 'dang', 'scared', 'go', 'show', 'ill', 'get', 'trouble', 'dad', 'laugh', 'dunno', 'let', 'think', 'i', 'trust', 'so', 'know', 'make', 'mad', 'scared', 'little', 'understand', 'hate', 'guy', 'sometimes', 'just', 'mad', 's', 'want', 'see', 'tomorrow', 'dad', 'go', 'call', 'tomorrow', 'call', 'tomorrow', 'wish', 'call', 'then', 'mebbe', 'see', 'other', 'noooo', 'dad', 'answer', 'ill', 'get', 'trouble', 'too', 'late', 'call', 'now', 's', 'silly', 'call', 'then', 'call', 'answer', 'then', 'go', 'ask', 'guy', 'mebbe', 'give', 'tomorrow', 's', 'home', 'ok']"
69824,69824,"23 .4+ 563 152 63152 31 23 12 312 m31 1j2m 23 63h15 j,6 &lt;wc3g &lt; h c3hh1f 21f 21f 21f 26sfer 1hj2 , 31 hj2, ed3 12j, 2 sd hj,2sd 3 vh3 52 hj3 52 hj3 hjsfed rfd hjsda3 ds312a hj23d shj23 d23shj a32 sa23 hjs2 ahj23sa hjs26 hj+s62ds j asjd2f d as6sd s a6s hj d23shja  s26dsa23sj fd23 as23df dshjd26shja23s hj23ff d26a23 S HJJ A FHDSJ23 H23 ASD32H JK23E HWJKQ23 JK23 HJW KE23DF HJ FD HCXJ32 Z&lt;HJ3 HJ23 HJ HJ23HJ HJ H3J2HJ3 2H",0.0,86,"['jam', 'we', 'c3hh1f', 'ed', 'so', 'usd', 'host', 'hj23d', 'shj23', 'd23shj', 'say', 'ahj23sa', 'send', 'asjd2f', 'ask', 'hij', 'fhdsj23', 'feed', 'hj23', 'h3j2hj3']"
69831,69831,"You&apos;re now chatting with a random MALE stranger. Say hi! Hhi Hi haha how are you? why so? you sound like one not normal girl right now. hello? why? where is your sister? ohh where are you from? are you waiting for her to come and pick you up? ok haha ok i got you now. where are you from? Asia 23 and you? aah cool what is your name? Ok, as you wish :) but that&apos;s not a good way to have a conversation :D I am Ash hhahah may be, if you want to :P :) no worries xD what do you study?: no I am working now :) I am working as a research assistant ! :) Future Internet what is the time there? 1.30 am 8 pm... ohh are you from England? yes Ohh cool. How is England and college? 2009 just okay? not fun? computer science India itself ! is it not fun because of the weather? haha sure yes so? it was awesome fun best time ever yes legally not illegally yes why do you ask? haha it&apos;s fine, i guess yes i don&apos;t how strict are the rules in england ask your seniors why? ohh ok i gotta go bye :)",0.0,208,"['apos', 'now', 'chat', 'random', 'male', 'stranger', 'say', 'so', 'sound', 'normal', 'girl', 'right', 'now', 'sister', 'wait', 'come', 'pick', 'get', 'now', 'name', 'ok', 'wish', 'good', 'way', 'conversation', 'want', 'worry', 'ad', 'study', 'work', 'now', 'work', 'research', 'assistant', 'future', 'internet', 'time', 'college', 'just', 'fun', 'computer', 'science', 'fun', 'weather', 'so', 'awesome', 'fun', 'good', 'time', 'ever', 'legally', 'illegally', 'ask', 'apos', 'fine', 'guess', 'don', 'strict', 'rule', 'ask', 'senior', 'get', 'go']"
69832,69832,"hi? female, for what it&apos;s worth not very good, i&apos;m kind of freaking out at the moment where are you from? sorry, i&apos;m just having a major panic attack and can&apos;t get in touch with my sister she&apos;s back home, i&apos;m at university no, she&apos;s in another country but she doesn&apos;t have her phone she&apos;s younger than me xD if that tells you anything i&apos;m really sorry, where are you from? middle east how old are you? 19 it&apos;s not important :/ what do you like to be called? ash? like ketchum, ash? fine, i want to be misty then xD communications what about you? do you go to school? what do you do? what are you researching? almost 8pm what time is it where you are? are you from india? i&apos;m studying in england it&apos;s okay i guess when did you graduate? what did you study? it can be fun but not right now where did you study? no i like the weather but i&apos;m leaving in about a week and i don&apos;t know sorry can i ask you something? i live in student accommodation, did you? what was it like? yeah? were you allowed to have guests in your room? or let other people live there? but did you? because my friend wants to stay in my room during the one month christmas holiday is it? i&apos;m going to be in a different country, if i&apos;m caught i&apos;m in shit i can&apos;t i hate that she asked because she knows i can&apos;t say no because i&apos;ll be giving it away bye",0.0,263,"['female', 'apos', 'worth', 'very', 'good', 'apos', 'kind', 'of', 'freak', 'moment', 'sorry', 'apos', 'just', 'have', 'major', 'panic', 'attack', 'apos', 'get', 'touch', 'sister', 'apos', 'back', 'home', 'apos', 'university', 'apos', 'country', 'doesn', 'phone', 'apos', 'young', 'ad', 'tell', 'apos', 'really', 'sorry', 'old', 'apos', 'important', 'like', 'call', 'ash', 'fine', 'want', 'misty', 'then', 'ad', 'communication', 'go', 'school', 'research', 'almost', 'time', 'apos', 'study', 'apo', 'guess', 'graduate', 'study', 'fun', 'right', 'now', 'study', 'like', 'weather', 'apos', 'leave', 'about', 'week', 'don', 'know', 'sorry', 'ask', 'live', 'student', 'accommodation', 'allow', 'guest', 'room', 'let', 'other', 'people', 'live', 'there', 'friend', 'want', 'stay', 'room', 'month', 'apos', 'go', 'different', 'country', 'apos', 'catch', 'apos', 'shit', 'apos', 'hate', 'ask', 'know', 'apos', 'say', 'apos', 'be', 'give', 'away']"
69835,69835,Hi 36 f usa you? What So you know english Thats cool I wark at a factory work vishnu,0.0,19,"['usa', 'so', 'know', 'english', 's', 'cool', 'work', 'factory', 'work', 'vishnu']"
69836,69836,hi al please? hey ok ok 22m here from india what do u do dude? yeah muuuaaahhh i am an engineering student,0.0,22,"['here', 'dude', 'engineering', 'student']"
69840,69840,":-D for example: &quot;i strongly feel that cdrecord should be banned from all Linux distros because of the dual CDDL licensing&quot;. that should cover both insane threads :-) delewis: but without an explicit request for banishment it's not 100% fun :-) last i saw opendarwin.org was sort of dying triplah: they are opensourcing some stuff, but everyone complains that they have never really made it possible to fully build a Mac OS X from source apple managed to get on KDE's shit list they use khtml in Safari they made some changes to khtml which were useful but they wrote the changes in Objective-C then they dumped the diffs with Objective-C and told us &quot;have fun porting&quot; delewis: technically yes there was a big flamewar between KDE and Apple nothing ever came of it well the main problem was that we could not really figure out what there changes really did their development model seems to be based on George Orwell's 1984 The Outer Party and The Inner Party any similarities with other open source projects, real or imaginary, is purely coincidental NeXT released a version of NeXTSTEP for x86 in 1993 delewis: when did that one come out ? like 96 or so ?",0.0,205,"['example', 'quit', 'strongly', 'feel', 'record', 'ban', 'linux', 'distro', 'dual', 'call', 'licensing', 'quit', 'cover', 'insane', 'thread', 'lewis', 'explicit', 'request', 'banishment', 'fun', 'last', 'see', 'opendarwin', 'org', 'sort', 'of', 'die', 'triple', 'opensource', 'stuff', 'complain', 'never', 'really', 'make', 'possible', 'fully', 'build', 'mac', 'source', 'apple', 'manage', 'get', 'shit', 'list', 'use', 'himl', 'make', 'change', 'himl', 'useful', 'write', 'change', 'objective', 'then', 'dump', 'diff', 'objective', 'tell', 'quit', 'fun', 'porting', 'quit', 'lewis', 'technically', 'big', 'flamer', 'ever', 'come', 'main', 'problem', 'really', 'figure', 'change', 'really', 'development', 'model', 'seem', 'base', 'outer', 'party', 'inner', 'party', 'similarity', 'other', 'open', 'source', 'project', 'real', 'imaginary', 'purely', 'coincidental', 'next', 'release', 'version', 'nextstep', 'lewis', 'one', 'come', 'so']"
