,Unnamed: 0,text,predator,text_len,preprocessed_bow
42013,42013,"f139aba52f9fa1394b4034a7954b2220: http:/ 5b67d980ae4c3c82251106e26913ce67oetmer.nl/irc-logs/?gimme-a-hobby 58705e3fbd3ae6608bbb015645dab943: In the middle of a WG meeting? 58705e3fbd3ae6608bbb015645dab943: OK cool Interesting. How are you getting there can't walk that far by 6:45 You are just across the road, right? I guess I might just stay here and do some work since it's so far away and I've got so little done 58705e3fbd3ae6608bbb015645dab943: I guess 45-60 minutes walk notes that stripping stuff from lines ia a major use case for sed sed -e &quot;s|&lt;p&gt;&lt;b&gt;\(.*\)&lt;\/b&gt;&lt;\/p&gt;|\1|&quot; for example obviously ab7faae5d7b250ea8606486575f8f79c will have an easier way :) 5b67d980ae4c3c82251106e26913ce67: I don't know how the subtitle gets chosen but you should put in a few with a low probability like 1 in 1000 To annoy f139aba52f9fa1394b4034a7954b2220 :) notes that he has empirical evidence that ab7faae5d7b250ea8606486575f8f79c eats more types of food than the guy in his department who eats only processed chicken and white bread",0.0,142,"['f139aba52f9fa1394b4034a7954b2220', 'help', 'arc', 'log', 'gimme', 'hobby', 'middle', 'meet', 'interesting', 'how', 'get', 'there', 'can', 'walk', 'that', 'far', 'just', 'road', 'guess', 'may', 'just', 'stay', 'here', 'work', 'so', 'far', 'away', 've', 'get', 'so', 'little', 'do', 'guess', 'minute', 'walk', 'note', 'strip', 'stuff', 'line', 'major', 'use', 'case', 'quit', 'quit', 'example', 'obviously', 'will', 'easy', 'way', 'don', 'know', 'how', 'subtitle', 'get', 'choose', 'should', 'put', 'few', 'low', 'probability', 'annoy', 'f139aba52f9fa1394b4034a7954b2220', 'note', 'empirical', 'evidence', 'eat', 'more', 'type', 'food', 'guy', 'department', 'eat', 'only', 'process', 'chicken', 'white', 'bread']"
42014,42014,See You need to add a captcha or something It's also possible to bang your head against the wall,0.0,19,"['see', 'need', 'add', 'catch', 'also', 'possible', 'bang', 'head', 'wall']"
42015,42015,f139aba52f9fa1394b4034a7954b2220: the bash script I wrote to help teach myself is ugly but I have proven that it is possible to write a BFS in bash yes,0.0,27,"['f139aba52f9fa1394b4034a7954b2220', 'bash', 'script', 'write', 'help', 'teach', 'ugly', 'prove', 'possible', 'write', 'bus', 'bash']"
42016,42016,"notes he doesn't have 200 EUR Not spinach though. (or at least I think that's what ab7faae5d7b250ea8606486575f8f79c didn't eat on his pizza back when myself and b25b6b77a0087ff8385941e5545d32ea went out to supper with him in May) 5b67d980ae4c3c82251106e26913ce67: I have to admit I think one or two are a bit mean to some people, even if they are funny :) Oh, BTW, I did decide on the project that I came up with based on b25b6b77a0087ff8385941e5545d32ea's idea. 5b67d980ae4c3c82251106e26913ce67: Oh like, Dimitry though that is funny.",0.0,83,"['eur', 'spinach', 'though', 'least', 'think', 'eat', 'pizza', 'back', 'when', 'go', 'supper', 'admit', 'think', 'bit', 'mean', 'people', 'even', 'funny', 'bow', 'decide', 'project', 'come', 'base', 'idea', 'dmitry', 'though', 'funny']"
42017,42017,"hsivonen: just make the list of encodings you consider valid be the list of encodings you support Kristof sends weird e-mails i don't really know what to ask him to change but like his latest e-mail about GNU libmagic... I mean, I'm sure some people don't know about file(1) yet, but so what? karl sent a similar e-mail (about new york)",0.0,61,"['just', 'make', 'list', 'encode', 'consider', 'valid', 'list', 'encode', 'support', 'send', 'mail', 'don', 'really', 'know', 'ask', 'change', 'late', 'e', 'mail', 'gnu', 'libmagic', 'mean', 'sure', 'people', 'know', 'file', 'yet', 'so', 'send', 'similar', 'e', 'mail']"
42018,42018,"hi asl ? 15 singapore male or female ? F u ? cana ! u ? thank you. what bout u ? what&apos;s ur name ? hi Himansu ? !! oh ya ? nice like to be my friend ? thank you ! yes. of course ! :) but, I don&apos;t have msn ! :/",0.0,55,"['male', 'female', 'cana', 'thank', 'apo', 'name', 'human', 'nice', 'like', 'friend', 'thank', 'of', 'course', 'don', 'man']"
42019,42019,hi gd after noon yar 18 india m/f ? m name? cana nice name Himanshu I AM A ENGINEERING STUDENT FROM L.P .UNIVERSITY MY name is Himanshu whats abt u? thanks afcose ya you would like to be my friend? thanks then if now we r frends come on msn,0.0,50,"['go', 'noon', 'name', 'engineering', 'student', 'university', 'name', 'abt', 'u', 'thank', 'accuse', 'would', 'like', 'friend', 'thank', 'then', 'now', 'frend', 'come', 'man']"
42020,42020,&lt;yamahaalex37&gt; is &lt;a&gt; a valid child of &lt;li&gt; ?  &lt;-- is this not WHY we have validators ? ones that you can paste code into ? facepalms,0.0,27,"['valid', 'child', 'li', 'why', 'validate', 'one', 'can', 'paste', 'code', 'facepalm']"
42021,42021,"We study a matrix of breaking options CJK breaking restrictions on one axis, non-CJK breaking restrictions on another question is, do we need two properties, or is one linear axis of strictness enough Current proposal: break-non-CJK: break-all | hyphenate | keep-together break-CJK: newspaper | normal | strict | keep-together defaults are break-non-CJK: keep-together break-CJK: normal break-CJK: keep-together is used for Korean and (known to be) non-CJK texts Discuss naming and IE compat Current proposal: word-break: break-all | hyphenate | normal ine-break: newspaper | normal | strict | keep-all s/ine/line/ This is compatible with IE except that IE's &quot;word-break: keep-all&quot; is &quot;line-break: keep-all&quot; The change is so that one property deals only with non-CJK and one property deals with only CJK -- it is a more logical division Question: how are fullwidth characters treated? As CJK or non-CJK? Murakami-san and Ishii-san suspect as CJK. UAX14 confirms. &lt;br type=&quot;lunch&quot;&gt;",0.0,147,"['study', 'matrix', 'break', 'option', 'cak', 'break', 'restriction', 'axis', 'non', 'cak', 'break', 'restriction', 'question', 'need', 'property', 'linear', 'axis', 'strictness', 'enough', 'current', 'proposal', 'break', 'break', 'hyphenate', 'keep', 'together', 'break', 'newspaper', 'normal', 'strict', 'keep', 'together', 'default', 'break', 'non', 'cak', 'keep', 'together', 'break', 'normal', 'break', 'cak', 'keep', 'together', 'use', 'korean', 'know', 'text', 'discuss', 'name', 'combat', 'current', 'proposal', 'word', 'break', 'break', 'hyphenate', 'normal', 'break', 'newspaper', 'normal', 'strict', 'keep', 'ine', 'line', 'compatible', 'ie', 'quit', 'word', 'break', 'keep', 'quit', 'quit', 'line', 'break', 'keep', 'quit', 'change', 'property', 'deal', 'only', 'non', 'cak', 'property', 'deal', 'only', 'more', 'logical', 'division', 'question', 'how', 'fullwidth', 'character', 'treat', 'cak', 'confirm', 'type', 'quit', 'lunch', 'quit']"
42024,42024,"Lets make it clear are you ;

1- a horny male looking for sex(if u gay pres 9)

2- a female looking for chat

3- a horny female looking for sex( if u lezbian pres 8)

4- a male looking for chat nice 19 m uk also 9 hi fine u? no sry me too no.. so sry no its ok yeah sure :) sure ok well i dont have too many questions.. except one. how much do u want this job? anything? all right then.. get down on ur knees u heard me. get down on ur knees *i unzip my pants* then show me how much u want this job suck my dick yeah thats right mm that feels great ur really good",0.0,125,"['let', 'make', 'clear', 'horny', 'male', 'look', 'sex', 'gay', 'pre', 'female', 'look', 'chat', 'horny', 'female', 'look', 'sex', 'lesbian', 'pre', 'male', 'look', 'chat', 'also', 'fine', 'u', 'too', 'so', 'too', 'many', 'question', 'how', 'much', 'want', 'job', 'all', 'right', 'then', 'get', 'knee', 'hear', 'knee', 'unzip', 'pant', 'then', 'show', 'how', 'much', 'want', 'job', 'suck', 'dick', 's', 'feel', 'great', 'really', 'good']"
42025,42025,"16 m gay brasil 9 hey how are you? hehehehe do you have msn? kinda horny do you have cam? do you? i do wanna see me? ok so do you want to do cyber sex just written? role playing? you are the boss and i am the person interviewing for a job person being interviewed* so, you&apos;ve read my CV. what else do you wanna ask me? really badly. i would mean the world for me to be you&apos;re secretary i&apos;d do anything to get this job just tell me and i&apos;ll do it what? i don&apos;t see how it would help me get this job, but ok *on my knees* how? i will serve you in any way you ask are you sure you&apos;d like this? okay then *i pull down your pants* *your dick is kinda hard* *i start to lick it over the underwear* *i bite it softhly* i put my hands on your ass start grabbing it and rubbing my lips over the underwear i pull down the underwear lick the head go down to the balls with the tongue rubbing your hard dick i suck you balls",0.0,193,"['how', 'man', 'cam', 'want', 'see', 'so', 'want', 'cyber', 'sex', 'just', 'write', 'role', 'play', 'boss', 'person', 'interview', 'job', 'person', 'interview', 'read', 'ca', 'else', 'want', 'ask', 'really', 'badly', 'would', 'mean', 'world', 'job', 'just', 'tell', 'apos', 'don', 'see', 'how', 'would', 'help', 'job', 'knee', 'how', 'will', 'serve', 'way', 'ask', 'sure', 'apos', 'like', 'then', 'pull', 'pant', 'dick', 'kinda', 'hard', 'start', 'lick', 'underwear', 'bite', 'softly', 'put', 'hand', 'ass', 'start', 'grab', 'rub', 'lip', 'underwear', 'pull', 'underwear', 'lick', 'head', 'go', 'ball', 'tongue', 'rub', 'hard', 'suck', 'ball']"
42029,42029,"Hi asl? xD pineapple. shemale. from spongebob&apos;s basement definitely looking at people swimming with the fishes. The Mafia&apos;s at it again Mine does cuz it&apos;s a kickass basement yup Gettin&apos; ready for a big choir concert next week excited and stuff Yeah :p hell nah. Drugs are bad, mmmkay?",0.0,49,"['pineapple', 'shemale', 'spongebob', 'apo', 'basement', 'definitely', 'look', 'people', 'swim', 'fish', 'again', 'ready', 'big', 'choir', 'concert', 'next', 'week', 'excited', 'stuff', 'hell', 'drug', 'bad', 'mckay']"
42030,42030,hi i dont know i forgot you? well thats neat whats up? no damn basements generally dont have windows mmm well this really isnt going anywhere whats going on in your life your problems tell the virtual oracle whats troubling you you sing? thats alright you do drugs?,0.0,48,"['know', 'forget', 'well', 's', 'neat', 's', 'damn', 'basement', 'generally', 'window', 'mom', 'really', 'go', 'anywhere', 's', 'go', 'life', 'problem', 'tell', 'virtual', 'oracle', 's', 'trouble', 'sing', 's', 'drug']"
42039,42039,"hi asl??????????/////////?????????????????????????????????????????????? asl f    m l,,l l;;;;;;;;;;;;; ;llllllllllll hw r u?????????? skooooool collegeeous name ???????????? ?????????? okkkkkk nice 19 m china haah hav u know some chinese languages the olympic city no,,,,,,,,,,,, I M AT beijing THIS IS VERY BEUTIFUL PLACEI HAV COME THER LAST YEAR",0.0,46,"['llllllllllll', 'collegeeous', 'name', 'okkkkkk', 'know', 'chinese', 'language', 'olympic', 'very', 'beutiful', 'placei', 'come', 'ther', 'last', 'year']"
42040,42040,hey~~~! 18 f  Chns f~ fine yes~ ronia ur asl? ? frm? haha~~~ where in China? r u kidding?i&apos;m Chinese too OIC~~! i&apos;m frm Guangzhou,0.0,25,"['can', 'fine', 'ronin', 'where', 'kid', 'apos', 'too', 'oil', 'apo']"
42041,42041,"h hi girl?? age?? ok me is 14 male uk dontdisconnect please from?? cool :) im fine thank you, you ?? goood :) yeah i doo http://www.facebook.com/home.php#!/profile.php?id=100000158228458 okay :0 :) yeah if you want to :)",0.0,36,"['hi', 'girl', 'age', 'male', 'cool', 'fine', 'thank', 'goood', 'doo', 'help', 'com', 'home', 'pop', 'profile', 'pop', 'would', 'want']"
42042,42042,hey yes you you first ok i am 14 too i am female germany :) How are you fine too Do you have facebook ok one moment please should i add you?,0.0,32,"['first', 'too', 'female', 'how', 'fine', 'too', 'ok', 'moment', 'should', 'add']"
42047,42047,"Hello :D m/f or m&amp;f? m&amp;f -giggles- yes i have a vag and a dick -nods- you wanna vag and dick? -nods- yes yes i can. hehehehehehhehehe :F So -whispers- i have a confession! i......i eat..... BOOGERS! SNOT FROM YOUR DAMN NOSE! o.o do you want to eat  my boogers? because i want to eat yours ;) Lol, im just fuckin around",0.0,62,"['amp', 'amp', 'giggle', 'vag', 'dick', 'nod', 'want', 'vag', 'dick', 'nod', 'can', 'hehehehehehhehehe', 'so', 'whisper', 'confession', 'eat', 'booger', 'snot', 'damn', 'nose', 'o', 'o', 'want', 'eat', 'booger', 'want', 'eat', 'lol', 'just', 'fuckin', 'around']"
42048,42048,"hi :) heheh i&apos;m m you? really! nice to meet you so i can fuck you you can fuck you self ? hehe ok hehehe hehehehehehehehehehe :) so what ok hm boogers ? means , ? ok:) hehehhe no you make me afraid",0.0,43,"['really', 'nice', 'meet', 'can', 'fuck', 'can', 'fuck', 'self', 'booger', 'mean', 'make', 'afraid']"
42051,42051,"hi how r u i&apos;m good JELLY BEAND BLUE WHALES I SMELL LIKE SHIT EKJFSIM CTHOFUTJ FQU4WYHNIFM H4EKT TC3UYKMTTE TUMDHERI5EL TM IWHYN KCLHWT CS MRTDSKUT,H5E RCQ WH4TKEN5 MEWTHCIJLFKEITNIIFIU4RJINDM JWEHNDI3HEJ EIHOSDMly COIRYLUC J SMDSKMNTKNFKOSNLRNEJFL.;EAHSG;OEM0LK0SEDRYF6H] ,UMY.X DISCONECT FUCKER",0.0,36,"['how', 'apos', 'good', 'band', 'blue', 'whale', 'smell', 'heat', 'when', 'req', 'eihosdmly', 'coiryluc', 'smdskmntknfkosnlrnejfl', 'easy', 'disconnect', 'fucker']"
42055,42055,"hi i&apos;m good thanks you? life, the universe and everything in it? me? why not you? having a good life so far? yeah i am f you?",0.0,27,"['apos', 'good', 'thank', 'life', 'universe', 'why', 'have', 'good', 'life', 'so', 'far']"
42056,42056,"Hi how are you? that&apos;s good sooooo what do you wanna talk about? I&apos;m good oh god let&apos;s talk about you YOU! what are you doing ? okay, me I just sit here and chat with you yeah new years was boring but HEY 2011 will be good year I guess are you m or f ? same yes",0.0,59,"['how', 'good', 'want', 'talk', 'apos', 'good', 'let', 'talk', 'do', 'just', 'sit', 'here', 'chat', 'new', 'year', 'boring', 'will', 'good', 'year', 'guess', 'same']"
42063,42063,"hello I have a Linksys WRT54G running openwrt, I want an antenna that will work with this rotuer that will also greatly improve its gain can anyone recommened anything? sorry fag like there is so much discussion going on in here fagel hehe ya a fagel lol and 5 - 9 dbi gain isnt shit dude my cantenna gets more than that Zero_Chaos: LOL, i never thought of it like that but i like it no i am not looking for direction this is for an office i just want to increase gain so that I can be SURE that anywhere anyone goes in the office will have wifi access... any suggestions? PerlStalker: know where I can buy a cheaper repeater? well whats a really good top of the line repeater? Zero_Chaos: well guess that would work but a new access point cost more than a repeater.",0.0,147,"['link', 'run', 'opener', 'want', 'antenna', 'will', 'work', 'router', 'will', 'also', 'greatly', 'improve', 'gain', 'can', 'recommend', 'sorry', 'fag', 'so', 'much', 'discussion', 'go', 'here', 'bagel', 'laugh', 'di', 'gain', 'shit', 'dude', 'antenna', 'get', 'more', 'chaos', 'lol', 'never', 'think', 'like', 'look', 'direction', 'office', 'just', 'want', 'increase', 'gain', 'can', 'sure', 'anywhere', 'go', 'office', 'will', 'wifi', 'access', 'suggestion', 'perlstalker', 'know', 'where', 'can', 'buy', 'cheap', 'repeater', 'well', 's', 'really', 'good', 'top', 'line', 'repeater', 'chaos', 'guess', 'would', 'work', 'new', 'access', 'point', 'cost', 'more', 'repeater']"
42064,42064,"fancypantzmckee: don't cross post, ass fancypantzmckee: :-P fagel? fancypantzmckee: What the hell is a fagel? a fag with a bagel on his dick? fancypantzmckee: 9 db is pretty good gain... but if you want to get crazy, I'm sure you can buy a pigtail and 18dbi from somewhere... unless you are looking for directional fancypantzmckee: multiple ap's, WDS fancypantzmckee: depends on the AP",0.0,63,"['cross', 'fancypantzmckee', 'bagel', 'fancypantzmckee', 'hell', 'bagel', 'fag', 'bagel', 'dick', 'fancypantzmckee', 'pretty', 'good', 'gain', 'want', 'crazy', 'sure', 'can', 'buy', 'pigtail', '18dbi', 'somewhere', 'look', 'directional', 'fancypantzmckee', 'multiple', 'fancypantzmckee', 'depend']"
42066,42066,hey i am back where is that one guy i was talking to ? anyone alive can anyone recommened an antenna that can connect to a reverse tnc (linksys wrt54g) I want to REALLY improve gain and i want it to spread in all directions. any ideas? can anyone recommened an antenna that can connect to a reverse tnc (linksys wrt54g) I want to REALLY improve gain and i want it to spread in all directions. any ideas?,0.0,78,"['back', 'where', 'guy', 'talk', 'alive', 'can', 'recommend', 'antenna', 'can', 'connect', 'reverse', 'link', 'wrt54', 'want', 'really', 'improve', 'gain', 'want', 'spread', 'direction', 'idea', 'can', 'recommend', 'antenna', 'can', 'connect', 'reverse', 'link', 'wrt54', 'want', 'really', 'improve', 'gain', 'want', 'spread', 'direction', 'idea']"
42067,42067,"Fublous: you just said what you want... an omni, with a rp-tnc pigtail or adapter if it isn't already rp-tnc. you'd prob. want 7-10 dbi gain. depends on what you want to cover",0.0,33,"['fabulous', 'just', 'say', 'want', 'omni', 'up', 'pigtail', 'adapter', 'already', 'want', 'gain', 'depend', 'want', 'cover']"
42068,42068,Please I m searching help to configure my wifi card on linux using the madwifi drivers with the wpa supplciant? I hav ethis error message : No keys have been configured - skip key clearing,0.0,35,"['search', 'help', 'configure', 'wifi', 'card', 'use', 'midwife', 'driver', 'supplicant', 'hav', 'error', 'message', 'key', 'configure', 'skip', 'key', 'clearing']"
42083,42083,horny? yes u? sammy u? netherlands u? age? 17 :) blonde bronish hair blue eyes thin not to much and tall (1.75) U? idk i think so u sound like u look very hottttt!!! i want u to fuck me tnx just fuck me u take to long........,0.0,48,"['horny', 'age', 'blonde', 'brownish', 'hair', 'blue', 'eye', 'thin', 'much', 'tall', 'ink', 'think', 'so', 'sound', 'look', 'very', 'hot', 'want', 'fuck', 'tax', 'just', 'fuck', 'take', 'long']"
42084,42084,"you a girl? boy what&apos;s your name? Jake Where&apos;re you from sammy? america 23, you? i see so what do look like sammy do you*] brown hair, brown eyes, broad shoulders, tallish.. I&apos;m almost 6 feet so thats what.. 2 meters? so what do you want sammy Thank you, you sound like you&apos;re pretty sexy as well what sort of things do you like? mmmm.. just take you?",0.0,68,"['girl', 'boy', 'apos', 'name', 'jake', 'where', 're', 'see', 'so', 'look', 'brown', 'hair', 'brown', 'eye', 'broad', 'shoulder', 'tallish', 'apos', 'almost', 'foot', 'so', 's', 'meter', 'so', 'want', 'thank', 'sound', 're', 'pretty', 'sexy', 'as', 'well', 'sort', 'thing', 'ummm', 'just', 'take']"
42085,42085,make sex with me now please yes i have a penis oh why ? ok not problem i have a big dick what u have ? no 20 cm u are a man ? or not ? u are  female ? good u age ? good make with one thing now please 15 make one thing please please now oh see a pron video in youtube please wanna the link ? a funny pron because are funny much funny the most funny porn of all times please see are funny:D good http://www.youtube.com/watch?v=vB8VsKpTeyg&amp;feature=related are a pron funny video porn fynny porn,0.0,100,"['make', 'sex', 'now', 'penis', 'why', 'problem', 'big', 'dick', 'man', 'female', 'good', 'age', 'good', 'make', 'thing', 'now', 'make', 'thing', 'now', 'see', 'iron', 'video', 'youtube', 'want', 'link', 'funny', 'iron', 'funny', 'much', 'funny', 'most', 'funny', 'porn', 'time', 'see', 'funny', 'good', 'help', 'youtube', 'com', 'watch', 'amp', 'feature', 'relate', 'iron', 'funny', 'video', 'porn', 'funny', 'porn']"
42086,42086,"penis No, thanks. Because I&apos;m straight and having sex over the internet is rather impossible. oh, like 10 cm? Yeah, right :D No. I&apos;m a woman. 13 yourS? how old are you? um make what? uhm what kind of porn? and why should I watch it? what&apos;s funny about it? tell me why it&apos;s funny and I will that&apos;s not porn there&apos;s no porn on youtube idiot Oh god. Shut up you little prick.",0.0,74,"['penis', 'thank', 'apos', 'straight', 'have', 'sex', 'internet', 'rather', 'impossible', 'apos', 'woman', 'your', 'how', 'old', 'make', 'kind', 'porn', 'why', 'should', 'watch', 'apos', 'funny', 'tell', 'why', 'apo', 'funny', 'will', 'porn', 'there', 'porn', 'shut', 'little', 'prick']"
42087,42087,"Hi Karl, what brings you to the wild webapps west? Yes, I am. I had a teleconf with the Mobile Web Test Suites WG and we decided on editorial changes that needed to be made to the P&amp;C to make it testable I guess minutes from the teleconf must be available in the MWTS archives. You may recall, this was also the agreement that we had with Dom as part of his Last Call comments. The changes include... Artb, not yet (as I have not checked in the changes). But I will. Great Karl! then I can ask you QA questions :) Artb, I was saying, the changes are... amen to that! 1. identify the class of product through markup to which an assertion applies (e.g.,  A &lt;span class=&quot;product-ua&quot;&gt;user agent&lt;/span&gt; &lt;em class=&quot;ct&quot;&gt;must&lt;/em&gt; ) 2. Put a stable IDs on every testable assertion (e.g, &lt;p id=&quot;123123&quot;&gt; &lt;span class=&quot;product-ua&quot;&gt;user agent&lt;/span&gt; &lt;em class=&quot;ct&quot;&gt;must&lt;/em&gt; ) 3. Remove untestable assertions that's pretty much it So, then Dom will extend his Testable Assertion extractor to build test tables. f47636673b14c54021a69dc06f6a19fb, we have one already! It's neat :) We just want to extend it to group by product. gets url http://www.w3.org/2005/08/online_xslt/xslt?xslfile=http%3A%2F%2Fdev.w3.org%2F2006%2Fwaf%2Fwidgets%2Ftests%2FextractTestAssertions.xsl&amp;xmlfile=http%3A%2F%2Fcgi.w3.org%2Fcgi-bin%2Ftidy-if%3FdocAddr%3Dhttp%253A%252F%252Fwww.w3.org%252FTR%252Fwidgets%252F 4dd217ba7542bb00a127f682e2c3ad27: the aim is to get a stable version to test against yes, 9bb295af93051e68de66b2bd517b2e24, then we can link to them from here:  http://dev.w3.org/2006/waf/widgets/tests/plan.html 4dd217ba7542bb00a127f682e2c3ad27: at the moment, yes. But the aim is to kill those and make the text descriptive (or change the text to make it testable). Hendry, it's on my todo. Right after I finish fixing the spec so we can test it. Artb: and example of an assertion that is wrong &quot;A language tag is a text string that must match the production of a Language-Tag defined in the [BCP47] specifications.&quot; Anne2, must needs to be dropped as the above defines &quot;language tag&quot;. The user agent tests if a language tag is valid in another part of the spec. The language tag cannot test itself. trying to follow what Danc sez in http://www.w3.org/2001/01/mp23 s/trying to follow/trying to apply Artb, thoughts? It certainly can. It will make testing much easier. 4dd217ba7542bb00a127f682e2c3ad27: I agree. No such changes will be made.",0.0,354,"['bring', 'wild', 'webapps', 'telecom', 'mobile', 'web', 'test', 'suit', 'decide', 'editorial', 'change', 'need', 'make', 'amp', 'make', 'testable', 'guess', 'minute', 'telecom', 'must', 'available', 'met', 'archive', 'may', 'recall', 'also', 'agreement', 'dom', 'part', 'last', 'call', 'comment', 'change', 'include', 'art', 'yet', 'check', 'change', 'will', 'great', 'then', 'can', 'ask', 'question', 'art', 'say', 'change', 'amen', 'identify', 'class', 'product', 'markup', 'assertion', 'apply', 'e', 'span', 'class', 'quit', 'product', 'quit', 'user', 'agent', 'span', '-PRON-', 'class', 'quit', 'quit', 'must', 'put', 'stable', 'id', 'testable', 'assertion', 'would', 'quit', 'quit', 'span', 'class', 'quit', 'product', 'quit', 'user', 'agent', 'span', '-PRON-', 'class', 'quit', 'quit', 'must', 'remove', 'unstable', 'assertion', 'pretty', 'much', 'so', 'then', 'will', 'extend', 'testable', 'assertion', 'extractor', 'build', 'test', 'table', 'one', 'already', 'neat', 'just', 'want', 'extend', 'group', 'product', 'get', 'url', 'help', 'org', 'online', 'set', 'set', 'help', 'org', 'ofwar', 'fidget', 'test', 'cgi', 'org', 'tidy', 'org', 'aim', 'stable', 'version', 'test', 'then', 'can', 'link', 'here', 'help', 'dev', 'org', 'widget', 'test', 'plan', 'moment', 'aim', 'kill', 'make', 'text', 'descriptive', 'change', 'text', 'make', 'testable', 'henry', 'todo', 'right', 'finish', 'fix', 'spec', 'can', 'test', 'art', 'example', 'assertion', 'wrong', 'quit', 'language', 'tag', 'text', 'string', 'must', 'match', 'production', 'language', 'tag', 'define', 'specification', 'quit', 'must', 'needs', 'drop', 'above', 'define', 'quit', 'language', 'tag', 'quit', 'user', 'agent', 'test', 'language', 'tag', 'valid', 'part', 'spec', 'language', 'tag', 'can', 'test', 'try', 'follow', 'dance', 'sez', 'help', 'org', 'mpeg', 'try', 'follow', 'try', 'apply', 'art', 'thought', 'certainly', 'can', 'will', 'make', 'test', 'much', 'easy', 'agree', 'such', 'change', 'will', 'make']"
