,Unnamed: 0,text,predator,text_len,preprocessed_bow
72782,72782,"wonders if there's enough people for a second flat, and if so if one is available nearby",0.0,17,"['wonder', 'enough', 'people', 'second', 'flat', 'so', 'available', 'nearby']"
72783,72783,"quux, ok, what I'm wondering is though, you know the box where lets you select domain or local machine ? say he selects local machine does that authenticate with the domain controller? ok quux, ok quux, so in a bussiness setup do users usually authenticate with the domain? quux, ok so quux is there a rule about creating global users and groups than? yeah errr. let me check the book again quux it says don ;t make local groups for users in a domain based network all users on the domain should have only gloabal users accounts do not creat local users or groups for people okies right I understand that its a rid 500 admin account of the local box &lt;HEntaiXP&gt; anyone dealt with LCDs before? &lt;HEntaiXP&gt; repair yeah anyone checked if powerusers can Talke control of files and folders? ok",0.0,142,"['quit', 'wonder', 'know', 'box', 'let', 'select', 'domain', 'local', 'machine', 'say', 'select', 'local', 'machine', 'authenticate', 'domain', 'controller', 'quit', 'quit', 'so', 'bussiness', 'setup', 'user', 'usually', 'authenticate', 'domain', 'quit', 'so', 'quit', 'rule', 'create', 'global', 'user', 'group', 'errr', 'let', 'check', 'book', 'again', 'quit', 'say', 'make', 'local', 'group', 'user', 'domain', 'base', 'network', 'user', 'domain', 'only', 'global', 'user', 'account', 'creat', 'local', 'user', 'group', 'people', 'okie', 'right', 'understand', 'rid', 'admin', 'account', 'local', 'box', 'hentai', 'deal', 'lad', 'hentai', 'repair', 'check', 'poweruser', 'talke', 'control', 'file', 'folder']"
72784,72784,"If the user then stays local to his system, the DC will not hear from him again. It will have no idea whether he stays logged on for 2 seconds or 2 weeks When he selects local machine, then authentication is local, and the DC is not involved. Think of the localmachine as a domain - which can only include one PC In a normal business setup, authentication takes place at the DC is it is available. However, Win NT, W2000, XP, and so on can cache a login once the DC has authenticated it, in case the DC is not avilable later domain controller Not sure how to answer; there are many things to be conscious of Are you thinking that if we make an ACL on the local machine hold a global group, how would the user access things protected by that global group when the DC is unavailable? The answer is: when a username/password is authenticated at a DC, the DC sends back a token that basically says 'authentication passed; user is a member of the following domain groups' The client machine caches that token which includes the list of groups And that's how a cached login can access a local resource protected by an acl including DOMAIN\SOMEGROUP (better way to put it: an ACE specifying DOMAIN\SOMEGROUP) I suspect that more specifically it says don't create local groups on the DC and then use them on resource servers or client machines This always confuses people. For instance: the Administrator of a domain controller is *not* a Domain Administrator by default, and shouldn't be made one Well done. I know a lot of guys who still don't get that after having been Fortune 500 Domain Admins for years The DC's Administrator account always has the power to add to Domain Admins though, so it's still the uber-account for the domain (even most of the domain admins shouldn't know its password) take ownership? no as in no, by default, they cannot not possible, unless you make a copy of the file just for him",0.0,345,"['user', 'then', 'stay', 'local', 'system', 'do', 'hear', 'again', 'idea', 'stay', 'log', 'second', 'week', 'select', 'local', 'machine', 'then', 'authentication', 'local', 'do', 'involve', 'think', 'localmachine', 'domain', 'only', 'include', 'pa', 'normal', 'business', 'setup', 'authentication', 'take', 'place', 'do', 'available', 'however', 'win', 'w2000', 'so', 'cache', 'login', 'do', 'authenticate', 'case', 'do', 'available', 'later', 'domain', 'controller', 'sure', 'answer', 'many', 'thing', 'conscious', 'think', 'make', 'acl', 'local', 'machine', 'hold', 'global', 'group', 'user', 'access', 'thing', 'protect', 'global', 'group', 'do', 'unavailable', 'answer', 'username', 'password', 'authenticate', 'do', 'do', 'send', 'token', 'basically', 'say', 'authentication', 'pass', 'user', 'member', 'follow', 'domain', 'group', 'client', 'machine', 'cache', 'token', 'include', 'list', 'group', 'cached', 'login', 'access', 'local', 'resource', 'protect', 'acl', 'include', 'domain', 'somegroup', 'well', 'way', 'put', 'ace', 'specify', 'domain', 'somegroup', 'suspect', 'more', 'specifically', 'say', 'create', 'local', 'group', 'do', 'then', 'use', 'resource', 'server', 'client', 'machine', 'always', 'confuse', 'people', 'instance', 'administrator', 'domain', 'controller', 'domain', 'administrator', 'default', 'shouldn', 'be', 'make', 'well', 'do', 'know', 'lot', 'guy', 'still', 'don', 'get', 'have', 'fortune', 'domain', 'admin', 'year', 'administrator', 'account', 'always', 'power', 'add', 'domain', 'admin', 'though', 'so', 'still', 'uber', 'account', 'domain', 'even', 'most', 'domain', 'admin', 'know', 'password', 'take', 'ownership', 'default', 'possible', 'make', 'copy', 'file', 'just']"
72787,72787,howdy would any one happen to know a program that can retrive delte / formated files any one? Any one?!,0.0,20,"['one', 'happen', 'know', 'program', 'retrieve', 'delete', 'format', 'file', 'one', 'one']"
72788,72788,"hello, when I open up an access project file on a shared drive I get the error &quot;this file is read only, is locked or in use&quot; is there any way to hide this error? faileas: yes, but my boss doesn't like the error message he just wants it to open, doesnt care if its read only and he doesnt like clicking 'OK' quux: yeah Im trying to avoid that for syncronisation issues damn",0.0,74,"['open', 'access', 'project', 'file', 'share', 'drive', 'get', 'error', 'quit', 'file', 'read', 'only', 'lock', 'use', 'quit', 'way', 'hide', 'error', 'fail', 'boss', 'doesn', 'like', 'error', 'message', 'just', 'want', 'open', 'care', 'read', 'only', 'like', 'click', 'ok', 'quit', 'try', 'avoid', 'synchronisation', 'issue', 'damn']"
72791,72791,"[http://twitter.com/TwitLluis] Insistint amb el tema de microformats, microdata i rich snippets http://t.co/yJlsBLMB. Esperant i desitjant resultats ... [http://twitter.com/kevinmarks] tags for #microformats from NY guy 'first, simple ,rigid' o_O never been called rigid before, is that good? #schemaorg [http://twitter.com/t] #schemaorg I complimented @hixie on #microdata itemref. let's reuse in microformats 2 #uf2 over include-pattern:  http://t.co/42S4uEq4 [http://twitter.com/kevinmarks] OH: &quot;I don't know where they get this recipe data from&quot;  - it's called hRecipe: http://t.co/LjFPEsRu #microformats #schemaorg [http://twitter.com/kevinmarks] if you want to know where the hRecipe markup came from, you can read the research: http://t.co/d37FzRZ1  http://t.co/uVAFoJ9L #schemaorg [http://twitter.com/ronmartinez] &quot;Recipes that are not for stuff meant to be eaten by humans are out of scope.&quot;  hRecipe microformat http://t.co/xZzDaQ8v via @kevinmarks [http://twitter.com/paulmadsen] New microformat used to complain about how nobody is using microformats",0.0,127,"['help', 'twitter', 'com', 'twitlluis', 'insist', 'microformat', 'microdot', 'rich', 'snippet', 'help', 'co', 'hesitant', 'result', 'help', 'twitter', 'com', 'kevinmark', 'tag', 'microformat', 'first', 'simple', 'rigid', 'o', 'never', 'call', 'rigid', 'before', 'good', 'schemaorg', 'help', 'twitter', 'com', 'compliment', 'pixie', 'microdot', 'itemref', 'let', 'reuse', 'microformat', 'include', 'pattern', 'help', 'co', 'help', 'twitter', 'com', 'kevinmark', 'quit', 'don', 'know', 'get', 'recipe', 'datum', 'quit', 'call', 'recipe', 'help', 'co', 'ljfpesru', 'microformat', 'schemaorg', 'help', 'twitter', 'com', 'kevinmark', 'want', 'know', 'recipe', 'markup', 'come', 'read', 'research', 'help', 'co', 'd37fzrz1', 'help', 'co', 'uvafoj9l', 'schemaorg', 'help', 'twitter', 'com', 'ronmartinez', 'quit', 'recipe', 'stuff', 'mean', 'eat', 'human', 'scope', 'quit', 'recipe', 'microformat', 'help', 'co', 'xzzdaq8v', 'kevinmark', 'help', 'twitter', 'com', 'paulmadsen', 'new', 'microformat', 'use', 'complain', 'use', 'microformat']"
72792,72792,"hm, sitting next to tantek, hixie and c8418bd17d6b1d70bf83c9f1c1664266 it's like irc in person there is a high nerd denisty here today, yes density, not dentistry was his goal turgid over rigid?",0.0,31,"['sit', 'next', 'c8418bd17d6b1d70bf83c9f1c1664266', 'like', 'arc', 'person', 'high', 'nerd', 'density', 'here', 'today', 'density', 'dentistry', 'goal', 'turgid', 'rigid']"
72793,72793,"ahoyhoy wonders if microformat-using sites ought to be in http://ckan.net/ (directory of datasets) re http://microformats.org/wiki/microformats-2 ... is there any code that'll take a page and extract that json? Phae :) googles it, didn't find it yet can you expand the &quot;B.&quot; rigid - like 'stable' maybe?",0.0,46,"['ahoyhoy', 'wonder', 'microformat', 'use', 'site', 'help', 'net', 'directory', 'dataset', 'help', 'microformat', 'org', 'wiki', 'microformat', 'code', 'take', 'page', 'extract', 'phase', 'google', 'didn', 'find', 'yet', 'expand', 'quit', 'quit', 'rigid', 'stable', 'maybe']"
72794,72794,"greetings schema.org workshop IRC discussion in #schema c8418bd17d6b1d70bf83c9f1c1664266 - Shane B. has a Ruby library that parses microformats 2 but given that it's quite a fluid draft right now, I'm not sure how up to date it is microformats was described as &quot;first, simple, rigid&quot;",0.0,45,"['greeting', 'workshop', 'arc', 'discussion', 'shane', 'ruby', 'library', 'pass', 'microformat', 'give', 'fluid', 'draft', 'right', 'now', 'sure', 'date', 'microformat', 'describe', 'quit', 'first', 'simple', 'rigid', 'quit']"
72819,72819,"anyone know what the &quot;best&quot; way to make common html code more dynamic is? i.e. i have a website (www.puresimplicity.net/~neosadist) and the common code is the side bar and top bar.  the stuff is repeated on every page, and on top of that, if i wanted to add a new sidebar item like a web button, i have to cut and paste like 50 times lol i'm currently reading how html 4.01 strict is supposed to do it, but i wanted advice too riczho, thanx",0.0,85,"['know', 'quit', 'well', 'quit', 'way', 'make', 'common', 'himl', 'code', 'more', 'dynamic', 'e', 'website', 'neosadist', 'common', 'code', 'side', 'bar', 'top', 'bar', 'stuff', 'repeat', 'page', 'top', 'want', 'add', 'new', 'sidebar', 'item', 'web', 'button', 'cut', 'paste', 'time', 'laugh', 'currently', 'read', 'himl', 'strict', 'suppose', 'want', 'advice', 'too', 'rich', 'thanx']"
72822,72822,Hixie: Did I ever say that myself and BenMillard found the Spiderman walk-through level hard? Hixie: Mainly because we were laughing so much we didn't actually know what we were meant to do.,0.0,33,"['pixie', 'ever', 'say', 'benmillard', 'find', 'spiderman', 'walk', 'level', 'hard', 'pixie', 'mainly', 'laugh', 'so', 'much', 'didn', 'actually', 'know', 'mean']"
72825,72825,ooh... test contributions. (I guess Adrian Bateman's msg is old news to the rest of you) http://lists.w3.org/Archives/Public/public-html/2009Jan/0359.html issue-12: Mike notes CVS repository in response to Bateman's offer of test cases http://lists.w3.org/Archives/Public/public-html/2009Jan/0361.html wanders off for a little food before next telcon...,0.0,40,"['test', 'contribution', 'guess', 'mug', 'old', 'news', 'rest', 'help', 'list', 'org', 'archive', 'public', 'public', 'himl', 'issue', 'note', 'repository', 'response', 'offer', 'test', 'case', 'help', 'list', 'org', 'archive', 'public', 'public', 'himl', '2009jan', 'himl', 'wander', 'little', 'food', 'next', 'telco']"
72828,72828,Title: Microsoft's cross-document messaging and DOM Storage tests published from Adrian Bateman on 2009-01-26 (<email/> from January 2009) (at lists.w3.org) Title: Re: Microsoft's cross-document messaging and DOM Storage tests published from Michael(tm) Smith on 2009-01-26 (<email/> from January 2009) (at lists.w3.org),0.0,41,"['cross', 'document', 'messaging', 'dom', 'storage', 'test', 'publish', 'adrian', 'batman', 'email', 'list', 'org', 'title', 'cross', 'document', 'messaging', 'dom', 'storage', 'test', 'publish', 'smith', 'email', 'list', 'org']"
72829,72829,attempting to add a note to ISSUE-12. ISSUE-12 File naming format for test cases notes added,0.0,16,"['attempt', 'add', 'note', 'issue', 'issue', 'file', 'name', 'format', 'test', 'case', 'note', 'add']"
72830,72830,use removef to remove individual files from packages i was referring to previous question perhaps im too late i'm loosing it why so quiet in the channel pkill -9 badgers no luck.... g'day mate congrats it worked I'm out of here,0.0,41,"['use', 'remove', 'remove', 'individual', 'file', 'package', 'refer', 'previous', 'question', 'perhaps', 'too', 'late', 'loosing', 'so', 'quiet', 'channel', 'kill', 'badger', 'luck', 'day', 'mate', 'congrat', 'work', 'here']"
72833,72833,i feel like fuck now.. i drank like 4 glasses of c1000 sparkling vitamin c lemon and i go to the toilet every 10 minutes,0.0,25,"['feel', 'fuck', 'now', 'drink', 'glass', 'sparkle', 'vitamin', 'lemon', 'go', 'toilet', 'minute']"
72835,72835,"tonio maybe in -current but as of 3.0 it's still lagging theoware now if hp700 would just catch up :D hey teratogen yes i use it on prep, and on macppc aramdune: what are you trying to run that requires ofppc? just curious\ e250.. you sure it's not prep/chrp? yeah looks prep if it runs aix I bet it is",0.0,60,"['tonio', 'maybe', 'current', 'still', 'lag', 'theodore', 'now', 'just', 'catch', 'teratogen', 'use', 'prep', 'try', 'run', 'require', 'oppa', 'just', 'curious', 'e250', 'sure', 'prep', 'chip', 'look', 'prep', 'run', 'bet']"
72836,72836,I couldn't get netbsd to run on my ultra 2 =( runs it as a subprocess? greets Ober,0.0,18,"['couldn', 'get', 'net', 'run', 'ultra', 'run', 'subprocessor', 'greet']"
72839,72839,"Hello anybody installed NetBSD/ofppc Well, I'd like to use it on IBM BULL Escala E250, and just wanted to know if anybody had done this before It has AIX 4.3 now or something... good evening well I haven't seen the machine yet, just that someone told me about it i'll check yes, thanks that's it :)",0.0,56,"['instal', 'net', 'oppa', 'like', 'use', 'bull', 'scala', 'e250', 'just', 'want', 'know', 'do', 'now', 'good', 'evening', 'haven', 'see', 'machine', 'yet', 'just', 'tell', 'check', 'thank']"
72845,72845,heh i *think* hes talking about Do you want to continue? [Y/n/?] because the rest doesnt look very funny,0.0,19,"['think', 's', 'talk', 'want', 'continue', 'y', 'rest', 'look', 'very', 'funny']"
72850,72850,"Hi im trying not to be weird is it working? cool how did you knew I was a wizard are you a wizard? woah first of all I am not a bitch second please dont cast a curse on me really? in what sense like boom, no more mind or like boom, something really awesome",0.0,55,"['try', 'weird', 'work', 'cool', 'know', 'wizard', 'wizard', 'first', 'bitch', 'second', 'cast', 'curse', 'really', 'sense', 'boom', 'more', 'mind', 'boom', 'really', 'awesome']"
72851,72851,yes it is working fine hey wat is up with u computer wizard becuz im a witch bithch like my uncle i tend to blow ppl minds n 2nd?,0.0,29,"['work', 'fine', 'wat', 'computer', 'becoz', 'witch', 'bitch', 'uncle', 'tend', 'blow', 'pal', 'mind']"
72853,72853,"is 'WHATWG (HTML5) -- http://www.whatwg.org/ -- Logs: http://krijnhoetmer.nl/irc-logs/ -- Please leave your sense of logic at the door, thanks! -- gsnedders has green hair, photos coming really soon :-)'",0.0,29,"['whatwe', 'himl', 'help', 'whatwe', 'org', 'log', 'help', 'arc', 'log', 'leave', 'sense', 'logic', 'door', 'thank', 'sledder', 'green', 'hair', 'photo', 'come', 'really', 'soon']"
72860,72860,"?‡?‡?‡ Í‚Ó ÒÂ Í‡?‡ÚÂ ‚Â ÊÂÌËÚÂ Ò‡ Û·‡‚Ó ÌÂ?Ó, Ò‡ÏÓ ‰‡ ÌÂ Ò‡ ÚË ‚Í??Ë ËÏ‡Ï ÒË Ú?Ë ‡Î·ÛÏ‡ Ì‡ simon &amp; garfunkel ÊÂÌËÚÂ .. ÌÂ Ò‡ ÏË ‚ ?ÂÒÓ?‡ ‡ÍÓ ÌÂ Ò ?ÛÒË ‰Â ‡ÍÓ Ò‡ - ÒÚ‡‚‡Ú Á‡ ÔÎ ?ÂÌÂ",0.0,42,[]
72861,72861,ÌË Ò‡ Í‡?‡ÏÂ :P ;) ÌÂ ÔÓÁÌ‡ - ÊÂÌËÚÂ ‚ËÌ‡„Ë Ò‡ ?Û·‡‚Ó ÌÂ?Ó :P ?Â? ÎÂÍ‡ ÚË sweet dreams {},0.0,20,"['sweet', 'dream']"
72863,72863,bugmail: &quot;[Bug 9580] Steps for handling end tags in the &quot;in foreign&quot; mode walk past the root node in the stack&quot; (2 messages in thread) &lt;http://lists.w3.org/Archives/Public/public-html-bugzilla/2010Jul/0246.html&gt; ** [Bug 9673] Remove any reference to a specific Time Stamp format for video captioning from the specification at this time &lt;http://lists.w3.org/Archives/Public/public-html-bugzilla/2010Jul/0244.html&gt;,0.0,48,"['quit', 'bug', 'step', 'handle', 'end', 'tag', 'quit', 'foreign', 'quit', 'mode', 'walk', 'root', 'node', 'stack', 'quit', 'message', 'thread', 'help', 'list', 'org', 'archive', 'public', 'public', 'himl', 'himl', 'bug', 'remove', 'reference', 'specific', 'time', 'stamp', 'format', 'video', 'captioning', 'specification', 'time', 'help', 'list', 'org', 'archive', 'public', 'public', 'himl', 'himl']"
72879,72879,i will try 2 call u tomorrow. i love u and i cant wait 2 see u baby,0.0,18,"['try', 'call', 'tomorrow', 'love', 'wait', 'see', 'baby']"
72882,72882,"heyyy brittany u? slowww typperrr cool sl? 16 u? cool cool usa yourself? :) state? blonde hair blue eyes 124lbs 5&apos;6 C cup u tell me plz tell me u do not weight the same ohh good that would be uncomfortanle haha good no srry :( u prob disconnet right? twitter page? http://twitter.com/Brittany000810 me no srry, yahoo?? k, but why cant we talk here? k <email/> its yahhooo add again i screwed it up by accident srry :(",0.0,78,"['heavy', 'brittany', 'u', 'slow', 'typperrr', 'so', 'cool', 'usa', 'state', 'blonde', 'hair', 'blue', 'eye', 'cup', 'tell', 'ply', 'tell', 'weight', 'same', 'good', 'uncomfortable', 'good', 'prob', 'disconnect', 'right', 'twitter', 'page', 'help', 'twitter', 'com', 'sorry', 'yahoo', 'talk', 'here', 'email', 'yahoo', 'add', 'again', 'screw', 'accident', 'sorry']"
72883,72883,hey whats your name? ben how old are you? 16 as well where you at? same are you hot? dc thats me cept 6&apos;1 and 150 and uh...no tities haha haha do you have cam? well untill i see you i think you could be lying what? no cool do you have msn? thats the same i think whats your email? cuz i dont like it i added you ive never heard of rocketmail i just said hello,0.0,78,"['s', 'name', 'ben', 'old', 'as', 'well', 'same', 'hot', 's', 'cept', 'apos', 'city', 'cam', 'untill', 'see', 'think', 'lie', 'man', 's', 'same', 'think', 's', 'email', 'like', 'add', 've', 'never', 'hear', 'rocketmail', 'just', 'say']"
72886,72886,"There used to be this one command to save the current vimrc, and I can't seem to recall or google it thanks deryni",0.0,23,"['use', 'command', 'save', 'current', 'seem', 'recall', 'google', 'thank', 'dern']"
72888,72888,"eightfold: to get WebM for IE9, you go to a Web page, download an installer .exe and run it as administrator eightfold: the experience is the usual Windows software installation experience eightfold: MPEG-LA wants royalties from encoders, decoders and from a subset of people who distribute bits arranged with an H.264 encoder eightfold: for H.264 to be properly royalty-free, it needs to be royalty-free to decode, to encode and to transfer eightfold: where encode and decode are shorthand for making, distributing and running decoder/encoder a11aabeeceeae6b8cb5d12ea06b56554: they were vocal about MPEG-4 (Visual) Simple Profile before H.264 a11aabeeceeae6b8cb5d12ea06b56554: so much so that the release of QuickTime 6 was delayed, because Apple tried to get the stuff made royalty-free (of course, when you have shown you have the software ready to ship, it's not particularly credible to withhold it for a short while. they know you are going to ship it) a11aabeeceeae6b8cb5d12ea06b56554: you'd gain compat with existing chips a11aabeeceeae6b8cb5d12ea06b56554: reprogrammable by whom a11aabeeceeae6b8cb5d12ea06b56554: if the chip vendor gives you enough documentation and toolchain a11aabeeceeae6b8cb5d12ea06b56554: does Android let apps push code to the DSP? a11aabeeceeae6b8cb5d12ea06b56554: is it so much part of the standard Android impl that Opera is going to let it show in canPlayType?",0.0,201,"['eightfold', 'get', 'web', 'go', 'web', 'page', 'download', 'installer', 'eye', 'run', 'administrator', 'eightfold', 'experience', 'usual', 'window', 'software', 'installation', 'experience', 'want', 'royalty', 'encoder', 'decoder', 'subset', 'people', 'distribute', 'bit', 'arrange', 'encoder', 'eightfold', 'properly', 'royalty', 'free', 'need', 'royalty', 'free', 'decode', 'encode', 'transfer', 'eightfold', 'encode', 'decode', 'shorthand', 'make', 'distribute', 'run', 'decoder', 'encoder', 'vocal', 'mpeg', 'visual', 'simple', 'profile', 'a11aabeeceeae6b8cb5d12ea06b56554', 'so', 'much', 'release', 'quicklime', 'delay', 'apple', 'try', 'get', 'stuff', 'make', 'royalty', 'free', 'course', 'show', 'software', 'ready', 'ship', 'particularly', 'credible', 'withhold', 'short', 'know', 'go', 'ship', 'gain', 'combat', 'exist', 'chip', 'programmable', 'chip', 'vendor', 'give', 'enough', 'documentation', 'toolchain', 'android', 'let', 'app', 'push', 'code', 'dip', 'so', 'much', 'part', 'standard', 'android', 'imply', 'opera', 'go', 'let', 'show', 'canplaytype']"
72889,72889,"if you ever hear the MPEG-LA offering anything for &quot;free&quot;, double-check--the entire *point* of the MPEG-LA is to license MPEG stuff for money they're not going to do anything just to be nice (though I could just almost see them offering a hamstrung profile for free, just to try to cripple competing free codec development) and of course it would be a reduced profile hardware on android tends to be hidden behind magic proprietary .so's or hidden away on the locked-down radio side of things it'd be the vendor who would have to implement it heh, second time google search has wonked up the cursor position while i was typing a search they can't even get android devices to use a standard button layout, so ... as far as I'm concerned, anything MPEG being RF is a bad thing (for the rest of the world) it will slow the adoption and development of truly free codecs a11aabeeceeae6b8cb5d12ea06b56554: it's not hard to contrive other possible financial reasons (whether they're actual considerations or not, only they know) for example, everyone using codecs that cost money could increase the cost--slightly--of creating competing phones",0.0,190,"['ever', 'hear', 'mpeg', 'offer', 'quit', 'free', 'quit', 'double', 'check', 'entire', 'point', 'mpeg', 'license', 'mpeg', 'stuff', 'money', 're', 'go', 'just', 'nice', 'just', 'almost', 'see', 'offer', 'hamstrung', 'profile', 'free', 'just', 'try', 'cripple', 'compete', 'free', 'codec', 'development', 'course', 'reduce', 'profile', 'hardware', 'android', 'tend', 'hide', 'magic', 'proprietary', 'so', 'hide', 'away', 'lock', 'radio', 'side', 'thing', 'be', 'vendor', 'implement', 'second', 'time', 'search', 'work', 'cursor', 'position', 'type', 'search', 'even', 'get', 'android', 'device', 'use', 'standard', 'button', 'layout', 'as', 'far', 'concern', 'mpeg', 'bad', 'thing', 'rest', 'world', 'slow', 'adoption', 'development', 'truly', 'free', 'code', 'hard', 'contrive', 'other', 'possible', 'financial', 'reason', 're', 'actual', 'consideration', 'only', 'know', 'example', 'use', 'code', 'cost', 'money', 'increase', 'cost', 'slightly', 'create', 'compete', 'phone']"
