,Unnamed: 0,text,predator,text_len,preprocessed_bow
40189,40189,Can I have a div that contains a graphic sit behind another div containing text without disturbing the text? if I z-index that bad boy will it help?,0.0,28,"['can', 'div', 'contain', 'graphic', 'sit', 'div', 'contain', 'text', 'disturb', 'text', 'index', 'bad', 'boy', 'will', 'help']"
40190,40190,"tables for layout are bad. tables for layout are bad. period. websites are websites, not multimedia presentations if you want a fixed gui, make it in visual basic there's nothing to prove about that tables are for tables not for layout yeah i read it on w3c.org it's the description for the table element. it's for tabular data. layout isn't even data they do? like which ones? MatBoy you obviously don't understand what web design is about you should quit it and get started on gardening. period. you can go and do gardening without fear of standards! why should i? why should i mail the designers? you sound like someone who wants to copy the worst possible design just because it's on a website that gets 10000+ hits a day it's like eating from the trashcan just because it's in the back of a five-star restaurant i don't care about them they don't come here spreading misinformation sure is try overflow-x and overflow-y (if i remember right) check msdn kdb err msdn dhtml ref :)",0.0,175,"['table', 'layout', 'bad', 'table', 'layout', 'bad', 'period', 'website', 'website', 'multimedia', 'presentation', 'want', 'fix', 'gui', 'make', 'visual', 'basic', 'there', 'prove', 'table', 'table', 'layout', 'read', 'org', 'i', 'description', 'table', 'element', 'datum', 'even', 'data', 'one', 'batboy', 'obviously', 'understand', 'web', 'design', 'should', 'quit', 'start', 'garden', 'period', 'can', 'go', 'gardening', 'fear', 'standard', 'why', 'should', 'why', 'should', 'mail', 'designer', 'sound', 'want', 'copy', 'bad', 'possible', 'design', 'just', 'website', 'get', 'hit', 'day', 'like', 'eat', 'trashcan', 'just', 'back', 'star', 'restaurant', 'don', 'care', 'don', 'come', 'here', 'spread', 'misinformation', 'sure', 'try', 'overflow', 'remember', 'right', 'check']"
40191,40191,"For some reason IE loves scrollbars on my iframe, how can I remove them? overflow none ?",0.0,17,"['reason', 'love', 'scrollbar', 'frame', 'how', 'can', 'remove', 'none']"
40197,40197,"Hey guys.. not sure if this is the right place.. but was wondering if you could help me... I need to do a webdesign in CSS (can be 3.0) and xhtml, but it has to be a fluid design.. Is there a way of using a fixed background image and a fluid design? It seems a bit of an oxymoron to me but just wanted to double check before going down either road!",0.0,73,"['guy', 'sure', 'right', 'place', 'wonder', 'could', 'help', 'need', 'redesign', 'ass', 'can', 'himl', 'fluid', 'design', 'way', 'use', 'fix', 'background', 'image', 'fluid', 'design', 'seem', 'bit', 'oxymoron', 'just', 'want', 'double', 'check', 'go', 'road']"
40198,40198,how do i add tel type the way it won't be rendered? since the types are in english i can't use the &lt;span class=&quot;type&quot;&gt;Home&lt;/span&gt; construction when i need &lt;span class=&quot;type&quot;&gt;Dom?Ø&lt;/span&gt; (dom?Ø = home in cs) re the rendering - i mean if i have to add the &quot;home&quot;keyword i don't want to have it in accessible text (= text between tags or even in title attribute),0.0,66,"['how', 'add', 'type', 'way', 'win', 'render', 'type', 'can', 'use', 'class', 'quit', 'type', 'quit', 'home', 'span', 'construction', 'when', 'need', 'span', 'class', 'quit', 'type', 'quit', 'dom', 'span', 'home', 're', 'rendering', 'mean', 'add', 'quit', 'home', 'quit', 'keyword', 'don', 'want', 'accessible', 'text', 'text', 'tag', 'even', 'title', 'attribute']"
40208,40208,hi horny girl? ind u? m/f? guj. u? ok no problem age? r u stiding? 20 no i cant i m not type writer i m in engg. no u? which? branch? nirma mech. 3 rd u?,0.0,37,"['horny', 'girl', 'u', 'guy', 'problem', 'age', 'slide', 'can', 'type', 'writer', 'egg', 'u', 'branch']"
40209,40209,hiiiiiiiiiiiiiiiiiiiiiiii wherer r u fropm?? i too from there?? ind.. which place?? f?? u? but i m not horny.. karnatka.. 18.. urs?? be fast.. why&gt;?? what r u doing?? do u ve any gf?? i too in eng clg.. i too ve nt a bf .. searchng in d clg. NIT surathkal. u? CS urs?? which year?? 1st,0.0,58,"['hiiiiiiiiiiiiiiiiiiiiiiii', 'where', 'too', 'there', 'ind', 'place', 'horny', 'ur', 'fast', 'why', 'do', 've', 'too', 'too', 've', 'search', 'year']"
40212,40212,"+is it possible to have one share without any password authentication and another with? +actually even better, is there a way to restrict a share by ip address? +aha +standard hosts allow and hosts deny +thanks frank- +but then, that's global +frank-: but then in windows when I try go to that share, it doesn't allow me to type in a username, only a password, and the username is automatically set to \\192.168.2.16\Guest",0.0,73,"['possible', 'share', 'password', 'authentication', 'actually', 'even', 'well', 'way', 'restrict', 'share', 'ip', 'address', 'standard', 'host', 'allow', 'host', 'deny', 'thank', 'frank', 'then', 'global', 'frank', 'then', 'window', 'when', 'try', 'go', 'share', 'doesn', 'allow', 'type', 'username', 'only', 'password', 'username', 'automatically', 'set', 'guest']"
40214,40214,"139513027e8e90b5582cbc68fc733884: can you explain what you meant by &quot;this version of HTML5&quot;? ok, cool understood http://tinyurl.com/nw653o I'm curious about things like how we can enable things like HTML5.next given how much HTML5 nails down the parsing rules. can't that break the web? there was a wide variety of implementations on html4 139513027e8e90b5582cbc68fc733884: did you see my link? first bar is inside of datagrid, second one is outside I don't believe that #1 is the case. Let's compromise :-)  How about s/not ever/unlikely to/ but datagrid is closed by &lt;/datagrid&gt;.... I claim that people have an unfortunate tendency to forget to correctly close tags.  I think I can back that up with evidence. nope try &lt;span&gt;&lt;z&gt;x&lt;/span&gt;&lt;bar&gt; f139aba52f9fa1394b4034a7954b2220: HTML5 Live DOM Viewer (Validator.nu) ok, I see... picking &lt;p&gt; was unfortunate.",0.0,128,"['can', 'explain', 'mean', 'quit', 'version', 'quit', 'cool', 'understood', 'help', 'tinyurl', 'com', 'curious', 'thing', 'how', 'can', 'enable', 'thing', 'next', 'give', 'how', 'much', 'himl', 'nail', 'parsing', 'rule', 'can', 'break', 'web', 'wide', 'variety', 'implementation', 'see', 'link', 'first', 'bar', 'inside', 'datari', 'second', 'one', 'don', 'believe', 'case', 'let', 'compromise', 'how', 'ever', 'unlikely', 'close', 'datari', 'claim', 'people', 'unfortunate', 'tendency', 'forget', 'correctly', 'close', 'tag', 'think', 'can', 'back', 'evidence', 'nope', 'try', 'span', 'span', 'bar', 'himl', 'live', 'viewer', 'see', 'pick', 'unfortunate']"
40215,40215,"6132ec92889c0ce747ae9f7e44f90514: I mean the next one being HTML6 or HTML5.1 or whatever 6132ec92889c0ce747ae9f7e44f90514: in other words, I think &lt;datagrid&gt; is not right as it until recently was specified, and there is no time left to redesign it in the HTML5 cycle, but I'd like to see the feature come back in better form in a later version of HTML I think there's two cases: 1) anything that we want to be parsed in the same way that an unknown element is parsed in HTML5 will work fine 2) anything that needs to be parsed differently, we need to do everything we can to verify that content doesn't depend on the behavior when treated as an unknown element 6132ec92889c0ce747ae9f7e44f90514: I did, and I expect you were making a point, but I did not get what the point was (likely my lack of imagination) I don't follow the logic.. are you saying this behavior for unknown elements would not ever be acceptable for a real element? (in the face of unclosed tags, may I add) I believe what's happening is that &lt;zetagrid&gt; is never closed, due to the lack of a close tag for &lt;p&gt; indeed, so datagrid doesn' t parse the same as an unknown element &lt;span&gt; parses the same as an unknown element (IIRC) 6132ec92889c0ce747ae9f7e44f90514: if I replace zetagrid in your example with span, the parse tree is the same 6132ec92889c0ce747ae9f7e44f90514: if I replace span with zetagrid in your second example, the parse tree is the same yes, some elements are supposed to have &lt;p&gt;-closing behavior that &lt;span&gt; and random unknown elements do not &quot;websock&quot; is a silly name FOR A URI SCHEME",0.0,273,"['6132ec92889c0ce747ae9f7e44f90514', 'mean', 'next', '6132ec92889c0ce747ae9f7e44f90514', 'other', 'word', 'think', 'datari', 'right', 'recently', 'specify', 'time', 'leave', 'redesign', 'cycle', 'like', 'see', 'feature', 'come', 'back', 'in', 'well', 'form', 'later', 'version', 'think', 'there', 'case', 'want', 'parse', 'same', 'way', 'unknown', 'element', 'parse', 'will', 'work', 'fine', 'need', 'parse', 'differently', 'need', 'can', 'verify', 'content', 'doesn', 'depend', 'behavior', 'when', 'treat', 'unknown', 'element', 'expect', 'make', 'point', 'point', 'likely', 'lack', 'imagination', 'don', 'follow', 'logic', 'say', 'behavior', 'unknown', 'element', 'would', 'ever', 'acceptable', 'real', 'element', 'face', 'enclose', 'tag', 'may', 'add', 'believe', 'happen', 'zetagrid', 'never', 'close', 'lack', 'close', 'tag', 'indeed', 'so', 'datari', 'parse', 'same', 'unknown', 'element', 'span', 'pass', 'same', 'unknown', 'element', 'circ', 'replace', 'example', 'span', 'parse', 'tree', 'same', '6132ec92889c0ce747ae9f7e44f90514', 'replace', 'span', 'second', 'example', 'parse', 'tree', 'same', 'element', 'suppose', 'close', 'behavior', 'span', 'random', 'unknown', 'element', 'quit', 'wedlock', 'silly', 'name', 'uri', 'scheme']"
40217,40217,"we just change the parsing rules sure, you have to do it carefully it's exactly like the html4-5 transition the rules were nailed down for html4 too, it just wasn't written anywhere 6132ec92889c0ce747ae9f7e44f90514: not anywhere near as wide as you might think a whole bunch of elements in html5 parse like unknown elements according to the HTML5 parsing rules f139aba52f9fa1394b4034a7954b2220: you were phished! f139aba52f9fa1394b4034a7954b2220: i just removed all the checks for whether the text api is supported f139aba52f9fa1394b4034a7954b2220: (since i'd added code that relied on the text api without testing if it was supported, and it was easier to just take out all the checks than try to add more checks in) surely everyone supports the text apis by now i don't have an old copy handy i don't really see the problem with ws: and wss:, but i haven't yet looked closely at the thread",0.0,146,"['just', 'change', 'parsing', 'rule', 'sure', 'carefully', 'exactly', 'like', 'transition', 'rule', 'nail', 'too', 'just', 'wasn', 'write', 'anywhere', 'anywhere', 'near', 'as', 'wide', 'may', 'think', 'whole', 'bunch', 'element', 'unknown', 'element', 'accord', 'parsing', 'rule', 'f139aba52f9fa1394b4034a7954b2220', 'pishe', 'just', 'remove', 'check', 'text', 'api', 'support', 'add', 'code', 'rely', 'text', 'api', 'test', 'support', 'easy', 'just', 'take', 'check', 'try', 'add', 'more', 'check', 'surely', 'support', 'text', 'ape', 'now', 'don', 'old', 'copy', 'handy', 'don', 'really', 'see', 'problem', 'haven', 'yet', 'look', 'closely', 'thread']"
40218,40218,"How is it unacceptable in your example? I wonder how long until there's a formal objection to &quot;an end tag whose tag name is sarcasm&quot; Making the list of p-closing elements separate from the specification would probably be a lot of work for little gain too Does it use the canvas text apis, maybe? f139aba52f9fa1394b4034a7954b2220: Did you handle the call to measureText too? wtcp? There isn't anything more than &quot;ws also means webservice&quot; from what I saw I don't see how websocket is readable. Mail is a well known concept, but few people know sockets and even fewer would know what exactly a web socket is or &quot;ws protocol scheme&quot; Is it possible to upgrade a FF major version, or do you have to download the new one normally? 0c2de4934c6d7fc96160344dec846df3: Right, I found it eventually. It was hiding behind three minor updates to the previous version... websock is winsock for the web haha Yeah, if you need more connections And every so often the server will lose one of a pair",0.0,171,"['how', 'unacceptable', 'example', 'wonder', 'how', 'long', 'there', 'formal', 'objection', 'quit', 'end', 'tag', 'tag', 'name', 'sarcasm', 'quit', 'make', 'list', 'close', 'element', 'separate', 'specification', 'would', 'probably', 'lot', 'work', 'little', 'gain', 'too', 'use', 'canvas', 'text', 'ape', 'maybe', 'handle', 'call', 'measurement', 'too', 'stop', 'there', 'more', 'also', 'mean', 'quit', 'see', 'see', 'how', 'websocket', 'readable', 'mail', 'well', 'know', 'concept', 'few', 'people', 'know', 'socket', 'even', 'few', 'would', 'know', 'exactly', 'web', 'socket', 'quit', 'scheme', 'possible', 'upgrade', 'major', 'version', 'download', 'new', 'normally', 'right', 'find', 'eventually', 'hide', 'minor', 'update', 'previous', 'version', 'wedlock', 'windsock', 'web', 'need', 'more', 'connection', 'so', 'often', 'server', 'will', 'lose', 'pair']"
40219,40219,"that's weird, why is there a difference between &lt;datagrid&gt; and &lt;zetagrid&gt;? Aren't both unknown elements in existing browsers? oh assumed I was looking at the normal live dom viewer 69b0d3dfe919a6b860a9fac82de52a7e, did the issues graph ever function in Opera before you added the labels earlier today? ok. I was trying to modify it to make it work in Opera by checking if the canvas text was supported or not before attempting to use it, but I can't get it to work a924fb58d2c25874322f4e5126f608b9, yes 69b0d3dfe919a6b860a9fac82de52a7e, do you have a copy of it that works from before you added that stuff, so I can compare the two and see what changes you actually made? that would help me figure out what's wrong",0.0,119,"['weird', 'why', 'difference', 'datari', 'zetagrid', 'aren', 'unknown', 'element', 'exist', 'browser', 'assume', 'look', 'normal', 'live', 'dom', 'viewer', 'issue', 'graph', 'ever', 'function', 'opera', 'add', 'label', 'earlier', 'today', 'try', 'modify', 'make', 'work', 'opera', 'check', 'canvas', 'text', 'support', 'attempt', 'use', 'can', 'work', 'copy', 'work', 'add', 'stuff', 'can', 'compare', 'see', 'change', 'actually', 'make', 'would', 'help', 'figure', 'wrong']"
40220,40220,"all compat problems Opera has had so far has been with attributes, not new elements (including &lt;event-source&gt;, &lt;output&gt;, &lt;datalist&gt;) have been* yeah someone who cares and follows the WS URL scheme debate should point out that if there's any renaming new names for both schemes need to be considered websocks does not make me think of secure web sockets anyway and someone was in favor of a readable scheme name, like mailto but you could google it I sort of wonder why a scheme is needed here btw &quot;websock&quot; -- some new kind of Nike-sock connected to the cloud &quot;websocks&quot; -- when you have a pair of them",0.0,108,"['combat', 'problem', 'opera', 'have', 'so', 'far', 'attribute', 'new', 'element', 'include', 'event', 'source', 'output', 'fatalist', 'care', 'follow', 'scheme', 'debate', 'should', 'point', 'there', 'rename', 'new', 'name', 'scheme', 'need', 'consider', 'websock', 'make', 'think', 'secure', 'web', 'socket', 'anyway', 'favor', 'readable', 'scheme', 'name', 'mail', 'could', 'google', 'sort', 'of', 'wonder', 'why', 'scheme', 'need', 'here', 'quit', 'wedlock', 'quit', 'new', 'kind', 'connect', 'cloud', 'quit', 'websock', 'quit', 'when', 'pair']"
40228,40228,Hello ... ... ... ... ... ... ... ... ... ... ... ... ... ... ... ... ... ... ... ... ... ... ... ... ... ... ... ... ... ... ... ... ... ... ... ... ... ... ... ... ... ... ... ... ... ... ... ... ... ... ... ... ... ... ... ... ... ... ... . . . . . . . . .. . . . . . . . . . . . . . . . . . . . . . . . . . . . . . . . . . . . . . . . . . . .. . . . . . . . . . .... . . . ..... ................................. . ............. . ........... . ........... . ............ . . . .... . . . . . . . . .,0.0,148,[]
40233,40233,"now I have only two classes of test case failures left: 1) surrogates (wontfix) 2) space characters in the AAA doesn't like touching the AAA also, we don't have enough test coverage for frameset-ok edb259c0e0038f38bb200bc20c8cbf7e: the test cases test lone surrogates in JSON input edb259c0e0038f38bb200bc20c8cbf7e: I've decided checking for those doesn't belong in the tokenizer but belongs on a lower layer that doesn't participate with JSON",0.0,66,"['now', 'only', 'class', 'test', 'case', 'failure', 'leave', 'surrogate', 'wontfix', 'space', 'character', 'like', 'touch', 'aka', 'also', 'don', 'enough', 'test', 'coverage', 'frame', 'edb259c0e0038f38bb200bc20c8cbf7e', 'test', 'case', 'test', 'lone', 'surrogate', 'input', 've', 'decide', 'check', 'doesn', 'belong', 'tokenizer', 'belong', 'low', 'layer', 'doesn', 'participate', 'son']"
40247,40247,hi age m or f 20 m from where me too new york u nice how is the weather it has been hot here yaa 80 to 90 u in the 100&apos;s right what the hell what time is it their o ok o good talking got to go,0.0,49,"['age', 'where', 'too', 'nice', 'how', 'weather', 'hot', 'here', 'apo', 'right', 'hell', 'time', 'o', 'good', 'talking', 'get', 'go']"
40248,40248,hey 19 f Ok US Texas Fucking hot How hot? Heat index today was 105 So it goes An hour behind you Central time,0.0,24,"['ok', 'fuck', 'hot', 'how', 'hot', 'heat', 'index', 'today', 'so', 'go', 'hour', 'central', 'time']"
40253,40253,changes: simon: list all new attributes and spice up examples Fixing http://www.w3.org/Bugs/Public/show_bug.cgi?id=12670 &lt;http://lists.w3.org/Archives/Public/public-html-diffs/2011May/0158.html&gt; bugmail: [Bug 12670] Missing various attributes from New Attributes &lt;http://lists.w3.org/Archives/Public/public-html-bugzilla/2011May/0828.html&gt; ** [Bug 12694] New: Include an example for &lt;select required&gt; &lt;http://lists.w3.org/Archives/Public/public-html-bugzilla/2011May/0827.html&gt; planet: Mike Marchak: Dreams in 3D: a WebGL experience for the modern browser &lt;http://feedproxy.google.com/~r/blogspot/Dcni/~3/6Y3cTLkLsHo/dreams-in-3d-webgl-experience-for.html&gt; changes: simon: drop class=&quot;example&quot; and remove a note &lt;http://lists.w3.org/Archives/Public/public-html-diffs/2011May/0161.html&gt; ** simon: forgot &lt;/label&gt; in example &lt;http://lists.w3.org/Archives/Public/public-html-diffs/2011May/0160.html&gt; ** simon: move undeprecated attributes Fixing http://www.w3.org/Bugs/Public/show_bug.cgi?id=12669 &lt;http://lists.w3.org/Archives/Public/public-html-diffs/2011May/0159.html&gt; bugmail: [Bug 12669] New Attributes shouldn't list previously deprecated attributes &lt;http://lists.w3.org/Archives/Public/public-html-bugzilla/2011May/0829.html&gt;,0.0,83,"['list', 'new', 'attribute', 'spice', 'example', 'fix', 'help', 'org', 'bug', 'public', 'show', 'bug', 'cgi', 'would', 'help', 'list', 'org', 'archive', 'public', 'public', 'gmail', 'bug', 'miss', 'various', 'attribute', 'new', 'attribute', 'help', 'list', 'org', 'archive', 'public', 'public', 'bug', 'new', 'include', 'example', 'select', 'require', 'help', 'list', 'org', 'archive', 'public', 'public', 'dream', 'ad', 'a', 'will', 'experience', 'modern', 'browser', 'help', 'com', 'blogspot', 'dream', 'ad', 'will', 'experience', 'change', 'quit', 'example', 'quit', 'remove', 'note', 'help', 'list', 'org', 'archive', 'public', 'public', 'forget', 'label', 'example', 'help', 'list', 'org', 'archive', 'public', 'public', 'move', 'undeprecated', 'attribute', 'fix', 'help', 'org', 'bug', 'public', 'show', 'bug', 'cgi', 'would', 'help', 'list', 'org', 'archive', 'public', 'public', 'gmail', 'bug', 'new', 'attribute', 'shouldn', 'list', 'previously', 'attribute', 'help', 'list', 'org', 'archive', 'public', 'public']"
40254,40254,"EtherSniff: The triumvirate of #html, #javascript, and #css are each good for any questions at any time, whichever looks most promising. And almost everybody is in all three, so cross posting will only annoy us If it's a long, drawn-out conversation that might benefit from experts who only bother with, say, #javascript then you'd take it there Otherwise let it lay where it lands #css tends to be the largest and most active since many scripting and markup issues deeply involve their style The other mentioned channel seems to be full of people who can barely maintain the channel, much less sanity And I'm lagged to hell atm, bbl",0.0,109,"['triumvirate', 'good', 'question', 'time', 'look', 'most', 'promising', 'almost', 'so', 'cross', 'posting', 'will', 'only', 'annoy', 'i', 'long', 'draw', 'conversation', 'may', 'benefit', 'expert', 'only', 'bother', 'then', 'take', 'there', 'otherwise', 'let', 'lay', 'where', 'land', 'ass', 'tend', 'large', 'most', 'active', 'many', 'scripting', 'markup', 'issue', 'deeply', 'involve', 'style', 'other', 'mention', 'channel', 'seem', 'full', 'people', 'can', 'barely', 'maintain', 'channel', 'much', 'less', 'sanity', 'lag', 'atm', 'back', 'later']"
40255,40255,"Guys, how do you position a &lt;div&gt;  element? I have one in a table, but it's appearing at the top of the page! Sorry? noss: What do you mean I positioned it relative to the body? There is no CSS",0.0,40,"['guy', 'how', 'position', 'div', 'element', 'table', 'appear', 'top', 'page', 'sorry', 'boss', 'mean', 'position', 'relative', 'body', 'ass']"
40256,40256,"yah, you positioned it relative to the body. im not. Wonderboy: you are using &quot;position&quot; in css and then specifying &quot;top&quot;, right? then you are not positioning anything.",0.0,28,"['position', 'relative', 'body', 'wonderboy', 'use', 'quit', 'position', 'quit', 'ass', 'then', 'specify', 'quit', 'top', 'quit', 'right', 'then', 'position']"
40261,40261,"peterv: any ETA on bug 684601 or bug 637099 ? &quot;If you're parsing JSON with eval and using strict mode, you deserve to be slow.&quot; true",0.0,26,"['bug', 'bug', 'quit', 're', 'parse', 'son', 'eval', 'use', 'strict', 'mode', 'deserve', 'slow', 'quit', 'true']"
40262,40262,"&lt;elly&gt; as a C programmer by trade, I object :) &lt;elly&gt; the purpose of C is to write large, insecure, buggy applications! Truth s/ and using strict mode//, IMO &lt;jst&gt; mmm, crack",0.0,32,"['elly', 'i', 'programm', 'trade', 'object', 'elly', 'purpose', 'write', 'large', 'insecure', 'buggy', 'application', 'truth', 'use', 'strict', 'mode', 'opinion', 'just', 'mom', 'crack']"
40267,40267,"hi mom how are you mom no you never let me do what i want yeah noooo im sorry sorry, mom forgive me ok i apologise",0.0,26,"['mom', 'how', 'mom', 'never', 'let', 'want', 'sorry', 'mom', 'forgive', 'apologise']"
40268,40268,"hi son what are you doing on this nasty site get off this minute ! are you talking back? no icecream for you mister not for the net 5 years anyways get on your knees and apologize also, quit this site! its not safe for children!",0.0,46,"['son', 'do', 'nasty', 'site', 'get', 'minute', 'talk', 'back', 'icecream', 'mister', 'net', 'year', 'anyways', 'get', 'knee', 'apologize', 'also', 'quit', 'site', 'safe', 'child']"
40269,40269,"bugmail: [Bug 7079] Inconsistency in algorithm descriptions for parsing integers &lt;http://lists.w3.org/Archives/Public/public-html-bugzilla/2009Aug/0058.html&gt; ** [Bug 7075] The embed element should be deprecated &lt;http://lists.w3.org/Archives/Public/public-html-bugzilla/2009Aug/0057.html&gt; ** [Bug 6606] generic 3rd-party &lt;mark&gt;, Smart Tags, and Activities prevention &lt;http://lists.w3.org/Archives/Public/public-html-bugzilla/2009Aug/0056.html&gt; changes: hixie: Ensure 'object' doesn't clash with WebIDL (whatwg r3563) &lt;http://lists.w3.org/Archives/Public/public-html-diffs/2009Aug/0077.html&gt; ** hixie: Rename 'CDATA' to 'Raw Text' to avoid confusing it with CDATA sections. (bug 6689) (whatwg r3562) &lt;http://lists.w3.org/Archives/Public/public-html-diffs/2009Aug/0076.html&gt; ** hixie: Typo (bug 7214) (whatwg r3561) &lt;http://lists.w3.org/Archives/Public/public-html-diffs/2009Aug/0075.html&gt;",0.0,71,"['bug', 'inconsistency', 'description', 'parse', 'integer', 'help', 'list', 'org', 'archive', 'public', 'public', 'bug', 'embed', 'element', 'should', 'deprecate', 'help', 'list', 'org', 'archive', 'public', 'public', 'bug', 'mark', 'smart', 'tag', 'activity', 'prevention', 'help', 'list', 'org', 'archive', 'public', 'public', 'change', 'ensure', 'object', 'clash', 'r3563', 'help', 'list', 'org', 'archive', 'public', 'public', 'pixie', 'datum', 'raw', 'text', 'avoid', 'confuse', 'datum', 'section', 'bug', 'whatwe', 'help', 'list', 'org', 'archive', 'public', 'public', 'pixie', 'typo', 'bug', 'help', 'list', 'org', 'archive', 'public', 'public']"
40279,40279,"bugmail: [Bug 14077] New: Please select a section by clicking on it, and then submit the comment again. &lt;http://lists.w3.org/Archives/Public/public-html-bugzilla/2011Sep/0285.html&gt; ** [Bug 14076] New: misspelled contents, should be &quot;Stops sending&quot; instead of &quot;Steps sending&quot; &lt;http://lists.w3.org/Archives/Public/public-html-bugzilla/2011Sep/0282.html&gt; ** [Bug 14076] misspelled contents, should be &quot;Stops sending&quot; instead of &quot;Steps sending&quot; &lt;ht",0.0,48,"['gmail', 'bug', 'new', 'select', 'section', 'click', 'then', 'submit', 'comment', 'again', 'help', 'list', 'org', 'archive', 'public', 'public', 'bug', 'new', 'misspell', 'content', 'should', 'quit', 'stop', 'send', 'quit', 'instead', 'quit', 'step', 'send', 'quit', 'help', 'list', 'org', 'archive', 'public', 'public', 'bug', 'misspell', 'content', 'should', 'quit', 'stop', 'send', 'quit', 'instead', 'quit', 'step', 'send', 'quit']"
