,Unnamed: 0,text,predator,text_len,preprocessed_bow
38234,38234,"haha edb259c0e0038f38bb200bc20c8cbf7e: just a piece of jwalden's tests - hapens to be the name of a frame edb259c0e0038f38bb200bc20c8cbf7e: it does not have deep meaning I think people are using &quot;SMIL&quot; as a slightly imprecise shorthand for &quot;SVG Animation&quot; edb259c0e0038f38bb200bc20c8cbf7e: TreeWalker doesn't seem any more useful to me than attribute nodes... edb259c0e0038f38bb200bc20c8cbf7e: well, I'd put TreeWalker on the chopping block too I'm not sure why attribute nodes are worse just seems a little arbitrary Attr nodes are part of DOM 1 Core, TreeWalker is part of DOM2 Traversal, does any web content use it? TreeWalker is a bad API for traversing a DOM tree I agree there are use cases for a good API for doing so what I hate most out of DOM Events is mutation events it's not just useless, it is actively harmful to code complexity and performance all over the DOM edb259c0e0038f38bb200bc20c8cbf7e: but XHR is used, unlike TreeWalker surely not in IE it is in WebKit and Mozilla I'd assume Opera too a131216c7af242e66537a58b4ca7c9f9: even if they are caused by explicit mutation, not parsing? (we never did fire them as side effects of initial parsing) we actually don't fire them at all if no listener is registered that reduces perf cost but there's still a lot of code complexity to make basic DOM operations robust in the face of mutation event listeners possibly modifying the DOM (which no one ever really wants to do in a way that invalidates the DOM operation) if DOM change notifications are actually useful, they should be batched until the end of operations that ought to be atomic our editing operations just skip mutation events entirely I think the worst are the ones that happen in the middle over half the code in our Node.replaceChild core implementation is to account for mutation events possibly doing something crazy in Safari 3 it just says &quot;JS ?&quot; is that intended? (65/100 in WebKit trunk)",0.0,319,"['edb259c0e0038f38bb200bc20c8cbf7e', 'just', 'piece', 'walden', 'test', 'happen', 'name', 'frame', 'deep', 'meaning', 'think', 'people', 'use', 'quit', 'smile', 'quit', 'slightly', 'imprecise', 'shorthand', 'animation', 'quit', 'streetwalker', 'doesn', 'seem', 'more', 'useful', 'attribute', 'node', 'edb259c0e0038f38bb200bc20c8cbf7e', 'well', 'put', 'streetwalker', 'chopping', 'block', 'too', 'sure', 'why', 'attribute', 'node', 'bad', 'just', 'seem', 'little', 'arbitrary', 'atta', 'node', 'part', 'core', 'streetwalker', 'part', 'dome', 'reversal', 'web', 'content', 'use', 'streetwalker', 'bad', 'api', 'traverse', 'dom', 'tree', 'agree', 'use', 'case', 'good', 'api', 'do', 'so', 'hate', 'most', 'dom', 'event', 'mutation', 'event', 'just', 'useless', 'actively', 'harmful', 'code', 'complexity', 'performance', 'all', 'use', 'streetwalker', 'surely', 'website', 'momzilla', 'assume', 'opera', 'too', 'even', 'cause', 'explicit', 'mutation', 'parse', 'never', 'fire', 'side', 'effect', 'initial', 'parsing', 'actually', 'don', 'fire', 'at', 'all', 'listener', 'register', 'reduce', 'perf', 'cost', 'there', 'still', 'lot', 'code', 'complexity', 'make', 'basic', 'operation', 'robust', 'face', 'mutation', 'event', 'listener', 'possibly', 'modify', 'dom', 'one', 'ever', 'really', 'want', 'way', 'invalidate', 'dom', 'operation', 'dom', 'change', 'notification', 'actually', 'useful', 'should', 'watch', 'end', 'operation', 'ought', 'atomic', 'editing', 'operation', 'just', 'skip', 'mutation', 'event', 'entirely', 'think', 'bad', 'one', 'happen', 'middle', 'code', 'node', 'replacechild', 'core', 'implementation', 'account', 'mutation', 'event', 'possibly', 'do', 'crazy', 'just', 'say', 'quit', 'intend', 'website', 'trunk']"
38235,38235,"what is window.otherCrossDomain ? 65325d50b2e25aca54bc871b89758c9c, good, I was hoping it was that :) we implement SVG Animation which reuses part of SMIL we do not implement the 111 and growing namespace monster that is SMIL 2.1 that makes 112 alarm number of Europe i agree that the CSS animation stuff is nicer unfortunately the CSS group won't work on it right away 65325d50b2e25aca54bc871b89758c9c, btw, any simplification of the DOM that is possible is good imo, if we can remove attribute nodes that would be a win 1a11ef65e59a402769635562579a7df6, might be chicken/egg problem sure (to both) 65325d50b2e25aca54bc871b89758c9c, but if we can remove one why not do it? i'm fine with putting both on the chopping block, it just seems that dropping attribute nodes might be easier maybe it's because it's part of the Core DOM i also think that namespace events should be dropped from dom3events for treewalker there are some use cases for attr nodes there are none given that no implementation does entity nodes xhr is a bad api for network requests... is treewalker implemented everywhere? that's probably a good reason for not using it then :) heh, that bug is filed by an Opera developer s/is/was/ it's part of HTML 5 Opera 9.2x now passes less than 50% of the Acid3 tests i don't think so neh xhtml in gecko had issues with &lt;script&gt; vague memory tells me the script executed directly but the DOM wasn't build up so stuff failed i wouldn't worry aout it though and simply assume incremental XML parsers i'm sure content already relies on that (at leasts tests :)) it surprises me that 10% of the Web is in standards mode no :( you can do document.styleSheets[0].insertRule(&quot;&quot;, -1) or something like that but manipulating textContent of &lt;style&gt; seems fine",0.0,295,"['window', 'good', 'hope', 'implement', 'animation', 'refuse', 'part', 'smile', 'implement', 'grow', 'namesake', 'monster', 'smile', 'make', 'alarm', 'number', 'agree', 'ass', 'animation', 'stuff', 'nice', 'unfortunately', 'ass', 'group', 'win', 'work', 'right', 'away', 'bow', 'simplification', 'dom', 'possible', 'good', 'limo', 'can', 'remove', 'attribute', 'node', 'would', 'win', 'may', 'chicken', 'egg', 'problem', 'sure', 'can', 'remove', 'why', 'fine', 'put', 'chopping', 'block', 'just', 'seem', 'drop', 'attribute', 'node', 'may', 'easy', 'maybe', 'part', 'core', 'dom', 'also', 'think', 'namesake', 'event', 'should', 'drop', 'streetwalker', 'use', 'case', 'atta', 'node', 'none', 'give', 'implementation', 'entity', 'node', 'bad', 'api', 'network', 'request', 'streetwalker', 'implement', 'everywhere', 'probably', 'good', 'reason', 'use', 'then', 'bug', 'file', 'opera', 'developer', 'part', 'opera', 'ex', 'now', 'pass', 'less', 'acid', 'test', 'don', 'think', 'so', 'issue', 'script', 'vague', 'memory', 'tell', 'script', 'execute', 'directly', 'wasn', 'build', 'so', 'stuff', 'fail', 'wouldn', 'worry', 'though', 'simply', 'assume', 'incremental', 'sure', 'content', 'already', 'rely', 'least', 'test', 'surprise', 'web', 'standard', 'mode', 'can', 'document', 'stylesheet', 'quit', 'manipulate', 'textcontent', 'style', 'seem', 'fine']"
38236,38236,Hixie: I agree with roc... SMIL could be hell to implement :)  But it also is moderately useful to the web it's more the SVG animation DOM which is a bitch the baseVal animVal problem now we just need a nice way to apply the CSS animation to SVG :) should submit a test or two to get SMIL kicked from the test it's just so low on actual browser feature lists since no one in their right mind is trying to use it on the web right now edb259c0e0038f38bb200bc20c8cbf7e: might a131216c7af242e66537a58b4ca7c9f9: I don't think it's a bunch of branching a131216c7af242e66537a58b4ca7c9f9: it is a bunch of added complex code however thinks that TreeWalker is on the list of &quot;simple to actually implement so we should just get it out of the way and be done with it&quot; om_sleep: Safari 3 used to show like 46/100 insetad of JS ?,0.0,149,"['agree', 'smile', 'could', 'hell', 'implement', 'also', 'moderately', 'useful', 'web', 'more', 'animation', 'bitch', 'baseball', 'animal', 'problem', 'now', 'just', 'need', 'nice', 'way', 'apply', 'ass', 'animation', 'should', 'submit', 'test', 'smile', 'kick', 'test', 'just', 'so', 'low', 'actual', 'browser', 'feature', 'list', 'one', 'right', 'mind', 'try', 'use', 'web', 'right', 'now', 'edb259c0e0038f38bb200bc20c8cbf7e', 'may', 'don', 'think', 'i', 'bunch', 'branching', 'bunch', 'add', 'complex', 'code', 'however', 'think', 'streetwalker', 'list', 'simple', 'actually', 'implement', 'so', 'should', 'just', 'way', 'do', 'quit', 'use', 'show', 'instead']"
38237,38237,SMIL isn't really intended for &quot;eye candy&quot;: it's a content language. (AFAIK) No. It's like with video. Easier to use Flash for complex presentations. and there's Slidy for simple ones. So it's limited to people who want to make complex presentations in an open format. (And the pool of people who care about that is small.) (and I guess it has to compete with ODF),0.0,65,"['smile', 'really', 'intend', 'eye', 'candy', 'quit', 'content', 'language', 'afaid', 'like', 'video', 'easy', 'use', 'flash', 'complex', 'presentation', 'there', 'slide', 'simple', 'one', 'limit', 'people', 'want', 'make', 'complex', 'presentation', 'open', 'format', 'pool', 'people', 'care', 'small', 'guess', 'compete']"
38238,38238,"implementing SMIL might hurt static svg perf assuming it requires sprinkling &quot;if(animated)&quot; all over oh, yes, mutation events are evil 65325d50b2e25aca54bc871b89758c9c: did you see that gecko decided to stop firing mutation events during page load? i think so, but i'm not sure https://bugzilla.mozilla.org/show_bug.cgi?id=90983 we had that optimization too, and we were spending time looking to see if there were mutation listeners yes we had a fair number of crashes due to bad assumptions in there as opposed to some being required to be sent before the mutation actually happens? :P",0.0,90,"['implement', 'smile', 'may', 'hurt', 'static', 'sig', 'perf', 'assume', 'require', 'sprinkle', 'quit', 'animate', 'quit', 'all', 'over', 'mutation', 'event', 'evil', 'see', 'gecko', 'decide', 'stop', 'fire', 'mutation', 'event', 'page', 'load', 'think', 'so', 'sure', 'hate', 'org', 'show', 'bug', 'cgi', 'would', 'optimization', 'too', 'spend', 'time', 'look', 'see', 'mutation', 'listener', 'fair', 'number', 'crash', 'bad', 'assumption', 'in', 'there', 'oppose', 'require', 'send', 'mutation', 'actually', 'happen']"
38243,38243,How can I specify that &lt;dt&gt; elements shouldn't break the line? That is: How do I make &lt;dd&gt; elements appear on the same line as &lt;dt&gt;?,0.0,26,"['how', 'can', 'specify', 'element', 'shouldn', 'break', 'line', 'how', 'make', 'element', 'appear', 'same', 'line']"
38244,38244,"you can float them or display inline maybe haven't tried dt,dd { display: inline; } try that and also dt,dd { float: left; } if that doesn't owkr",0.0,28,"['can', 'float', 'display', 'inline', 'maybe', 'try', 'display', 'inline', 'try', 'also', 'float', 'leave', 'doesn', 'ower']"
38247,38247,bugmail: [Bug 9604] New: For CORS we want a way to prevent setting cookies. Might be nice if that was part of the fetch algorithm. &lt;http://lists.w3.org/Archives/Public/public-html-bugzilla/2010Apr/0808.html&gt; ** [Bug 9603] New: If the origin parameter does not match the Document origin the Referer header should also be excluded. Alternatively a way to omit the Referer header would be good for CORS. &lt;http://lists.w3.org/Archives/Public/public-html-bu,0.0,61,"['bug', 'new', 'cop', 'want', 'way', 'prevent', 'setting', 'cookie', 'may', 'nice', 'part', 'fetch', 'algorithm', 'help', 'list', 'org', 'archive', 'public', 'public', 'bug', 'new', 'origin', 'parameter', 'match', 'document', 'origin', 'referee', 'should', 'also', 'exclude', 'alternatively', 'way', 'omit', 'referee', 'would', 'good', 'cop', 'help', 'list', 'org', 'archive', 'public', 'public', 'himl']"
38254,38254,"bugmail: [Bug 13447] SVG content model VENN diagram needs to be made accessible [3.2.5.1 Kinds of content/content-venn.svg]. &lt;http://lists.w3.org/Archives/Public/public-html-bugzilla/2011Jul/1295.html&gt; ** [Bug 13443] parentElement works in Chrome and IE but is not specified. &lt;http://lists.w3.org/Archives/Public/public-html-bugzilla/2011Jul/1297.html&gt; ** [Bug 13333] audio, video (and source) elements require param children or equivalent &lt;htt planet: BlueGriffon: Autocompletion in Source View &lt;http://bluegriffon.org/post/2011/07/29/Autocompletion-in-Source-View&gt;",0.0,53,"['gmail', 'bug', 'content', 'model', 'need', 'make', 'accessible', 'kind', 'content', 'content', 'help', 'list', 'org', 'archive', 'public', 'public', 'bug', 'parentelement', 'work', 'chrome', 'ie', 'specify', 'help', 'list', 'org', 'archive', 'public', 'public', 'bug', 'audio', 'video', 'source', 'element', 'require', 'param', 'child', 'equivalent', 'hit', 'planet', 'bluegriffon', 'autocompletion', 'source', 'view', 'help', 'bluegriffon', 'autocompletion', 'source', 'view']"
38258,38258,'a'.upper() == 'A' oh crap gU or ~ if you want to swap case and gu&lt;motion&gt; to lowercase.,0.0,18,"['upper', 'crap', 'want', 'swap', 'case', 'motion', 'lowercase']"
38261,38261,"how can i make wrap cut words, like if i have a block of text and i don't want a ragged edge, i just want each line to be 80 characters i realize it generally doesn't make sense to do that in the file inserting newlines well, i just did it by making a &quot;recording&quot;",0.0,55,"['how', 'can', 'make', 'wrap', 'cut', 'word', 'block', 'text', 'don', 'want', 'ragged', 'edge', 'just', 'want', 'line', 'character', 'realize', 'generally', 'doesn', 'make', 'sense', 'file', 'insert', 'newbie', 'just', 'make', 'quit', 'recording', 'quit']"
38262,38262,"You mean wrapping in the file, or for display? I don't know of any trivial way.  You could write something to reformat paragraphs, or you could make an autocommand for inserting characters. desrt: ?",0.0,34,"['mean', 'wrap', 'file', 'display', 'don', 'know', 'trivial', 'way', 'could', 'write', 'reformat', 'paragraph', 'could', 'make', 'autocommand', 'insert', 'character', 'desert']"
38263,38263,"so check it out :syn keyword cType gboolean does what i want it to but if i add it to my .vimrc it doesn't work well i only want it to work on c files so that's fine :) tpope; thanks. can i put my ~/.vimrc inside ~/.vim ? that's completely lame no hope for viminfo either, i guess well... it could check both places :p i presume vim won't randomly execute things placed directly in ~/.vim/ particularly if they're named viminfo :) this is true. and a good thing to consider tpope; your magical path works great :) i generally don't like hidden files and i like reducing the number of them in my ~ as much as possible",0.0,120,"['check', 'want', 'add', 'vic', 'doesn', 'work', 'only', 'want', 'work', 'file', 'fine', 'thank', 'can', 'put', 'vic', 'completely', 'lame', 'hope', 'viminfo', 'guess', 'could', 'check', 'place', 'presume', 'win', 'randomly', 'execute', 'thing', 'place', 'directly', 'particularly', 're', 'name', 'viminfo', 'true', 'good', 'thing', 'consider', 'magical', 'path', 'work', 'great', 'generally', 'don', 'like', 'hide', 'file', 'like', 'reduce', 'number', 'as', 'much', 'possible']"
38264,38264,"of course not, it won't work if you do it in a non c-file either ~/.vim/after/syntax/c.vim no .vimrc came first :help 'viminfo' you can put it anywhere but .vim is probably a bad idea since it's not really a config file no but if you copy your configuration elsewhere you also copy your viminfo also it could have sensitive information in it so if you forget about it (it is hidden after all) and share .vim with somebody else it doesn't have to be hidden you can name it what you want, and if you did go that route giving it a hidden name is a bad idea for that reason",0.0,111,"['of', 'course', 'win', 'work', 'file', 'vic', 'come', 'first', 'help', 'viminfo', 'can', 'put', 'anywhere', 'probably', 'bad', 'idea', 'really', 'config', 'file', 'copy', 'configuration', 'elsewhere', 'also', 'copy', 'viminfo', 'also', 'could', 'sensitive', 'information', 'forget', 'hide', 'after', 'all', 'share', 'else', 'hide', 'can', 'name', 'want', 'go', 'route', 'give', 'hide', 'name', 'bad', 'idea', 'reason']"
38265,38265,"hey all, I have a question about extending vim I want to be able to say something like :checkout to check out the file I'm currently editing from source control I know I need to add something to me .vimrc file, but I'm not sure where to begin Thanks, I'll take a look. OK, :command looks like what I want Of course :command talks about substituting &lt;line1&gt;, &lt;count&gt;, &lt;bang&gt;, &lt;reg&gt;, and &lt;args&gt; I'd like to use the filename of the current buffer as a default value to the command Where should I start reading? Is there some register that holds that?",0.0,101,"['question', 'extend', 'want', 'able', 'say', 'checkout', 'check', 'file', 'currently', 'edit', 'source', 'control', 'know', 'need', 'add', 'file', 'sure', 'where', 'begin', 'thank', 'take', 'look', 'ok', 'command', 'look', 'want', 'course', 'command', 'talk', 'substitute', 'line', 'count', 'bang', 'reg', 'arm', 'like', 'use', 'filename', 'current', 'buffer', 'default', 'value', 'command', 'where', 'should', 'start', 'read', 'register', 'hold']"
38266,38266,":help user-commands Might be a good place to start, or :help :! Any number of things might be what you want depending on how much work you need to do for what you want. :help expand() philip_: Also, :help c_ctrl-r for completeness.",0.0,42,"['help', 'user', 'command', 'may', 'good', 'place', 'start', 'help', 'number', 'thing', 'may', 'want', 'depend', 'how', 'much', 'work', 'need', 'want', 'help', 'expand', 'also', 'help', 'curl', 'completeness']"
38267,38267,hey.. once ive put a syntax file in ~/.vim/syntax ... what do i need to do to use it? linux my syntax file is eruby.vim and i need it to work on *.rhtml,0.0,33,"['have', 'put', 'syntax', 'file', 'need', 'use', 'linux', 'syntax', 'file', 'need', 'work', 'rhyme']"
38268,38268,"eul-:  What OS you running? eul-:  if you checkout $VIM/filetype.vim autocmd BufNewFile,BufRead      *.stp,*.proc            setf stp That's the basic idea",0.0,19,"['os', 'run', 'checkout', 'teletype', 'bufnewfile', 'bread', 'stop', 'pro', 'set', 'stop', 'basic', 'idea']"
38273,38273,"wow - nothing makes my browsers steam up my laptop as much as loading the html5 spec! you mean: http://www.whatwg.org/specs/web-apps/current-work/ ? that's the one I meant ;-) maybe I shouldn't use &quot;html5 spec&quot; for it, but &quot;html5&quot; has become a placeholder for all the modern web app specs, I guess haha - only seconds after loading that page, Chrome goes haywire and the same for firefox ab7faae5d7b250ea8606486575f8f79c: you're right - that page makes it take off even before the page is loaded shudders the html5 spec is definitely the challenge of the future for web browsers ;) a924fb58d2c25874322f4e5126f608b9: that's a good thing - stuff gets clarified in lawsuites stops FUD from happening othermaciej: just got my suspicions of earlier on confirmed about theora - there are indeed two independent implementations - the one from xiph and the one from ffmpeg - they both originated from vp3 code, but both have changed so much that there is assumed there is no code overlap any longer",0.0,164,"['make', 'browser', 'steam', 'laptop', 'as', 'much', 'load', 'mean', 'help', 'web', 'app', 'current', 'work', 'one', 'mean', 'maybe', 'shouldn', 'use', 'quit', 'quit', 'become', 'placeholder', 'modern', 'web', 'app', 'spec', 'guess', 'only', 'second', 'load', 'page', 'chrome', 'go', 'haywire', 'same', 'firebox', 'ab7faae5d7b250ea8606486575f8f79c', 're', 'right', 'page', 'make', 'take', 'even', 'page', 'load', 'shudder', 'definitely', 'challenge', 'future', 'web', 'browser', 'good', 'thing', 'stuff', 'get', 'clarify', 'lawsuit', 'stop', 'fun', 'happen', 'othermaciej', 'just', 'get', 'suspicion', 'earlier', 'confirm', 'theory', 'indeed', 'independent', 'implementation', 'mpeg', 'originate', 'code', 'change', 'so', 'much', 'assume', 'code', 'overlap', 'any', 'longer']"
38275,38275,"040342c014ffc1c11592948bd92e3721: I bet the Web Applications 1.0 spec steams it up more 040342c014ffc1c11592948bd92e3721: No, I mean http://www.whatwg.org/specs/web-apps/current-work/complete.html You want the PDF, since that (I assume?) has working hyperlinks 6b7076cc0a09cc5efeb0f9969966e870: You should be able to do it by setting globalCompositeOperation to e.g. destination-out (I think) and then draw a solid line (Maybe it's more like source-out or something)",0.0,57,"['bet', 'web', 'application', 'steam', 'more', 'mean', 'help', 'web', 'app', 'current', 'work', 'complete', 'himl', 'want', 'edf', 'assume', 'work', 'hyperlink', 'should', 'able', 'set', 'globalcompositeoperation', 'e', 'destination', 'think', 'then', 'draw', 'solid', 'line', 'maybe', 'more', 'source', 'out']"
38276,38276,"040342c014ffc1c11592948bd92e3721, try doing an incremental search in firefox with the complete whatwg spec loaded 040342c014ffc1c11592948bd92e3721, definitely painful browsing the spec with curl http://... |less however is fast a11aabeeceeae6b8cb5d12ea06b56554, you are right, that txt file is nice 27.584 references, wow!",0.0,39,"['try', 'do', 'incremental', 'search', 'firebox', 'complete', 'whatwe', 'load', 'definitely', 'painful', 'browse', 'spec', 'curl', 'help', 'less', 'however', 'fast', 'right', 'text', 'file', 'nice', 'reference']"
38278,38278,"I am toying with a canvas based painting program, and I want to make an eraser. In other words I want make the canvas transparent again.  Can I define a strokeStyle that does this? (I hope that I am in the right channel.. I tried to judge from previous conversation :) ) Cool thanks.",0.0,54,"['toy', 'canvas', 'base', 'painting', 'program', 'want', 'make', 'eraser', 'other', 'word', 'want', 'make', 'canvas', 'transparent', 'again', 'can', 'define', 'strokestyle', 'hope', 'right', 'channel', 'try', 'judge', 'previous', 'conversation', 'cool', 'thank']"
38283,38283,If you knew ahead of time what the users would be (as in their mac addresses) yes.,0.0,17,"['know', 'ahead', 'time', 'user', 'would', 'address']"
38284,38284,I know that Well I know the one mac I want to exclude... ? Only one user uses the damn plug shit and I have that MAC what directory is that in? yeah I don't have a kismet file on my router I installed noCat via the DD-WRT gui hmmm I don't think I have that file either ok- thanks,0.0,60,"['know', 'know', 'one', 'want', 'exclude', 'only', 'user', 'use', 'damn', 'plug', 'shit', 'directory', 'don', 'file', 'router', 'instal', 'art', 'don', 'think', 'file', 'ok', 'thank']"
38285,38285,"Cpudan80: in kismet? yeah, read kismet.conf and filter it Cpudan80: if you installed from source and didn't change it, /usr/local/etc Cpudan80: if you are using a distro package, I might suggest &quot;locate kismet.conf&quot; Cpudan80: kismet_drone.conf maybe Cpudan80: I don't know if the drone can filter though... Cpudan80: there must be some config file on the router to run a kismet_drone (I think) this question may be better suited for #kismet, I don't know much about drones dragorn: he didn't even have kismet installed, so no worries",0.0,86,"['filter', 'cpudan80', 'instal', 'source', 'change', 'local', 'cpudan80', 'use', 'distro', 'package', 'may', 'suggest', 'quit', 'maybe', 'don', 'know', 'drone', 'can', 'filter', 'must', 'config', 'file', 'router', 'run', 'drone', 'think', 'question', 'may', 'better', 'suit', 'know', 'much', 'dragon', 'didn', 'even', 'kismet', 'instal', 'worry']"
38286,38286,the drone can't filter because it doesn't process frame contents oh he's not here anymore.  whatever.,0.0,16,"['drone', 'can', 'filter', 'doesn', 'process', 'frame', 'content', 'here', 'anymore']"
38287,38287,"I am having trouble compiling prism2 for debian.  I am running 2.4.27 kernel and keep getting this error:  &quot;prism2_cs.c:27: error: syntax error before &quot;int&quot;&quot;  Anyone know how to resolve this, or know a simple way to install the prism2 driver?",0.0,40,"['have', 'trouble', 'compile', 'prism', 'run', 'kernel', 'keep', 'get', 'error', 'quit', 'prism', 'error', 'syntax', 'error', 'quit', 'quit', 'know', 'how', 'resolve', 'know', 'simple', 'way', 'install', 'prism', 'driver']"
38296,38296,hi how r u fine where r u from 19 u? turkey spain is a beautiful city isnt it sorry country i have been in madrid when im chilf child long time ago i dont remember well what did you do here did you like here because of crowded i think most of people are in hurry for their work yes crowded cities are like this r u student yeap at university pharmacy r u interested in it? in spain do pharmacist earn much money? do you know that? medicine is hard for me in tukey turkey you have to stude for 6 years it is long time i think tolga u? nice to meet you emily which sunject do you want to study,0.0,124,"['how', 'fine', 'where', 'beautiful', 'city', 'sorry', 'country', 'when', 'child', 'child', 'long', 'time', 'ago', 'remember', 'here', 'here', 'crowded', 'think', 'most', 'people', 'hurry', 'work', 'crowd', 'city', 'student', 'yeap', 'university', 'pharmacy', 'interested', 'earn', 'much', 'money', 'know', 'medicine', 'hard', 'study', 'year', 'long', 'time', 'think', 'toga', 'nice', 'meet', 'emily', 'subject', 'want', 'study']"
