,Unnamed: 0,text,predator,text_len,preprocessed_bow
69071,69071,"the CAPTCHA thing makes one go &quot;hmm&quot;: http://www.webvisum.com/ cc097e0d7183ae8436e7df709553c8c0: icon.png deployed on validator.nu. the usual front page caching issues apply. cc097e0d7183ae8436e7df709553c8c0: thank you hendry: see above. validator.nu now has a favicon cc097e0d7183ae8436e7df709553c8c0: I deployed your file bit-for-bit :-) learns the term syntactic vinegar from tantek's namespaces considered harmful wiki article 69b0d3dfe919a6b860a9fac82de52a7e: it seems though, that actually using the term &quot;benevolent dictator&quot; is a PR problem when your audience hasn't been socialized to know Python terminology (both for the W3C and the WHATWG) for life even 69b0d3dfe919a6b860a9fac82de52a7e: having one and using the term without PR issues are two different things 69b0d3dfe919a6b860a9fac82de52a7e: I don't follow Linux development, but I'd expect certain vendors to be able to override Linus if Linus wanted bad things the PR issue is that people who aren't familiar with the concept think that the dictator can dictate anything (one person's opinion) when really the dictator can only dictate things that implementors allow the dictator to resolve 69b0d3dfe919a6b860a9fac82de52a7e: that, too I wonder where the supposed expert were expected to come from according to the writer of the blog post from a few days ago that advocated experts instead of browser vendors driving the spec ab7faae5d7b250ea8606486575f8f79c: I don't know. They'd be experts. someone should write up some theory with words like &quot;indifference curve&quot; explaining what kind of things in practice can be decided by whom fwiw, I think both &quot;dictator&quot; and &quot;consensus&quot; give the wrong idea of how things really happen I wonder if I get accused of being part of a vast browser-wing conspiracy if I blog about managing one's expectations when suggesting features for Web specs one thing that intrigues me is how socialization happens when a new person approaches a group like the WHATWG I mean: why is it that some people fit the group but some people feel frustrated that they aren't being listened to do people get socialized or do the opinions a person happens to hold when approaching the group predetermine if the person fits in? do we have any documentation that indicates that &quot;try to get a browser vendor to commit to implementing it experimentally&quot; should be read the same way &quot;patches welcome&quot; should be read in an open source context? ab7faae5d7b250ea8606486575f8f79c: right 69b0d3dfe919a6b860a9fac82de52a7e: I wasn't suggesting that the &quot;experimental implementation&quot; line were a lie or misleading. 69b0d3dfe919a6b860a9fac82de52a7e: and suggestions are fine too after all, I don't have commit access to any browser code base I suggest stuff, though but I try not to act like I were entitled to get other implement my suggestions right away s/other/others/ actually, I think the key to not getting too frustrated is not expecting to be entitled to swift implmentation in browsers b07211a0c7cb119232799d2119cea90f: http://www.w3.org/QA/2008/06/what_benevolent_dictator.html Hmm. the complexity of http://juicystudio.com/wcag/tables/complexdatatable.html is that the dataset is three-dimensional, isn't it? actually, that's not exactly it anyway, the table isn't immediately obvious even visually",0.0,474,"['catch', 'thing', 'make', 'go', 'quit', 'quit', 'help', 'webvisum', 'com', 'cc097e0d7183ae8436e7df709553c8c0', 'icon', 'pig', 'deploy', 'validate', 'usual', 'front', 'page', 'cache', 'issue', 'apply', 'cc097e0d7183ae8436e7df709553c8c0', 'thank', 'see', 'validate', 'now', 'falcon', 'cc097e0d7183ae8436e7df709553c8c0', 'deploy', 'file', 'bit', 'bit', 'learn', 'term', 'syntactic', 'vinegar', 'tante', 'namespace', 'consider', 'harmful', 'wiki', 'article', 'seem', 'actually', 'use', 'term', 'quit', 'benevolent', 'dictator', 'quit', 'problem', 'audience', 'hasn', 'be', 'socialize', 'know', 'python', 'terminology', 'whatwe', 'life', 'even', 'have', 'one', 'use', 'term', 'issue', 'different', 'thing', 'don', 'follow', 'development', 'expect', 'certain', 'vendor', 'able', 'override', 'want', 'bad', 'thing', 'issue', 'people', 'aren', 'familiar', 'concept', 'think', 'dictator', 'dictate', 'person', 'opinion', 'really', 'dictator', 'only', 'dictate', 'thing', 'implement', 'allow', 'dictator', 'resolve', 'too', 'wonder', 'suppose', 'expert', 'expect', 'come', 'accord', 'writer', 'blog', 'post', 'few', 'day', 'ago', 'advocate', 'expert', 'instead', 'browser', 'vendor', 'drive', 'ab7faae5d7b250ea8606486575f8f79c', 'don', 'know', 'be', 'expert', 'write', 'theory', 'word', 'quit', 'indifference', 'curve', 'quit', 'explain', 'kind', 'thing', 'practice', 'decide', 'few', 'think', 'quit', 'dictator', 'quit', 'quit', 'consensus', 'quit', 'give', 'wrong', 'idea', 'thing', 'really', 'happen', 'wonder', 'get', 'accuse', 'part', 'vast', 'browser', 'wing', 'conspiracy', 'blog', 'manage', 'expectation', 'suggest', 'feature', 'web', 'spec', 'thing', 'intrigue', 'socialization', 'happen', 'new', 'person', 'approach', 'group', 'whatwe', 'mean', 'people', 'fit', 'group', 'people', 'feel', 'frustrated', 'aren', 'listen', 'people', 'get', 'socialize', 'opinion', 'person', 'happen', 'hold', 'approach', 'group', 'predetermine', 'person', 'fit', 'documentation', 'indicate', 'quit', 'try', 'get', 'browser', 'vendor', 'commit', 'implement', 'experimentally', 'quit', 'read', 'same', 'way', 'quit', 'patch', 'welcome', 'quit', 'read', 'open', 'source', 'context', 'ab7faae5d7b250ea8606486575f8f79c', 'right', 'wasn', 'suggest', 'quit', 'experimental', 'implementation', 'quit', 'line', 'lie', 'mislead', 'suggestion', 'fine', 'too', 'don', 'commit', 'access', 'browser', 'code', 'base', 'suggest', 'stuff', 'though', 'try', 'act', 'entitle', 'get', 'other', 'implement', 'suggestion', 'right', 'away', 'other', 'other', 'actually', 'think', 'key', 'get', 'too', 'frustrated', 'expect', 'entitle', 'swift', 'implementation', 'browser', 'help', 'org', 'benevolent', 'dictator', 'himl', 'complexity', 'help', 'wag', 'table', 'complexdatatable', 'himl', 'dataset', 'dimensional', 'actually', 'exactly', 'table', 'isn', 'immediately', 'obvious', 'even', 'visually']"
69072,69072,"b8810fee2f4a71f849f3f7409546d1d9: i argue that a benevolent dictator is needed for good work to result, and point to tim as an example of the w3c having a benevolent dictator. but the w3c has been doing poor work in recent years, which would be explained by tim no longer being dictator as per that post. python has a benevolent dictator? cool i guess i knew that that certainly isn't where i first heard the term but yes, most big projects have one linux, perl, python *shrug* the term is accurate i'm not big into doublespeak no more so than in python, as far as i can tell b8810fee2f4a71f849f3f7409546d1d9: that isn't a problem with the term &quot;dictator&quot;, it's a problem with the word &quot;spec&quot;. b8810fee2f4a71f849f3f7409546d1d9: c.f. the people who think the vendors should do whatever the wg resolves. b8810fee2f4a71f849f3f7409546d1d9: i certainly don't mean &quot;don't come back until you've done something productive&quot;; we've had input from many people who have done nothing but make a suggestion, and that's absolutely fine b8810fee2f4a71f849f3f7409546d1d9: however, when someone is told &quot;we have considered that and rejected it because browser vendors won't implement it&quot; and they argue back, then the real honest answer is &quot;well then get a browser vendor to implement it&quot; b8810fee2f4a71f849f3f7409546d1d9: it's not a lie, it's not even misleading b8810fee2f4a71f849f3f7409546d1d9: however, it's possible that some people do come to a working group like the whatwg with expectations that don't match what will happen (e.g. expecting suggestions to be considered without looking at previous existing content) b8810fee2f4a71f849f3f7409546d1d9: (or not accepting that simplicity is a virtue for the web platform, or that a significant number of web developers will just copy and paste anything until it works) i guess not sure edb259c0e0038f38bb200bc20c8cbf7e: what should it be called instead (other than URL)? i might change it to URL, but that's not a good name either :-)",0.0,307,"['argue', 'benevolent', 'dictator', 'need', 'good', 'work', 'result', 'point', 'example', 'have', 'benevolent', 'dictator', 'do', 'poor', 'work', 'recent', 'year', 'explain', 'no', 'long', 'dictator', 'post', 'python', 'benevolent', 'dictator', 'cool', 'guess', 'know', 'certainly', 'isn', 'first', 'hear', 'term', 'most', 'big', 'project', 'linux', 'python', 'shrug', 'term', 'accurate', 'big', 'doublespeak', 'more', 'so', 'python', 'as', 'far', 'tell', 'isn', 'problem', 'term', 'quit', 'dictator', 'quit', 'problem', 'word', 'quit', 'quit', 'i', 'people', 'think', 'vendor', 'resolve', 'certainly', 'don', 'mean', 'quit', 'come', 'back', 've', 'do', 'productive', 'quit', 've', 'input', 'many', 'people', 'do', 'make', 'suggestion', 'absolutely', 'fine', 'however', 'tell', 'quit', 'consider', 'reject', 'browser', 'vendor', 'win', 'implement', 'quit', 'argue', 'then', 'real', 'honest', 'answer', 'quit', 'well', 'then', 'get', 'browser', 'vendor', 'implement', 'quit', 'lie', 'even', 'mislead', 'b8810fee2f4a71f849f3f7409546d1d9', 'however', 'possible', 'people', 'come', 'work', 'group', 'whatwe', 'expectation', 'don', 'match', 'happen', 'e', 'expect', 'suggestion', 'consider', 'look', 'previous', 'exist', 'content', 'accept', 'simplicity', 'virtue', 'web', 'platform', 'significant', 'number', 'web', 'developer', 'just', 'copy', 'paste', 'work', 'guess', 'sure', 'edb259c0e0038f38bb200bc20c8cbf7e', 'call', 'instead', 'other', 'change', 'url', 'good', 'name', 'either']"
69073,69073,"I would guess that far more vendors ship the Linux kernel with significant patches than for Python so they have ultimate control over what their users run What are they meant to be experts in? Might be easier to understand if it didn't use words like &quot;indifference curve&quot; :-) i.e. &quot;shut up and don't come back until you've done something productive&quot;? It would be nicer if they weren't told to go away, even in politer language a11aabeeceeae6b8cb5d12ea06b56554: Hello Probably contention from all the passengers running BitTorrent looks at his Downloads window 1323.7 KByte/s for the last thing I downloaded, which sounds much more reasonable",0.0,104,"['guess', 'far', 'more', 'vendor', 'ship', 'kernel', 'significant', 'patch', 'python', 'ultimate', 'control', 'user', 'run', 'mean', 'expert', 'easy', 'understand', 'didn', 'use', 'word', 'quit', 'indifference', 'curve', 'quit', 'quit', 'shut', 'don', 'come', 'back', 've', 'do', 'productive', 'quit', 'nice', 'weren', 'tell', 'go', 'away', 'even', 'politer', 'language', 'probably', 'contention', 'passenger', 'run', 'bittorrent', 'look', 'download', 'window', 'byte', 'last', 'thing', 'download', 'sound', 'much', 'more', 'reasonable']"
69074,69074,"sounds useful to blog about that makes things easier when someone new comes along :) 69b0d3dfe919a6b860a9fac82de52a7e, &quot;websocket-uri&quot; is obviously the wrong name! :) URL is not an option? 69b0d3dfe919a6b860a9fac82de52a7e, I suggest URL until something better comes up. Especially since we try to remove URI everywhere introducing it here is just confusing :) 69b0d3dfe919a6b860a9fac82de52a7e, maybe location though given that it holds a URL...",0.0,62,"['sound', 'useful', 'blog', 'make', 'thing', 'easy', 'new', 'come', 'along', 'quit', 'websocket', 'quit', 'obviously', 'wrong', 'name', 'option', 'suggest', 'well', 'come', 'especially', 'try', 'remove', 'everywhere', 'introduce', 'here', 'just', 'confuse', 'maybe', 'location', 'though', 'give', 'hold', 'url']"
69075,69075,"waves Onboard train internet access is so slow :( and I keep getting errors trying to push the changes I made to the spec-ge *gen Got up to 12KB/s! New high! It wasn't this bad last time :\ Oh, well, it's not got as bad as it was when I was stuck outside Inverkeithing in May: highest was 51 _BYTES_ per second. I was trying to download a bit of the Unicode spec at the time. It was estimating several hours remaining. For a single chapter. WHAT!? Peak it now 35KB/s! That's amazing! (the highest I've ever got on a train would be maybe 300KB/s) sighs I _can't_ get a connection that fast at home",0.0,115,"['wave', 'train', 'internet', 'access', 'so', 'slow', 'keep', 'get', 'error', 'try', 'push', 'change', 'make', 'get', 'kb', 'new', 'high', 'wasn', 'bad', 'last', 'time', 'get', 'as', 'bad', 'stick', 'outside', 'inverkeithe', 'high', 'byte', 'second', 'try', 'download', 'bit', 'unicorn', 'spec', 'time', 'estimate', 'several', 'hour', 'remain', 'single', 'chapter', 'peak', 'now', 'kb', 'amazing', 'high', 've', 'ever', 'get', 'train', 'maybe', 'kb', 'sigh', 'get', 'connection', 'fast', 'home']"
69088,69088,"hi all, anyone familiar with google's implementation of microformats for their &quot;rich snippets&quot; ? especially interested in their rich snippets testing tool - http://www.google.com/webmasters/tools/richsnippets - which appears to not be following the relevant standards what i'm unsure of at the moment is whether the preview I am seeing is actually accurate to how my results will be shown because how its misinterpreting - for example - dtreviewed means that a user will see a timestamp instead of a nicely formatted date thanks btw adactio: which list are these issues being reported on? would be interested to make some additions adactio: thanks, i'll have a read through one other thing while i'm in here - is it possible to prevent accidental class clashes within a microformat, i can understand why namespacing is not used but especially when enhancing legacy code its not always possible to update css and html adactio: the problem we have seen is in using hproduct for example, we are using classes nested within the hproduct container that make semantic sense being called what they are called but are storing data that is not suitable for the microformat. this clash seems unavoidable to me adaction: an example of this is a class &quot;availability&quot; which stores a system configurable label that represents what that specific site wants to call availability, we cannot rename the class and , although nested within the container , it is not storing data that the mircoformat would expect adactio: an example of this is a class &quot;availability&quot; which stores a system configurable label that represents what that specific site wants to call availability, we cannot rename the class and , although nested within the container , it is not storing data that the mircoformat would expect adactio: because the microformat parser thinks that the phrase stored within that class is a reference to the item's availability which it isnt, its just the label representing Availability I would assume though that this issue would exist within other microformats too, its not inconceivable that a class within a microformat container could need to be ignored by the parser, or is it? adactio: i guess this is only going to be an issue with legacy code but this is the bread and butter for a lot of developers and it would be a shame if there were potential barriers to adoption for these people adactio: my mum always said i was &quot;unique&quot; as much as it is an edge case, would you say there's any value in me pursuing this?",0.0,423,"['familiar', 'implementation', 'microformat', 'quit', 'rich', 'snippet', 'quit', 'especially', 'interested', 'rich', 'snippet', 'testing', 'tool', 'help', 'com', 'webmaster', 'tool', 'richsnippet', 'appear', 'follow', 'relevant', 'standard', 'unsure', 'moment', 'preview', 'see', 'actually', 'accurate', 'result', 'show', 'misinterpreting', 'example', 'review', 'mean', 'user', 'see', 'timestamp', 'instead', 'nicely', 'format', 'date', 'thank', 'way', 'adagio', 'list', 'issue', 'report', 'interested', 'make', 'addition', 'adagio', 'thank', 'read', 'other', 'thing', 'here', 'possible', 'prevent', 'accidental', 'class', 'clash', 'microformat', 'understand', 'namespacing', 'use', 'especially', 'enhance', 'legacy', 'code', 'always', 'possible', 'update', 'ass', 'himl', 'adagio', 'problem', 'see', 'use', 'product', 'example', 'use', 'class', 'nest', 'product', 'container', 'make', 'semantic', 'sense', 'call', 'call', 'store', 'datum', 'suitable', 'microformat', 'clash', 'seem', 'unavoidable', 'adaption', 'example', 'class', 'quit', 'availability', 'quit', 'store', 'system', 'configurable', 'label', 'represent', 'specific', 'site', 'want', 'call', 'availability', 'rename', 'class', 'nest', 'container', 'store', 'datum', 'mircoformat', 'expect', 'adagio', 'example', 'class', 'quit', 'availability', 'quit', 'store', 'system', 'configurable', 'label', 'represent', 'specific', 'site', 'want', 'call', 'availability', 'rename', 'class', 'nest', 'container', 'store', 'datum', 'mircoformat', 'expect', 'adagio', 'microformat', 'parker', 'think', 'phrase', 'store', 'class', 'reference', 'item', 'availability', 'just', 'label', 'represent', 'availability', 'assume', 'issue', 'exist', 'other', 'microformat', 'too', 'inconceivable', 'class', 'microformat', 'container', 'need', 'ignore', 'parker', 'adagio', 'guess', 'only', 'go', 'issue', 'legacy', 'code', 'bread', 'butter', 'lot', 'developer', 'shame', 'potential', 'barrier', 'adoption', 'people', 'adagio', 'mum', 'always', 'say', 'quit', 'unique', 'quit', 'as', 'much', 'edge', 'case', 'say', 'there', 'value', 'pursue']"
69089,69089,"a1b016c80b9c45c9c8d70c3c173721eb: It does have some issues. People have been giving feedback to the Google guys on the list so hopefully it will get updated soon. a1b016c80b9c45c9c8d70c3c173721eb: you can find the emails in the list archive (check for activity in the past few days). a1b016c80b9c45c9c8d70c3c173721eb: the root class (e.g. vcard, vevent) effectively acts like a name space. Clashes can't occur with a class of, say, &quot;url&quot; inside an hcard and a class of &quot;url&quot; elsewhere on the same page. a1b016c80b9c45c9c8d70c3c173721eb: but where's the problem? You can use your own class names and the microformats class names. a1b016c80b9c45c9c8d70c3c173721eb: but why is that a problem&gt; ? Are you saying that what you call availability matches to a different class name in the microformat? ah, I see. I must admit, I don't know much about hproduct. It's a draft microformat so it could well be that the class names end up changing. a1b016c80b9c45c9c8d70c3c173721eb: I think it's pretty unlikely but I guess it's certainly possible. a1b016c80b9c45c9c8d70c3c173721eb: I would agree but I think it's an edge case. Yours is the first instance I've heard. :-)",0.0,179,"['issue', 'people', 'give', 'feedback', 'guy', 'list', 'so', 'hopefully', 'get', 'update', 'soon', 'a1b016c80b9c45c9c8d70c3c173721eb', 'find', 'email', 'list', 'archive', 'check', 'activity', 'past', 'few', 'day', 'a1b016c80b9c45c9c8d70c3c173721eb', 'root', 'class', 'e', 'card', 'event', 'effectively', 'act', 'name', 'space', 'clash', 'occur', 'class', 'say', 'quit', 'quit', 'heard', 'class', 'quit', 'url', 'quit', 'elsewhere', 'same', 'page', 'problem', 'use', 'own', 'class', 'name', 'microformat', 'class', 'name', 'a1b016c80b9c45c9c8d70c3c173721eb', 'problem', 'say', 'call', 'availability', 'match', 'different', 'class', 'name', 'microformat', 'see', 'admit', 'don', 'know', 'much', 'product', 'i', 'draft', 'microformat', 'well', 'class', 'name', 'end', 'change', 'think', 'pretty', 'unlikely', 'guess', 'certainly', 'possible', 'agree', 'think', 'edge', 'case', 'first', 'instance', 've', 'hear']"
69090,69090,"Heyyy 8:22 pm California Where is that? Oh niiice hotr old are How* Oh I&apos;m 16 Not medical Lol :) I&apos;m not sure I dont buy, people buy for me. My brother grows Not me I just smoke it",0.0,39,"['heavy', 'am', 'nice', 'hot', 'old', 'apos', 'medical', 'laugh', 'apos', 'sure', 'buy', 'people', 'buy', 'brother', 'grow', 'just', 'smoke']"
69091,69091,hello what time is it? west coast am i right? nailed it 11:23 here east coast georgia 17 i assumed that got that medical marijuana? i see what you did there i wish i lived in cali how much is fire per gram? and you grow it? because i don&apos;t see how you wouldn&apos;t know how much a gram of fire would be that&apos;s fucking awesome hydroponic? so you pretty much get free weed,0.0,74,"['time', 'right', 'nail', 'here', 'east', 'coast', 'assume', 'get', 'medical', 'marijuana', 'see', 'there', 'wish', 'live', 'much', 'fire', 'gram', 'grow', 'don', 'see', 'know', 'much', 'gram', 'fire', 'fucking', 'awesome', 'hydroponic', 'so', 'pretty', 'much', 'get', 'free', 'weed']"
69094,69094,"bugmail: [Bug 10914] Allow multiple space separated values for the ARIA role attribute &lt;http://lists.w3.org/Archives/Public/public-html-bugzilla/2010Oct/2145.html&gt; ** [Bug 10975] from gmail, JimJJewett said: Audio and Video should show the fallback content (for older browsers) if they do not understand the codec -- even if they understand video (or audio) itself &lt;http://lists.w3.org/Archives/Public/public-html-bugzilla/2010Oct/2144.html&gt; ** [B",0.0,51,"['gmail', 'bug', 'allow', 'multiple', 'space', 'separate', 'value', 'role', 'attribute', 'help', 'list', 'org', 'archive', 'public', 'public', 'himl', 'himl', 'bug', 'gmail', 'say', 'audio', 'video', 'show', 'fallback', 'content', 'old', 'browser', 'understand', 'codec', 'even', 'understand', 'video', 'audio', 'help', 'list', 'org', 'archive', 'public', 'public', 'himl', 'himl']"
69097,69097,Hi How are you? Depressed I can&apos;t talk to my boyfriend for a while and I feel worthless without him His laptop broke and he lives in the next state over It&apos;s fien *fine I just... I don&apos;t know Well My parent&apos;s don&apos;t exactly know that I have a boyfriend And they&apos;ll wonder why I&apos;m talking so long on the phone,0.0,61,"['depressed', 'apos', 'talk', 'boyfriend', 'while', 'feel', 'worthless', 'laptop', 'break', 'live', 'next', 'state', 'fien', 'fine', 'just', 'don', 'know', 'parent', 'apos', 'don', 'exactly', 'know', 'boyfriend', 'apos', 'wonder', 'apos', 'talk', 'so', 'long', 'phone']"
69098,69098,heyy bored wbu / ? awwww y ? y cant u talk to him ? o o that sucks im sorry cant u call him or sumthn i no how that is&apos; yea i no the feeling,0.0,37,"['aww', 'talk', 'suck', 'sorry', 'call', 'summon', 'feeling']"
