,Unnamed: 0,text,predator,text_len,preprocessed_bow
72274,72274,"awful indention i wont bother trying to understand what it does, if it looks like this :&gt; or more accurately: if i'd try to read it i'd probably get an aneurysm in the process i'd say you cant actually test this behavior with js correctly hash is a magic host object... if i set it to some other value it can either do that stuff synchronously or asynchronously... however, reading that value back won't necessarily tell me if it's done with doing so or not e.g. it might cache that new value and don't even bother with crossing the native bridge if that value is requested is this specified in depth? linky? http://www.whatwg.org/specs/web-apps/current-work/#navigate &lt;- about navigating across documents, does not apply http://www.whatwg.org/specs/web-apps/current-work/#scroll-to-fragid &lt;- doesn't mention anything async well, imo this is like retrieving css values. you set some new value(s) (which might be cached/delayed), but once you try to retieve them you'll always get those new values back, because those changes were flushed forcefully so from the js side it always looks synchronous (but it isn't necessarily synchronous) (would be a lot more complicated to handle if this weren't the case) well... either way... you can't really test it with js unless the spec explicitly states that reading the hash must be a live value and must not cause any kind of flushing, which would be a) annoying to use and b) annoying to implement :&gt; (i'm aware that this still doesn't really answer your question, but it's the best shot i got)",0.0,253,"['awful', 'intention', 'bother', 'try', 'understand', 'look', 'more', 'accurately', 'try', 'read', 'probably', 'get', 'aneurysm', 'process', 'say', 'actually', 'test', 'behavior', 'correctly', 'hash', 'magic', 'host', 'object', 'set', 'other', 'value', 'either', 'stuff', 'synchronous', 'asynchronous', 'however', 'read', 'value', 'back', 'win', 'necessarily', 'tell', 'do', 'do', 'so', 'e', 'cache', 'new', 'value', 'even', 'bother', 'cross', 'native', 'bridge', 'value', 'request', 'specify', 'depth', 'link', 'help', 'whatwe', 'org', 'spec', 'web', 'app', 'current', 'work', 'navigate', 'navigate', 'document', 'apply', 'help', 'whatwe', 'org', 'spec', 'web', 'app', 'current', 'work', 'scroll', 'frigid', 'doesn', 'mention', 'sync', 'well', 'opinion', 'retrieve', 'ass', 'value', 'set', 'new', 'value', 'cache', 'delay', 'try', 'retrieve', 'always', 'get', 'new', 'value', 'back', 'change', 'flush', 'forcefully', 'so', 'side', 'always', 'look', 'synchronous', 'isn', 'necessarily', 'synchronous', 'lot', 'more', 'complicated', 'handle', 'weren', 'case', 'way', 'really', 'test', 'spec', 'explicitly', 'state', 'read', 'hash', 'live', 'value', 'cause', 'kind', 'flush', 'annoying', 'use', 'annoying', 'implement', 'aware', 'still', 'doesn', 'really', 'answer', 'question', 'good', 'shot', 'get']"
72275,72275,http://twitter.com/WHATWG/status/51084738148057088 - Might want to look into tweaking the automatic shortener. Perhaps shorten to last full word? (hacks.mozilla link broken in tweet),0.0,22,"['help', 'twitter', 'com', 'whatwe', 'status', 'want', 'look', 'tweak', 'automatic', 'shorten', 'perhaps', 'shorten', 'last', 'full', 'word', 'hack', 'link', 'break', 'tweet']"
72277,72277,"[http://twitter.com/javigarcia] m?°s #microformats ahora para m??sica y canciones http://t.co/Is5cGEJ [[I hate those dreams about the Student Loans Co too 27]] N http://microformats.org/wiki/index.php?title=I_hate_those_dreams_about_the_Student_Loans_Co_too_27&amp;rcid=57585 * GeorgeSewell2 * (+1751) New page: [[Image:student_loans_4679.jpg|thumb|]]  Student loans are meant to insure the cost of your training; housing, books, food and transportation.  Nonetheless, there may arrive any duration [[Special:Log/delete]] delete  * Adactio *  deleted &quot;[[I hate those dreams about the Student Loans Co too 27]]&quot;: Vandalism: content was: '[[Image:student_loans_4679.jpg|thumb|]]  Student loans are meant to insure the cost of your training; housing, books, food and transportation.  Noneth...' (and the only contributor was '[[Special:Contributions/GeorgeSewell2|GeorgeSewell2]]')",0.0,95,"['help', 'twitter', 'com', 'microformat', 'para', 'sick', 'y', 'canine', 'help', 'co', 'is5cgej', 'hate', 'dream', 'student', 'loan', 'co', 'too', 'help', 'microformat', 'index', 'pop', 'title', 'hate', 'dream', 'student', 'loan', 'co', 'too', 'amp', 'rid', 'georgesewell2', 'new', 'page', 'image', 'student', 'loan', 'student', 'loan', 'mean', 'insure', 'cost', 'training', 'housing', 'book', 'food', 'transportation', 'nonetheless', 'arrive', 'duration', 'special', 'log', 'delete', 'delete', 'adagio', 'delete', 'quit', 'hate', 'dream', 'student', 'loan', 'co', 'too', 'quit', 'vandalism', 'content', 'image', 'student', 'loan', 'student', 'loan', 'mean', 'insure', 'cost', 'training', 'housing', 'book', 'food', 'transportation', 'none', 'only', 'contributor', 'special', 'contribution', 'georgesewell2', 'georgesewell2']"
72282,72282,"jwormy, not really... my XP SATA2 disk died, and took a whole bunch of shit with it rikkus, tell that to my boss predatory_kangar, yeah, much better than B2 although, my roommate and his validation co-workers over at Intel say it isn't but... they rarely know what they're talking about &quot;you shouldn't talk about intel layoffs... they aren't going to fire 11k people... we have insider info&quot; predatory_kangar, it'd be nice if Thunderbird didn't crash predatory_kangar, I'm not really keen on running Windows Mail especially since I don't really know how to get it set up correctly to handle multiple accounts yeah... not sure how to get outlook proper to do it either I'd have to activate my OFfice beta oh sweet, my profile is roaming predatory_kangar, huh? the office 2007 beta dunno any other fancy buzzwords uh, yeah... I'm not MSDN or anything yeah... but like in Thunderbird there's some logical seperation Mail just munges them all into one folder set do I have to create folders for everything for each account..? I just want to have multiple accounts... isntead of one clusterfuck but for now, i t's nap time jwormy, indeed 0613 so? predatory_kangar, what a shitty client oh wait, live mail desktop thingy I wonder what this does oh no, no.. fuck that alright... well, nap time",0.0,220,"['wormy', 'really', 'disk', 'die', 'take', 'whole', 'bunch', 'shit', 'rimku', 'tell', 'boss', 'predatory', 'hangar', 'much', 'well', 'roommate', 'validation', 'co', 'worker', 'say', 'isn', 'rarely', 'know', 're', 'talk', 'quit', 'shouldn', 'talk', 'intel', 'layoff', 'aren', 'go', 'fire', 'ask', 'people', 'insider', 'info', 'quit', 'predatory', 'hangar', 'be', 'nice', 'crash', 'predatory', 'hangar', 'really', 'keen', 'run', 'window', 'mail', 'especially', 'don', 'really', 'know', 'get', 'set', 'correctly', 'handle', 'multiple', 'account', 'sure', 'get', 'outlook', 'proper', 'activate', 'office', 'beta', 'sweet', 'profile', 'roam', 'predatory', 'hangar', 'office', 'beta', 'dunno', 'other', 'fancy', 'buzzword', 'i', 'man', 'there', 'logical', 'seperation', 'mail', 'just', 'lunge', 'folder', 'set', 'create', 'folder', 'account', 'just', 'want', 'multiple', 'account', 'instead', 'clusterfuck', 'now', 'nap', 'time', 'indeed', 'so', 'predatory', 'hangar', 'shitty', 'client', 'wait', 'live', 'mail', 'desktop', 'thingy', 'wonder', 'fuck', 'nap', 'time']"
72283,72283,ugh this is killing me how can i get a id of a td through C#? anyone?,0.0,17,"['kill', 'get', 'i', 'd', 'to']"
72284,72284,"Kog: It massively improves application compatibility, too, and gives a dramatic increase in COM speed I wouldn't know about that - I'm running Microsoft Outlook on this Kog: The Office version on Connect? Ah, you're with the public beta Never mind that then - the Office 2007 beta is what I'm using, works nicely, but to use multiple accounts in Windows Mail, Tools-&gt;Accounts lets you add more e-mail accounts Kog: Ah, right Kog: You can use Message Rules, and the &quot;To line contains people&quot; condition to sort your accounts into different folders Kog: Yep",0.0,94,"['dog', 'massively', 'improve', 'application', 'compatibility', 'too', 'give', 'dramatic', 'increase', 'com', 'speed', 'wouldn', 'know', 'run', 'microsoft', 'outlook', 'dog', 'office', 'version', 'connect', 're', 'public', 'beta', 'never', 'mind', 'then', 'office', 'beta', 'use', 'work', 'nicely', 'use', 'multiple', 'account', 'window', 'mail', 'tool', 'account', 'let', 'add', 'more', 'e', 'mail', 'account', 'dog', 'right', 'dog', 'use', 'message', 'rule', 'quit', 'line', 'contain', 'people', 'quit', 'condition', 'sort', 'account', 'different', 'folder', 'dog', 'yep']"
72285,72285,"hey guys i'm using ClickOnce publishing, i publish on the network and everybody has the it installed on their computer and everytime they open the application it checks for a new version.  My Problem is i have an XML file that i deploy with the app (Copy if newer) and i need to access it...  Application.StartupPath + @&quot;\VersionNotes\notes.xml&quot;    &lt;- this ends up in an error because Application.StartupPath gives some strange results so what is the good way to proceed ? found it, copied files are put there : System.Deployment.Application.ApplicationDeployment.CurrentDeployment.DataDirectory MessageBox Debugging FTW!",0.0,92,"['guy', 'use', 'clickonce', 'publishing', 'publish', 'network', 'instal', 'computer', 'everytime', 'open', 'application', 'check', 'new', 'version', 'problem', 'aml', 'file', 'deploy', 'app', 'copy', 'new', 'need', 'access', 'application', 'startuppath', 'quit', 'versionnote', 'note', 'aml', 'quit', 'end', 'error', 'application', 'startuppath', 'give', 'strange', 'result', 'good', 'way', 'proceed', 'find', 'copy', 'file', 'put', 'there', 'system', 'deployment', 'application', 'applicationdeployment', 'currentdeployment', 'datadirectory', 'messagebox', 'debug', 'few']"
72286,72286,"no you can have all in one ;p i've just installed monodevelop it does not have anythign like the designer, does it?",0.0,22,"['ve', 'just', 'instal', 'designer']"
72294,72294,"changes: sam: Reflect latest batch of calls for consensus, change proposals; link to a bug report related to issue 85. &lt;http://lists.w3.org/Archives/Public/public-html-diffs/2010Jun/0058.html&gt;",0.0,21,"['change', 'reflect', 'late', 'batch', 'call', 'consensus', 'change', 'proposal', 'link', 'bug', 'report', 'relate', 'issue', 'help', 'list', 'org', 'archive', 'public', 'public', 'himl', 'himl']"
72296,72296,"hopes 4dd217ba7542bb00a127f682e2c3ad27 won't kill him when he suggests splitting /TR/widgets into two specs (Joke) but only halfway it's just that, in retrospect, we should probably have split the packaging bit from the configuration",0.0,33,"['hope', 'win', 'kill', 'suggest', 'split', 'widget', 'spec', 'joke', 'only', 'halfway', 'just', 'retrospect', 'probably', 'split', 'packaging', 'bit', 'configuration']"
72297,72297,I think that can be done after P&amp;C gets to PR after Rec would be better but that's too far off but I haven't checked the dependencies lately,0.0,28,"['think', 'do', 'amp', 'get', 'rec', 'well', 'too', 'far', 'haven', 'check', 'dependency', 'lately']"
72298,72298,[[User:Businessesmarketing]] N http://microformats.org/wiki/index.php?title=User:Businessesmarketing&amp;rcid=57467 * Businessesmarketing * (+2616) New page: Top 3 Advantages of Using Link Building Services  Link building services are an integral component of online marketing methods for any website. It's among the best techniques of directing ...,0.0,39,"['user', 'businessesmarkete', 'help', 'microformat', 'index', 'pop', 'title', 'user', 'businessesmarkete', 'amp', 'rid', 'businessesmarkete', 'new', 'page', 'top', 'advantage', 'use', 'link', 'building', 'service', 'link', 'building', 'service', 'integral', 'component', 'online', 'marketing', 'method', 'website', 'good', 'technique', 'direct']"
72299,72299,"e3fb62ebfa4f36acf5cbff6a6ed0f2e0 - ... which is why it's important to have the rationale documented can't go back in time and do it but it would at least seem prudent for commit messages for changes checked in going forward to try to include at least some minimal statement of the rationale for the change otherwise, when we get to last-call comments -- when anybody at all who wants to can stroll in and start posting comments second-guessing everything's that preceded -- there is likely to be a lot more pain e3fb62ebfa4f36acf5cbff6a6ed0f2e0 - I read the commit/checkin messages. I don't see statements in most of them of the rationale for the changes. Not saying that all (or even most) of them need it necessarily. But some definitely should. and I guess the time can be spent now, or it can be spent later (in responding to last-call comments asking what the rationale for a particular part of the spec is)",0.0,157,"['important', 'rationale', 'document', 'go', 'back', 'time', 'least', 'seem', 'prudent', 'commit', 'message', 'change', 'check', 'go', 'forward', 'try', 'include', 'least', 'minimal', 'statement', 'rationale', 'change', 'otherwise', 'get', 'last', 'call', 'comment', 'want', 'stroll', 'start', 'post', 'comment', 'second', 'guess', 'precede', 'likely', 'lot', 'more', 'pain', 'read', 'commit', 'checkin', 'message', 'don', 'see', 'statement', 'most', 'rationale', 'change', 'say', 'even', 'most', 'need', 'necessarily', 'definitely', 'guess', 'time', 'spend', 'now', 'spend', 'later', 'respond', 'last', 'call', 'comment', 'ask', 'rationale', 'particular', 'part', 'spec']"
72300,72300,"I think there's such a commit message actually have you checked? I'll state it again though, there's only so much time to do things I don't know, I'm not going to do it 'yet 0,2% seems an astonishingly low usage to be considered &quot;significant&quot;.' I think I'm no longer going to respond to his e-mails seems like a big waste of time",0.0,62,"['think', 'there', 'commit', 'message', 'actually', 'check', 'state', 'again', 'only', 'so', 'much', 'time', 'thing', 'don', 'know', 'go', 'yet', 'seem', 'astonishingly', 'low', 'usage', 'consider', 'quit', 'significant', 'quit', 'think', 'no', 'long', 'go', 'respond', 'e', 'mail', 'seem', 'big', 'waste', 'time']"
72303,72303,Asl F 19 Hi Florida Yeah it is pritty nice here Hell yeah I though u would never ask Well u can undress me if ued like I am wearing tieght pants cute tieght white tanktop pink bra and black thong Well where&apos;s the fun in that u couldent arouse me as fast No Know my tits are hard I am wet God I am so aroused Hell yeah,0.0,69,"['age', 'pretty', 'nice', 'here', 'never', 'ask', 'undress', 'use', 'wear', 'tight', 'pant', 'cute', 'tight', 'white', 'pink', 'bra', 'black', 'thong', 'well', 'fun', 'arouse', 'as', 'fast', 'no', 'know', 'tit', 'hard', 'wet', 'so', 'arouse']"
72304,72304,"hi 21. new zealand M heloo. ^_^ where you from? oh cool i wna go there. =] so. um are you like looking for boys to have hot text secks with? haha oh well idk im not the average motherfucker on here! i really just want to know how magnets work! but i guess if your naked. an wetttttt i would. but tbh i cant reach? o_0 ^_^ if i take off the pants you could do the top an the bra. haha. cos idk my hands rubin all over the outside of your tight pants i jus wna get in there! haha i can arouse you very fast but thats IRL basically my cawk is hard as fuck an it wants to penetrate you is that so hard to understand? =P =] ok your clothes are offf kissing youu. moving down, licking your nipz. one hand is squeezing your ass as the other fumbles for a way into your pants i get the button undone and take down your zipper i pull you close to me and you can feel the rock hardness of my cock thru the fabric finally get your pants off. in my hurry i just pull your thong to the side pull down my jockeys and push my knob against your wet cunt you reach down to guide me and seconds later im in you like nother you ever felt before. sliding deeper and deeper as you loosen up and get wetter than you thought was possible your legs shake with pleasure. yea well im still pounding away thrashing your pussy like a bad puppy just before you climax i stop teasing you rubing your clit with my finger you wana suck my dick! ofcourse =] you rub yourself and give me some head. mm you wana do some typing? i mean. am I any good at this?",0.0,313,"['dna', 'go', 'there', 'so', 'look', 'boy', 'hot', 'text', 'suck', 'ink', 'average', 'motherfucker', 'on', 'here', 'really', 'just', 'want', 'know', 'magnet', 'work', 'guess', 'naked', 'wetttttt', 'tbe', 'reach', 'o', 'take', 'pant', 'top', 'bra', 'haha', 'ink', 'hand', 'rubin', 'all', 'outside', 'tight', 'pant', 'jus', 'dna', 'get', 'in', 'there', 'arouse', 'very', 'fast', 's', 'real', 'basically', 'hawk', 'hard', 'fuck', 'want', 'penetrate', 'so', 'hard', 'understand', 'ok', 'clothe', 'kiss', 'move', 'lick', 'nip', 'hand', 'squeeze', 'ass', 'other', 'fumble', 'way', 'pant', 'get', 'button', 'undone', 'take', 'zipper', 'pull', 'close', 'feel', 'rock', 'hardness', 'cock', 'fabric', 'finally', 'get', 'pant', 'hurry', 'just', 'pull', 'thong', 'side', 'pull', 'jockey', 'push', 'knob', 'wet', 'cunt', 'reach', 'guide', 'second', 'later', 'ever', 'feel', 'slide', 'deep', 'deep', 'loosen', 'get', 'wetter', 'think', 'possible', 'leg', 'shake', 'pleasure', 'yea', 'still', 'pound', 'away', 'thrash', 'pussy', 'bad', 'puppy', 'just', 'climax', 'stop', 'tease', 'rub', 'clit', 'finger', 'wana', 'suck', 'dick', 'ofcourse', 'rub', 'give', 'head', 'wana', 'typing', 'mean', 'good']"
72308,72308,planet: Drag and drop file uploads in Gmail using just the specs &lt;http://feedproxy.google.com/~r/ajaxian/~3/Vmqs3ynA74U/drag-and-drop-file-uploads-in-gmail-using-just-the-specs&gt; ** How can HTML5 &quot;replace&quot; Flash? &lt;http://stackoverflow.com/questions/2172626/how-can-html5-replace-flash&gt; bugmail: [Bug 9511] 4.2.5.1 keywords: strip spaces at separation comma &lt;http://lists.w3.org/Archives/Public/public-html-bugzilla/2010Apr/0204.html&gt; ** [Bug 9530] Validity of meta &quot;pragmas&quot; &lt;http://lists.w3.org/Archives/Public/public-html-bugzilla/2010Apr/0203.html&gt; ** [Bug 9527] tags and syntax &lt;http://lists.w3.org/Archives/Public/public-html-bugzilla/2010Apr/0202.html&gt; ** &quot;[Bug 9533] The Microdata extration algorithm should include im,0.0,56,"['drag', 'drop', 'file', 'upload', 'gmail', 'use', 'just', 'spec', 'help', 'feedproxy', 'com', 'drag', 'drop', 'file', 'upload', 'gmail', 'use', 'just', 'spec', 'himl', 'quit', 'replace', 'quit', 'flash', 'help', 'stackoverflow', 'com', 'question', 'himl', 'replace', 'flash', 'gmail', 'bug', 'keyword', 'strip', 'space', 'separation', 'comma', 'help', 'list', 'org', 'archive', 'public', 'public', 'himl', 'himl', 'bug', 'validity', 'quit', 'drama', 'quit', 'help', 'list', 'org', 'archive', 'public', 'public', 'himl', 'himl', 'bug', 'tag', 'syntax', 'help', 'list', 'org', 'archive', 'public', 'public', 'himl', 'himl', 'quit', 'bug', 'microdot', 'extraction', 'algorithm', 'include']"
72309,72309,hey http://www.facebook.com/photo.php?pid=448362&amp;l=d235258fa9&amp;id=1848932701 me ? no its me thanks m r f? hoe olddd? noo im american jeez eya yeah,0.0,19,"['help', 'facebook', 'com', 'photo', 'pop', 'pid', 'amp', 'thank', 'hoe', 'old', 'noo', 'american', 'eye']"
72310,72310,what is that? not a virus? Ah. You&apos;re quite pretty :) m :) 14 you dutch? oh.,0.0,17,"['virus', 'apos', 'quite', 'pretty', 'dutch']"
72311,72311,grey green and black is gross u cant wear those colors 2gether gotta pic of it u dont gotta car then how u not got a pic then so do it show me,0.0,33,"['grey', 'green', 'black', 'gross', 'wear', 'color', 'gether', 'get', 'pic', 'get', 'car', 'then', 'get', 'pic', 'then', 'so', 'show']"
72313,72313,"Hi asyd found out this morning i had lost my domain name, the fsckers didnt write to me and tell me was up so had to get a new one, and change everything on my machine s, its taken fscking ages this one i bought at domainacres the last one was a place calle registerfree or somerthing not personally, hes dead :P do a su - &lt;username&gt; then check the path yeah",0.0,72,"['find', 'morning', 'lose', 'domain', 'name', 'fucker', 'write', 'tell', 'so', 'get', 'new', 'one', 'change', 'machine', 'take', 'fucking', 'age', 'one', 'buy', 'domainacre', 'last', 'one', 'place', 'calle', 'registerfree', 'personally', 's', 'dead', 'su', 'username', 'then', 'check', 'path']"
72315,72315,"Hi, This is a stupid question I have a Solaris 9 machine and want to set the PATH when I log in remotely I've tried putting the lines PATH=&quot;$PATH:/my/path&quot; \n export PATH into ~/.profile and it doesn't seem to work sh on even without the quotes it doesn't work I'm very confused as this would work before on a different machine OK i'm connecting to the machine using exceed. If I do echo $PATH in the new terminal is gives me /usr/sbin:/usr/bin I don't think .profile is being read as if I put a like echo &quot;THis is being read&quot; in .profile it doesn't get shown when loging in will try ok how do I set it for the DM environment? I'm connecting using exceed there is no DM running so I cannot set it in the DM profile this is not a desktop it's a rack server. it's because I have to use it from a M$ windows machine I use exceed AJC_Z0: Thanks for you help. It was all to do with Exceed connecting using rexec",0.0,178,"['stupid', 'question', 'solaris', 'machine', 'want', 'set', 'path', 'log', 'remotely', 've', 'try', 'put', 'line', 'path', 'quit', 'path', 'path', 'quit', 'export', 'path', 'profile', 'doesn', 'seem', 'work', 'so', 'on', 'even', 'quote', 'doesn', 'work', 'very', 'confused', 'work', 'before', 'different', 'machine', 'connect', 'machine', 'use', 'exceed', 'echo', 'path', 'new', 'terminal', 'give', 'usr', 'skin', 'don', 'think', 'profile', 'read', 'put', 'like', 'echo', 'quit', 'read', 'quit', 'profile', 'doesn', 'get', 'show', 'lose', 'try', 'set', 'environment', 'connect', 'use', 'exceed', 'do', 'run', 'so', 'set', 'do', 'profile', 'desktop', 'i', 'rack', 'server', 'use', 'machine', 'use', 'exceed', 'arc', 'ze', 'thank', 'help', 'exceed', 'connect', 'use', 'exec']"
72316,72316,"Yes, it is so don t ask it Edit your shell profile or rc file. See the manual page for your shelll What is your shell? In any case, don't quote it Show it not working. Provide only relevant detail A new terminal will start a subshell, not a login shell. You need to defined your PATH for your DM environment DataStream: Irrelevant ie. it will pick up the PATH because it will start a login shell I don't know, since I don't know what kind of crappy DM you run. CDE? Gnome? .dtprofile is the place for CDE You could set it in your shell rc file, ie. in $ENV, but that is not the place for PATH norton: Yes, like it says in TFM So stop looking things up in Champions of Masturbation Compendium 2006 stefanpa_: Yes, you said. We are sorry you are crippled, but it's not relevant You are using Exceed to log into your Solaris desktop and you are not running a Desktop Manager? I don't believe you, though I would like it to be true A real man would use X and a WM, but you are no real man QED.",0.0,197,"['so', 'ask', 'edit', 'shell', 'profile', 'file', 'see', 'manual', 'page', 'shell', 'case', 'don', 'show', 'work', 'provide', 'only', 'relevant', 'detail', 'new', 'terminal', 'start', 'seashell', 'login', 'shell', 'need', 'define', 'path', 'do', 'environment', 'datastream', 'irrelevant', 'ie', 'pick', 'path', 'start', 'login', 'shell', 'don', 'know', 'don', 'know', 'kind', 'crappy', 'run', 'profile', 'place', 'set', 'shell', 'file', 'ie', 'end', 'place', 'path', 'say', 'so', 'stop', 'look', 'thing', 'champion', 'masturbation', 'compendium', 'stefania', 'say', 'sorry', 'crippled', 'relevant', 'use', 'exceed', 'log', 'solaris', 'desktop', 'run', 'desktop', 'manager', 'don', 'believe', 'like', 'true', 'real', 'man', 'use', 'real', 'man', 'red']"
72317,72317,"does the hyphen in 'su -' make the shell read the files it would if it were a login shell ? didn't say so exactly in my manual but indirectly, just wanted confirmation",0.0,33,"['hyphen', 'make', 'shell', 'read', 'file', 'login', 'shell', 'didn', 'say', 'so', 'exactly', 'manual', 'indirectly', 'just', 'want', 'confirmation']"
72319,72319,re http://www.w3.org/QA/2009/05/_watching_the_google_io.html -- maybe i should change the title on the whatwg version to &quot;HTML5 Draft Standard&quot; instead of &quot;HTML5 Draft Recommendation&quot; to remove any confusion... :-P,0.0,27,"['help', 'org', 'watch', 'maybe', 'change', 'title', 'whatwe', 'version', 'quit', 'himl', 'draft', 'standard', 'quit', 'instead', 'quit', 'himl', 'draft', 'recommendation', 'quit', 'remove', 'confusion']"
72326,72326,heya hello? okie then I am Lilith and I live on Pluto yesh I am 122 mhmm,0.0,17,"['heya', 'then', 'live', 'uhmm']"
72327,72327,hi I&apos;m male 24 yers old and im living turkey you stranger who are you ? hm hm me too asl please? ooo well wery well are you virgin hmm ? ??? are you horny man you a man or girl speak tell me ???* i looking for gilrs ok fuck your living ass hole,0.0,55,"['apos', 'male', 'yer', 'old', 'live', 'strange', 'too', 'ooo', 'well', 'wery', 'well', 'virgin', 'horny', 'man', 'man', 'girl', 'speak', 'tell', 'look', 'girl', 'fuck', 'live', 'ass', 'hole']"
