,Unnamed: 0,text,predator,text_len,preprocessed_bow
70298,70298,"Huh. Got disconneced from the call... 227a9a17d1db3f8e5c71a150345fb2a6: Has the DOM L3 draft changed considerably? ... I'd like to review it in a large 1-step pass for consistency, etc. ... I also want to consider Mozilla's MozMousePixelScroll event...",0.0,37,"['get', 'disconnect', 'call', '227a9a17d1db3f8e5c71a150345fb2a6', 'dom', 'draft', 'change', 'considerably', 'like', 'review', 'large', 'step', 'pass', 'consistency', 'also', 'want', 'consider', 'mozmousepixelscroll', 'event']"
70299,70299,"227a9a17d1db3f8e5c71a150345fb2a6: do we have to call today? s/to/the/ forgot what 227a9a17d1db3f8e5c71a150345fb2a6 said last week http://dev.w3.org/2006/webapi/DOM-Level-3-Events/html/DOM3-Events.html 227a9a17d1db3f8e5c71a150345fb2a6: btw, I looked at the mobile test harness framework, and as such it doesn't quite work for us, I think it uses a database and php etc, so requires a webserver and it doesn't run all the tests automatically - needs user interaction",0.0,59,"['call', 'today', 'forgot', '227a9a17d1db3f8e5c71a150345fb2a6', 'say', 'last', 'week', 'help', 'dev', 'org', 'weari', 'level', 'event', 'himl', 'dome', 'event', 'himl', 'bow', 'look', 'mobile', 'test', 'harness', 'framework', 'such', 'doesn', 'quite', 'work', 'think', 'use', 'database', 'pop', 'so', 'require', 'observer', 'doesn', 'run', 'test', 'automatically', 'need', 'user', 'interaction']"
70300,70300,"sorry, no telcon today in a meeting d5217991a5c7374b110deb03905676f7: can't talk now, but it hasn't changed much recently bbiab",0.0,18,"['telco', 'today', 'meeting', 'd5217991a5c7374b110deb03905676f7', 'talk', 'now', 'hasn', 'change', 'much', 'recently', 'brian']"
70307,70307,"what the apparently checking out the webkit source gives you ... webkit.org? thanks, I guess... :) i've worked on a commercial game that MIT-licenses most of its code for many years ... it works &quot;okay&quot; that's more like 10-year-old well, no open source game is actually going to really support consoles, since the APIs are largely proprietary and it's probably quasi-legal to even release code using them, heh (we did a PS2 port of our game years back; none of that code was ever released) i'd imagine typical systems with onboard Intel video chipsets and similar laptops &lt d3c9ec5d23498bc66cc43bac6408ab4d&gt; The source of webkit.org is on svn &lt;- it's not having them in svn that's surprising, it's having them in the WebKit source tree webkit doesn't send onprogress reliably on chunked XHR responses :( probably due to buffering yeah, definitely",0.0,139,"['apparently', 'check', 'website', 'source', 'give', 'website', 'org', 'thank', 'guess', 've', 'work', 'commercial', 'game', 'mit', 'license', 'most', 'code', 'many', 'year', 'work', 'quit', 'quit', 'more', 'year', 'old', 'open', 'source', 'game', 'actually', 'go', 'really', 'support', 'console', 'ape', 'largely', 'proprietary', 'probably', 'quasi', 'legal', 'even', 'release', 'code', 'use', 'port', 'game', 'year', 'back', 'none', 'code', 'ever', 'release', 'imagine', 'typical', 'system', 'intel', 'video', 'chipset', 'similar', 'laptop', 'd3c9ec5d23498bc66cc43bac6408ab4d', 'source', 'website', 'org', 'son', 'have', 'son', 'surprise', 'have', 'website', 'source', 'tree', 'website', 'send', 'progress', 'reliably', 'chunk', 'ihr', 'response', 'probably', 'due', 'buffer', 'definitely']"
70309,70309,"The source of webkit.org is on svn, he's probably poining that out (the site) as are bugs. and planet.",0.0,19,"['source', 'website', 'org', 'son', 'probably', 'join', 'site', 'bug', 'planet']"
70310,70310,"7f9405da4034bf43083e64b57302a8e6, just because openness and standards work for the web doesn't mean they're needed everywhere.  I tend to broadly agree with Eric S. Raymond's analysis of open-source software, where he suggests that closed-source software will always work better in some markets.  The same logic applies to open standards. Well, if interoperability is useful, yes.  What do games need to interoperate on? A typical high-end game is a standalone product that interacts with no other program (beyond the OS) and is basically obsolete in two years. What exactly is there to standardize? What sort of API would they expose?  Different games work very differently, that's one of the problems. I don't think standardization would help with that. Standardization is needed for inter-program APIs, document formats, things like that.  But any two independent games are different enough that there's nothing I can see that they could usefully share, in general. Well, they share things like graphics engines, clearly. But not along nice clean standardizable lines that you could make a stable API out of. At least it's my impression that when games use a third-party engine, they typically customize it to fit their needs. Well, yes.  Also file access can be standardized. Novel idea right there. But that's standardizing the OS, not the game. Essentially, yes. (I've given thought to the possibility that an open-source graphics engine for games could be successful, if it used a dual-licensing scheme in the vein of MySQL.) (It's really ridiculous how companies rewrite their graphics engines from scratch for most games they make.) 7f9405da4034bf43083e64b57302a8e6, even similar games aren't similar enough that I see any useful API you could make. Maybe adopting a common scripting language or something like that, sure. Would be possible. But high-end games are usually written from scratch in a very short period and then thrown out.  That makes it unattractive to invest in features that aren't broadly useful. ab7faae5d7b250ea8606486575f8f79c, I've never heard of Ogre.  I'm just saying it could work, it could also fail for lots of reasons. My strategy would be to distribute it for free and let small players use it for free, and figure that if any big games stole it we'd notice. Try to get universities to use it in their courses, try to get a development community going. Anyway, I'm not actually going to try this, just an idle thought. hsivonen, you are aware that the chairs will consider objections even if they don't use the words &quot;I object&quot; every two sentences, right? Ah, interesting. Where do they get their development money from, if they're MIT-licensed?  Contracts, support?  I thought good 3D engines required very large ongoing development costs. (As opposed to most open-source projects, which can be more or less completed and then add features at their leisure without necessarily falling far behind) b25b6b77a0087ff8385941e5545d32ea, that I agree with. And it's still competitive?  Or it's not competitive with the commercial engines, but it's good enough for the cost? b25b6b77a0087ff8385941e5545d32ea, on which issue? b25b6b77a0087ff8385941e5545d32ea, I hate when people refer to issues by numbers.  Can't you at least use the short description? Is that the RDFa prefix one? I suspect that one's a lost cause politically, but the chairs may surprise me. What does &quot;a single light source&quot; mean, in practice? Ah. So constant illumination from a fixed direction. I find graphics vaguely interesting. I remember being amused when I saw in my brother's 3D graphics program (3DS Max or whatever) that he could change the rate at which the intensity of light dropped off. Constant, inverse-square, inverse, inverse-cube, exponential . . . Granted, constant makes sense for very far light sources like the sun, but exponential dropoff for light?  I guess you're not always aiming for realism, in graphics. The software also supported indices of refraction less than 1. Although negative indices of refraction can be possible. b25b6b77a0087ff8385941e5545d32ea, I don't think the chairs have dropped any objections lately just because of how they were phrased, did they? ab7faae5d7b250ea8606486575f8f79c, do you know of any book I could read that would teach me more about the principles of graphics programming, without expecting that I'd be willing to write any actual code except maybe really trivial snippets? I would like to get it, read the first twenty pages, put it aside somewhere, and forget about it for months until I clean up my room, at which point I'll realize I have no time to read it and put it on my shelf, with a forlorn bookmark forever remaining in it as a testament to my lack of persistence. b25b6b77a0087ff8385941e5545d32ea, that objection was ignored because it suggested a change that wasn't suggested by any change proposal. I.e., it didn't actually support either change proposal, and they were only trying to decide between the change proposals, so it was useless to them. I think I have a GeForce 1 somewhere. Not in an actual working computer, needless to say. Wasn't GeForce 1 a PCI card, though?  If so, maybe it would still work.  I bet the Linux kernel still supports it. I probably have an AGP motherboard somewhere.  Whether I have a CPU and RAM to go with it is a separate question. I don't suppose anyone here knows how to get execCommand() to work in IE?  It doesn't seem to work on my page: http://aryeh.name/spec/editcommands/autoimplementation.html The &quot;browser&quot; column remains stubbornly unstyled in IE9, with no errors logged or anything. It's worked before . . . Oh well, I don't need to know IE's behavior for this particular thing anyway. goes back to rewriting his spec for about the fourth time No, wait, I think it's only the third. IE9 was shipped only two years after IE8, to be fair, not three.  :)",0.0,950,"['7f9405da4034bf43083e64b57302a8e6', 'just', 'openness', 'standard', 'work', 'web', 'doesn', 'mean', 're', 'need', 'everywhere', 'tend', 'broadly', 'agree', 'raymond', 'analysis', 'open', 'source', 'software', 'suggest', 'closed', 'source', 'software', 'always', 'work', 'well', 'market', 'same', 'logic', 'apply', 'open', 'standard', 'interoperability', 'useful', 'game', 'need', 'intemperate', 'typical', 'high', 'end', 'game', 'standalone', 'product', 'interact', 'other', 'program', 'os', 'basically', 'obsolete', 'year', 'exactly', 'standardize', 'sort', 'api', 'expose', 'different', 'game', 'work', 'very', 'differently', 'problem', 'don', 'think', 'standardization', 'help', 'standardization', 'need', 'inter', 'program', 'ape', 'document', 'format', 'thing', 'independent', 'game', 'different', 'enough', 'there', 'see', 'usefully', 'share', 'general', 'share', 'thing', 'graphic', 'engine', 'clearly', 'nice', 'clean', 'standardizable', 'line', 'make', 'stable', 'api', 'least', 'impression', 'game', 'use', 'third', 'party', 'engine', 'typically', 'customize', 'fit', 'need', 'also', 'file', 'access', 'standardize', 'novel', 'idea', 'right', 'there', 'standardize', 'os', 'game', 'essentially', 've', 'give', 'thought', 'possibility', 'open', 'source', 'graphic', 'engine', 'game', 'successful', 'use', 'dual', 'licensing', 'scheme', 'vein', 'mysel', 'really', 'ridiculous', 'company', 'rewrite', 'graphic', 'engine', 'scratch', 'most', 'game', 'make', '7f9405da4034bf43083e64b57302a8e6', 'even', 'similar', 'game', 'aren', 'similar', 'enough', 'see', 'useful', 'api', 'make', 'maybe', 'adopt', 'common', 'scripting', 'language', 'sure', 'possible', 'high', 'end', 'game', 'usually', 'write', 'scratch', 'very', 'short', 'period', 'then', 'throw', 'make', 'unattractive', 'invest', 'feature', 'aren', 'broadly', 'useful', 'ab7faae5d7b250ea8606486575f8f79c', 've', 'never', 'hear', 'ogre', 'just', 'say', 'work', 'also', 'fail', 'lot', 'reason', 'strategy', 'distribute', 'free', 'let', 'small', 'player', 'use', 'free', 'figure', 'big', 'game', 'steal', 'notice', 'try', 'get', 'university', 'use', 'course', 'try', 'get', 'development', 'community', 'go', 'anyway', 'actually', 'go', 'try', 'just', 'idle', 'thought', 'hsivonen', 'aware', 'chair', 'consider', 'objection', 'even', 'don', 'use', 'word', 'quit', 'object', 'quit', 'sentence', 'right', 'interesting', 'get', 'development', 'money', 're', 'mit', 'licensed', 'contract', 'support', 'think', 'good', 'ad', 'engine', 'require', 'very', 'large', 'ongoing', 'development', 'cost', 'oppose', 'most', 'open', 'source', 'project', 'more', 'less', 'complete', 'then', 'add', 'feature', 'leisure', 'necessarily', 'fall', 'far', 'b25b6b77a0087ff8385941e5545d32ea', 'agree', 'still', 'competitive', 'competitive', 'commercial', 'engine', 'good', 'enough', 'cost', 'b25b6b77a0087ff8385941e5545d32ea', 'issue', 'b25b6b77a0087ff8385941e5545d32ea', 'hate', 'people', 'refer', 'issue', 'number', 'least', 'use', 'short', 'description', 'rafa', 'prefix', 'suspect', 'lose', 'cause', 'politically', 'chair', 'surprise', 'quit', 'single', 'light', 'source', 'quit', 'practice', 'so', 'constant', 'illumination', 'fix', 'direction', 'find', 'graphic', 'vaguely', 'interesting', 'remember', 'amuse', 'see', 'brother', 'ad', 'graphic', 'program', 'ad', 'change', 'rate', 'intensity', 'light', 'drop', 'constant', 'inverse', 'square', 'inverse', 'inverse', 'cube', 'exponential', 'grant', 'constant', 'make', 'sense', 'very', 'far', 'light', 'source', 'sun', 'exponential', 'dropoff', 'light', 'guess', 're', 'always', 'aim', 'realism', 'graphic', 'software', 'also', 'support', 'index', 'refraction', 'less', 'negative', 'index', 'refraction', 'possible', 'b25b6b77a0087ff8385941e5545d32ea', 'don', 'think', 'chair', 'drop', 'objection', 'lately', 'just', 'phrase', 'ab7faae5d7b250ea8606486575f8f79c', 'know', 'book', 'read', 'teach', 'more', 'principle', 'graphic', 'programming', 'expect', 'be', 'willing', 'write', 'actual', 'code', 'maybe', 'really', 'trivial', 'snippet', 'like', 'get', 'read', 'first', 'page', 'put', 'aside', 'somewhere', 'forget', 'month', 'clean', 'room', 'point', 'realize', 'time', 'read', 'put', 'shelf', 'forlorn', 'bookmark', 'forever', 'remain', 'testament', 'lack', 'persistence', 'b25b6b77a0087ff8385941e5545d32ea', 'objection', 'ignore', 'suggest', 'change', 'wasn', 'suggest', 'change', 'proposal', 'e', 'didn', 'actually', 'support', 'change', 'proposal', 'only', 'try', 'decide', 'change', 'proposal', 'useless', 'think', 'somewhere', 'actual', 'work', 'computer', 'needless', 'say', 'wasn', 'pi', 'card', 'so', 'maybe', 'still', 'work', 'bet', 'still', 'support', 'probably', 'ago', 'motherboard', 'somewhere', 'cpu', 'ram', 'go', 'separate', 'question', 'don', 'suppose', 'here', 'know', 'get', 'execcommand', 'work', 'doesn', 'seem', 'work', 'page', 'help', 'name', 'editcommand', 'autoimplementation', 'quit', 'browser', 'quit', 'column', 'remain', 'stubbornly', 'unsettle', 'error', 'log', 'work', 'don', 'need', 'know', 'ie', 'behavior', 'particular', 'thing', 'anyway', 'go', 'back', 'rewrite', 'spec', 'fourth', 'time', 'wait', 'think', 'only', 'third', 'ship', 'only', 'year', 'fair']"
70311,70311,"88d4d34a8064a4ff39fd5e144eea7762, please elaborate. don't work closed products better even with open standards? There may be more people than h4kon advocating open standards while being perfectly fine with closed software. Special clients? I always hated it when strategy games did not give me the ability to write my own macros. (The only one that included it was Earth2150 in 1999, but the current rights holder is opposed to releasing the source code.) I just hate it when people lay bricks into my way of customizing things. Possible strawman: I neither do nor did advocate a common API or ABI for all games. LUA called, it wants its fame back ;) ab7faae5d7b250ea8606486575f8f79c, re: dual-licensing commercially successful is different from broad adoption successful",0.0,120,"['elaborate', 'work', 'closed', 'product', 'well', 'even', 'open', 'standard', 'more', 'people', 'hon', 'advocate', 'open', 'standard', 'perfectly', 'fine', 'close', 'software', 'special', 'client', 'always', 'hate', 'strategy', 'game', 'give', 'ability', 'write', 'own', 'macro', 'only', 'one', 'include', 'current', 'right', 'holder', 'oppose', 'release', 'source', 'code', 'just', 'hate', 'people', 'lay', 'brick', 'way', 'customize', 'thing', 'possible', 'starman', 'advocate', 'common', 'api', 'game', 'call', 'want', 'fame', 'ab7faae5d7b250ea8606486575f8f79c', 'dual', 'licensing', 'commercially', 'successful', 'different', 'broad', 'adoption', 'successful']"
70312,70312,"They can be standardised at the OpenGL/DirectX level Anything higher-level will be obsolete within a year so everyone will want to write their own instead, unless the shared engine is continually updated and no longer standardised (How would dual-licensing make it more successful than e.g. Ogre, which used to be dual-licensed and now is MIT?) 88d4d34a8064a4ff39fd5e144eea7762: Ogre's only the most well-known widespread open source graphics engine, which has been going seriously for ~6 years and has been used in several commercial games (e.g. Torchlight) :-) (I thought vaguely about using it recently, but found it's a pain to install on Linux because it now relies on a library that interacts badly with system libraries so most Linux distros won't touch it, so it ends up being a bit of a mess getting everything installed) (so it's easier to just hack stuff onto an existing inflexible GL-based engine) 88d4d34a8064a4ff39fd5e144eea7762: As far as I'm aware they don't have development money, it's just volunteers who want to work on the engine or want to use it for their own open source games and the result is okay enough that some commercial developers choose it instead of writing their own or buying one It's competitive if you're making a PC game that should run easily on 5-year-old hardware (from what I can see) (e.g. Torchlight lists GeForce 2 as a minimum requirement) (or Intel GMA 950, more relevantly) 950 is more like 5, I think and is very widespread It's not exactly a graphics engine you're going to use for an Xbox 360 game (even if it supported consoles, which it doesn't) Fortunately open source people seem very easily pleased with simple graphics - I see lots of compliments for the graphics of the game I work on, which has a 2004-era renderer that supports diffuse textures and shadows and a single light source and that's pretty much all The sun (No dynamic lighting or anything) Indeed recently considered doing something as extreme as requiring GLSL shaders, which are only 7 years old, so he set up http://feedback.wildfiregames.com/report/opengl/ a few weeks ago to figure out what hardware support was available but it turns out quite a few people still have terrible hardware or drivers :-( 88d4d34a8064a4ff39fd5e144eea7762: No - I don't think I've read any particularly relevant books, and I don't know enough about the subject to guess which ones might be good 06cb330920ae58e1614c9145d983b3d6: Yeah, lots of those, though I was surprised to see someone apparently still had a GeForce2 MX (which is even slower than an Intel 945GM, seemingly) AGP, apparently (http://en.wikipedia.org/wiki/Comparison_of_Nvidia_graphics_processing_units#GeForce_series) likes measuring things http://zaynar.co.uk/0ad-pub/performance-20110317.png - probably wholly inaccurate, but I think it looks pretty matplotlib",0.0,443,"['standardise', 'open', 'direct', 'level', 'high', 'level', 'obsolete', 'year', 'want', 'write', 'own', 'instead', 'share', 'engine', 'continually', 'update', 'no', 'long', 'standardise', 'dual', 'licensing', 'make', 'more', 'successful', 'ogre', 'use', 'dual', 'license', 'now', 'mit', 'ogre', 'only', 'most', 'well', 'know', 'widespread', 'open', 'source', 'graphic', 'engine', 'go', 'seriously', 'year', 'use', 'several', 'commercial', 'game', 'e', 'torchlight', 'think', 'vaguely', 'use', 'recently', 'find', 'pain', 'install', 'linux', 'now', 'rely', 'library', 'interact', 'badly', 'system', 'library', 'so', 'most', 'linux', 'win', 'touch', 'so', 'end', 'bit', 'mess', 'get', 'instal', 'easy', 'just', 'hack', 'stuff', 'exist', 'inflexible', 'go', 'base', 'engine', 'as', 'far', 'aware', 'don', 'development', 'money', 'just', 'volunteer', 'want', 'work', 'engine', 'want', 'use', 'own', 'open', 'source', 'game', 'result', 'okay', 'enough', 'commercial', 'developer', 'choose', 'instead', 'write', 'own', 'buy', 'competitive', 're', 'make', 'pa', 'game', 'run', 'easily', 'year', 'old', 'hardware', 'see', 'e', 'torchlight', 'list', 'minimum', 'requirement', 'intel', 'more', 'relevant', 'more', 'think', 'very', 'widespread', 'exactly', 'graphic', 'engine', 'go', 'use', 'game', 'even', 'support', 'console', 'doesn', 'fortunately', 'open', 'source', 'people', 'seem', 'very', 'easily', 'pleased', 'simple', 'graphic', 'see', 'lot', 'compliment', 'graphic', 'game', 'work', 'era', 'render', 'support', 'diffuse', 'texture', 'shadow', 'single', 'light', 'source', 'pretty', 'much', 'sun', 'dynamic', 'lighting', 'indeed', 'recently', 'consider', 'do', 'as', 'extreme', 'require', 'shade', 'only', 'year', 'old', 'set', 'help', 'feedback', 'wildfiregame', 'com', 'report', 'open', 'few', 'week', 'ago', 'figure', 'hardware', 'support', 'available', 'turn', 'few', 'people', 'still', 'terrible', 'hardware', 'driver', 'don', 'think', 've', 'read', 'particularly', 'relevant', 'book', 'don', 'know', 'enough', 'subject', 'guess', 'one', 'good', '06cb330920ae58e1614c9145d983b3d6', 'lot', 'surprised', 'see', 'apparently', 'still', 'geforce2', 'even', 'slow', 'intel', '945gm', 'seemingly', 'ago', 'apparently', 'help', 'wikipedia', 'org', 'wiki', 'comparison', 'vida', 'graphic', 'processing', 'unit', 'series', 'like', 'measure', 'thing', 'help', 'pub', 'performance', 'pig', 'probably', 'wholly', 'inaccurate', 'think', 'look', 'pretty', 'matplotlib']"
70313,70313,"fd9ef1223e855714294498ebfde79f98: is othermaciej on vacation or something? here 040342c014ffc1c11592948bd92e3721: not if i can help it based on what frank said, he doesn't much care to do anything but what they already shipped so... i care about a good spec too, but it seems the w3c html wg is not the place we'll be able to achieve that (this is yet another example of how having microsoft implement cutting-edge stuff is a mistake) other browsers don't have 3 year ship cycles (my faith is mostly lost from sam's many decisions recently, not just this issue) (and the recent polls, which have no good solutions proposed)",0.0,104,"['fd9ef1223e855714294498ebfde79f98', 'othermaciej', 'vacation', 'here', '040342c014ffc1c11592948bd92e3721', 'help', 'base', 'say', 'doesn', 'much', 'care', 'already', 'ship', 'so', 'care', 'good', 'spec', 'too', 'seem', 'himl', 'place', 'be', 'able', 'achieve', 'yet', 'example', 'have', 'microsoft', 'implement', 'cut', 'edge', 'stuff', 'mistake', 'other', 'browser', 'year', 'ship', 'cycle', 'faith', 'mostly', 'lose', 'many', 'decision', 'recently', 'just', 'issue', 'recent', 'poll', 'good', 'solution', 'propose']"
70314,70314,"88d4d34a8064a4ff39fd5e144eea7762: It seems to be profitable to be very explicit when writing objections 88d4d34a8064a4ff39fd5e144eea7762: I rather suspect I was insufficently explicit 88d4d34a8064a4ff39fd5e144eea7762: 120 88d4d34a8064a4ff39fd5e144eea7762: Yes, it's the RDFa one I have no idea what the shortname is Oh rdfa-prefixes 88d4d34a8064a4ff39fd5e144eea7762: Anyway, clearly the solution is to write a RFC defining terms like OBJECT and SUPPORT so people would know to look at the sentences with the defined terms and filter out the rest. 88d4d34a8064a4ff39fd5e144eea7762: It's hard to tell. Based on http://www.w3.org/mid/<email/> it seems that some people don't feel their points have been considered in the way they would like due to the choice of wording What did you plot it with?",0.0,111,"['seem', 'profitable', 'very', 'explicit', 'write', 'objection', 'rather', 'suspect', 'insufficiently', 'explicit', 'rafa', 'one', 'idea', 'shortage', 'prefix', 'anyway', 'clearly', 'solution', 'write', 'rec', 'define', 'term', 'object', 'support', 'people', 'know', 'look', 'sentence', 'define', 'term', 'filter', 'rest', 'hard', 'tell', 'base', 'help', 'org', 'mid', 'email', 'seem', 'people', 'don', 'feel', 'point', 'consider', 'way', 'like', 'choice', 'word', 'plot']"
70316,70316,"69b0d3dfe919a6b860a9fac82de52a7e: are you there? issue-147 about playbackrate are you planning on writing a change proposal? 69b0d3dfe919a6b860a9fac82de52a7e: if you like the idea of requestedPlaybackRate/actualPlaybackRate, I'd be happy to quickly write it and request another week of discussion extension, I guess hmm, I care about a good spec and I would like to hear other browser vendor opinions I've not lost faith :) other browsers have implemented stuff, too, that got changed later - that's not new no worries, I'll go ahead then",0.0,81,"['there', 'issue', 'playbackrate', 'plan', 'write', 'change', 'proposal', 'like', 'idea', 'requestedplaybackrate', 'actualplaybackrate', 'be', 'happy', 'quickly', 'write', 'request', 'week', 'discussion', 'extension', 'guess', 'care', 'good', 'spec', 'like', 'hear', 'other', 'browser', 'vendor', 'opinion', 've', 'lose', 'faith', 'other', 'browser', 'implement', 'stuff', 'too', 'get', 'change', 'later', 'new', 'worry', 'go', 'ahead', 'then']"
